idx,name,y_true,y_predict,feature
1640,perl-JSON-PP,库,其它,compatible compile environment fast instal json module perl pure write
1641,perl-JSON-XS,库,库,convert correct data fast goal json module perl structure write
1642,perl-LDAP,库,库,collection directory entry function implement modify module perform perl program search service
1643,perl-LWP-MediaTypes,其它,其它,compatibility define encoding extension file function handle instead know look medium module provide type
1644,perl-List-MoreUtils,库,库,commonly functionality list need provide
1645,perl-List-MoreUtils-XS,库,库,compile function list module provide version
1646,perl-Locale-Codes,库,其它,code contain deal different distribution handle include language module type
1647,perl-Locale-Maketext,库,工具,access application code common directly feature framework interface need present processing produce program provide software text tool
1648,perl-MIME-Base64,库,其它,contain encode encoding internet mail method package specify string
1649,perl-MIME-Charset,库,其它,character information internet message provide
1650,perl-MRO-Compat,库,库,code compatibility deal general high interface like method module order perl provide resolution software support utility version want work write
1651,perl-Mail-DKIM,库,库,check component currently enable implement internet mail message module plugin require sign standard various
1652,perl-Mail-SPF,库,库,framework http implementation information mail object org oriented policy www
1653,perl-Mail-Sender,库,其它,mail module send server
1654,perl-MailTools,库,其它,application mail module perl related various
1655,perl-Math-BigInt,库,库,arbitrary module perl provide size
1656,perl-Math-BigInt-FastCalc,库,库,fast module perl provide speed support
1657,perl-Math-BigRat,库,其它,arbitrary number provide support
1658,perl-Module-Build,库,库,additional alternative build building code cross easily include instal install like make mean module need perl platform pure require shell sub traditional work write
1659,perl-Module-CoreList,库,库,core information list module package perl provide query tool version
1660,perl-Module-Implementation,库,库,arbitrary case implementation know like load module multiple need perl plugin process provide pure time useful want
1661,perl-Module-Install,库,库,correct distribution extensible installation like module package perl simple standalone version write
1662,perl-Module-Install-AuthorTests,库,库,build directory module package perl plug test
1663,perl-Module-Install-ReadmeFromPod,库,工具,automatically contain convert extension file format generate html manual module output page plain support text
1664,perl-Module-Load,库,工具,case change dynamically file load mean module need particular platform require run string time want word
1665,perl-Module-Load-Conditional,库,工具,information instal load module provide query run simple time
1666,perl-Module-Metadata,库,库,code execute file information metadata module package perl provide standard
1667,perl-Module-Pluggable,库,库,ability automatically class export extensible file look method module package path plugins provide search simple space
1668,perl-Module-ScanDeps,库,库,code dependency hash module perl program reference return test value
1669,perl-Mozilla-LDAP,库,其它,module perl wrap
1670,perl-NTLM,其它,其它,authentication connection http mail mechanism method module perform perl protocol provide
1671,perl-Net-DNS,库,库,allow bind capability collection domain format module packet perform perl programmer query section various
1672,perl-Net-HTTP,其它,其它,class client connection http instance level low protocol represent server support
1673,perl-Net-SMTP-SSL,库,其它,network operation support
1674,perl-Net-SSLeay,其它,库,access application client extension function high http level module offer package page perl server write
1675,perl-Net-Server,库,库,class engine extensible general intend internet layer module perl protocol server write
1676,perl-NetAddr-IP,库,库,abstraction address allow easy manipulation module object oriented provide
1677,perl-Number-Compare,库,其它,compile module number perl simple subroutine test value
1678,perl-Package-DeprecationManager,库,其它,allow distribution feature hash import manage module package provide value version
1679,perl-Package-Generator,库,其它,data easily generate module package provide
1680,perl-Package-Stash,库,其它,easy manipulate module necessary perl simple symbol table
1681,perl-Package-Stash-XS,库,库,compiler correct default end environment functionality implementation instal package provide
1682,perl-PadWalker,库,其它,allow change module play point subroutine variable
1683,perl-Params-Check,库,工具,allow argument generic input mechanism parsing template
1684,perl-Params-Classify,库,库,argument code data depend example function intend like module operate perl provide type unlike various
1685,perl-Params-Util,库,库,basic check easy function make parameter provide simple standalone
1686,perl-Params-Validate,库,其它,additional allow arbitrary argument capable certain class determine function level method module object parameter pass perl simple specific type
1687,perl-Params-ValidationCompiler,库,库,build check create non parameter subroutine
1688,perl-Parse-Yapp,库,库,collection compiler create easily end extension file generate input interface like module object parse parser perl script thread
1689,perl-Path-Tiny,库,工具,access attempt core easy fast file friendly function handle input like method mode module object operate output path platform provide reading small style translation unix utility work
1690,perl-PathTools,工具,库,distribution file module perl
1691,perl-Perl-OSType,库,服务,base current example generic know linux match microsoft module need operate operating perl provide specific type unix version windows
1692,perl-PerlIO-via-QuotedPrint,库,库,decode encode file format handle implement layer module read string work write
1693,perl-Pod-Checker,库,工具,check content document documentation error format module plain specification syntax tool
1694,perl-Pod-Coverage,库,其它,computer determine documentation long mechanism module provide write
1695,perl-Pod-Escapes,库,其它,decode module provide resolve sequence thing useful
1696,perl-Pod-LaTeX,库,工具,command convert data documentation format module provide replacement
1697,perl-Pod-Markdown,库,其它,convert module
1698,perl-Pod-Parser,库,库,basic contain distribution documentation handle information manual module package page perl plain software
1699,perl-Pod-Perldoc,库,工具,display documentation embed format installation library look module perl primarily script tree
1700,perl-Pod-Plainer,库,其它,convert extension perl process replace return style tool
1701,perl-Pod-Simple,库,库,documentation framework language library module parse perl plain text write
1702,perl-Pod-Usage,库,工具,argument command description documentation level line manual message option page present print script usage
1703,perl-Ref-Util,库,服务,check function help reference smart utility
1704,perl-Ref-Util-XS,库,服务,check function help reference smart utility
1705,perl-Role-Tiny,库,工具,size tool
1706,perl-SGMLSpm,库,库,convert document format help html library module output parse perl program
1707,perl-SNMP_Session,库,库,currently generation operation perl pure support
1708,perl-SUPER,库,库,access class control easy implementation method module provide want
1709,perl-Scalar-List-Utils,库,库,contain core extension general high list package perl size small subroutine usage utility
1710,perl-Scope-Guard,库,库,allow automatically convenient deal exception execution form make management module perform perl provide reference resource subroutine thread useful
1711,perl-Socket,库,库,address based binary bind conversion core deal form function module native network operation perl provide socket structure support useful value variety
1712,perl-Socket6,库,其它,enable environment include independent intend module programming protocol related socket structure support
1713,perl-Software-License,库,其它,common contains license open package provide software source template
1714,perl-Specio,库,库,built check class distribution instead interpreter make note perl provide represent start syntax type value variable
1715,perl-Storable,库,库,array contain data disk hash object package perl reference retrieve store structure time
1716,perl-String-CRC32,库,其它,check file generate generation interface module package perl program provide string support value various
1717,perl-Sub-Exporter,库,库,allow alternative built custom export generation provide read routine sub
1718,perl-Sub-Exporter-Progressive,库,工具,advanced come directly export feature like module need note package power powerful runtime user variable work wrapper
1719,perl-Sub-Identify,库,库,allow code mechanism module perl provide real reference retrieve
1720,perl-Sub-Info,库,其它,allow perl subroutine tool
1721,perl-Sub-Install,库,其它,easily easy install make module package subroutine
1722,perl-Sub-Name,库,工具,allow debug include module note subroutine
1723,perl-Sub-Uplevel,库,库,function high like stack
1724,perl-Sys-CPU,库,库,currently extension information number perl support
1725,perl-Sys-MemInfo,库,库,byte free information memory module perl return variable
1726,perl-Sys-Syslog,库,库,function interface like list perl string unix
1727,perl-Term-ANSIColor,库,其它,color function import interface module offer output screen sequence utility
1728,perl-Term-Cap,库,库,capability database extract function interface level low perl terminal
1729,perl-Term-Size-Any,库,库,alternative implement information interface list load module retrieve size terminal
1730,perl-Term-Size-Perl,库,库,build exception extension implementation perl pure retrieve size terminal time version
1731,perl-Term-Table,库,库,able data format header module perl table
1732,perl-TermReadKey,库,库,allow architecture control driver function goal good main mode module non perl plug portable possible provide read simple support terminal work
1733,perl-Test-Exception,库,库,base build code exception function library method module perl play provide test
1734,perl-Test-Harness,库,库,allow automatically code compatible directly distribution exist instead interface module output package perl provide result script standard test write
1735,perl-Test-Pod-Coverage,库,库,check create distribution document file test
1736,perl-Test-Simple,库,库,basic component core facility information package provide simple test utility write
1737,perl-Test-Warn,库,库,base code extension method module perl provide test
1738,perl-Test2-Suite,库,库,build bundle distribution framework library perl plugins rich test tool write
1739,perl-Text-Balanced,库,其它,extract perl prefix sequence string subroutine text
1740,perl-Text-CharWidth,库,其它,equivalent feature module number provide string subroutine terminal
1741,perl-Text-Diff,库,工具,available basic complete feature file integrate large perform perl platform provide record service shell small text utility
1742,perl-Text-Glob,库,库,file implement instead match module pattern perl style text want
1743,perl-Text-ParseWords,库,库,array directly expression function inside line list long parse regular return save simply single string text word
1744,perl-Text-Soundex,库,库,algorithm develop implement implementation index module original sound
1745,perl-Text-Tabs+Wrap,库,工具,command document line long perform remove simple text unix
1746,perl-Text-Template,库,库,build embed form generate html library page perl program replace template text value
1747,perl-Text-Unidecode,库,工具,attempt character data function provide represent representation text unicode
1748,perl-Text-WrapI18N,库,其它,byte character encoding include intend language like line module multi setup space support text word wrap
1749,perl-Thread-Queue,库,库,access module number provide thread
1750,perl-Time-HiRes,库,库,high implement interface module perl resolution time word
1751,perl-Time-Local,库,库,array built compute date example function local module operating perl posix provide require return support time unix value work
1752,perl-TimeDate,其它,库,date display format include interface manipulation module number particular perl point provide read representation small string time various
1753,perl-Tk,库,库,code compliant fully graphical implement include interface perl port series toolkit user
1754,perl-Try-Tiny,其它,其它,additional block come common dependency design devel extra feature layer minimal module parent provide return stack subroutine support syntax type unlike
1755,perl-Types-Serialiser,库,库,common container data different extra format implementation json module provide repository share simple small type
1756,perl-URI,库,库,class implement manipulation module parsing perl reference represent resource specify update
1757,perl-Unicode-Collate,库,库,algorithm implementation package perl standard unicode
1758,perl-Unicode-EastAsianWidth,库,其它,character deal http module org property provide specify unicode user www
1759,perl-Unicode-LineBreak,库,工具,algorithm define determine line property unicode
1760,perl-Unicode-Normalize,库,库,convert define form function package perl provide standard string unicode various
1761,perl-Unicode-UTF8,库,其它,decode encode encoding form function module provide specify unicode
1762,perl-Unix-Syslog,库,库,able attempt implementation interface module native perl provide right unix
1763,perl-Variable-Magic,库,库,access data extra mechanism module object operation perl user variable
1764,perl-WWW-RobotRules,其它,服务,access database file html http module org parse specify standard www
1765,perl-XML-Catalog,库,库,html http implement know module open org public resolve syntax write www
1766,perl-XML-DOM,库,库,allow build compliant data description document extension http interface level model object org oriented perl structure style www
1767,perl-XML-LibXML,库,库,allow capable file gnome high implement implementation interface library make manipulate module parse parser performance perl programmer provide
1768,perl-XML-LibXML-PrettyPrint,库,库,module perl result space tree
1769,perl-XML-NamespaceSupport,库,库,application basic check class generic help maintain module need number offer prefix process provide simple space support
1770,perl-XML-Parser,库,库,argument build case create creation document extra instance interface level library method module object option parse pass perl provide time
1771,perl-XML-RegExp,库,服务,contain expression following module package reference regular utility
1772,perl-XML-SAX,库,库,able access application building class come design different driver filter framework java need parser perl plug programmer require right specification
1773,perl-XML-SAX-Base,库,库,base character class default directly driver example filter implement input module output pass perl simple task useful
1774,perl-XML-Simple,库,库,easy layer maintain module parse parser perl provide simple
1775,perl-XML-TokeParser,库,库,event html input interface mode provide
1776,perl-XML-Twig,库,库,allow build document interface memory minimal mode module need offer option output perl process processing provide resource tree usage
1777,perl-XML-XPath,库,库,allow extension form function functionality http module need org parser perl specification support www
1778,perl-YAML,其它,其它,base data generic http implement include information language modern module optimize org perl programming specification structure syntax www
1779,perl-YAML-Tiny,库,库,class code file load memory perl possible read reading reduce style time write
1780,perl-autodie,库,其它,convenient equivalent exception function provide replace return
1781,perl-bignum,库,库,attempt easy make number package perl script support write
1782,perl-common-sense,库,库,common debug default define feature implement layer memory module perl portable program state switch thread usage
1783,perl-constant,库,库,allow block code compile easy expression machine maintain method optimize particular perl program read replace script send space time value write
1784,perl-experimental,库,其它,convenient easy enable feature make provide
1785,perl-generators,库,库,binary dependency generator module package perl provide require
1786,perl-gettext,工具,库,access database family function interface message module perl retrieve software string
1787,perl-inc-latest,库,库,build bundle configure dependency directory distribution help instal module time
1788,perl-libintl-perl,库,库,compatible example implement library message package perl translation
1789,perl-libnet,库,其它,client collection interface internet module network perl programming protocol provide simple various
1790,perl-libwww-perl,其它,库,allow application class client collection contain function general help http implement interface library main module perl program provide server simple wide write
1791,perl-libxml-perl,库,工具,collection document module perl script small software work
1792,perl-local-lib,库,工具,allow application case collection configuration contain convenient copy create current directly directory easy environment file library like list local make module need perl print provide shell specific specify suitable syntax usage useful user variable
1793,perl-namespace-autoclean,库,其它,available bind class compile current function import instance like look method module package perl remove similar symbol
1794,perl-namespace-clean,库,其它,available base bind class compile current define example function import include instance load method multiple package perl plugin problem remove symbol
1795,perl-parent,库,其它,base class compile load module package require similar time
1796,perl-perlfaq,库,其它,commonly document perl programming
1797,perl-podlators,库,工具,capability contain convert format include input module output package page plain source sub suitable terminal text various
1798,perl-srpm-macros,库,其它,build macro package perl repository source
1799,perl-threads,库,库,available based data default information interpreter model perl programming provide remove result share state thread
1800,perl-threads-shared,库,库,allow copy create data default different exist extension module perl share structure thread variable
1801,perl-version,库,库,change code extension implement method module object parse perl provide release usage version
1802,perltidy,库,库,code command control default easy error extra follow good help html line make output parameter perl read script setting source style time tool track useful write
1803,pesign,工具,工具,binary contain package sign tool utility
1804,phonon,库,其它,framework
1805,pidgin,库,工具,allow base client common contain core design easy editor feature gtk implement include library like message microsoft modular perl plugins protocol simple support variety
1806,pidgin-sipe,库,库,able client connect implement microsoft multi package party plugin protocol provide replace server simple suite various version
1807,pigz,工具,库,compress core data fully implementation multiple processor replacement stand
1808,pinentry,工具,工具,base collection contain entry gnome gtk http org package project protocol simple text version www
1809,pinfo,工具,工具,base browser expression file interface library page regular search similar support user
1810,pipewire,服务,服务,application client command contain interface libraries library like line linux medium operate package runtime server unix utility
1811,pipewire0.2,服务,服务,application client compatibility contain interface libraries library medium package runtime server
1812,pixman,库,工具,library manipulation
1813,pkgconf,库,服务,application automatically backend compiler configure development file framework functionality handle help include library link macro metadata org package program provide provider similar support toolkit
1814,plasma-breeze,其它,其它,common desktop file share style theme version
1815,plotutils,工具,工具,command contain contains data export file format function graphic library line package powerful program programmer software user utility
1816,plymouth,服务,服务,ability boot contain control core current custom default design distribution example extensible fast feature file graphic graphical help image instead integrate language library message package plugin process provide related render screen script sign simple simplify small space start text theme time track view
1817,pmdk,库,工具,access allow analysis apis application array base block capable change check collection command convert copy create data database design device dump dynamic environment execute facility file general implement level library like line load low management memory modify node object operation option parse particular perform power process program programming protocol provide python read remote routine script separate sequence similar size standalone standard state store style support target tool transfer translation update usage useful user utilities utility variable write
1818,pmix,库,服务,apis attempt cluster communication current definition design execute exist extend fully implementation include information interface level management mean need node operation process project property provide reference release represent resolve server size standard support time version
1819,po4a,工具,工具,documentation ease goal like maintain project tool translation
1820,policycoreutils,库,服务,access application base based basic change component contain control core dbus design develop environment feature filesystems functionality general improve include interface kernel kind level linux load machine manage management multi number operating operation originally package policy provide python python3 require security selinux service support switch tool type user utility utils
1821,polkit,服务,服务,allow define development documentation file framework handle libraries process toolkit
1822,polkit-pkla-compat,库,其它,compatibility file format helper provide release rule support user
1823,polkit-qt-1,库,库,binding developer library
1824,poppler,工具,工具,command convert file format glib library line manipulate render tool utility wrapper
1825,poppler-data,库,其它,automatically character consist enable encode encoding file instal package present read render
1826,popt,库,服务,allow arbitrary argument array automatically base command configuration file function improve include library like line parameter parse powerful rule shell string style utility variable
1827,portreserve,工具,服务,help port program range real release script service utility
1828,postfix,工具,服务,agent mail transport
1829,postgresql-jdbc,其它,其它,access advanced contain database documentation driver file include java management need object package postgresql program
1830,postgresql-odbc,其它,其它,access application database driver include need open package postgresql
1831,potrace,工具,工具,additional color create currently data default distribute easy file following format good graphic image input like mean note output process produce program render resolution trace utility
1832,powertop,工具,工具,component computer make monitor necessary power software tool
1833,ppp,服务,服务,contain daemon documentation internet line link method package point protocol provide provider service support
1834,prefixdevname,工具,服务,built configuration define determine file helper interface link network package prefix produce provide rule user utility write
1835,procmail,工具,工具,automatically certain convenient create different generate list mail processing program real separate start type
1836,procps-ng,工具,工具,block change command contain current currently directory display free graph include information list load long memory monitoring package print process program provide report send specify time update user utility virtual work
1837,prometheus-jmx-exporter,库,其它,agent bind binding configure expose http intend java local package server target
1838,protobuf,库,工具,binding buffer build code compile compiler contain data define depend easily efficient encode extensible feature file flexible format generate google language library mechanism option package program programming protocol python read small source special stream structure update variety want write
1839,protobuf-c,库,库,binding code compiler contain data efficient encode extensible format generator google language library package programming protocol provide pure run structure time version
1840,ps_mem,工具,工具,automatically available core kernel memory method process profile program report select share shared tool
1841,psacct,工具,服务,command contain display execute include information long monitor package process user utilities utility
1842,psmisc,工具,服务,command contain display file filesystems manage package path process send specify structure tree utilities utility
1843,pstoedit,工具,工具,come convert driver edit file format graphic import large package result various
1844,publicsuffix-list,库,服务,able cross database determine domain form include list maintain package provide public representation runtime software track user work
1845,pugixml,库,库,automatic buffer capability complex conversion data encoding fast feature file implementation interface library like non parser process query rich support tree unicode variant
