idx,name,y_true,y_predict,feature
0,GConf2,库,服务,configuration database feature process store support user
1,GeoIP,库,库,address base database enable file instal library package update user
2,GeoIP-GeoLite-data,库,服务,address available com contain create data database free http include number package www
3,HdrHistogram_c,工具,服务,dynamic high port range
4,Judy,其它,库,array available core design dynamic dynamically extensible general high implement large library machine memory number performance provide purpose simply size state technology
5,LibRaw,库,库,base code digital file library read source utility
6,ModemManager,工具,服务,application client contain device easy functionality glib interact libraries library make management package provide service support
7,NetworkManager,服务,服务,address advanced allow alternative application automatic automatically base based compatibility configuration connection contain default device different easy editor environment file functionality graphical instal instead intend interface legacy libraries library like make manage manager network non open operation package particular perform plugin policy replace rule script server service static support text user variety
8,NetworkManager-libreswan,库,其它,capability contain desktop file gnome integrate package plug plugin server software
9,OpenEXR,库,库,library runtime
10,OpenIPMI,库,服务,access allow application base binary binding code contain develop information interface language library libs management network open package perl platform project python runtime share tool
11,PackageKit,库,服务,abstraction access allow application architecture automatically bus command cross font glib helper install layer library line manage management module offer package plugin program related repository secure service session simple user utility
12,PyYAML,库,工具,allow arbitrary capable complete complex configuration data design error extension feature file format language message object parser provide python range represent script specific standard support task unicode
13,SDL,库,库,access audio buffer cross design device fast graphic layer library platform provide simple
14,WALinuxAgent,服务,服务,agent build disk environment image instal linux microsoft package rule specific support virtual
15,Xaw3d,工具,工具,application change code install like look minimal source version widget window
16,aajohan-comfortaa-fonts,其它,其它,font good language modern regular serif style type variant
17,abattis-cantarell-fonts,其它,其它,design family font serif
18,abrt,工具,工具,access addon application automatic base build client collect command configuration console contain container convenient create data dbus default desktop detect easy enable environment event exception extend file functionality generate generation graphical gtk handle help helper high information install installation interface kernel level libraries line make manipulate necessary need non org package plugin print problem process program provide python query report script service shell simple small storage tool usage user virtual
19,abrt-java-connector,库,库,agent capable convert exception java library problem process provide
20,accel-config,工具,服务,configuration configure device libraries library utility
21,accountsservice,库,服务,application base bus client command contain daemon implementation information interact interface library libs manipulate package project provide query user want
22,acl,工具,服务,access contain control dynamic function library list manipulate need package posix standard support utility
23,acpica-tools,工具,服务,advanced architecture basic binary code command complete component configuration contain contains content current data debug definition develop development directly display environment execution extract file following format help host implementation independent input instal integrate interface kernel language license machine manipulate message method need operation order output package power project provide purpose reference release small source space specific specification suitable table tool tree user version write
24,acpid,服务,服务,daemon event program space user
25,adcli,工具,工具,directory domain standard tool
26,adobe-mappings-cmap,工具,工具,application character code collection contain contains currently display encode form function mean package require resource sub text traditional unicode useful
27,adobe-mappings-pdf,工具,其它,application character code different file function resource share structure syntax type useful variety
28,adwaita-icon-theme,服务,其它,contain design desktop gnome modern originally package theme
29,adwaita-qt,库,其它,application library theme variant
30,alsa-firmware,服务,服务,binary card contain include number package require sound tools
31,alsa-lib,库,工具,advanced allow application architecture audio binary case compatibility configuration functionality high include input level library linux manager operating output package program programming provide runtime simplify sound support
32,alsa-plugins,工具,工具,access allow application backend control convert daemon determine device driver easy expose http input kind like native network node number option output play plugin plugins process processing program protocol provide public record simple sound specific stream suite task type virtual word www
33,alsa-sof-firmware,服务,服务,binary contain debug file open package project sound
34,alsa-tools,工具,工具,available card certain contain following package sound tool
35,alsa-utils,工具,服务,advanced architecture audio basic command contain fast framework library line linux package sound test tool utility
36,amanda,工具,工具,advanced allow automatic basic capable client component contain core device disk drive dump facility file host include instal install large library machine microsoft multiple native need network note number package program server single solution unix version write
37,anaconda,工具,服务,boot contain core custom depend dependency disk driver environment graphical gtk handle http include install installation interface list local main make module option package possible program runtime server setup specific task time user widget
38,anaconda-user-help,工具,工具,built content help package provide
39,anolis-logos,服务,其它,related usage
40,anolis-release,服务,其它,file package release repository
41,ansible-core,工具,服务,automatically based configuration daemon execution extension instal language machine manage management model module multi node remote require simple software task transfer work write
42,ansible-freeipa,工具,工具,address client cluster collection currently distribution environment group handle host install installation issue management manager method mode need node note package password process processing record require rule separate server service sign simple start support time user version work
43,ant,其它,工具,allow apache application build built command compile core drive extension file instance java library line main number point process target task test tool type usage
44,aom,库,工具,capable contain content device file flexible format free generation hardware include internet library modern non open optimize package quality real reference time user video
45,apache-commons-cli,其它,工具,argument command easy interface java library line option provide simple work
46,apache-commons-codec,其它,库,attempt common commonly implementation include provide
47,apache-commons-collections,其它,工具,access apis array certain class collection component container core create custom data development easy fast feature implementation interface java method need object package powerful programming property provides purpose reduce special structure style test utility
48,apache-commons-compress,其它,其它,apache compress dump file form java library package read remove support unix version work
49,apache-commons-io,其它,库,class contains develop file filter functionality implementation library stream utilities utility
50,apache-commons-jxpath,其它,工具,context expression graph include interpreter kind language object simple
51,apache-commons-lang3,其它,其它,apache basic building change class compatibility component contain core create creation developer exception extra file help helper host java library manipulation method multiple object package property provide provides series standard string structure support type utility version
52,apache-commons-logging,其它,服务,abstraction addition allow apache basic component developer implementation interface mean number org package particular provide runtime simple small standalone user want wrapper
53,apache-commons-net,其它,其它,abstraction access command develop internet java level library like originally protocol provide purpose suite support time version
54,appstream-data,库,其它,distribution gnome metadata package provide require software specific
55,apr,库,服务,apache data form free include layer library operate portable possible provide routine runtime structure
56,apr-util,工具,工具,abstraction additional apache contain data database driver free include interface library package parsing portable postgresql provide routine runtime structure support utility
57,arpwatch,工具,服务,address automatically build certain change contain database device install monitor monitoring need network package report tool track utility
58,asciidoc,工具,工具,base command document file format generation html page text translate unix write
59,aspell,工具,工具,come design dictionary feature good handle include independent language library main memory microsoft open possible process replace shared word
60,aspell-en,工具,库,dictionary following list provides word
61,at,工具,服务,command control drop execute file input install instead level load need note oriented package particular read shell specify standard time tool user utility
62,at-spi2-atk,工具,工具,access application base based bus control expose gtk include interact interface module package protocol query reader screen script technology tools transport version
63,at-spi2-core,工具,工具,access application based bus control daemon definition expose gtk interact interface protocol query reader screen script technology tools transport version
64,atk,库,工具,alternative application device graphical input interface library provide reader screen support tool toolkit user
65,atkmm,库,工具,class complex create extensible include interface library provide user widget
66,atlas,工具,库,architecture automatically base binary build compile configuration contain documentation efficient good hardware implementation information interface libraries library make necessary order package performance portable present project provide routine software source specific time variety
67,attr,工具,服务,attribute command compatible contain dynamic extend filesystem function library manage manipulate object package particular provide support tool utilities
68,audit,工具,服务,application binding configure contain database directory dynamic event facility framework generate interface kernel library libs like linux machine management need package plugin plugins provide python3 real record remote search server service space store thing time tool user utility
69,augeas,服务,服务,change configuration control definition edit expose file format libraries library make parse public read structure tree work write
70,authselect,工具,服务,authentication build case command common configuration configure design different feature file instead library line package profile replacement source stack support test time tool utility
71,autoconf,工具,工具,allow automatically build code configuration configure create develop end generation instal install like need note option package portable programmer require script shell software source specify tool user various
72,autoconf-archive,库,其它,archive collection free friendly internet macro software
73,autofs,服务,服务,automatically daemon filesystems include network tool
74,autogen,工具,库,base command consist document library line option parser parsing powerful process template time
75,automake,工具,工具,ability automatically compliant create develop file generate install like software standard tool
76,autotrace,工具,工具,convert format graphic include input output produce program utility
77,avahi,服务,服务,able address application automatic binding computer configuration contain convenient daemon dynamic easy file glib gobject implement intend kind libraries library libs link local mean need network package plug primarily print printer program protocol python3 range run server service share technology time view wrapper
78,awscli,工具,服务,command environment interface line package provide services
79,babel,工具,工具,access application build common data date display interface library message number provide python repository tool various work
80,babeltrace,工具,服务,allow common conversion create format library plugin project provide read trace write
81,babl,库,库,buffer conversion creation dynamic exist format help image library provide store type
82,bacula,工具,工具,allow alternative architecture base basic client command common computer console contain daemon data device different drive file library line manage management network package program script select server storage write
83,baobab,工具,工具,able change device directory filesystem graphical include make order real representation size specific time tree user
84,basesystem,服务,工具,basic component define example installation order package remove simple
85,bash,工具,工具,command compatible feature interpreter language script shell useful
86,bash-completion,工具,其它,collection feature function shell
87,bc,工具,工具,arbitrary base capability handling include install interactive language like mode need number package processing stack text
88,bcc,工具,工具,analysis binding collection command compiler control create easy efficient example extend feature include kernel know line linux make manipulation network packet performance program python python3 task tool toolkit trace useful wrapper write
89,bind,服务,服务,application bind build contain domain export implementation internet library libs package version
90,bind9.16,服务,服务,address application based bind code collection contain contains domain environment file host implementation include information install internet libraries library license need network operate package program provide query resolve routine runtime server suite tool tree utilities utility utils version
91,binutils,工具,库,address archive binary collection content convert create data display extract family file generate graph include index information line list modify object profile section size string symbol translate utility
92,biosdevname,工具,工具,argument device directly form helper kernel necessary return simple
93,bison,库,工具,able available binary change compatible complex contain context convert depend description develop development file free general generate generator information install know language manual need package parse parser program programming purpose range runtime section simple support wide work write
94,bitmap-fonts,其它,其它,compatibility contain convert design encode family file font fonts instal intend native number package provide select terminal
95,blktrace,工具,服务,block collect data event format include information install kernel layer linux mechanism need operation package pattern perform provide request space trace user utilities utility
96,bluez,工具,服务,application automatically configuration connect contain content daemon device example file function include instal install libraries like make manual mode need note object package regular require rule script share start support switch utilities utility want work
97,blur-effect,库,库,graphic hardware library
98,bogofilter,工具,工具,algorithm analysis check code design directly fast filter good include input list mail message mode normal operation process return speed standard text word
99,bolt,服务,服务,automatically bus command connect control daemon database device different line list local manage manager mode perform remove require security store task tool
100,boom-boot,工具,服务,boot compatible configuration entry file function integration library linux manage manager module package project provide python3 require script specification support tool
101,boost,库,工具,additional advanced allow application base buffer class code command compiler component configuration container context copy core data date define developer directory easy entry execution exist expression extend extension facility feature file filesystem filter flexible framework free function functionality generic graph handling implement implementation include interface language library line long make manage manipulate memory method multiple offer operate operation option order path point portable present program programming provide public query range reference regular require run runtime separate single source specific standard stream style subroutine suitable support switch template thread time tool type unicode useful user utility value variable wide work
102,booth,工具,服务,cluster core distribute executables file manage manager multi resource support
103,bpftrace,工具,工具,available backend capability compile dynamic exist filter high interact kernel language level linux make packet script trace user
104,brasero,工具,工具,application contain desktop easy extension gnome libraries library libs package runtime share simple
105,breeze-icon-theme,其它,其它,file resource theme
106,brltty,工具,工具,access application bind binding complete console daemon directly display documentation drive driver functionality install interface java linux mode module package process programming provide python run screen support text time unix
107,brotli,库,工具,algorithm available compress compression context currently data general generic method modern offer order purpose similar speed variant
108,bubblewrap,库,服务,binary container core engine execution kernel tool user work
109,byteman,工具,工具,access agent allow application based code contain data different documentation execute extra include java javadoc load method need original package program remove simplify source start test tool trace want
110,byzanz,工具,工具,command desktop ease format image include line record sound tool video
111,bzip2,工具,服务,application available capability compress compression data fast file format free high install libraries need quality speed time utility
112,c-ares,库,库,library operation perform request resolve write
113,c2esp,库,服务,driver filter printer
114,ca-certificates,工具,其它,bundle certificate contain internet package root
115,cachefilesd,服务,服务,cache daemon directory disk file local manage management network space user
116,cairo,库,工具,available binding buffer contain currently design display file functionality gnome gobject graphic hardware high image include integrate library make medium memory object output package print produce provide quality support target window
117,cairomm,库,工具,developer graphic include interface library make offer power standard template
118,cdparanoia,库,工具,ability application audio contain data digital directly disk drive dynamic extra feature file format good handle hardware include instead libraries library libs like need package read reading sample stream tool utility variety write
119,cdrdao,工具,库,allow audio base complete content control description disk mode record single track write
120,cdrkit,库,工具,able allow application audio binary block boot capable command contain create data device different digital directory drive error file form format fully generate host image include install library line medium message multi need package program provide read record save size sound suitable support tree utility work write
121,celt051,库,库,audio communication design file format high low mean normal package particular quality require special symbol traditional version
122,ceph,服务,工具,access allow application block client cluster develop device distribute file interface library like manage multiple object shared simple storage store
123,certmonger,工具,服务,certificate client monitor primarily service
124,chan,工具,库,available buffer implementation pure
125,check,工具,工具,address check code define developer editor error feature framework interface output separate simple source space test unit
126,checkpolicy,工具,工具,access base based building compiler component contain control design develop feature functionality general improve include kernel kind level linux multi number operating originally package policy provide require security selinux support type utility
127,cheese,工具,其它,application contain display gnome graphical interface library need package video want widget
128,chkconfig,工具,服务,basic command configure current directly edit information instead interface line link maintain manipulate page provide query service simple specify start tool update utility various
129,chrome-gnome-shell,工具,其它,browser capable extension gnome google host http integration manage native org provide repository shell support
130,chrony,服务,服务,client computer implementation input manual network operate protocol provide reference server service time
131,chrpath,工具,服务,allow compile currently dynamic library load modify path program remove support
132,cifs-utils,工具,服务,able allow authentication automatically client contain file filesystem kernel linux login machine manage microsoft module need option package password protocol provide purpose session share standard support tool user utilities windows work
133,cim-schema,服务,服务,common consist define description environment http information integration management model network org provide specification www
134,cjose,库,工具,
135,clang,其它,工具,
136,cldr-emoji-annotation,工具,其它,file language package provide
137,clevis,工具,服务,allow automatic automatically basic bind block boot building commonly data desktop device directly enable environment example framework gnome integration like package policy provide require root support
138,cloud-init,其它,其它,install instance need retrieve script special user various
139,clucene,工具,工具,alternative apache contain core date engine functionality high http java language module org popular port search similar specific speed text version
140,clufter,工具,服务,additional built capable cluster command common configuration contain conversion data extra file filter format framework generic include interface library line offer package plugin plugins primarily process python3 specific stack target tool variety
141,clutter,库,工具,application create example fast graphical interface library medium open rich software source type usage user
142,clutter-gst2,库,其它,create enable fast graphical integration interface library open rich software source user
143,clutter-gst3,库,其它,create enable fast graphical integration interface library open rich software source user
144,clutter-gtk,库,工具,allow application basic embed gtk inside library widget
145,cmake,工具,工具,base code common compiler complex configuration contain control cross data directory environment file generation independent macro make module native package platform possible process require simple software support template
146,cockpit,库,服务,authentication base browser card certificate client command component configuration configure console contain dbus enable instal interactive interface line linux network offer package report selinux server service session shell smart user
147,cockpit-appstream,库,服务,archive component create instal install integration interface load machine manage package read storage support update user virtual
148,cockpit-composer,库,其它,custom generate image integrate suitable
149,cockpit-session-recording,库,其它,allow component configuration generate module provide record session terminal view
150,codemodel,库,其它,code compiler file generate generator java library program project provide source
151,cogl,库,工具,able apis component design developer different easy extension good graphic hardware help implement implementation library like machine make mean need open option provide render single small software source specification state style utility write
152,color-filesystem,库,其它,color directory filesystem layout package provide store
153,colord,服务,服务,color context daemon device level library profile
154,colord-gtk,库,库,additional functionality gtk library provide require support
155,compat-libtiff3,库,工具,compatibility current file format image library manipulate package provide version
156,conntrack-tools,工具,服务,addition available cluster collect command connection contain currently daemon dump event high interact interface kernel line linux list maintain manipulate message monitor multiple package program search setup state table tools track userspace
157,container-exception-logger,工具,工具,able container design exception host input inside tool
158,containerd,服务,服务,available complete container daemon execution host image level linux low manage network open runtime standard storage test transfer windows
