name,label,summary,description,predict
google-noto-serif-telugu-fonts,其它, Serif Telugu font," Noto fonts aims to remove tofu from web by providing fonts for all
Unicode supported scripts. Its design goal is to achieve visual harmonization
between multiple scripts. Noto family supports almost all scripts available
in Unicode.

Noto Serif font for Telugu.",其它
go-toolset,应用, Package that installs go-toolset, This is the main package for go-toolset.,应用
gpgme,系统, GnuPG Made Easy - high level crypto API," GnuPG Made Easy (GPGME) is a library designed to make access to GnuPG
easier for applications.  It provides a high-level crypto API for
encryption, decryption, signing, signature verification and key
management.",系统
gpgmepp,系统,C++ bindings/wrapper for GPGME ,C++ bindings/wrapper for GPGME. ,系统
gpm-libs,应用, Dynamic library for gpm," This package contains the libgpm.so dynamic library which contains
the gpm system calls and library functions.",应用
graphite2,应用, Font rendering capabilities for complex non-Roman writing systems," Graphite2 is a project within SIL__ Non-Roman Script Initiative and Language
Software Development groups to provide rendering capabilities for complex
non-Roman writing systems. Graphite can be used to create __mart fonts_ capable
of displaying writing systems with various complex behaviors. With respect to
the Text Encoding Model, Graphite handles the ""Rendering"" aspect of writing
system implementation.",应用
graphviz-gd,应用, Graphviz plugin for renderers based on gd," Graphviz plugin for renderers based on gd.  (Unless you absolutely have to use
GIF, you are recommended to use the PNG format instead because of the better
quality anti-aliased lines provided by the cairo+pango based renderer.)",应用
graphviz-python3,应用, Python 3 extension for graphviz, Python 3 extension for graphviz.,应用
greenboot,系统, Generic Health Check Framework for systemd, Generic Health Check Framework for systemd.,系统
greenboot-default-health-checks,系统, Series of optional and curated health checks, Series of optional and curated health checks.,应用
grilo,应用, Content discovery framework," Grilo is a framework that provides access to different sources of
multimedia content, using a pluggable system.
This package contains the core library and elements.",应用
grilo-plugins,应用, Plugins for the Grilo framework," Grilo is a framework that provides access to different sources of
multimedia content, using a pluggable system.
This package contains plugins to get information from theses sources:
- Apple Trailers
- Bookmarks
- Euronews
- Filesystem
- Flickr
- Freebox
- Gravatar
- iTunes Music Sharing
- Jamendo
- Last.fm (for album arts)
- Local metadata (album arts and thumbnails)
- Metadata Store
- Pocket
- Podcasts
- Radio France
- Shoutcast
- The Guardian Videos
- Tracker
- Vimeo
- Youtube",应用
groff-base,核心, Parts of the groff formatting system required to display manual pages," The groff-base package contains only necessary parts of groff formatting
system which are required to display manual pages, and the groff's default
display device (PostScript).",应用
grub2-efi-aa64-modules,核心,Modules used to build custom grub.efi images ,"
The GRand Unified Bootloader (GRUB) is a highly configurable and
customizable bootloader with modular architecture.  It supports a rich
variety of kernel formats, file systems, computer architectures and
hardware devices.

This subpackage provides support for rebuilding your own grub.efi. ",核心
grub2-efi-x64-cdboot,核心,Files used to boot removeable media with EFI ,"
The GRand Unified Bootloader (GRUB) is a highly configurable and
customizable bootloader with modular architecture.  It supports a rich
variety of kernel formats, file systems, computer architectures and
hardware devices.

This subpackage provides optional components of grub used with removeable media on efi-x64 systems. ",核心
grub2-pc,核心,"Bootloader with support for Linux, Multiboot, and more ","
The GRand Unified Bootloader (GRUB) is a highly configurable and
customizable bootloader with modular architecture.  It supports a rich
variety of kernel formats, file systems, computer architectures and
hardware devices.

This subpackage provides support for %{1} systems. ",核心
grub2-tools,核心, Support tools for GRUB.," 
The GRand Unified Bootloader (GRUB) is a highly configurable and
customizable bootloader with modular architecture.  It supports a rich
variety of kernel formats, file systems, computer architectures and
hardware devices.

This subpackage provides tools for support of all platforms.",核心
grub2-tools-extra,核心, Support tools for GRUB.," 
The GRand Unified Bootloader (GRUB) is a highly configurable and
customizable bootloader with modular architecture.  It supports a rich
variety of kernel formats, file systems, computer architectures and
hardware devices.

This subpackage provides tools for support of all platforms.",核心
grubby,系统, Command line tool for updating BootLoaderSpec files," This package provides a grubby compatibility script that manages
BootLoaderSpec files and is meant to only be used for legacy compatibility
users with existing grubby users.",系统
gsettings-qt,应用, Qt/QML bindings for GSettings, Qt/QML bindings for GSettings.,应用
gspell,应用, Spell-checking library for GTK+," gspell provides a flexible API to implement the spell checking
in a GTK+ application.",应用
gssdp,应用, Resource discovery and announcement over SSDP," GSSDP implements resource discovery and announcement over SSDP and is part
of gUPnP.  GUPnP is an object-oriented open source framework for creating
UPnP devices and control points, written in C using GObject and libsoup. The
GUPnP API is intended to be easy to use, efficient and flexible.",应用
gssdp-docs,应用, Documentation files for gssdp, This package contains developer documentation for gssdp.,应用
gssntlmssp,应用, GSSAPI NTLMSSP Mechanism, A GSSAPI Mechanism that implements NTLMSSP,应用
gssproxy,应用,GSSAPI Proxy ,A proxy for GSSAPI credential handling ,系统
gstreamer,应用, GStreamer streaming media framework runtime," GStreamer is a streaming media framework, based on graphs of filters which
operate on media data. Applications using this library can do anything
from real-time sound processing to playing videos, and just about anything
else media-related.  Its plugin-based architecture means that new data
types or processing capabilities can be added simply by installing new
plugins.",应用
gstreamer1,应用, GStreamer streaming media framework runtime," GStreamer is a streaming media framework, based on graphs of filters which
operate on media data. Applications using this library can do anything
from real-time sound processing to playing videos, and just about anything
else media-related.  Its plugin-based architecture means that new data
types or processing capabilities can be added simply by installing new
plugins.",应用
gstreamer1-plugins-bad-free,应用," GStreamer streaming media framework ""bad"" plugins"," GStreamer is a streaming media framework, based on graphs of elements which
operate on media data.

This package contains plug-ins that aren't tested well enough, or the code
is not of good enough quality.",应用
gstreamer1-plugins-good,应用, GStreamer plugins with good code and licensing," GStreamer is a streaming media framework, based on graphs of filters which
operate on media data. Applications using this library can do anything
from real-time sound processing to playing videos, and just about anything
else media-related.  Its plugin-based architecture means that new data
types or processing capabilities can be added simply by installing new
plugins.

GStreamer Good Plugins is a collection of well-supported plugins of
good quality and under the LGPL license.",应用
gstreamer1-plugins-good-gtk,应用," GStreamer ""good"" plugins gtk plugin"," GStreamer is a streaming media framework, based on graphs of elements which
operate on media data.

GStreamer Good Plugins is a collection of well-supported plugins of
good quality and under the LGPL license.

This package (gstreamer1-plugins-good-gtk) contains the gtksink output plugin.",应用
gstreamer1-plugins-ugly-free,应用," GStreamer streaming media framework ""ugly"" plugins"," GStreamer is a streaming media framework, based on graphs of elements which
operate on media data.

This package contains plug-ins whose license is not fully compatible with LGPL.",应用
gmock,应用, Google C++ Mocking Framework," Inspired by jMock, EasyMock, and Hamcrest, and designed with C++s
specifics in mind, Google C++ Mocking Framework (or Google Mock for
short) is a library for writing and using C++ mock classes.

Google Mock:

 o lets you create mock classes trivially using simple macros,
 o supports a rich set of matchers and actions,
 o handles unordered, partially ordered, or completely ordered
   expectations,
 o is extensible by users, and
 o works on Linux, Mac OS X, Windows, Windows Mobile, minGW, and
   Symbian.",应用
gtest,应用, Google C++ testing framework," Framework for writing C++ tests on a variety of platforms (GNU/Linux,
Mac OS X, Windows, Windows CE, and Symbian). Based on the xUnit
architecture. Supports automatic test discovery, a rich set of
assertions, user-defined assertions, death tests, fatal and non-fatal
failures, various options for running the tests, and XML test report
generation.",应用
gtk2,应用, GTK+ graphical user interface library," GTK+ is a multi-platform toolkit for creating graphical user
interfaces. Offering a complete set of widgets, GTK+ is suitable for
projects ranging from small one-off tools to complete application
suites.",应用
gtk2-devel-docs,应用, Developer documentation for GTK+, This package contains developer documentation for the GTK+ widget toolkit.,应用
gtk2-immodules,应用, Input methods for GTK+," The gtk2-immodules package contains standalone input methods that are shipped
as part of GTK+.",应用
gtk3-immodule-xim,应用, XIM support for GTK+, The gtk3-immodule-xim package contains XIM support for GTK+ 3.,应用
gtkmm24,应用, C++ interface for GTK2 (a GUI library for X)," gtkmm provides a C++ interface to the GTK+ GUI library. gtkmm2 wraps GTK+ 2.
Highlights include typesafe callbacks, widgets extensible via inheritance
and a comprehensive set of widget classes that can be freely combined to
quickly create complex user interfaces.",应用
gtkmm30,应用, C++ interface for the GTK+ library," gtkmm is the official C++ interface for the popular GUI library GTK+.
Highlights include type safe callbacks, and a comprehensive set of
widgets that are easily extensible via inheritance.",应用
gtk-vnc2,应用, A GTK3 widget for VNC clients," gtk-vnc is a VNC viewer widget for GTK3. It is built using coroutines
allowing it to be completely asynchronous while remaining single threaded.",应用
gvnc,应用, A GObject for VNC connections," gvnc is a GObject for managing a VNC connection. It provides all the
infrastructure required to build a VNC client without having to deal
with the raw protocol itself.",应用
gupnp-igd,系统, Library to handle UPnP IGD port mapping, gupnp-igd is a library to handle UPnP IGD port mapping.,应用
gutenprint,应用, Printer Drivers Package," Gutenprint is a package of high quality printer drivers for Linux, BSD,
Solaris, IRIX, and other UNIX-alike operating systems.
Gutenprint was formerly called Gimp-Print.",应用
gutenprint-cups,应用," CUPS drivers for Canon, Epson, HP and compatible printers"," This package contains native CUPS support for a wide range of Canon,
Epson, HP and compatible printers.",应用
gutenprint-libs,应用, libgutenprint library," This package includes libgutenprint library, necessary to run gutenprint.",应用
gvfs,系统, Backends for the gio framework in GLib," The gvfs package provides backend implementations for the gio
framework in GLib. It includes ftp, sftp, cifs.",应用
gvfs-afc,系统, AFC support for gvfs," This package provides support for reading files on mobile devices
including phones and music players to applications using gvfs.",应用
gvfs-afp,系统, AFP support for gvfs," This package provides support for reading and writing files on
Mac OS X and original Mac OS network shares via Apple Filing Protocol
to applications using gvfs.",应用
gvfs-archive,系统, Archiving support for gvfs," This package provides support for accessing files inside Zip and Tar archives,
as well as ISO images, to applications using gvfs.",应用
gvfs-client,系统, Client modules of backends for the gio framework in GLib," The gvfs package provides client modules of backend implementations for the gio
framework in GLib.",应用
gvfs-goa,系统, GOA support for gvfs," This package provides seamless integration with gnome-online-accounts
file services.",应用
gvfs-gphoto2,系统, gphoto2 support for gvfs," This package provides support for reading and writing files on
PTP based cameras (Picture Transfer Protocol) and MTP based
media players (Media Transfer Protocol) to applications using gvfs.",应用
gvfs-mtp,系统, MTP support for gvfs," This package provides support for reading and writing files on
MTP based devices (Media Transfer Protocol) to applications using gvfs.",应用
gvfs-smb,系统, Windows fileshare support for gvfs," This package provides support for reading and writing files on windows
shares (SMB) to applications using gvfs.",应用
hamcrest,应用, Library of matchers for building test expressions," Provides a library of matcher objects (also known as constraints or predicates)
allowing 'match' rules to be defined declaratively, to be used in other
frameworks. Typical scenarios include testing frameworks, mocking libraries and
UI validation rules.",应用
hamcrest-javadoc,应用, Javadoc for hamcrest, Javadoc for hamcrest.,应用
haproxy,系统, HAProxy reverse proxy for high availability environments," HAProxy is a TCP/HTTP reverse proxy which is particularly suited for high
availability environments. Indeed, it can:
 - route HTTP requests depending on statically assigned cookies
 - spread load among several servers while assuring server persistence
   through the use of HTTP cookies
 - switch to backup servers in the event a main one fails
 - accept connections to special ports dedicated to service monitoring
 - stop accepting connections without breaking existing ones
 - add, modify, and delete HTTP headers in both directions
 - block requests matching particular patterns
 - report detailed status to authenticated users from a URI
   intercepted from the application",应用
harfbuzz-icu,应用, Harfbuzz ICU support library, This package contains Harfbuzz ICU support library.,应用
hawtjni-javadoc,应用, Javadocs for hawtjni, This package contains the API documentation for hawtjni.,应用
help2man,应用, Create simple man pages from --help output," help2man is a script to create simple man pages from the --help and
--version output of programs.

Since most GNU documentation is now in info format, this provides a
way to generate a placeholder man page pointing to that resource while
still providing some useful information.",系统
highlight,应用, Universal source code to formatted text converter," A utility that converts sourcecode to HTML, XHTML, RTF, LaTeX, TeX,
XSL-FO, XML or ANSI escape sequences with syntax highlighting.
It supports several programming and markup languages.
Language descriptions are configurable and support regular expressions.
The utility offers indentation and reformatting capabilities.
It is easily possible to create new language definitions and colour themes.",系统
highlight-gui,应用, GUI for the hihghlight source code formatter, A Qt-based GUI for the highlight source code formatter source.,应用
hivex,应用, Read and write Windows Registry binary hive files," Hive files are the undocumented binary files that Windows uses to
store the Windows Registry on disk.  Hivex is a library that can read
and write to these files.

'hivexsh' is a shell you can use to interactively navigate a hive
binary file.

'hivexregedit' (in perl-hivex) lets you export and merge to the
textual regedit format.

'hivexml' can be used to convert a hive file to a more useful XML
format.

In order to get access to the hive files themselves, you can copy them
from a Windows machine.  They are usually found in
%systemroot%\system32\config.  For virtual machines we recommend
using libguestfs or guestfish to copy out these files.  libguestfs
also provides a useful high-level tool called 'virt-win-reg' (based on
hivex technology) which can be used to query specific registry keys in
an existing Windows VM.

For OCaml bindings, see 'ocaml-hivex-devel'.

For Perl bindings, see 'perl-hivex'.

For Python 3 bindings, see 'python3-hivex'.

For Ruby bindings, see 'ruby-hivex'.",应用
ocaml-hivex,应用, OCaml bindings for hivex," ocaml-hivex contains OCaml bindings for hivex.

This is for toplevel and scripting access only.  To compile OCaml
programs which use hivex you will also need ocaml-hivex-devel.",应用
perl-hivex,应用, Perl bindings for hivex, perl-hivex contains Perl bindings for hivex.,系统
hostname,系统,Utility to set/show the host name or domain name ,"This package provides commands which can be used to display the system's
DNS name, and to display or set its hostname or NIS domain name. ",应用
hplip,应用, HP Linux Imaging and Printing Project," The Hewlett-Packard Linux Imaging and Printing Project provides
drivers for HP printers and multi-function peripherals.",应用
hplip-common,应用, Files needed by the HPLIP printer and scanner drivers, Files needed by the HPLIP printer and scanner drivers.,应用
hplip-libs,应用, HPLIP libraries, Libraries needed by HPLIP.,应用
libsane-hpaio,应用, SANE driver for scanners in HP's multi-function devices, SANE driver for scanners in HP's multi-function devices (from HPOJ).,应用
httpcomponents-client-cache,应用, Cache module for httpcomponents-client, This package provides client side caching for httpcomponents-client.,应用
httpcomponents-client-javadoc,应用, API documentation for httpcomponents-client, API documentation for httpcomponents-client.,应用
httpcomponents-core-javadoc,应用, API documentation for httpcomponents-core, API documentation for httpcomponents-core.,应用
httpcomponents-project,应用, Common POM file for HttpComponents," Common Maven POM  file for HttpComponents. This project should be
required only for building dependant packages with Maven. Please don't
use it as runtime requirement.",应用
httpd,应用, Apache HTTP Server," The Apache HTTP Server is a powerful, efficient, and extensible
web server.",应用
httpd-filesystem,应用, The basic directory layout for the Apache HTTP server," The httpd-filesystem package contains the basic directory layout
for the Apache HTTP server including the correct permissions
for the directories.",应用
mod_ldap,应用, LDAP authentication modules for the Apache HTTP Server," The mod_ldap and mod_authnz_ldap modules add support for LDAP
authentication to the Apache HTTP Server.",应用
mod_session,应用, Session interface for the Apache HTTP Server," The mod_session module and associated backends provide an abstract
interface for storing and accessing per-user session data.",应用
http-parser,应用, HTTP request/response parser for C," This is a parser for HTTP messages written in C. It parses both requests and
responses. The parser is designed to be used in performance HTTP applications.
It does not make any syscalls nor allocations, it does not buffer data, it can
be interrupted at anytime. Depending on your architecture, it only requires
about 40 bytes of data per message stream (in a web server that is per
connection).",应用
hunspell,应用, A spell checker and morphological analyzer library," Hunspell is a spell checker and morphological analyzer library and program
designed for languages with rich morphology and complex word compounding or
character encoding. Hunspell interfaces: Ispell-like terminal interface using
Curses library, Ispell pipe interface, LibreOffice UNO module.",应用
hunspell-ar,应用, Arabic hunspell dictionaries," Arabic (Egypt, Algeria, etc.) hunspell dictionaries.",应用
hunspell-az,应用, Azerbaijani hunspell dictionaries, Azerbaijani hunspell dictionaries.,应用
hyphen-be,应用, Belarusian hyphenation rules, Belarusian hyphenation rules.,应用
hunspell-csb,应用, Kashubian hunspell dictionaries, Kashubian hunspell dictionaries.,应用
hunspell-cv,应用, Chuvash hunspell dictionaries, Chuvash hunspell dictionaries.,应用
hunspell-de,应用, German hunspell dictionaries," German (Germany, Switzerland, etc.) hunspell dictionaries.",应用
hunspell-el,应用, Greek hunspell dictionaries, Greek hunspell dictionaries.,应用
hunspell-es,应用, Spanish hunspell dictionaries," Spanish (Spain, Mexico, etc.) hunspell dictionaries.",应用
hunspell-es-AR,应用, Argentine Spanish hunspell dictionary, Argentine Spanish hunspell dictionary,应用
hunspell-es-BO,应用, Bolivian Spanish hunspell dictionary, Bolivian Spanish hunspell dictionary,应用
hunspell-es-CO,应用, Colombian Spanish hunspell dictionary, Colombian Spanish hunspell dictionary,应用
hunspell-es-CU,应用, Cuban Spanish hunspell dictionary, Cuban Spanish hunspell dictionary,应用
hunspell-es-DO,应用, Dominican Spanish hunspell dictionary, Dominican Spanish hunspell dictionary,应用
hunspell-es-EC,应用, Ecuadorian Spanish hunspell dictionary, Ecuadorian Spanish hunspell dictionary,应用
hunspell-es-ES,应用, European Spanish hunspell dictionary, European Spanish hunspell dictionary,应用
hunspell-es-HN,应用, Honduran Spanish hunspell dictionary, Honduran Spanish hunspell dictionary,应用
hunspell-es-PR,应用, Puerto Rican Spanish hunspell dictionary, Puerto Rican Spanish hunspell dictionary,应用
hunspell-es-PY,应用, Paraguayan Spanish hunspell dictionary, Paraguayan Spanish hunspell dictionary,应用
hunspell-es-SV,应用, Salvadoran Spanish hunspell dictionary, Salvadoran Spanish hunspell dictionary,应用
hunspell-es-VE,应用, Venezuelan Spanish hunspell dictionary, Venezuelan Spanish hunspell dictionary,应用
hyphen-et,应用, Estonian hyphenation rules, Estonian hyphenation rules.,应用
hunspell-fr,应用, French hunspell dictionaries," French (France, Belgium, etc.) hunspell dictionaries.",应用
hunspell-fur,应用, Friulian hunspell dictionaries, Friulian hunspell dictionaries.,应用
hunspell-grc,应用, Ancient Greek hunspell dictionaries, Ancient Greek hunspell dictionaries.,应用
hunspell-gv,应用, Manx hunspell dictionaries, Manx hunspell dictionaries.,应用
hunspell-haw,应用, Hawaiian hunspell dictionaries, Hawaiian hunspell dictionaries.,应用
hunspell-hi,应用, Hindi hunspell dictionaries, Hindi hunspell dictionaries.,应用
hunspell-hsb,应用, Upper Sorbian hunspell dictionaries, Upper Sorbian hunspell dictionaries.,应用
hunspell-hu,应用, Hungarian hunspell dictionaries, Hungarian hunspell dictionaries.,应用
hunspell-is,应用, Icelandic hunspell dictionaries, Icelandic hunspell dictionaries.,应用
hunspell-it,应用, Italian hunspell dictionaries, Italian hunspell dictionaries.,应用
hunspell-ky,应用, Kirghiz hunspell dictionaries, Kirghiz hunspell dictionaries.,应用
hunspell-la,应用, Latin hunspell dictionaries, Latin hunspell dictionaries.,应用
hunspell-lb,应用, Luxembourgish hunspell dictionaries, Luxembourgish hunspell dictionaries.,应用
mythes-lb,应用, Luxembourgish thesaurus, Luxembourgish thesaurus.,应用
hunspell-lt,应用, Lithuanian hunspell dictionaries, Lithuanian hunspell dictionaries.,应用
hunspell-mai,应用, Maithili hunspell dictionaries, Maithili hunspell dictionaries.,应用
hunspell-mg,应用, Malagasy hunspell dictionaries, Malagasy hunspell dictionaries.,应用
hunspell-mi,应用, Maori hunspell dictionaries, Maori hunspell dictionaries.,应用
hunspell-ml,应用, Malayalam hunspell dictionaries, Malayalam hunspell dictionaries,应用
hunspell-mr,应用, Marathi hunspell dictionaries, Marathi hunspell dictionaries.,应用
hunspell-mt,应用, Maltese hunspell dictionaries, Maltese hunspell dictionaries.,应用
hunspell-nds,应用, Lowlands Saxon hunspell dictionaries, Lowlands Saxon hunspell dictionaries.,应用
hunspell-nb,应用, Bokmaal hunspell dictionaries, Bokmaal hunspell dictionaries.,应用
mythes-nb,应用, Bokmaal thesaurus, Bokmaal thesaurus.,应用
hunspell-ny,应用, Chichewa hunspell dictionaries, Chichewa hunspell dictionaries.,应用
hunspell-oc,应用, Occitan hunspell dictionaries, Occitan hunspell dictionaries.,应用
hunspell-qu,应用, Quechua Ecuador hunspell dictionaries, Quechua Ecuador hunspell dictionaries.,应用
hunspell-quh,应用," Quechua, South Bolivia hunspell dictionaries", Quechua South Bolivia hunspell dictionaries.,应用
hunspell-ru,应用, Russian hunspell dictionaries, Russian hunspell dictionaries.,应用
hunspell-sc,应用, Sardinian hunspell dictionaries, Sardinian hunspell dictionaries.,应用
hunspell-se,应用, Northern Saami hunspell dictionaries, Northern Saami hunspell dictionaries.,应用
hunspell-smj,应用, Lule Saami hunspell dictionaries, Lule Saami hunspell dictionaries.,应用
hunspell-sq,应用, Albanian hunspell dictionaries, Albanian hunspell dictionaries.,应用
hunspell-sr,应用, Serbian hunspell dictionaries, Serbian hunspell dictionaries.,应用
hunspell-sv,应用, Swedish hunspell dictionaries, Swedish hunspell dictionaries.,应用
hunspell-sw,应用, Swahili hunspell dictionaries, Swahili hunspell dictionaries.,应用
hunspell-te,应用, Telugu hunspell dictionaries, Telugu hunspell dictionaries.,应用
hunspell-th,应用, Thai hunspell dictionaries, Thai hunspell dictionaries.,应用
