name,label,summary,description,predict
micropipenv,应用, A simple wrapper around pip to support Pipenv and Poetry files," A lightweight wrapper for pip to support Pipenv and Poetry lock files or
converting them to pip-tools compatible output.",系统
mingw-binutils-generic,应用, Utilities which are needed for both the Win32 and Win64 toolchains," Utilities (like strip and objdump) which are needed for
both the Win32 and Win64 toolchains",应用
mingw32-bzip2-static,应用, Static library for mingw32-bzip2 development, Static library for mingw32-bzip2 development.,应用
mingw64-bzip2,应用, 64 Bit version of bzip2 for Windows," Bzip2 is a freely available, patent-free, high quality data compressor.
Bzip2 compresses files to within 10 to 15 percent of the capabilities
of the best techniques available.  However, bzip2 has the added benefit
of being approximately two times faster at compression and six times
faster at decompression than those techniques.  Bzip2 is not the
fastest compression utility, but it does strike a balance between speed
and compression capability.

This package contains development tools and libraries for use when
cross-compiling Windows software.",应用
mingw32-cairo,应用, MinGW Windows Cairo library, MinGW Windows Cairo library.,应用
mingw64-cairo,应用, MinGW Windows Cairo library, MinGW Windows Cairo library.,应用
mingw32-crt,应用, MinGW Windows cross-compiler runtime for the win32 target," MinGW Windows cross-compiler runtime, base libraries for the win32 target.",应用
mingw64-crt,应用, MinGW Windows cross-compiler runtime for the win64 target," MinGW Windows cross-compiler runtime, base libraries for the win64 target.",应用
mingw64-expat,应用, MinGW Windows port of expat XML parser library," This is expat, the C library for parsing XML, written by James Clark. Expat
is a stream oriented XML parser. This means that you register handlers with
the parser prior to starting the parse. These handlers are called when the
parser discovers the associated structures in the document being parsed. A
start tag is an example of the kind of structures for which you may
register handlers.",应用
mingw32-filesystem,应用, MinGW cross compiler base filesystem and environment for the win32 target," This package contains the base filesystem layout, RPM macros and
environment for all MinGW packages.",应用
mingw-filesystem-base,应用, Generic files which are needed for both mingw32-filesystem and mingw64-filesystem," This package contains the base filesystem layout, RPM macros and
environment for all MinGW packages.",应用
mingw64-fontconfig,应用, MinGW Windows Fontconfig library, MinGW Windows Fontconfig library.,应用
mingw32-freetype-static,应用, Static version of the MinGW Windows Freetype library, Static version of the MinGW Windows Freetype library.,应用
mingw64-freetype,应用, Free and portable font rendering engine, MinGW Windows Freetype library.,应用
mingw64-freetype-static,应用, Static version of the MinGW Windows Freetype library, Static version of the MinGW Windows Freetype library.,应用
mingw32-cpp,应用, MinGW Windows cross-C Preprocessor for the win32 target, MinGW Windows cross-C Preprocessor for the win32 target.,应用
mingw32-gcc-c++,应用, MinGW Windows cross-compiler for C++ for the win32 target, MinGW Windows cross-compiler for C++ for the win32 target.,应用
mingw64-gcc,应用, MinGW Windows cross-compiler (GCC) for C for the win64 target, MinGW Windows cross-compiler (GCC) for C for the win64 target.,应用
mingw64-gcc-c++,应用, MinGW Windows cross-compiler for C++ for the win64 target, MinGW Windows cross-compiler for C++ for the win64 target.,应用
mingw64-gettext,应用, GNU libraries and utilities for producing multi-lingual messages, MinGW Windows Gettext library,应用
mingw32-glib2-static,应用, Static version of the MinGW Windows GLib2 library, Static version of the MinGW Windows GLib2 library.,应用
mingw64-gstreamer1,应用, MinGW Windows Streaming-Media Framework Runtime," GStreamer is a streaming-media framework, based on graphs of filters
which operate on media data. Applications using this library can do
anything from real-time sound processing to playing videos, and just
about anything else media-related. Its plug-in-based architecture
means that new data types or processing capabilities can be added by
installing new plug-ins.",应用
mingw32-harfbuzz-static,应用, Static version of the MinGW Windows Harfbuzz library, Static version of the MinGW Windows Harfbuzz library.,应用
mingw64-harfbuzz,应用, MinGW Windows Harfbuzz library, HarfBuzz is an implementation of the OpenType Layout engine.,应用
mingw64-headers,应用, MinGW Windows cross-compiler Win64 header files, MinGW Windows cross-compiler Win64 header files.,应用
mingw32-icu,应用, MinGW compilation of International Components for Unicode Tools," ICU is a set of C and C++ libraries that provides robust and
full-featured Unicode and locale support. The library provides calendar
support, conversions for many character sets, language sensitive
collation, date and time formatting, support for many locales, message
catalogs and resources, message formatting, normalization, number and
currency formatting, time zone support, transliteration, and word,
line, and sentence breaking, etc.",应用
mingw32-libjpeg-turbo-static,应用, Static version of the MinGW Windows Libjpeg-turbo library, Static version of the MinGW Windows cross compiled Libjpeg-turbo library.,应用
mingw64-libjpeg-turbo,应用, MinGW Windows Libjpeg-turbo library, MinGW Windows cross compiled Libjpeg-turbo library.,应用
mingw32-libpng-static,应用, Static version of MinGW Windows Libpng library," MinGW Windows Libpng library.

This package contains static cross-compiled libraries.",应用
mingw64-libpng-static,应用, Static version of MinGW Windows Libpng library," MinGW Windows Libpng library.

This package contains static cross-compiled libraries.",应用
mingw32-pcre-static,应用, Static version of the mingw32-pcre library, Static version of the mingw32-pcre library.,应用
mingw64-pcre,应用, MinGW Windows pcre library," Cross compiled Perl-compatible regular expression library for use with mingw64.

PCRE has its own native API, but a set of ""wrapper"" functions that are based on
the POSIX API are also supplied in the library libpcreposix. Note that this
just provides a POSIX calling interface to PCRE: the regular expressions
themselves still follow Perl syntax and semantics. The header file
for the POSIX-style functions is called pcreposix.h.",应用
mingw32-pixman,应用, MinGW Windows Pixman library, MinGW Windows Pixman library.,应用
mingw64-readline,应用, MinGW port of readline for editing typed command lines," The Readline library provides a set of functions that allow users to
edit command lines. Both Emacs and vi editing modes are available. The
Readline library includes additional functions for maintaining a list
of previously-entered command lines for recalling or editing those
lines, and for performing csh-like history expansion on previous
commands.

This is a port of the library and development tools to Windows.",应用
mingw32-sqlite,应用, MinGW Windows port of sqlite embeddable SQL database engine," SQLite is a C library that implements an SQL database engine. A large
subset of SQL92 is supported. A complete database is stored in a
single disk file. The API is designed for convenience and ease of use.
Applications that link against SQLite can enjoy the power and
flexibility of an SQL database without the administrative hassles of
supporting a separate database server.  Version 2 and version 3 binaries
are named to permit each to be installed on a single host

This package contains cross-compiled libraries and development tools
for Windows.",应用
mingw32-sqlite-static,应用, Static version of MinGW Windows port of sqlite library," SQLite is a C library that implements an SQL database engine. A large
subset of SQL92 is supported. A complete database is stored in a
single disk file. The API is designed for convenience and ease of use.
Applications that link against SQLite can enjoy the power and
flexibility of an SQL database without the administrative hassles of
supporting a separate database server.  Version 2 and version 3 binaries
are named to permit each to be installed on a single host

This package contains static cross-compiled library",应用
mingw64-sqlite,应用, MinGW Windows port of sqlite embeddable SQL database engine," SQLite is a C library that implements an SQL database engine. A large
subset of SQL92 is supported. A complete database is stored in a
single disk file. The API is designed for convenience and ease of use.
Applications that link against SQLite can enjoy the power and
flexibility of an SQL database without the administrative hassles of
supporting a separate database server.  Version 2 and version 3 binaries
are named to permit each to be installed on a single host

This package contains cross-compiled libraries and development tools
for Windows.",应用
mingw32-termcap,应用, MinGW terminal feature database," This is the GNU termcap library -- a library of C functions that
enable programs to send control strings to terminals in a way
independent of the terminal type.  The GNU termcap library does not
place an arbitrary limit on the size of termcap entries, unlike most
other termcap libraries.

This package contains libraries and development tools for the MinGW
cross-compiled version.",应用
mingw64-termcap,应用, MinGW terminal feature database," This is the GNU termcap library -- a library of C functions that
enable programs to send control strings to terminals in a way
independent of the terminal type.  The GNU termcap library does not
place an arbitrary limit on the size of termcap entries, unlike most
other termcap libraries.

This package contains libraries and development tools for the MinGW
cross-compiled version.",应用
mingw32-win-iconv-static,应用, Static version of the MinGW Windows Iconv library, Static version of the MinGW Windows Iconv library.,应用
mingw64-win-iconv,应用, MinGW Windows Iconv library, MinGW Windows Iconv library,应用
mingw32-winpthreads,应用, MinGW pthread library for the win32 target," The POSIX 1003.1-2001 standard defines an application programming
interface (API) for writing multithreaded applications. This interface
is known more commonly as pthreads. A good number of modern operating
systems include a threading library of some kind: Solaris (UI)
threads, Win32 threads, DCE threads, DECthreads, or any of the draft
revisions of the pthreads standard. The trend is that most of these
systems are slowly adopting the pthreads standard API, with
application developers following suit to reduce porting woes.

Win32 does not, and is unlikely to ever, support pthreads
natively. This project seeks to provide a freely available and
high-quality solution to this problem.",应用
mingw32-winpthreads-static,应用, Static version of the MinGW Windows pthreads library, Static version of the MinGW Windows pthreads library.,应用
mingw64-winpthreads,应用, MinGW pthread library for the win64 target," The POSIX 1003.1-2001 standard defines an application programming
interface (API) for writing multithreaded applications. This interface
is known more commonly as pthreads. A good number of modern operating
systems include a threading library of some kind: Solaris (UI)
threads, Win32 threads, DCE threads, DECthreads, or any of the draft
revisions of the pthreads standard. The trend is that most of these
systems are slowly adopting the pthreads standard API, with
application developers following suit to reduce porting woes.

Win32 does not, and is unlikely to ever, support pthreads
natively. This project seeks to provide a freely available and
high-quality solution to this problem.",应用
mingw32-zlib,应用, MinGW Windows zlib compression library for the win32 target, MinGW Windows zlib compression library for the win32 target.,应用
mingw32-zlib-static,应用, Static libraries for mingw32-zlib development., The mingw32-zlib-static package contains static library for mingw32-zlib development.,应用
mingw64-zlib,应用, MinGW Windows zlib compression library for the win64 target, MinGW Windows zlib compression library for the win64 target.,应用
mingw64-zlib-static,应用, Static libraries for mingw64-zlib development, The mingw64-zlib-static package contains static library for mingw64-zlib development.,应用
minicom,应用,A text-based modem control and terminal emulation program ,"Minicom is a simple text-based modem control and terminal emulation
program somewhat similar to MSDOS Telix. Minicom includes a dialing
directory, full ANSI and VT100 emulation, an (external) scripting
language, and other features. ",系统
minizip1.2,应用, Library for manipulation with .zip archives," Minizip is a library for manipulation with files from .zip archives.
This package contains the old minizip API, as bundled with zlib.",系统
mksh,应用,MirBSD enhanced version of the Korn Shell ,"mksh is the MirBSD enhanced version of the Public Domain Korn shell (pdksh),
a bourne-compatible shell which is largely similar to the original AT&T Korn
shell. It includes bug fixes and feature improvements in order to produce a
modern, robust shell good for interactive and especially script use, being a
bourne shell replacement, pdksh successor and an alternative to the C shell. ",应用
mockito,应用, A Java mocking framework," Mockito is a mocking framework that tastes really good. It lets you write
beautiful tests with clean & simple API. Mockito doesn't give you hangover
because the tests are very readable and they produce clean verification
errors.",应用
mod_authnz_pam,应用, PAM authorization checker and PAM Basic Authentication provider," mod_authnz_pam is a PAM authorization module, supplementing
authentication done by other modules, for example mod_auth_kerb; it
can also be used as full Basic Authentication provider which runs the
[login, password] authentication through the PAM stack.",系统
mod_http2,应用, module implementing HTTP/2 for Apache 2," The mod_h2 Apache httpd module implements the HTTP2 protocol (h2+h2c) on
top of libnghttp2 for httpd 2.4 servers.",应用
mod_md,应用, Certificate provisioning using ACME for the Apache HTTP Server," This module manages common properties of domains for one or more
virtual hosts. Specifically it can use the ACME protocol to automate
certificate provisioning.  Certificates will be configured for managed
domains and their virtual hosts automatically, including at renewal.",应用
mod_security,应用, Security module for the Apache HTTP Server," ModSecurity is an open source intrusion detection and prevention engine
for web applications. It operates embedded into the web server, acting
as a powerful umbrella - shielding web applications from attacks.",应用
python3-mod_wsgi,应用, A WSGI interface for Python web applications in Apache," The mod_wsgi adapter is an Apache module that provides a WSGI compliant
interface for hosting Python based web applications within Apache. The
adapter is written completely in C code against the Apache C runtime and
for hosting WSGI applications within Apache has a lower overhead than using
existing WSGI adapters for mod_python or CGI.",应用
modello-javadoc,应用, Javadoc for modello, API documentation for modello.,应用
ModemManager,应用, Mobile broadband modem management service," The ModemManager service manages WWAN modems and provides a consistent API for
interacting with these devices to client applications.",应用
mojo-parent,应用, Codehaus MOJO parent project pom file, Codehaus MOJO parent project pom file,应用
mokutil,应用,Tool to manage UEFI Secure Boot MoK Keys ,"mokutil provides a tool to manage keys for Secure Boot through the MoK
(""Machine's Own Keys"") mechanism. ",应用
motif-static,应用, Static libraries, This package contains the static Motif libraries.,应用
mousetweaks,应用, Mouse accessibility support for the GNOME desktop," The Mousetweaks package provides mouse accessibility enhancements for
the GNOME desktop, such as performing various clicks without using any
hardware button. The options can be accessed through the Accessibility
tab of the Mouse Preferences of GNOME Control Center or through command-line.",应用
mozjs60,系统, SpiderMonkey JavaScript library," SpiderMonkey is the code-name for Mozilla Firefox's C++ implementation of
JavaScript. It is intended to be embedded in other applications
that provide host environments for JavaScript.",应用
mpg123,应用," Real time MPEG 1.0/2.0/2.5 audio player/decoder for layers 1, 2 and 3"," Real time MPEG 1.0/2.0/2.5 audio player/decoder for layers 1, 2 and 3 (most
commonly MPEG 1.0 layer 3 aka MP3), as well as re-usable decoding and output
libraries.",应用
mpg123-plugins-pulseaudio,应用, Pulseaudio output plug-in for mpg123," Real time MPEG 1.0/2.0/2.5 audio player/decoder for layers 1, 2 and 3 (most
commonly MPEG 1.0 layer 3 aka MP3), as well as re-usable decoding and output
libraries.

Pulseaudio output plug-in.",应用
python3-mpich,应用, mpich support for Python 3, mpich support for Python 3.,应用
mpitests-mpich,应用, MPI tests package compiled against mpich, MPI test suite compiled against the mpich package,应用
mpitests-mvapich2,应用, MPI tests package compiled against mvapich2, MPI test suite compiled against the mvapich2 package,应用
mpitests-mvapich2-psm2,应用, MPI tests package compiled against mvapich2 using OmniPath, MPI test suite compiled against the mvapich2 package using OmniPath,应用
mpitests-openmpi,应用, MPI tests package compiled against openmpi, MPI test suite compiled against the openmpi package,应用
mpv,应用, Movie player playing most video formats and DVDs," Mpv is a movie player based on MPlayer and mplayer2. It supports a wide variety
of video file formats, audio and video codecs, and subtitle types. Special
input URL types are available to read input from a variety of sources other
than disk files. Depending on platform, a variety of different video and audio
output methods are supported.",应用
mrtg,应用, Multi Router Traffic Grapher," The Multi Router Traffic Grapher (MRTG) is a tool to monitor the traffic
load on network-links. MRTG generates HTML pages containing PNG
images which provide a LIVE visual representation of this traffic.",系统
mstflint,系统, Mellanox firmware burning tool," This package contains firmware update tool, vpd dump and register dump tools
for network adapters based on Mellanox Technologies chips.",应用
mtools,系统,Programs for accessing MS-DOS disks without mounting the disks ,"Mtools is a collection of utilities for accessing MS-DOS files.
Mtools allow you to read, write and move around MS-DOS filesystem
files (normally on MS-DOS floppy disks).  Mtools supports Windows95
style long file names, OS/2 XDF disks, and 2m disks

Mtools should be installed if you need to use MS-DOS disks ",应用
munge-libs,应用, Runtime libs for uid * gid authentication across a host cluster, Runtime libraries for using MUNGE.,应用
munge-maven-plugin-javadoc,应用, API documentation for munge-maven-plugin, This package provides API documentation for munge-maven-plugin.,应用
mutter,应用, Window and compositing manager based on Clutter," Mutter is a window and compositing manager that displays and manages
your desktop via OpenGL. Mutter combines a sophisticated display engine
using the Clutter toolkit with solid window-management logic inherited
from the Metacity window manager.

While Mutter can be used stand-alone, it is primarily intended to be
used as the display core of a larger system such as GNOME Shell. For
this reason, Mutter is very extensible via plugins, which are used both
to add fancy visual effects and to rework the window management
behaviors to meet the needs of the environment.",应用
mvapich2,应用, OSU MVAPICH2 MPI package," MVAPICH2 is a Message Passing Interface (MPI 3.0) implementation based on MPICH
and developed by Ohio State University.",系统
mysql,应用, MySQL client programs and shared libraries," MySQL is a multi-user, multi-threaded SQL database server. MySQL is a
client/server implementation consisting of a server daemon (mysqld)
and many different client programs and libraries. The base package
contains the standard MySQL client programs and generic MySQL files.",应用
mysql-common,应用, The shared files required for MySQL server and client," The mysql-common package provides the essential shared files for any
MySQL program. You will need to install this package to use any other
MySQL package.",应用
mythes,应用, A thesaurus library," MyThes is a simple thesaurus that uses a structured text data file and an
index file with binary search to look up words and phrases and return
information on part of speech, meanings, and synonyms.",应用
mythes-bg,应用, Bulgarian thesaurus, Bulgarian thesaurus.,应用
mythes-cs,应用, Czech thesaurus, Czech thesaurus.,应用
mythes-da,应用, Danish thesaurus, Danish thesaurus.,应用
mythes-fr,应用, French thesaurus, French thesaurus.,应用
mythes-ga,应用, Irish thesaurus, Irish thesaurus.,应用
mythes-mi,应用, Maori thesaurus, Maori thesaurus.,应用
mythes-ne,应用, Nepali thesaurus, Nepali thesaurus.,应用
mythes-nl,应用, Dutch thesaurus, Dutch thesaurus.,应用
mythes-ro,应用, Romanian thesaurus, Romanian thesaurus.,应用
mythes-sk,应用, Slovak thesaurus, Slovak thesaurus.,应用
mythes-sl,应用, Slovenian thesaurus, Slovenian thesaurus.,应用
nafees-web-naskh-fonts,其它, Nafees Web font for writing Urdu in the Naskh script," 
Character based Nafees Web Naskh Open Type Font for writing Urdu in Naskh
script based on Unicode standard. This version has complete support of
Aerabs for Urdu and updated glyphs for Latin characters.
Nafees Web Naskh OTF contains approximately 330 glyphs, including 5 ligatures.",应用
nasm,应用, A portable x86 assembler which uses Intel-like syntax," NASM is the Netwide Assembler, a free portable assembler for the Intel
80x86 microprocessor series, using primarily the traditional Intel
instruction mnemonics and syntax.",应用
nautilus,应用, File manager for GNOME," Nautilus is the file manager and graphical shell for the GNOME desktop
that makes it easy to manage your files and the rest of your system.
It allows to browse directories on local and remote filesystems, preview
files and launch applications associated with them.
It is also responsible for handling the icons on the GNOME desktop.",应用
nautilus-sendto,应用, Nautilus context menu for sending files," The nautilus-sendto package provides a Nautilus context menu for
sending files via other desktop applications.  These functions are
implemented as plugins, so nautilus-sendto can be extended with
additional features.",应用
nbdkit-basic-plugins,系统, Basic plugins for nbdkit," This package contains plugins for nbdkit which only depend on simple
C libraries: glibc, gnutls, libzstd.  Other plugins for nbdkit with
more complex dependencies are packaged separately.

nbdkit-data-plugin          Serve small amounts of data from the command line.

nbdkit-eval-plugin          Write a shell script plugin on the command line.

nbdkit-file-plugin          The normal file plugin for serving files.

nbdkit-floppy-plugin        Create a virtual floppy disk from a directory.

nbdkit-full-plugin          A virtual disk that returns ENOSPC errors.

nbdkit-info-plugin          Serve client and server information.

nbdkit-memory-plugin        A virtual memory plugin.

nbdkit-null-plugin          A null (bitbucket) plugin.

nbdkit-ondemand-plugin      Create filesystems on demand.

nbdkit-pattern-plugin       Fixed test pattern.

nbdkit-partitioning-plugin  Create virtual disks from partitions.

nbdkit-random-plugin        Random content plugin for testing.

nbdkit-sh-plugin            Write plugins as shell scripts or executables.

nbdkit-sparse-random-plugin Make sparse random disks.

nbdkit-split-plugin         Concatenate one or more files.

nbdkit-streaming-plugin     A streaming file serving plugin.

nbdkit-zero-plugin          Zero-length plugin for testing.",系统
nbdkit-curl-plugin,系统, HTTP/FTP (cURL) plugin for nbdkit, This package contains cURL (HTTP/FTP) support for nbdkit.,系统
nbdkit-gzip-filter,系统, GZip filter for nbdkit, This package is a gzip filter for nbdkit.,系统
nbdkit-gzip-plugin,系统, GZip plugin for nbdkit, This package is a gzip plugin for nbdkit.,系统
nbdkit-nbd-plugin,系统, NBD proxy / forward plugin for nbdkit," This package lets you forward NBD connections from nbdkit
to another NBD server.",应用
nbdkit-python-plugin,系统, Python 3 plugin for nbdkit, This package lets you write Python 3 plugins for nbdkit.,系统
nbdkit-tar-filter,系统, Tar archive filter for nbdkit, This package is a tar archive filter for nbdkit.,系统
nbdkit-tar-plugin,系统, Tar archive plugin for nbdkit, This package is a tar archive plugin for nbdkit.,系统
nbdkit-tmpdisk-plugin,系统, Remote temporary filesystem disk plugin for nbdkit, This package is a remote temporary filesystem disk plugin for nbdkit.,系统
nbdkit-vddk-plugin,系统, VMware VDDK plugin for nbdkit," This package is a plugin for nbdkit which connects to
VMware VDDK for accessing VMware disks and servers.",系统
ncurses,核心, Ncurses support utilities," The curses library routines are a terminal-independent method of
updating character screens with reasonable optimization.  The ncurses
(new curses) library is a freely distributable replacement for the
discontinued 4.4 BSD classic curses library.

This package contains support utilities, including a terminfo compiler
tic, a decompiler infocmp, clear, tput, tset, and a termcap conversion
tool captoinfo.",核心
