name,label,summary,description,predict
python38-pysocks,系统, A Python SOCKS client module," 
A fork of SocksiPy with bug fixes and extra features.

Acts as a drop-in replacement to the socket module. Featuring:

- SOCKS proxy client for Python 2.6 - 3.x
- TCP and UDP both supported
- HTTP proxy client included but not supported or recommended (you should use
  urllib2's or requests' own HTTP proxy interface)
- urllib2 handler included.
This package is for Python3 version 3.8 only.",系统
python3-pytoml,系统, Parser for TOML, A parser for TOML-0.4.0,应用
python3-pyudev,系统, A libudev binding," pyudev is a LGPL licensed, pure Python binding for libudev, the device
and hardware management and information library for Linux.  It supports
almost all libudev functionality, you can enumerate devices, query device
properties and attributes or monitor devices, including asynchronous
monitoring with threads, or within the event loops of Qt, Glib or wxPython.

The binding supports CPython 2 (2.6 or newer) and 3 (3.1 or newer), and
PyPy 1.5 or newer.  It is tested against udev 151 or newer, earlier
versions of udev as found on dated Linux systems may work, but are not
officially supported.",系统
python3-qt5-base,应用, Python 3 bindings for Qt5 base, Python 3 bindings for Qt5 base.,应用
python-qt5-rpm-macros,应用, RPM macros python-qt5, RPM macros python-qt5.,系统
python3-requests,系统," HTTP library, written in Python, for human beings"," Most existing Python modules for sending HTTP requests are extremely verbose and
cumbersome. Python__ built-in urllib2 module provides most of the HTTP
capabilities you should need, but the API is thoroughly broken. This library is
designed to make HTTP requests easy for developers.",系统
python2-requests,系统," HTTP library, written in Python, for human beings"," Most existing Python modules for sending HTTP requests are extremely verbose and
cumbersome. Python__ built-in urllib2 module provides most of the HTTP
capabilities you should need, but the API is thoroughly broken. This library is
designed to make HTTP requests easy for developers.",系统
python38-requests,系统," HTTP library, written in Python, for human beings"," Most existing Python modules for sending HTTP requests are extremely verbose and
cumbersome. Python__ built-in urllib2 module provides most of the HTTP
capabilities you should need, but the API is thoroughly broken. This library is
designed to make HTTP requests easy for developers.",系统
python39-requests,系统," HTTP library, written in Python, for human beings"," Most existing Python modules for sending HTTP requests are extremely verbose and
cumbersome. Python__ built-in urllib2 module provides most of the HTTP
capabilities you should need, but the API is thoroughly broken. This library is
designed to make HTTP requests easy for developers.",系统
python3-requests-ftp,系统, FTP transport adapter for python3-requests," Requests-FTP is an implementation of a very stupid FTP transport adapter for
use with the awesome Requests Python library.

This is the Python 3 version of the transport adapter module.",系统
python3-rpm-macros,系统, RPM macros for building Python 3 packages, RPM macros for building Python 3 packages.,系统
python-rpm-macros,系统, The unversioned Python RPM macros," This package contains the unversioned Python RPM macros, that most
implementations should rely on.

You should not need to install this package manually as the various
python?-devel packages require it. So install a python-devel package instead.",系统
python-srpm-macros,系统, RPM macros for building Python source packages, RPM macros for building Python source packages.,系统
target-restore,系统,Systemd service for targetcli/rtslib ,"Systemd service to restore the LIO kernel target settings
on system restart. ",系统
python3-s3transfer,系统, An Amazon S3 Transfer Manager, S3transfer is a Python library for managing Amazon S3 transfers.,应用
python2-scour,系统, An SVG scrubber, An SVG scrubber.,应用
python3-setuptools,系统,Easily build and distribute Python 3 packages ,"Setuptools is a collection of enhancements to the Python distutils that allow
you to more easily build and distribute Python packages, especially ones that
have dependencies on other packages.

This package also contains the runtime components of setuptools, necessary to
execute the software that requires pkg_resources.py. ",系统
python3-setuptools-wheel,系统, The setuptools wheel, A Python wheel of setuptools to use with venv.,系统
python2-setuptools_scm,系统, Blessed package to manage your versions by scm tags," Setuptools_scm handles managing your python package versions in scm metadata.
It also handles file finders for the suppertes scms.",系统
python-sphinx-locale,系统, Locale files for python-sphinx," Sphinx is a tool that makes it easy to create intelligent and
beautiful documentation for Python projects (or other documents
consisting of multiple reStructuredText sources), written by Georg
Brandl. It was originally created to translate the new Python
documentation, but has now been cleaned up in the hope that it will be
useful to many other projects.

This package contains locale files for Sphinx",应用
python3-sphinx_rtd_theme,系统, Sphinx theme for readthedocs.org," This is a prototype mobile-friendly sphinx theme for readthedocs.org.
It's currently in development and includes some rtd variable checks that
can be ignored if you're just trying to use it on your project outside
of that site.",应用
python3-sphinx-theme-alabaster,系统, Configurable sidebar-enabled Sphinx theme," This theme is a modified ""Kr"" Sphinx theme from @kennethreitz (especially as
used in his Requests project), which was itself originally based on @mitsuhiko's
theme used for Flask & related projects.",应用
python3-sqlalchemy,系统, Modular and flexible ORM library for python," SQLAlchemy is an Object Relational Mappper (ORM) that provides a flexible,
high-level interface to SQL databases.  Database and domain concepts are
decoupled, allowing both sides maximum flexibility and power. SQLAlchemy
provides a powerful mapping layer that can work as automatically or as manually
as you choose, determining relationships based on foreign keys or letting you
define the join conditions explicitly, to bridge the gap between database and
domain.

This package includes the python 3 version of the module.",系统
python3-suds,系统, A python SOAP client," The suds project is a python soap web services client lib.  Suds leverages
python meta programming to provide an intuitive API for consuming web
services.  Objectification of types defined in the WSDL is provided
without class generation.  Programmers rarely need to read the WSDL since
services and WSDL based objects can be easily inspected.",系统
python3-sure,系统, Utility belt for automated testing in Python 3," A testing library for Python with powerful and flexible assertions. Sure is
heavily inspired by should.js.",系统
python39-toml,系统," Python Library for Tom's Obvious, Minimal Language"," TOML aims to be a minimal configuration file format that's easy to read due to
obvious semantics. TOML is designed to map unambiguously to a hash table. TOML
should be easy to parse into data structures in a wide variety of languages.
This package loads toml file into python dictionary and dump dictionary into
toml file.",系统
python3-uritemplate,系统, Simple python library to deal with URI Templates (RFC 6570)," Simple python library to deal with URI Templates (RFC 6570).

Python 3 version.",系统
python3-urllib3,系统, Python3 HTTP library with thread-safe connection pooling and file post, Python3 HTTP module with connection pooling and file POST abilities.,系统
python39-urllib3,系统, Python3 HTTP library with thread-safe connection pooling and file post, Python3 HTTP module with connection pooling and file POST abilities.,系统
python3-varlink,系统,Python implementation of Varlink ,An python module for Varlink with client and server support. ,系统
python3-virtualenv,系统, Tool to create isolated Python environments," virtualenv is a tool to create isolated Python environments. virtualenv
is a successor to workingenv, and an extension of virtual-python. It is
written by Ian Bicking, and sponsored by the Open Planning Project. It is
licensed under an MIT-style permissive license",系统
python2-virtualenv,系统, Tool to create isolated Python environments," virtualenv is a tool to create isolated Python environments. virtualenv
is a successor to workingenv, and an extension of virtual-python. It is
written by Ian Bicking, and sponsored by the Open Planning Project. It is
licensed under an MIT-style permissive license",系统
python3-werkzeug,系统, The Swiss Army knife of Python web development," Werkzeug
========

Werkzeug started as simple collection of various utilities for WSGI
applications and has become one of the most advanced WSGI utility
modules.  It includes a powerful debugger, full featured request and
response objects, HTTP utilities to handle entity tags, cache control
headers, HTTP dates, cookie handling, file uploads, a powerful URL
routing system and a bunch of community contributed addon modules.

Werkzeug is unicode aware and doesn't enforce a specific template
engine, database adapter or anything else.  It doesn't even enforce
a specific way of handling requests and leaves all that up to the
developer. It's most useful for end user applications which should work
on as many server environments as possible (such as blogs, wikis,
bulletin boards, etc.).",系统
python39-wheel-wheel,系统, The Python wheel module packaged as a wheel, A Python wheel of wheel to use with virtualenv.,系统
python3-whoosh,系统," Fast, Python3 full text indexing, search, and spell checking library"," Whoosh is a fast, featureful full-text indexing and searching library
implemented in pure Python. Programmers can use it to easily add search
functionality to their applications and websites. Every part of how Whoosh
works can be extended or replaced to meet your needs exactly.",应用
python3-yubico,系统, Pure-python library for interacting with Yubikeys, Pure-python library for interacting with Yubikeys. For Python 3.,系统
python2-pytz,系统, World Timezone Definitions for Python," pytz brings the Olson tz database into Python. This library allows accurate
and cross platform timezone calculations using Python 2.3 or higher. It
also solves the issue of ambiguous times at the end of daylight savings,
which you can read more about in the Python Library Reference
(datetime.tzinfo).

Almost all (over 540) of the Olson timezones are supported.",系统
python3-pytz,系统, World Timezone Definitions for Python," pytz brings the Olson tz database into Python. This library allows accurate
and cross platform timezone calculations using Python 2.3 or higher. It
also solves the issue of ambiguous times at the end of daylight savings,
which you can read more about in the Python Library Reference
(datetime.tzinfo).

Almost all (over 540) of the Olson timezones are supported.",系统
python38-pytz,系统, World Timezone Definitions for Python," pytz brings the Olson tz database into Python. This library allows accurate
and cross platform timezone calculations using Python 2.3 or higher. It
also solves the issue of ambiguous times at the end of daylight savings,
which you can read more about in the Python Library Reference
(datetime.tzinfo).

Almost all (over 540) of the Olson timezones are supported.",系统
python3-pyusb,系统, Python bindings for libusb," PyUSB provides easy USB access to python. The module contains classes and
methods to support most USB operations.",系统
python3-pyxattr,系统, Extended attributes library wrapper for Python 3," Python extension module wrapper for libattr. It allows to query, list,
add and remove extended attributes from files and directories.

Python 3 version.",系统
python38-pyyaml,系统, YAML parser and emitter for Python," YAML is a data serialization format designed for human readability and
interaction with scripting languages.  PyYAML is a YAML parser and
emitter for Python.

PyYAML features a complete YAML 1.1 parser, Unicode support, pickle
support, capable extension API, and sensible error messages.  PyYAML
supports standard YAML tags and provides Python-specific tags that
allow to represent an arbitrary Python object.

PyYAML is applicable for a broad range of tasks from complex
configuration files to object serialization and persistence.",系统
qatengine,系统, Intel QuickAssist Technology (QAT) OpenSSL Engine," This package provides the Intel QuickAssist Technology OpenSSL Engine
(an OpenSSL Plug-In Engine) which provides cryptographic acceleration
for both hardware and optimized software using Intel QuickAssist Technology
enabled Intel platforms.",系统
qatzip,系统, Intel QuickAssist Technology (QAT) QATzip Library," QATzip is a user space library which builds on top of the Intel
QuickAssist Technology user space library, to provide extended
accelerated compression and decompression services by offloading the
actual compression and decompression request(s) to the Intel Chipset
Series. QATzip produces data using the standard gzip* format
(RFC1952) with extended headers. The data can be decompressed with a
compliant gzip* implementation. QATzip is designed to take full
advantage of the performance provided by Intel QuickAssist
Technology.",系统
qatzip-libs,系统, Libraries for the qatzip package," This package contains libraries for applications to use
the QATzip APIs.",系统
qdox,应用, Extract class/interface/method definitions from sources," QDox is a high speed, small footprint parser
for extracting class/interface/method definitions
from source files complete with JavaDoc @tags.
It is designed to be used by active code
generators or documentation tools.",应用
qdox-javadoc,应用, Javadoc for qdox, API docs for qdox.,应用
qemu-img,系统, QEMU command line tool for manipulating disk images, This package provides a command line tool for manipulating disk images.,系统
qemu-kvm-block-gluster,系统, QEMU Gluster block driver," This package provides the additional Gluster block driver for QEMU.

Install this package if you want to access remote Gluster storage.",应用
qemu-kvm-core,系统, qemu-kvm core components," qemu-kvm is an open source virtualizer that provides hardware
emulation for the KVM hypervisor. qemu-kvm acts as a virtual
machine monitor together with the KVM kernel modules, and emulates the
hardware for a full system such as a PC and its associated peripherals.",系统
qemu-kvm-docs,系统, qemu-kvm documentation, qemu-kvm-docs provides documentation files regarding qemu-kvm.,应用
qemu-kvm-ui-opengl,系统, QEMU opengl support, This package provides opengl support.,应用
qpdf-libs,应用, QPDF library for transforming PDF files," QPDF is a C++ library that inspect and manipulate the structure of PDF files.
It can encrypt and linearize files, expose the internals of a PDF file,
and do many other operations useful to PDF developers.",应用
qperf,系统, Measure socket and RDMA performance, Measure socket and RDMA performance.,系统
qrencode,应用, Generate QR 2D barcodes," Qrencode is a utility software using libqrencode to encode string data in
a QR Code and save as a PNG image.",应用
qrencode-libs,应用, QR Code encoding library - Shared libraries," The qrencode-libs package contains the shared libraries and header files for
applications that use qrencode.",应用
qt5-rpm-macros,应用, RPM macros for building Qt5 and KDE Frameworks 5 packages, RPM macros for building Qt5 and KDE Frameworks 5 packages.,应用
qt5-srpm-macros,应用, RPM macros for source Qt5 packages, RPM macros for source Qt5 packages.,系统
qt5-qtbase-common,应用, Common files for Qt5, Common files for Qt5.,应用
qt5-qtbase-examples,应用, Programming examples for qt5-qtbase, Programming examples for qt5-qtbase.,应用
qt5-qtbase-gui,应用, Qt5 GUI-related libraries, Qt5 libraries used for drawing widgets and OpenGL items.,应用
qt5-qtbase-postgresql,应用, PostgreSQL driver for Qt5's SQL classes, PostgreSQL driver for Qt5's SQL classes.,应用
qt5-qtbase-static,应用, Static library files for qt5-qtbase, Static library files for qt5-qtbase.,应用
qt5-qtcanvas3d,应用, Qt5 - Canvas3d component, Qt5 Canvas3D component,应用
qt5-qtcanvas3d-examples,应用, Programming examples for qt5-qtcanvas3d, Programming examples for qt5-qtcanvas3d.,应用
qt5-qtdeclarative,应用, Qt5 - QtDeclarative component, Qt5 - QtDeclarative component.,应用
qt5-qtdeclarative-examples,应用, Programming examples for qt5-qtdeclarative, Programming examples for qt5-qtdeclarative.,应用
qt5-qtlocation-examples,应用, Programming examples for qt5-qtlocation, Programming examples for qt5-qtlocation.,应用
qt5-qtmultimedia,应用, Qt5 - Multimedia support," The Qt Multimedia module provides a rich feature set that enables you to
easily take advantage of a platforms multimedia capabilites and hardware.
This ranges from the playback and recording of audio and video content to
the use of available devices like cameras and radios.",应用
qt5-qtquickcontrols2-examples,应用, Examples for qt5-qtquickcontrols2, Examples for qt5-qtquickcontrols2.,应用
qt5-qtscript,应用, Qt5 - QtScript component, Qt5 - QtScript component.,应用
qt5-qtserialport,应用, Qt5 - SerialPort component," Qt Serial Port provides the basic functionality, which includes configuring,
I/O operations, getting and setting the control signals of the RS-232 pinouts.",应用
qt5-qtsvg,应用, Qt5 - Support for rendering and displaying SVG," Scalable Vector Graphics (SVG) is an XML-based language for describing
two-dimensional vector graphics. Qt provides classes for rendering and
displaying SVG drawings in widgets and on other paint devices.",应用
qt5-qtsvg-examples,应用, Programming examples for qt5-qtsvg, Programming examples for qt5-qtsvg.,应用
qt5-qdbusviewer,应用, D-Bus debugger and viewer," QDbusviewer can be used to inspect D-Bus objects of running programs
and invoke methods on those objects.",应用
qt5-qttools-libs-designer,应用, Qt5 Designer runtime library, Qt5 Designer runtime library.,应用
qt5-qttools-static,应用, Static library files for qt5-qttools, Static library files for qt5-qttools.,应用
qt5-qtwayland-examples,应用, Programming examples for qt5-qtwayland, Programming examples for qt5-qtwayland.,应用
qt5-qtwebchannel,应用, Qt5 - WebChannel component," The Qt WebChannel module provides a library for seamless integration of C++
and QML applications with HTML/JavaScript clients. Any QObject can be
published to remote clients, where its public API becomes available.",应用
qt5-qtwebsockets,应用, Qt5 - WebSockets component," The QtWebSockets module implements the WebSocket protocol as specified in RFC
6455. It solely depends on Qt (no external dependencies).",应用
qt5-qtwebsockets-examples,应用, Programming examples for qt5-qtwebsockets, Programming examples for qt5-qtwebsockets.,应用
qt5-qtx11extras,应用, Qt5 - X11 support library," The X11 Extras module provides features specific to platforms using X11, e.g.
Linux and UNIX-like systems including embedded Linux systems that use the X
Window System.",应用
qt5-qtxmlpatterns,应用, Qt5 - QtXmlPatterns component," The Qt XML Patterns module provides support for XPath, XQuery, XSLT,
and XML Schema validation.",应用
qtchooser,应用, Wrapper to select between Qt development binary versions," Qt Chooser provides a wrapper to switch between versions of Qt development
binaries when multiple versions like 4 and 5 are installed or local Qt builds
are to be used.",应用
quota,系统, System administration tools for monitoring users' disk usage," The quota package contains system administration tools for monitoring
and limiting user and or group disk usage per file system.",系统
quota-nld,系统,quota_nld daemon ,"Daemon that listens on netlink socket and processes received quota warnings.
Note, that you have to enable the kernel support for sending quota messages
over netlink (in Filesystems->Quota menu). The daemon supports forwarding
warning messages to the system D-Bus (so that desktop manager can display
a dialog) and writing them to the terminal user has last accessed. ",应用
rarian,应用, Documentation meta-data library," Rarian is a documentation meta-data library that allows access to documents,
man pages and info pages.  It was designed as a replacement for scrollkeeper.",应用
rarian-compat,应用, Extra files for compatibility with scrollkeeper," This package contains files needed to maintain backward-compatibility with
scrollkeeper.",应用
ibacm,系统, InfiniBand Communication Manager Assistant," The ibacm daemon helps reduce the load of managing path record lookups on
large InfiniBand fabrics by providing a user space implementation of what
is functionally similar to an ARP cache.  The use of ibacm, when properly
configured, can reduce the SA packet load of a large IB cluster from O(n^2)
to O(n).  The ibacm daemon is started and normally runs in the background,
user applications need not know about this daemon as long as their app
uses librdmacm to handle connection bring up/tear down.  The librdmacm
library knows how to talk directly to the ibacm daemon to retrieve data.",系统
infiniband-diags,系统,InfiniBand Diagnostic Tools ,"This package provides IB diagnostic programs and scripts needed to diagnose an
IB subnet.  infiniband-diags now also provides libibmad.  libibmad provides
low layer IB functions for use by the IB diagnostic and management
programs. These include MAD, SA, SMP, and other basic IB functions. ",系统
iwpmd,系统,iWarp Port Mapper userspace daemon ,"iwpmd provides a userspace service for iWarp drivers to claim
tcp ports through the standard socket interface. ",系统
libibumad,系统, OpenFabrics Alliance InfiniBand umad (userspace management datagram) library," libibumad provides the userspace management datagram (umad) library
functions, which sit on top of the umad modules in the kernel. These
are used by the IB diagnostic and management tools, including OpenSM.",应用
libibverbs-utils,系统,Examples for the libibverbs library ,"Useful libibverbs example programs such as ibv_devinfo, which
displays information about RDMA devices. ",系统
librdmacm,系统, Userspace RDMA Connection Manager, librdmacm provides a userspace RDMA Communication Management API.,系统
librdmacm-utils,系统,Examples for the librdmacm library ,Example test programs for the librdmacm library. ,系统
python3-pyverbs,系统,Python3 API over IB verbs ,"Pyverbs is a Cython-based Python API over libibverbs, providing an
easy, object-oriented access to IB verbs. ",系统
rdma-core,系统, RDMA core userspace libraries and daemons," RDMA core userspace infrastructure and documentation, including kernel
driver-specific modprobe override configs, IPoIB network scripts,
dracut rules, and the rdma-ndd utility.",系统
srp_daemon,系统,Tools for using the InfiniBand SRP protocol devices ,"In conjunction with the kernel ib_srp driver, srp_daemon allows you to
discover and use SCSI devices via the SCSI RDMA Protocol over InfiniBand. ",系统
recode,应用, Conversion between character sets and surfaces," The `recode' converts files between character sets and usages.
It recognizes or produces nearly 150 different character sets
and is able to transliterate files between almost any pair. When exact
transliteration are not possible, it may get rid of the offending
characters or fall back on approximations.  Most RFC 1345 character sets
are supported.",应用
redhat-lsb-core,核心, LSB Core module support," The Linux Standard Base (LSB) Core module support provides the fundamental
system interfaces, libraries, and runtime environment upon which all conforming
applications and libraries depend.",系统
redhat-lsb-desktop,核心, LSB Desktop module support," The Linux Standard Base (LSB) Desktop Specifications define components that are
required to be present on an LSB conforming system.",应用
redhat-lsb-printing,核心, LSB Printing module support," The Linux Standard Base (LSB) Printing specifications define components that
are required to be present on an LSB conforming system.",应用
redhat-rpm-config,系统, Red Hat specific rpm configuration files, Red Hat specific rpm configuration files.,系统
redis,应用, A persistent key-value database," Redis is an advanced key-value store. It is often referred to as a data
structure server since keys can contain strings, hashes, lists, sets and
sorted sets.

You can run atomic operations on these types, like appending to a string;
incrementing the value in a hash; pushing to a list; computing set
intersection, union and difference; or getting the member with highest
ranking in a sorted set.

In order to achieve its outstanding performance, Redis works with an
in-memory dataset. Depending on your use case, you can persist it either
by dumping the dataset to disk every once in a while, or by appending
each command to a log.

Redis also supports trivial-to-setup master-slave replication, with very
fast non-blocking first synchronization, auto-reconnection on net split
and so forth.

Other features include Transactions, Pub/Sub, Lua scripting, Keys with a
limited time-to-live, and configuration settings to make Redis behave like
a cache.

You can use Redis from most programming languages also.",系统
