name,label,summary,description,predict
389-ds-base-legacy-tools,系统, Legacy utilities for 389 Directory Server," Legacy (and deprecated) utilities for 389 Directory Server. This includes
the old account management and task scripts. These are deprecated in favour of
the dscreate, dsctl, dsconf and dsidm tools.",系统
389-ds-base-snmp,系统, SNMP Agent for 389 Directory Server, SNMP Agent for the 389 Directory Server base package.,系统
liba52,系统," A free ATSC A/52 stream decoder, also known as AC-3 or AC3"," liba52 is a free library for decoding ATSC A/52 streams. The A/52
standard is used in a variety of applications, including digital
television and DVD. It is also known as AC-3 or AC3",应用
abattis-cantarell-fonts,其它," Cantarell, a Humanist sans-serif font family"," Cantarell is a set of fonts designed by Dave Crossland.
It is a sans-serif humanist typeface family.",其它
abrt-addon-kerneloops,应用, abrt's kerneloops addon," This package contains plugin for collecting kernel crash information from
system log.",应用
abrt-addon-vmcore,应用, abrt's vmcore addon," This package contains plugin for collecting kernel crash information from
vmcore files.",应用
abrt-cli,应用, Virtual package to make easy default installation on non-graphical environments," Virtual package to install all necessary packages for usage from command line
environment.",应用
abrt-cli-ng,应用, abrt's improved command line interface, New generation command line interface for ABRT,应用
abrt-dbus,应用, ABRT DBus service," ABRT DBus service which provides org.freedesktop.problems API on dbus and
uses PolicyKit to authorize to access the problem data.",应用
abrt-gui,应用, abrt's gui, GTK+ wizard for convenient bug reporting.,应用
abrt-plugin-machine-id,应用, abrt's plugin to generate machine_id based off dmidecode," This package contains a configuration snippet to enable automatic generation
of machine_id for abrt events.",应用
abrt-plugin-sosreport,应用, abrt's plugin for building automatic sosreports," This package contains a configuration snippet to enable automatic generation
of sosreports for abrt events.",应用
abrt-tui,应用, abrt's command line interface," This package contains a simple command line client for processing abrt reports
in command line environment.",应用
python3-abrt,应用, ABRT Python 3 API," High-level API for querying, creating and manipulating
problems handled by ABRT in Python 3.",应用
accel-config,应用, Configure accelerator subsystem devices, Utility library for configuring the accelerator subsystem.,系统
accel-config-libs,应用, Configuration library for accelerator subsystem devices, Libraries for accel-config.,系统
accountsservice,应用, D-Bus interfaces for querying and manipulating user account information," The accountsservice project provides a set of D-Bus interfaces for
querying and manipulating user account information and an implementation
of these interfaces, based on the useradd, usermod and userdel commands.",应用
acl,核心, Access control list utilities," This package contains the getfacl and setfacl utilities needed for
manipulating access control lists.",系统
libacl,核心, Dynamic library for access control list support," This package contains the libacl.so dynamic library which contains
the POSIX 1003.1e draft standard 17 functions for manipulating access
control lists.",系统
acpid,系统, ACPI Event Daemon, acpid is a daemon that dispatches ACPI events to user-space programs.,系统
adcli,应用,Active Directory enrollment ,"adcli is a tool for joining an Active Directory domain using
standard LDAP and Kerberos calls. ",应用
adwaita-cursor-theme,应用, Adwaita cursor theme," The adwaita-cursor-theme package contains a modern set of cursors originally
designed for the GNOME desktop.",应用
adwaita-icon-theme,应用, Adwaita icon theme, This package contains the Adwaita icon theme used by the GNOME desktop.,应用
aide,应用, Intrusion detection environment," AIDE (Advanced Intrusion Detection Environment) is a file integrity
checker and intrusion detection program.",应用
alsa-firmware,系统, Firmware for several ALSA-supported sound cards," This package contains the firmware binaries for a number of sound cards.
Some (but not all of these) require firmware loaders which are included in
the alsa-tools-firmware package.",系统
alsa-lib,系统, The Advanced Linux Sound Architecture (ALSA) library," The Advanced Linux Sound Architecture (ALSA) provides audio and MIDI
functionality to the Linux operating system.

This package includes the ALSA runtime libraries to simplify application
programming and provide higher level functionality as well as support for
the older OSS API, providing binary compatibility for most OSS programs.",系统
alsa-ucm,系统, ALSA Use Case Manager configuration," The Advanced Linux Sound Architecture (ALSA) Universal Configuration
Manager allows configuration of Audio input/output names and routing",系统
alsa-plugins-maemo,系统, Maemo plugin for ALSA," This plugin converts the ALSA API over PCM task nodes protocol. In this way,
ALSA native applications can run over DSP Gateway and use DSP PCM task nodes.",应用
alsa-plugins-samplerate,系统, External rate converter plugin for ALSA," This plugin is an external rate converter using libsamplerate by Erik de
Castro Lopo.",系统
alsa-plugins-speex,系统, Rate Converter Plugin Using Speex Resampler," The rate plugin is an external rate converter using the Speex resampler
(aka Public Parrot Hack) by Jean-Marc Valin. The pcm plugin provides
pre-processing of a mono stream like denoise using libspeex DSP API.",应用
alsa-plugins-usbstream,系统, USB stream plugin for ALSA," The usbstream plugin is for snd-usb-us122l driver. It converts PCM
stream to USB specific stream.",系统
alsa-plugins-vdownmix,系统, Downmixer to stereo plugin for ALSA," The vdownmix plugin is a downmixer from 4-6 channels to 2-channel
stereo headphone output.  This plugin processes the input signals with
a simple spacialization, so the output sounds like a kind of ""virtual
surround"".",系统
alsa-utils-alsabat,系统, Advanced Linux Sound Architecture (ALSA) - Basic Audio Tester," This package contains tool for basic audio testing using Advanced Linux Sound
Architecture (ALSA) framework and Fast Fourier Transform library.",应用
amanda,应用, A network-capable tape backup solution," AMANDA, the Advanced Maryland Automatic Network Disk Archiver, is a
backup system that allows the administrator of a LAN to set up a
single master backup server to back up multiple hosts to one or more
tape drives or disk files.  AMANDA uses native dump and/or GNU tar
facilities and can back up a large number of workstations running
multiple versions of Unix.  Newer versions of AMANDA (including this
version) can use SAMBA to back up Microsoft(TM) Windows95/NT hosts.
The amanda package contains the core AMANDA programs and will need to
be installed on both AMANDA clients and AMANDA servers.  Note that you
will have to install the amanda-client and/or amanda-server packages as
well.",系统
amanda-client,应用, The client component of the AMANDA tape backup system," The Amanda-client package should be installed on any machine that will
be backed up by AMANDA (including the server if it also needs to be
backed up).  You will also need to install the amanda package on each
AMANDA client machine.",系统
amanda-server,应用, The server side of the AMANDA tape backup system," The amanda-server package should be installed on the AMANDA server,
the machine attached to the device(s) (such as a tape drive) where backups
will be written. You will also need to install the amanda package on
the AMANDA server machine.  And, if the server is also to be backed up, the
server also needs to have the amanda-client package installed.",系统
anaconda-core,系统, Core of the Anaconda installer," The anaconda-core package contains the program which was used to install your
system.",系统
anaconda-dracut,系统, The anaconda dracut module," The 'anaconda' dracut module handles installer-specific boot tasks and
options. This includes driver disks, kickstarts, and finding the anaconda
runtime on NFS/HTTP/FTP servers or local disks.",系统
anaconda-widgets,系统, A set of custom GTK+ widgets for use with anaconda, This package contains a set of custom GTK+ widgets used by the anaconda installer.,应用
annobin,应用, Annotate and examine compiled binary files," Provides a plugin for GCC that records extra information in the files
that it compiles.

Note - the plugin is automatically enabled in gcc builds via flags
provided by the redhat-rpm-macros package.",系统
anolis-indexhtml,核心,Browser default start page for Anolis OS ,"The anolis-indexhtml package provides a welcome page shown by a web browser
after successful installation of Anolis OS.

This web page advises users on how to register their Anolis OS software and how
to get any support they might need. ",核心
anolis-backgrounds,核心, Anolis OS related desktop backgrounds," Licensed only for approved usage, see COPYING for details.",应用
anolis-logos,核心,Anolis OS related icons and pictures ,"Licensed only for approved usage, see COPYING for details. ",核心
anolis-experimental-release,核心, Experimental Packages for Anolis OS 8 repository configuration," This package contains the Experimental Packages for Anolis OS 8 repository
GPG key as well as configuration for yum.",核心
anolis-release,核心,Anolis OS 8 release file ,Anolis OS 8 release files ,核心
anolis-repos,核心,Anolis OS package repositories ,Anolis OS package repository files for yum and dnf ,核心
ansible-collection-microsoft-sql,应用, The Ansible collection for Microsoft SQL Server management," This RPM installs the Ansible collection for Microsoft SQL Server management
microsoft.sql. This RPM also installs the roles provided by the collection in
the legacy roles format for users of Ansible < 2.9.",应用
ansible-freeipa,应用," Roles and playbooks to deploy FreeIPA servers, replicas and clients"," Ansible roles and playbooks to install and uninstall FreeIPA servers, replicas
and clients. Also modules management.

Note: The Ansible playbooks and roles require a configured Ansible environment
where the Ansible nodes are reachable and are properly set up to have an IP
address and a working package manager.

Features

- Server, replica and client deployment
- Cluster deployments: Server, replicas and clients in one playbook
- One-time-password (OTP) support for client installation
- Repair mode for clients
- Backup and restore, also to and from controller
- Modules for automembership rule management
- Modules for automount key management
- Modules for automount location management
- Modules for automount map management
- Modules for config management
- Modules for delegation management
- Modules for dns config management
- Modules for dns forwarder management
- Modules for dns record management
- Modules for dns zone management
- Modules for group management
- Modules for hbacrule management
- Modules for hbacsvc management
- Modules for hbacsvcgroup management
- Modules for host management
- Modules for hostgroup management
- Modules for location management
- Modules for permission management
- Modules for privilege management
- Modules for pwpolicy management
- Modules for role management
- Modules for self service management
- Modules for server management
- Modules for service management
- Modules for sudocmd management
- Modules for sudocmdgroup management
- Modules for sudorule management
- Modules for topology management
- Modules for trust management
- Modules for user management
- Modules for vault management

Supported FreeIPA Versions

FreeIPA versions 4.6 and up are supported by all roles.

The client role supports versions 4.4 and up, the server role is working with
versions 4.5 and up, the replica role is currently only working with versions
4.6 and up.

Supported Distributions

- RHEL/CentOS 7.4+
- Fedora 26+
- Ubuntu
- Debian 10+ (ipaclient only, no server or replica!)

Requirements

  Controller
  - Ansible version: 2.8+ (ansible-freeipa is an Ansible Collection)
  - /usr/bin/kinit is required on the controller if a one time password (OTP)
    is used

  Node
  - Supported FreeIPA version (see above)
  - Supported distribution (needed for package installation only, see above)

Limitations

External signed CA is now supported. But the currently needed two step process
is an issue for the processing in a simple playbook.
Work is planned to have a new method to handle CSR for external signed CAs in
a separate step before starting the server installation.",应用
ant-antlr,应用, Optional antlr tasks for ant, Optional antlr tasks for ant.,应用
ant-apache-bsf,应用, Optional apache bsf tasks for ant, Optional apache bsf tasks for ant.,应用
ant-apache-log4j,应用, Optional apache log4j tasks for ant, Optional apache log4j tasks for ant.,应用
ant-apache-oro,应用, Optional apache oro tasks for ant, Optional apache oro tasks for ant.,应用
ant-apache-regexp,应用, Optional apache regexp tasks for ant, Optional apache regexp tasks for ant.,应用
ant-apache-resolver,应用, Optional apache resolver tasks for ant, Optional apache resolver tasks for ant.,应用
ant-apache-xalan2,应用, Optional apache xalan2 tasks for ant, Optional apache xalan2 tasks for ant.,应用
ant-commons-logging,应用, Optional commons logging tasks for ant, Optional commons logging tasks for ant.,应用
ant-commons-net,应用, Optional commons net tasks for ant, Optional commons net tasks for ant.,应用
ant-javadoc,应用, Javadoc for ant, Javadoc for ant.,应用
ant-junit,应用, Optional junit tasks for ant, Optional junit tasks for ant.,应用
ant-swing,应用, Optional swing tasks for ant, Optional swing tasks for ant.,应用
ant-contrib,应用, Collection of tasks for Ant," The Ant-Contrib project is a collection of tasks
(and at one point maybe types and other tools)
for Apache Ant.",应用
antlr-javadoc,应用, Javadoc for antlr, Javadoc for antlr.,应用
libaom,应用, Library files for aom," Library files for aom, the royalty-free next-generation
video format.",应用
aopalliance,应用, Java/J2EE AOP standards," Aspect-Oriented Programming (AOP) offers a better solution to many
problems than do existing technologies, such as EJB.  AOP Alliance
intends to facilitate and standardize the use of AOP to enhance
existing middleware environments (such as J2EE), or development
environements (e.g. Eclipse).  The AOP Alliance also aims to ensure
interoperability between Java/J2EE AOP implementations to build a
larger AOP community.",应用
apache-commons-cli-javadoc,应用, API documentation for apache-commons-cli, API documentation for apache-commons-cli.,应用
apache-commons-codec,应用, Implementations of common encoders and decoders," Commons Codec is an attempt to provide definitive implementations of
commonly used encoders and decoders. Examples include Base64, Hex,
Phonetic and URLs.",应用
apache-commons-collections-javadoc,应用, Javadoc for apache-commons-collections, Javadoc for apache-commons-collections.,应用
apache-commons-compress,应用, Java API for working with compressed files and archivers," The Apache Commons Compress library defines an API for working with
ar, cpio, Unix dump, tar, zip, gzip, XZ, Pack200 and bzip2 files.
In version 1.14 read-only support for Brotli decompression has been added,
but it has been removed form this package.",应用
apache-commons-exec,应用, Java library to reliably execute external processes from within the JVM," Commons Exec is a library for dealing with external process execution and
environment management in Java.",应用
apache-commons-io-javadoc,应用, API documentation for apache-commons-io, API documentation for apache-commons-io.,应用
apache-commons-lang,应用, Provides a host of helper utilities for the java.lang API," The standard Java libraries fail to provide enough methods for
manipulation of its core classes. The Commons Lang Component provides
these extra methods.
The Commons Lang Component provides a host of helper utilities for the
java.lang API, notably String manipulation methods, basic numerical
methods, object reflection, creation and serialization, and System
properties. Additionally it contains an inheritable enum type, an
exception structure that supports multiple types of nested-Exceptions
and a series of utilities dedicated to help with building methods, such
as hashCode, toString and equals.",应用
apache-commons-lang3-javadoc,应用, API documentation for apache-commons-lang3, API documentation for apache-commons-lang3.,应用
apache-commons-logging-javadoc,应用, API documentation for apache-commons-logging, API documentation for apache-commons-logging.,应用
apache-commons-net,应用, Internet protocol suite Java library," This is an Internet protocol suite Java library originally developed by
ORO, Inc.  This version supports Finger, Whois, TFTP, Telnet, POP3, FTP,
NNTP, SMTP, and some miscellaneous protocols like Time and Echo as well
as BSD R command support. The purpose of the library is to provide
fundamental protocol access, not higher-level abstractions.",应用
apache-commons-net-javadoc,应用, API documentation for apache-commons-net, API documentation for apache-commons-net.,应用
apache-commons-parent,应用, Apache Commons Parent Pom, The Project Object Model files for the apache-commons packages.,应用
apache-ivy,应用, Java-based dependency manager," Apache Ivy is a tool for managing (recording, tracking, resolving and
reporting) project dependencies.  It is designed as process agnostic and is
not tied to any methodology or structure. while available as a standalone
tool, Apache Ivy works particularly well with Apache Ant providing a number
of powerful Ant tasks ranging from dependency resolution to dependency
reporting and publication.",应用
apache-parent,应用, Parent POM file for Apache projects, This package contains the parent pom file for apache projects.,应用
apache-resource-bundles,应用, Apache Resource Bundles," An archive which contains templates for generating the necessary license files
and notices for all Apache releases.",应用
apr,应用, Apache Portable Runtime library," The mission of the Apache Portable Runtime (APR) is to provide a
free library of C data structures and routines, forming a system
portability layer to as many operating systems as possible,
including Unices, MS Win32, BeOS and OS/2.",应用
apr-util,应用, Apache Portable Runtime Utility library," The mission of the Apache Portable Runtime (APR) is to provide a
free library of C data structures and routines.  This library
contains additional utility interfaces for APR; including support
for XML, LDAP, database interfaces, URI parsing and more.",应用
apr-util-ldap,应用, APR utility library LDAP support, This package provides the LDAP support for the apr-util.,应用
apr-util-mysql,应用, APR utility library MySQL DBD driver," This package provides the MySQL driver for the apr-util DBD
(database abstraction) interface.",应用
apr-util-openssl,应用, APR utility library OpenSSL crypto support, This package provides the OpenSSL crypto support for the apr-util.,应用
apr-util-pgsql,应用, APR utility library PostgreSQL DBD driver," This package provides the PostgreSQL driver for the apr-util
DBD (database abstraction) interface.",应用
aqute-bndlib,应用, BND library, BND library.,应用
arpwatch,应用,Network monitoring tools for tracking IP addresses on a network ,"The arpwatch package contains arpwatch and arpsnmp.  Arpwatch and
arpsnmp are both network monitoring tools.  Both utilities monitor
Ethernet or FDDI network traffic and build databases of Ethernet/IP
address pairs, and can report certain changes via email.

Install the arpwatch package if you need networking monitoring devices
which will automatically keep track of the IP addresses on your
network. ",应用
aspell-en,应用, English dictionaries for Aspell," Provides the word list/dictionaries for the following: English, Canadian
English, British English",应用
assertj-core,应用, Library of assertions similar to fest-assert," A rich and intuitive set of strongly-typed assertions to use for unit testing
(either with JUnit or TestNG).",应用
assertj-core-javadoc,应用, API documentation for assertj-core, This package provides API documentation for assertj-core.,应用
at,系统,Job spooling tools ,"At and batch read commands from standard input or from a specified
file. At allows you to specify that a command will be run at a
particular time. Batch will execute commands when the system load
levels drop to a particular level. Both commands use user's shell.

You should install the at package if you need a utility for
time-oriented job control. Note: If it is a recurring job that will
need to be repeated at the same time every day/week, etc. you should
use crontab instead. ",系统
atinject,应用, Dependency injection specification for Java (JSR-330)," This package specifies a means for obtaining objects in such a way as
to maximize reusability, testability and maintainability compared to
traditional approaches such as constructors, factories, and service
locators (e.g., JNDI). This process, known as dependency injection, is
beneficial to most nontrivial applications.",应用
atinject-javadoc,应用, API documentation for atinject, API documentation for atinject.,应用
atk,应用, Interfaces for accessibility support," The ATK library provides a set of interfaces for adding accessibility
support to applications and graphical user interface toolkits. By
supporting the ATK interfaces, an application or toolkit can be used
with tools such as screen readers, magnifiers, and alternative input
devices.",应用
at-spi2-atk,应用, A GTK+ module that bridges ATK to D-Bus at-spi," at-spi allows assistive technologies to access GTK-based
applications. Essentially it exposes the internals of applications for
automation, so tools such as screen readers, magnifiers, or even
scripting interfaces can query and interact with GUI controls.

This version of at-spi is a major break from previous versions.
It has been completely rewritten to use D-Bus rather than
ORBIT / CORBA for its transport protocol.

This package includes a gtk-module that bridges ATK to the new
D-Bus based at-spi.",应用
at-spi2-core,应用, Protocol definitions and daemon for D-Bus at-spi," at-spi allows assistive technologies to access GTK-based
applications. Essentially it exposes the internals of applications for
automation, so tools such as screen readers, magnifiers, or even
scripting interfaces can query and interact with GUI controls.

This version of at-spi is a major break from previous versions.
It has been completely rewritten to use D-Bus rather than
ORBIT / CORBA for its transport protocol.",应用
audispd-plugins,核心,Plugins for the audit event dispatcher ,"The audispd-plugins package provides plugins for the real-time
interface to the audit system, audispd. These plugins can do things
like relay events to remote machines. ",应用
audispd-plugins-zos,核心,z/OS plugin for the audit event dispatcher ,"The audispd-plugins-zos package provides a plugin that will forward all
incoming audit events, as they happen, to a configured z/OS SMF (Service
Management Facility) database, through an IBM Tivoli Directory Server
(ITDS) set for Remote Audit service. ",系统
audit,核心, User space tools for kernel auditing," The audit package contains the user space utilities for
storing and searching the audit records generated by
the audit subsystem in the Linux 2.6 and later kernels.",系统
python3-audit,核心,Python3 bindings for libaudit ,"The python3-audit package contains the bindings so that libaudit
and libauparse can be used by python3. ",核心
augeas,应用,A library for changing configuration files ,"A library for programmatically editing configuration files. Augeas parses
configuration files into a tree structure, which it exposes through its
public API. Changes made through the API are written back to the initially
read files.

The transformation works very hard to preserve comments and formatting
details. It is controlled by ``lens'' definitions that describe the file
format and the transformation into a tree. ",系统
augeas-libs,应用, Libraries for augeas," The libraries for augeas.

Augeas is a library for programmatically editing configuration files. It parses
configuration files into a tree structure, which it exposes through its
public API. Changes made through the API are written back to the initially
read files.",系统
authselect,系统, Configures authentication and identity sources from supported profiles," Authselect is designed to be a replacement for authconfig but it takes
a different approach to configure the system. Instead of letting
the administrator build the PAM stack with a tool (which may potentially
end up with a broken configuration), it would ship several tested stacks
(profiles) that solve a use-case and are well tested and supported.
At the same time, some obsolete features of authconfig are not
supported by authselect.",应用
authselect-compat,系统, Tool to provide minimum backwards compatibility with authconfig," This package will replace /usr/sbin/authconfig with a tool that will
translate some of the authconfig calls into authselect calls. It provides
only minimum backward compatibility and users are encouraged to migrate
to authselect completely.",应用
