name,label,layer_pred,class_pred,summary,description
389-ds-base-libs,系统库,系统,服务,Core libraries for 389 Directory Server,"Core libraries for the 389 Directory Server base package.  These libraries
are used by the main package and the -devel package.  This allows the -devel
package to be installed with just the -libs package and without the main package."
liba52,系统库,核心,库,"A free ATSC A/52 stream decoder, also known as AC-3 or AC3","liba52 is a free library for decoding ATSC A/52 streams. The A/52
standard is used in a variety of applications, including digital
television and DVD. It is also known as AC-3 or AC3"
abrt,系统库,应用,工具,Automatic bug detection and reporting tool,"abrt is a tool to help users to detect defects in applications and
to create a bug report with all information needed by maintainer to fix it.
It uses plugin system to extend its functionality."
abrt-addon-ccpp,应用工具,系统,工具,abrt's C/C++ addon,This package contains abrt's C/C++ analyzer plugin.
abrt-addon-coredump-helper,应用工具,核心,工具,abrt's /proc/sys/kernel/core_pattern helper,This package contains hook for C/C++ crashed programs.
abrt-addon-kerneloops,应用工具,核心,工具,abrt's kerneloops addon,"This package contains plugin for collecting kernel crash information from
system log."
abrt-addon-vmcore,应用工具,系统,工具,abrt's vmcore addon,"This package contains plugin for collecting kernel crash information from
vmcore files."
abrt-addon-xorg,应用工具,核心,服务,abrt's Xorg addon,"This package contains plugin for collecting Xorg crash information from Xorg
log."
abrt-cli,应用工具,系统,工具,Virtual package to make easy default installation on non-graphical environments,"Virtual package to install all necessary packages for usage from command line
environment."
abrt-cli-ng,应用工具,系统,工具,abrt's improved command line interface,New generation command line interface for ABRT
abrt-dbus,应用服务,应用,工具,ABRT DBus service,"ABRT DBus service which provides org.freedesktop.problems API on dbus and
uses PolicyKit to authorize to access the problem data."
abrt-desktop,应用服务/桌面,核心,服务,Virtual package to make easy default installation on desktop environments,"Virtual package to install all necessary packages for usage from desktop
environment."
abrt-gui,应用工具/桌面,应用,服务,abrt's gui,GTK+ wizard for convenient bug reporting.
abrt-plugin-machine-id,应用工具,应用,服务,abrt's plugin to generate machine_id based off dmidecode,"This package contains a configuration snippet to enable automatic generation
of machine_id for abrt events."
abrt-plugin-sosreport,应用工具,应用,服务,abrt's plugin for building automatic sosreports,"This package contains a configuration snippet to enable automatic generation
of sosreports for abrt events."
python3-abrt,系统库,应用,工具,ABRT Python 3 API,"High-level API for querying, creating and manipulating
problems handled by ABRT in Python 3."
python3-abrt-addon,系统库,系统,工具,abrt's addon for catching and analyzing Python 3 exceptions,"This package contains python 3 hook and python analyzer plugin for handling
uncaught exception in python 3 programs."
python3-abrt-container-addon,系统库,应用,工具,abrt's container addon for catching Python 3 exceptions,"This package contains python 3 hook and handling uncaught exception in python 3
programs in container."
abrt-java-connector,应用库,应用,服务,JNI Agent library converting Java exceptions to ABRT problems,"JNI library providing an agent capable to process both caught and uncaught
exceptions and transform them to ABRT problems"
accel-config,应用工具,应用,库,Configure accelerator subsystem devices,Utility library for configuring the accelerator subsystem.
accel-config-libs,应用库,核心,库,Configuration library for accelerator subsystem devices,Libraries for accel-config.
accountsservice-libs,应用库,系统,服务,Client-side library to talk to accountsservice,"The accountsservice-libs package contains a library that can
be used by applications that want to interact with the accountsservice
daemon."
acl,核心工具,核心,库,Access control list utilities,"This package contains the getfacl and setfacl utilities needed for
manipulating access control lists."
acpica-tools,系统工具,核心,工具,ACPICA tools for the development and debug of ACPI tables,"The ACPI Component Architecture (ACPICA) project provides an OS-independent
reference implementation of the Advanced Configuration and Power Interface
Specification (ACPI).  ACPICA code contains those portions of ACPI meant to
be directly integrated into the host OS as a kernel-resident subsystem, and
a small set of tools to assist in developing and debugging ACPI tables.

This package contains only the user-space tools needed for ACPI table
development, not the kernel implementation of ACPI.  The following commands
are installed:
   -- iasl: compiles ASL (ACPI Source Language) into AML (ACPI Machine
      Language), suitable for inclusion as a DSDT in system firmware.
      It also can disassemble AML, for debugging purposes.
   -- acpibin: performs basic operations on binary AML files (e.g.,
      comparison, data extraction)
   -- acpidump: write out the current contents of ACPI tables
   -- acpiexec: simulate AML execution in order to debug method definitions
   -- acpihelp: display help messages describing ASL keywords and op-codes
   -- acpinames: display complete ACPI name space from input AML
   -- acpisrc: manipulate the ACPICA source tree and format source files
      for specific environments
   -- acpixtract: extract binary ACPI tables from acpidump output (see
      also the pmtools package)

This version of the tools is being released under GPLv2 license."
adcli,应用工具,应用,服务,Active Directory enrollment,"adcli is a tool for joining an Active Directory domain using
standard LDAP and Kerberos calls."
adobe-mappings-cmap,应用工具,应用,其它,CMap resources for Adobe's character collections,"CMap (Character Map) resources are used to unidirectionally map character codes,
such as Unicode encoding form, to CIDs (Character IDs -- meaning glyphs) of a
CIDFont resource.

These CMap resources are useful for some applications (e.g. Ghostscript) to
correctly display text containing Japanese, (Traditional) Chinese, or Korean
characters."
adobe-mappings-cmap-deprecated,应用工具,应用,其它,Deprecated CMap resources for Adobe's character collections,"This sub-package contains currently deprecated CMap resources that some
applications might still require to function properly."
adobe-mappings-pdf,应用工具,应用,库,PDF mapping resources from Adobe,"Mapping resources for PDF have a variety of functions, such as mapping CIDs
(Character IDs) to character codes, or mapping character codes to other
character codes.

These mapping resources for PDF should not be confused with CMap resources.
While both types of resources share the same file structure and syntax, they
have very different functions.

These PDF mapping resources are useful for some applications (e.g. Ghostscript)
to function properly."
adwaita-cursor-theme,应用工具/桌面,应用,服务,Adwaita cursor theme,"The adwaita-cursor-theme package contains a modern set of cursors originally
designed for the GNOME desktop."
adwaita-icon-theme,应用工具/桌面,核心,服务,Adwaita icon theme,This package contains the Adwaita icon theme used by the GNOME desktop.
adwaita-qt5,应用库/桌面,应用,工具,Adwaita Qt5 theme,Adwaita theme variant for applications utilizing Qt5.
aide,应用工具,核心,库,Intrusion detection environment,"AIDE (Advanced Intrusion Detection Environment) is a file integrity
checker and intrusion detection program."
alsa-ucm,系统库,应用,服务,ALSA Use Case Manager configuration,"The Advanced Linux Sound Architecture (ALSA) Universal Configuration
Manager allows configuration of Audio input/output names and routing"
alsa-plugins-arcamav,系统服务,系统,库,Arcam AV amplifier plugin for ALSA,"This plugin exposes the controls for an Arcam AV amplifier
(see: http://www.arcam.co.uk/) as an ALSA mixer device."
alsa-plugins-maemo,系统服务,系统,库,Maemo plugin for ALSA,"This plugin converts the ALSA API over PCM task nodes protocol. In this way,
ALSA native applications can run over DSP Gateway and use DSP PCM task nodes."
alsa-plugins-oss,系统服务,系统,工具,Oss PCM output plugin for ALSA,"This plugin converts the ALSA API over OSS API.  With this plugin,
ALSA native apps can run on OSS drivers.

This plugin provides the PCM type ""oss""."
alsa-plugins-samplerate,系统服务,系统,库,External rate converter plugin for ALSA,"This plugin is an external rate converter using libsamplerate by Erik de
Castro Lopo."
alsa-plugins-speex,系统服务,系统,库,Rate Converter Plugin Using Speex Resampler,"The rate plugin is an external rate converter using the Speex resampler
(aka Public Parrot Hack) by Jean-Marc Valin. The pcm plugin provides
pre-processing of a mono stream like denoise using libspeex DSP API."
alsa-plugins-upmix,系统服务,系统,工具,Upmixer channel expander plugin for ALSA,"The upmix plugin is an easy-to-use plugin for upmixing to 4 or
6-channel stream.  The number of channels to be expanded is determined
by the slave PCM or explicitly via channel option."
alsa-plugins-usbstream,系统服务,系统,库,USB stream plugin for ALSA,"The usbstream plugin is for snd-usb-us122l driver. It converts PCM
stream to USB specific stream."
alsa-plugins-vdownmix,系统服务,系统,工具,Downmixer to stereo plugin for ALSA,"The vdownmix plugin is a downmixer from 4-6 channels to 2-channel
stereo headphone output.  This plugin processes the input signals with
a simple spacialization, so the output sounds like a kind of ""virtual
surround""."
alsa-sof-firmware,系统服务,其它,其它,Firmware and topology files for Sound Open Firmware project,This package contains the firmware binaries for the Sound Open Firmware project.
alsa-tools-firmware,系统工具,系统,服务,ALSA tools for uploading firmware to some soundcards,"This package contains tools for flashing firmware into certain sound cards.
The following tools are available:

* hdsploader   - for RME Hammerfall DSP cards
* mixartloader - for Digigram miXart soundcards
* vxloader     - for Digigram VX soundcards
* usx2yloader  - second phase firmware loader for Tascam USX2Y USB soundcards"
alsa-utils-alsabat,系统工具,系统,库,Advanced Linux Sound Architecture (ALSA) - Basic Audio Tester,"This package contains tool for basic audio testing using Advanced Linux Sound
Architecture (ALSA) framework and Fast Fourier Transform library."
amanda,应用工具,系统,服务,A network-capable tape backup solution,"AMANDA, the Advanced Maryland Automatic Network Disk Archiver, is a
backup system that allows the administrator of a LAN to set up a
single master backup server to back up multiple hosts to one or more
tape drives or disk files.  AMANDA uses native dump and/or GNU tar
facilities and can back up a large number of workstations running
multiple versions of Unix.  Newer versions of AMANDA (including this
version) can use SAMBA to back up Microsoft(TM) Windows95/NT hosts.
The amanda package contains the core AMANDA programs and will need to
be installed on both AMANDA clients and AMANDA servers.  Note that you
will have to install the amanda-client and/or amanda-server packages as
well."
amanda-client,应用工具,系统,工具,The client component of the AMANDA tape backup system,"The Amanda-client package should be installed on any machine that will
be backed up by AMANDA (including the server if it also needs to be
backed up).  You will also need to install the amanda package on each
AMANDA client machine."
amanda-libs,应用库,系统,服务,Amanda libraries,"This package contains basic Amanda libraries, which are used by all
Amanda programs."
amanda-server,应用服务,系统,工具,The server side of the AMANDA tape backup system,"The amanda-server package should be installed on the AMANDA server,
the machine attached to the device(s) (such as a tape drive) where backups
will be written. You will also need to install the amanda package on
the AMANDA server machine.  And, if the server is also to be backed up, the
server also needs to have the amanda-client package installed."
anaconda,系统工具,应用,服务,Graphical system installer,The anaconda package is a metapackage for the Anaconda installer.
anaconda-gui,系统工具/桌面,应用,服务,Graphical user interface for the Anaconda installer,This package contains graphical user interface for the Anaconda installer.
anaconda-install-env-deps,系统工具,核心,服务,Installation environment specific dependencies,"The anaconda-install-env-deps metapackage lists all installation environment dependencies.
This makes it possible for packages (such as Initial Setup) to depend on the main Anaconda package without
pulling in all the install time dependencies as well."
anaconda-tui,系统工具,核心,工具,Textual user interface for the Anaconda installer,This package contains textual user interface for the Anaconda installer.
anaconda-widgets,系统工具/桌面,应用,库,A set of custom GTK+ widgets for use with anaconda,This package contains a set of custom GTK+ widgets used by the anaconda installer.
anaconda-user-help,系统工具,应用,服务,Content for the Anaconda built-in help system,This package provides content for the Anaconda built-in help system.
annobin-annocheck,应用工具,系统,工具,A tool for checking the security hardening status of binaries,"Installs the annocheck program which uses the notes generated by annobin to
check that the specified files were compiled with the correct security
hardening options."
anolis-backgrounds,基础环境,核心,工具,Anolis OS related desktop backgrounds,"Licensed only for approved usage, see COPYING for details."
anolis-logos,基础环境,核心,工具,Anolis OS related icons and pictures,"Licensed only for approved usage, see COPYING for details."
anolis-logos-httpd,基础环境,核心,其它,Anolis OS related icons and pictures used by httpd,"Licensed only for approved usage, see COPYING for details."
anolis-logos-ipa,基础环境,核心,其它,Anolis OS related icons and pictures used by ipa,"Licensed only for approved usage, see COPYING for details."
ansible-collection-microsoft-sql,应用工具,应用,服务,The Ansible collection for Microsoft SQL Server management,"This RPM installs the Ansible collection for Microsoft SQL Server management
microsoft.sql. This RPM also installs the roles provided by the collection in
the legacy roles format for users of Ansible < 2.9."
ansible-core,应用工具,系统,工具,"SSH-based configuration management, deployment, and task execution system","Ansible is a radically simple model-driven configuration management,
multi-node deployment, and remote task execution system. Ansible works
over SSH and does not require any software or daemons to be installed
on remote nodes. Extension modules can be written in any language and
are transferred to managed machines automatically."
ansible-freeipa,应用工具,系统,服务,"Roles and playbooks to deploy FreeIPA servers, replicas and clients","Ansible roles and playbooks to install and uninstall FreeIPA servers, replicas
and clients. Also modules management.

Note: The Ansible playbooks and roles require a configured Ansible environment
where the Ansible nodes are reachable and are properly set up to have an IP
address and a working package manager.

Features

- Server, replica and client deployment
- Cluster deployments: Server, replicas and clients in one playbook
- One-time-password (OTP) support for client installation
- Repair mode for clients
- Backup and restore, also to and from controller
- Modules for automembership rule management
- Modules for automount key management
- Modules for automount location management
- Modules for automount map management
- Modules for config management
- Modules for delegation management
- Modules for dns config management
- Modules for dns forwarder management
- Modules for dns record management
- Modules for dns zone management
- Modules for group management
- Modules for hbacrule management
- Modules for hbacsvc management
- Modules for hbacsvcgroup management
- Modules for host management
- Modules for hostgroup management
- Modules for location management
- Modules for permission management
- Modules for privilege management
- Modules for pwpolicy management
- Modules for role management
- Modules for self service management
- Modules for server management
- Modules for service management
- Modules for sudocmd management
- Modules for sudocmdgroup management
- Modules for sudorule management
- Modules for topology management
- Modules for trust management
- Modules for user management
- Modules for vault management

Supported FreeIPA Versions

FreeIPA versions 4.6 and up are supported by all roles.

The client role supports versions 4.4 and up, the server role is working with
versions 4.5 and up, the replica role is currently only working with versions
4.6 and up.

Supported Distributions

- RHEL/CentOS 7.4+
- Fedora 26+
- Ubuntu
- Debian 10+ (ipaclient only, no server or replica!)

Requirements

  Controller
  - Ansible version: 2.8+ (ansible-freeipa is an Ansible Collection)
  - /usr/bin/kinit is required on the controller if a one time password (OTP)
    is used

  Node
  - Supported FreeIPA version (see above)
  - Supported distribution (needed for package installation only, see above)

Limitations

External signed CA is now supported. But the currently needed two step process
is an issue for the processing in a simple playbook.
Work is planned to have a new method to handle CSR for external signed CAs in
a separate step before starting the server installation."
ansible-pcp,应用工具,其它,服务,Ansible Metric collection for Performance Co-Pilot,"A collection containing roles for Performance Co-Pilot (PCP) and related
software such as Redis and Grafana.  The collection is made up of several
Ansible roles, including:

redhat.rhel_metrics.pcp
A role for core PCP capabilities, configuring live performance analysis
with a large base set of metrics from the kernel and system services, as
well as data recording and rule inference.

redhat.rhel_metrics.redis
A role for configuring a local Redis server, suitable for use with a
Performance Co-Pilot archive repository (for single or many hosts) and
fast, scalable querying of metrics.

redhat.rhel_metrics.grafana
A role for configuring a local Grafana server, providing web frontend
visuals for Performance Co-Pilot metrics, both live and historically.
Data sources for Vector (live), Redis (historical) and interactive
bpftrace (eBPF) scripts can be configured by this role.  The PCP REST
API service (from the core pcp role) should be configured in order to
use this role.

redhat.rhel_metrics.bpftrace
A role that extends the core PCP role, providing metrics from bpftrace
scripts using Linux eBPF facilities.  Configuring authentication of a
local user capable of running bpftrace scripts via the PCP agent is a
key task of this role.

redhat.rhel_metrics.elasticsearch
A role that extends the core PCP role, providing metrics from a live
ElasticSearch instance for PCP analysis or exporting of PCP metric
values (and metadata) to ElasticSearch for the indexing and querying
of performance data."
ant,应用工具,应用,库,Java build tool,"Apache Ant is a Java library and command-line tool whose mission is to
drive processes described in build files as targets and extension
points dependent upon each other.  The main known usage of Ant is the
build of Java applications.  Ant supplies a number of built-in tasks
allowing to compile, assemble, test and run Java applications.  Ant
can also be used effectively to build non Java applications, for
instance C or C++ applications.  More generally, Ant can be used to
pilot any type of process which can be described in terms of targets
and tasks."
ant-antlr,应用库,应用,工具,Optional antlr tasks for ant,Optional antlr tasks for ant.
ant-apache-oro,应用库,应用,工具,Optional apache oro tasks for ant,Optional apache oro tasks for ant.
ant-contrib,应用库,应用,工具,Collection of tasks for Ant,"The Ant-Contrib project is a collection of tasks
(and at one point maybe types and other tools)
for Apache Ant."
antlr-C++,应用库,核心,工具,C++ bindings for antlr2 generated parsers,This package provides a static C++ library for parsers generated by ANTLR2.
antlr-manual,应用库,应用,服务,Manual for antlr,Documentation for antlr.
apache-commons-beanutils,应用库/编程语言,应用,工具,Java utility methods for accessing and modifying the properties of arbitrary JavaBeans,"The scope of this package is to create a package of Java utility methods
for accessing and modifying the properties of arbitrary JavaBeans.  No
dependencies outside of the JDK are required, so the use of this package
is very lightweight."
apache-commons-parent,应用库/编程语言,应用,工具,Apache Commons Parent Pom,The Project Object Model files for the apache-commons packages.
apache-parent,应用库/编程语言,应用,工具,Parent POM file for Apache projects,This package contains the parent pom file for apache projects.
appstream-data,应用库,应用,服务,Cached AppStream metadata,"This package provides the distribution specific AppStream metadata required
for the GNOME and KDE software centers."
apr-util,应用工具,系统,工具,Apache Portable Runtime Utility library,"The mission of the Apache Portable Runtime (APR) is to provide a
free library of C data structures and routines.  This library
contains additional utility interfaces for APR; including support
for XML, LDAP, database interfaces, URI parsing and more."
apr-util-ldap,应用工具,系统,工具,APR utility library LDAP support,This package provides the LDAP support for the apr-util.
apr-util-mysql,应用工具,系统,工具,APR utility library MySQL DBD driver,"This package provides the MySQL driver for the apr-util DBD
(database abstraction) interface."
apr-util-odbc,应用工具,系统,工具,APR utility library ODBC DBD driver,"This package provides the ODBC driver for the apr-util DBD
(database abstraction) interface."
apr-util-openssl,应用工具,系统,工具,APR utility library OpenSSL crypto support,This package provides the OpenSSL crypto support for the apr-util.
apr-util-pgsql,应用工具,系统,工具,APR utility library PostgreSQL DBD driver,"This package provides the PostgreSQL driver for the apr-util
DBD (database abstraction) interface."
apr-util-sqlite,应用工具,系统,工具,APR utility library SQLite DBD driver,"This package provides the SQLite driver for the apr-util DBD
(database abstraction) interface."
bnd-maven-plugin,应用库,应用,工具,BND Maven plugin,BND Maven plugin.
arpwatch,应用工具,系统,服务,Network monitoring tools for tracking IP addresses on a network,"The arpwatch package contains arpwatch and arpsnmp.  Arpwatch and
arpsnmp are both network monitoring tools.  Both utilities monitor
Ethernet or FDDI network traffic and build databases of Ethernet/IP
address pairs, and can report certain changes via email.

Install the arpwatch package if you need networking monitoring devices
which will automatically keep track of the IP addresses on your
network."
aspell,应用工具,系统,工具,Spell checker,"GNU Aspell is a spell checker designed to eventually replace Ispell. It can
either be used as a library or as an independent spell checker. Its main
feature is that it does a much better job of coming up with possible
suggestions than just about any other spell checker out there for the
English language, including Ispell and Microsoft Word. It also has many
other technical enhancements over Ispell such as using shared memory for
dictionaries and intelligently handling personal dictionaries when more
than one Aspell process is open at once."
at,系统工具,核心,工具,Job spooling tools,"At and batch read commands from standard input or from a specified
file. At allows you to specify that a command will be run at a
particular time. Batch will execute commands when the system load
levels drop to a particular level. Both commands use user's shell.

You should install the at package if you need a utility for
time-oriented job control. Note: If it is a recurring job that will
need to be repeated at the same time every day/week, etc. you should
use crontab instead."
at-spi2-atk,应用工具,应用,库,A GTK+ module that bridges ATK to D-Bus at-spi,"at-spi allows assistive technologies to access GTK-based
applications. Essentially it exposes the internals of applications for
automation, so tools such as screen readers, magnifiers, or even
scripting interfaces can query and interact with GUI controls.

This version of at-spi is a major break from previous versions.
It has been completely rewritten to use D-Bus rather than
ORBIT / CORBA for its transport protocol.

This package includes a gtk-module that bridges ATK to the new
D-Bus based at-spi."
attr,核心工具,核心,库,Utilities for managing filesystem extended attributes,"A set of tools for manipulating extended attributes on filesystem
objects, in particular getfattr(1) and setfattr(1).
An attr(1) command is also provided which is largely compatible
with the SGI IRIX tool of the same name."
audispd-plugins,核心工具,应用,服务,Plugins for the audit event dispatcher,"The audispd-plugins package provides plugins for the real-time
interface to the audit system, audispd. These plugins can do things
like relay events to remote machines."
