name,label,layer_pred,class_pred,summary,description
ltrace,应用工具,系统,库,Tracks runtime library calls from dynamically linked executables,"Ltrace is a debugging program which runs a specified command until the
command exits.  While the command is executing, ltrace intercepts and
records both the dynamic library calls called by the executed process
and the signals received by the executed process.  Ltrace can also
intercept and print system calls executed by the process.

You should install ltrace if you need a sysadmin tool for tracking the
execution of processes."
lua,应用库/编程语言,应用,工具,Powerful light-weight programming language,"Lua is a powerful light-weight programming language designed for
extending applications. Lua is also frequently used as a
general-purpose, stand-alone language. Lua is free software.
Lua combines simple procedural syntax with powerful data description
constructs based on associative arrays and extensible semantics. Lua
is dynamically typed, interpreted from bytecodes, and has automatic
memory management with garbage collection, making it ideal for
configuration, scripting, and rapid prototyping."
lua-libs,应用库/编程语言,系统,工具,Libraries for lua,This package contains the shared libraries for lua.
lua-json,应用库/编程语言,应用,其它,JSON Parser/Constructor for Lua,"LuaJSON is a customizable JSON decoder/encoder, using LPEG for parsing."
lua-lpeg,应用库/编程语言,系统,库,Parsing Expression Grammars for Lua,"LPeg is a new pattern-matching library for Lua, based on Parsing Expression
Grammars (PEGs)."
lua-lunit,应用库/编程语言,核心,服务,Unit testing framework for Lua,"Lunit is a unit testing framework for lua, written in lua.

Lunit provides 26 assert functions, and a few misc functions for usage
in an easy unit testing framework.

Lunit comes with a test suite to test itself. The testsuite consists
of approximately 710 assertions."
lua-posix,应用库/编程语言,核心,库,A POSIX library for Lua,"This is a POSIX library for Lua which provides access to many POSIX features
to Lua programs."
lua-srpm-macros,应用库/编程语言,核心,工具,RPM macros for building Lua source packages,RPM macros for building Lua source packages.
libluksmeta,应用库,系统,库,Library for storing small metadata in the LUKSv1 header,"LUKSMeta is a C library for storing small portions of metadata in the LUKSv1
header for use before unlocking the volume."
luksmeta,应用库,系统,工具,Utility for storing small metadata in the LUKSv1 header,"LUKSMeta is a command line utility for storing small portions of metadata in
the LUKSv1 header for use before unlocking the volume."
device-mapper-event,系统工具,系统,服务,Device-mapper event daemon,"This package contains the dmeventd daemon for monitoring the state
of device-mapper devices."
device-mapper-libs,系统库,系统,工具,Device-mapper shared library,"This package contains the device-mapper shared library, libdevmapper."
lvm2,系统工具,核心,服务,Userland logical volume management tools,"LVM2 includes all of the support for handling read/write operations on
physical volumes (hard disks, RAID-Systems, magneto optical, etc.,
multiple devices (MD), see mdadm(8) or even loop devices, see
losetup(8)), creating volume groups (kind of virtual disks) from one
or more physical volumes and creating one or more logical volumes
(kind of logical partitions) in volume groups."
lvm2-libs,系统库,核心,工具,Shared libraries for lvm2,This package contains shared lvm2 libraries for applications.
lvm2-lockd,系统服务,系统,工具,LVM locking daemon,"
LVM commands use lvmlockd to coordinate access to shared storage."
lynx,应用工具,核心,服务,A text-based Web browser,"Lynx is a text-based Web browser. Lynx does not display any images,
but it does support frames, tables, and most other HTML tags. One
advantage Lynx has over graphical browsers is speed; Lynx starts and
exits quickly and swiftly displays web pages."
lz4-libs,核心工具,核心,库,Libaries for lz4,This package contains the libaries for lz4.
lzo,应用库,核心,库,Data compression library with very fast (de)compression,"LZO is a portable lossless data compression library written in ANSI C.
It offers pretty fast compression and very fast decompression.
Decompression requires no memory. In addition there are slower
compression levels achieving a quite competitive compression ratio
while still decompressing at this very high speed."
lzop,应用工具,核心,库,Real-time file compressor,"lzop is a compression utility which is designed to be a companion to gzip.
It is based on the LZO data compression library and its main advantages over
gzip are much higher compression and decompression speed at the cost of some
compression ratio. The lzop compression utility was designed with the goals
of reliability, speed, portability and with reasonable drop-in compatibility
to gzip."
m17n-db,应用库,应用,工具,Multilingualization datafiles for m17n-lib,"This package contains multilingualization (m17n) datafiles for m17n-lib
which describe input maps, encoding maps, OpenType font data and
font layout text rendering for languages."
mailcap,应用工具,其它,库,Helper application and MIME type associations for file types,"The mailcap file is used by the metamail program.  Metamail reads the
mailcap file to determine how it should display non-text or multimedia
material.  Basically, mailcap associates a particular type of file
with a particular program that a mail agent or other program can call
in order to handle the file.  Mailcap should be installed to allow
certain programs to be able to handle non-text files.

Also included in this package is the mime.types file which contains a
list of MIME types and their filename ""extension"" associations, used
by several applications e.g. to determine MIME types for filenames."
mailman,应用工具,系统,工具,Mailing list manager with built in Web access,"Mailman is software to help manage email discussion lists, much like
Majordomo and Smartmail. Unlike most similar products, Mailman gives
each mailing list a webpage, and allows users to subscribe,
unsubscribe, etc. over the Web. Even the list manager can administer
his or her list entirely from the Web. Mailman also integrates most
things people want to do with mailing lists, including archiving, mail
<-> news gateways, and so on.

Documentation can be found in: /usr/share/doc/mailman

When the package has finished installing, you will need to perform some
additional installation steps, these are described in:
/usr/share/doc/mailman/INSTALL.REDHAT"
mailx,应用工具,系统,工具,Enhanced implementation of the mailx command,"Mailx is an enhanced mail command, which provides the functionality
of the POSIX mailx command, as well as SysV mail and Berkeley Mail
(from which it is derived).

Additionally to the POSIX features, mailx can work with Maildir/ e-mail
storage format (as well as mailboxes), supports IMAP, POP3 and SMTP
protocols (including over SSL) to operate with remote hosts, handles mime
types and different charsets. There are a lot of other useful features,
see mailx(1).

And as its ancient analogues, mailx can be used as a mail script language,
both for sending and receiving mail.

Besides the ""mailx"" command, this package provides ""mail"" and ""Mail""
(which should be compatible with its predecessors from the mailx-8.x source),
as well as ""nail"" (the initial name of this project)."
make,应用工具,核心,工具,A GNU tool which simplifies the build process for users,"A GNU tool for controlling the generation of executables and other
non-source files of a program from the program's source files. Make
allows users to build and install packages without any significant
knowledge about the details of the build process. The details about
how the program should be built are provided for make in the program's
makefile."
libmalaga,应用工具,应用,库,Library files for malaga,Library files for malaga.
malaga-suomi-voikko,应用工具,应用,服务,A description of Finnish morphology written in Malaga (Voikko edition),"A description of Finnish morphology written in Malaga. This package is built
to support the Voikko spellchecker/hyphenator, it doesn't support the Sukija
text indexer."
mallard-rng,应用工具,系统,工具,RELAX NG schemas for all Mallard versions,"RELAX NG schemas for all Mallard versions and extensions that have been marked
final."
man-db-cron,应用工具,核心,工具,Periodic update of man-db cache,This package provides periodic update of man-db cache.
man-pages,应用工具,应用,库,Linux kernel and C library user-space interface documentation,A large collection of manual pages from the Linux Documentation Project (LDP).
man-pages-overrides,应用工具,应用,其它,Complementary and updated manual pages,"A collection of manual (""man"") pages to complement other packages or update
those contained therein. Always have the latest version of this package
installed."
mariadb,应用服务/数据库,系统,工具,A very fast and robust SQL database server,"MariaDB is a community developed branch of MySQL - a multi-user, multi-threaded
SQL database server. It is a client/server implementation consisting of
a server daemon (mysqld) and many different client programs and libraries.
The base package contains the standard MariaDB/MySQL client programs and
generic MySQL files."
mariadb-common,应用服务/数据库,应用,工具,The shared files required by server and client,"The package provides the essential shared files for any MariaDB program.
You will need to install this package to use any other MariaDB package."
mariadb-embedded,应用服务/数据库,应用,库,MariaDB as an embeddable library,"MariaDB is a multi-user, multi-threaded SQL database server. This
package contains a version of the MariaDB server that can be embedded
into a client application instead of running as a separate process.
MariaDB is a community developed branch of MySQL."
mariadb-oqgraph-engine,应用服务/数据库,应用,库,The Open Query GRAPH engine for MariaDB,"The package provides Open Query GRAPH engine (OQGRAPH) as plugin for MariaDB
database server. OQGRAPH is a computation engine allowing hierarchies and more
complex graph structures to be handled in a relational fashion. In a nutshell,
tree structures and friend-of-a-friend style searches can now be done using
standard SQL syntax, and results joined onto other tables."
mariadb-server-galera,应用服务/数据库,核心,服务,The configuration files and scripts for galera replication,"MariaDB is a multi-user, multi-threaded SQL database server. It is a
client/server implementation consisting of a server daemon (mysqld)
and many different client programs and libraries. This package contains
the MariaDB server and some accompanying files and directories.
MariaDB is a community developed branch of MySQL."
mariadb-server-utils,应用服务/数据库,系统,工具,Non-essential server utilities for MariaDB/MySQL applications,"This package contains all non-essential server utilities and scripts for
managing databases. It also contains all utilities requiring Perl and it is
the only MariaDB sub-package, except test subpackage, that depends on Perl."
mariadb-connector-c,应用库,系统,服务,The MariaDB Native Client library (C driver),"The MariaDB Native Client library (C driver) is used to connect applications
developed in C/C++ to MariaDB and MySQL databases."
mariadb-connector-c-config,应用库,其它,其它,Configuration files for packages that use /etc/my.cnf as a configuration file,"This package delivers /etc/my.cnf that includes other configuration files
from the /etc/my.cnf.d directory and ships this directory as well.
Other packages should only put their files into /etc/my.cnf.d directory
and require this package, so the /etc/my.cnf file is present."
maven2-javadoc,应用工具,应用,库,Javadoc for maven2,Javadoc for maven2.
maven-monitor,应用工具,应用,库,Compatibility Maven monitor artifact,Maven monitor artifact
maven-javadoc,应用工具,应用,库,API documentation for maven,API documentation for maven.
maven-antrun-plugin-javadoc,应用工具,应用,库,Javadoc for maven-antrun-plugin,This package contains the API documentation for maven-antrun-plugin.
maven-archiver-javadoc,应用工具,应用,库,Javadoc for maven-archiver,Javadoc for maven-archiver.
maven-artifact-resolver-javadoc,应用工具,应用,库,Javadoc for maven-artifact-resolver,API documentation for maven-artifact-resolver.
maven-artifact-transfer-javadoc,应用工具,应用,库,API documentation for maven-artifact-transfer,This package provides API documentation for maven-artifact-transfer.
maven-assembly-plugin-javadoc,应用工具,应用,库,API documentation for maven-assembly-plugin,This package provides API documentation for maven-assembly-plugin.
maven-clean-plugin-javadoc,应用工具,应用,库,API documentation for maven-clean-plugin,This package provides API documentation for maven-clean-plugin.
maven-common-artifact-filters-javadoc,应用工具,应用,库,Javadoc for maven-common-artifact-filters,This package contains javadoc for maven-common-artifact-filters.
maven-compiler-plugin-javadoc,应用工具,应用,库,Javadoc for maven-compiler-plugin,API documentation for maven-compiler-plugin.
maven-dependency-analyzer-javadoc,应用工具,应用,库,API documentation for maven-dependency-analyzer,API documentation for maven-dependency-analyzer
maven-dependency-plugin-javadoc,应用工具,应用,库,API documentation for maven-dependency-plugin,API documentation for maven-dependency-plugin.
maven-dependency-tree-javadoc,应用工具,应用,库,Javadoc for maven-dependency-tree,This package contains javadoc for maven-dependency-tree.
maven-doxia-javadoc,应用工具,应用,库,Javadoc for maven-doxia,API documentation for maven-doxia.
maven-doxia-sink-api,应用工具,应用,库,Sink-api module for maven-doxia,This package provides Sink-api module for maven-doxia.
maven-doxia-sitetools-javadoc,应用工具,应用,库,Javadoc for maven-doxia-sitetools,API documentation for maven-doxia-sitetools.
maven-enforcer-javadoc,应用工具,应用,库,Javadoc for maven-enforcer,API documentation for maven-enforcer.
maven-file-management-javadoc,应用工具,应用,库,Javadoc for maven-file-management,API documentation for maven-file-management.
maven-filtering-javadoc,应用工具,应用,库,Javadoc for maven-filtering,This package contains the API documentation for maven-filtering.
maven-install-plugin-javadoc,应用工具,应用,库,Javadoc for maven-install-plugin,API documentation for maven-install-plugin.
maven-invoker-javadoc,应用工具,应用,库,Javadoc for maven-invoker,API documentation for maven-invoker.
maven-invoker-plugin-javadoc,应用工具,应用,库,Javadoc for maven-invoker-plugin,API documentation for maven-invoker-plugin.
maven-jar-plugin-javadoc,应用工具,应用,库,Javadoc for maven-jar-plugin,API documentation for maven-jar-plugin.
maven-plugin-build-helper-javadoc,应用工具,应用,库,API documentation for maven-plugin-build-helper,This package provides API documentation for maven-plugin-build-helper.
maven-plugin-bundle-javadoc,应用工具,应用,库,Javadoc for maven-plugin-bundle,API documentation for maven-plugin-bundle.
maven-plugin-testing-javadoc,应用工具,应用,库,Javadoc for maven-plugin-testing,API documentation for maven-plugin-testing.
maven-test-tools,应用工具,应用,库,Maven Testing Tool,Framework to test Maven Plugins with Easymock objects.
maven-plugin-tools-javadocs,应用工具,应用,库,Javadoc for maven-plugin-tools,API documentation for maven-plugin-tools.
maven-remote-resources-plugin-javadoc,应用工具,应用,库,Javadoc for maven-remote-resources-plugin,API documentation for maven-remote-resources-plugin.
maven-reporting-api-javadoc,应用工具,应用,库,Javadoc for maven-reporting-api,API documentation for maven-reporting-api.
maven-reporting-impl-javadoc,应用工具,应用,库,Javadoc for maven-reporting-impl,API documentation for maven-reporting-impl.
maven-resolver-api,应用工具,应用,库,Maven Artifact Resolver API,The application programming interface for the repository system.
maven-resolver-connector-basic,应用工具,应用,库,Maven Artifact Resolver Connector Basic,A repository connector implementation for repositories using URI-based layouts.
maven-resolver-impl,应用工具,应用,库,Maven Artifact Resolver Implementation,An implementation of the repository system.
maven-resolver-spi,应用工具,应用,库,Maven Artifact Resolver SPI,"The service provider interface for repository system implementations and
repository connectors."
maven-resolver-javadoc,应用工具,应用,库,API documentation for maven-resolver,This package provides API documentation for maven-resolver.
maven-resolver-transport-classpath,应用工具,应用,库,Maven Artifact Resolver Transport Classpath,A transport implementation for repositories using classpath:// URLs.
maven-resolver-transport-file,应用工具,应用,库,Maven Artifact Resolver Transport File,A transport implementation for repositories using file:// URLs.
maven-resources-plugin-javadoc,应用工具,应用,库,Javadoc for maven-resources-plugin,API documentation for maven-resources-plugin.
maven-script-interpreter-javadoc,应用工具,应用,库,Javadoc for maven-script-interpreter,API documentation for maven-script-interpreter.
maven-shade-plugin-javadoc,应用工具,应用,库,API documentation for maven-shade-plugin,API documentation for maven-shade-plugin.
maven-shared-incremental-javadoc,应用工具,应用,库,API documentation for maven-shared-incremental,This package provides API documentation for maven-shared-incremental.
maven-shared-io-javadoc,应用工具,应用,库,Javadoc for maven-shared-io,API documentation for maven-shared-io.
maven-shared-utils-javadoc,应用工具,应用,库,Javadoc for maven-shared-utils,API documentation for maven-shared-utils.
maven-source-plugin-javadoc,应用工具,应用,库,Javadoc for maven-source-plugin,API documentation for maven-source-plugin.
maven-surefire-javadoc,应用工具,应用,库,Javadoc for maven-surefire,Javadoc for maven-surefire.
maven-verifier-javadoc,应用工具,应用,库,Javadoc for maven-verifier,API documentation for maven-verifier.
maven-wagon-file,应用工具,应用,库,file module for maven-wagon,file module for maven-wagon.
maven-wagon-javadoc,应用工具,应用,库,Javadoc for maven-wagon,Javadoc for maven-wagon.
maven-wagon-providers,应用工具,应用,库,providers module for maven-wagon,providers module for maven-wagon
mc,应用工具,系统,库,User-friendly text console file manager and visual shell,"Midnight Commander is a visual shell much like a file manager, only with
many more features. It is a text mode application, but it also includes
mouse support. Midnight Commander's best features are its ability to FTP,
view tar and zip files, and to poke into RPMs for specific files."
mcelog,系统工具,系统,服务,Tool to translate x86-64 CPU Machine Check Exception data,"mcelog is a utility that collects and decodes Machine Check Exception data
on x86-32 and x86-64 systems."
libmcpp,应用工具,应用,库,Alternative C/C++ preprocessor (library build),This package provides a library build of mcpp.
mcpp,应用工具,应用,库,Alternative C/C++ preprocessor,"C/C++ preprocessor defines and expands macros and processes '#if',
'#include' and some other directives.

MCPP is an alternative C/C++ preprocessor with the highest conformance.
It supports multiple standards: K&R, ISO C90, ISO C99, and ISO C++98.
MCPP is especially useful for debugging a source program which uses
complicated macros and also useful for checking portability of a source.

Though mcpp could be built as a replacement of GCC's resident
preprocessor or as a stand-alone program without using library build of
mcpp, this package installs only a program named 'mcpp' which links
shared library of mcpp and behaves independent from GCC."
mcstrans,应用服务,核心,服务,SELinux Translation Daemon,"Security-enhanced Linux is a feature of the Linux庐 kernel and a number
of utilities with enhanced security functionality designed to add
mandatory access controls to Linux.  The Security-enhanced Linux
kernel contains new architectural components originally developed to
improve the security of the Flask operating system. These
architectural components provide general support for the enforcement
of many kinds of mandatory access control policies, including those
based on the concepts of Type Enforcement庐, Role-based Access
Control, and Multi-level Security.

mcstrans provides an translation daemon to translate SELinux categories
from internal representations to user defined representation."
mdadm,系统工具,系统,服务,The mdadm program controls Linux md devices (software RAID arrays),"The mdadm program is used to create, manage, and monitor Linux MD (software
RAID) devices.  As such, it provides similar functionality to the raidtools
package.  However, mdadm is a single program, and it can perform
almost all functions without a configuration file, though a configuration
file can be used to help with some common tasks."
mdevctl,系统工具,系统,库,Mediated device management and persistence utility,"mdevctl is a utility for managing and persisting devices in the
mediated device device framework of the Linux kernel.  Mediated
devices are sub-devices of a parent device (ex. a vGPU) which
can be dynamically created and potentially used by drivers like
vfio-mdev for assignment to virtual machines."
mecab,应用工具,应用,库,Yet Another Part-of-Speech and Morphological Analyzer,"MeCab is a open source morphological analyzer which uses
CRF (Conditional Random Fields) as the estimation of parameters.

NOTE:
You have to install MeCab dictionary rpm to make use
of MeCab."
mecab-ipadic,应用工具,其它,工具,IPA dictionary for MeCab,"MeCab IPA is a dictionary for MeCab using CRF estimation
based on IPA corpus.
This dictionary is for UTF-8 use."
mecab-ipadic-EUCJP,应用工具,其它,工具,IPA dictionary for Mecab with encoded by EUC-JP,"
MeCab IPA is a dictionary for MeCab using CRF estimation
based on IPA corpus.
This dictionary is for EUC-JP use."
media-player-info,应用库,应用,其它,Data files describing media player capabilities,"media-player-info is a repository of data files describing media player
(mostly USB Mass Storage ones) capabilities. These files contain information
about the directory layout to use to add music to these devices, about the
supported file formats, etc.

The package also installs a udev rule to identify media player devices."
memcached,应用服务,系统,服务,"High Performance, Distributed Memory Object Cache","memcached is a high-performance, distributed memory object caching
system, generic in nature, but intended for use in speeding up dynamic
web applications by alleviating database load."
memkind,应用库,系统,库,User Extensible Heap Manager,"The memkind library is an user extensible heap manager built on top of
jemalloc which enables control of memory characteristics and a
partitioning of the heap between kinds of memory.  The kinds of memory
are defined by operating system memory policies that have been applied
to virtual address ranges. Memory characteristics supported by
memkind without user extension include control of NUMA and page size
features. The jemalloc non-standard interface has been extended to
enable specialized arenas to make requests for virtual memory from the
operating system through the memkind partition interface. Through the
other memkind interfaces the user can control and extend memory
partition features and allocate memory while selecting enabled
features. This software is being made available for early evaluation.
Feedback on design or implementation is greatly appreciated."
memstrack,应用工具,系统,工具,"A memory allocation tracer, like a hot spot analyzer for memory allocation","A memory allocation tracer, like a hot spot analyzer for memory allocation"
memtest86+,应用工具,核心,工具,Stand-alone memory tester for x86 and x86-64 computers,"Memtest86+ is a thorough stand-alone memory test for x86 and x86-64
architecture computers. BIOS based memory tests are only a quick
check and often miss many of the failures that are detected by
Memtest86+.

The ELF version should be used for booting from grub,
and avoids the following errors:
""Error 7: Loading below 1MB is not supported""
""Error 13: Invalid or unsupported executable format""
""Error 28: Selected item cannot fit into memory""

The script '/usr/sbin/memtest-setup' can be run (as root)
to add the memtest86+ entry to your GRUB boot menu."
mercurial,应用工具,系统,工具,Mercurial -- a distributed SCM,"Mercurial is a fast, lightweight source control management system designed
for efficient handling of very large distributed projects.

Quick start: http://www.selenic.com/mercurial/wiki/index.cgi/QuickStart
Tutorial: http://www.selenic.com/mercurial/wiki/index.cgi/Tutorial
Extensions: http://www.selenic.com/mercurial/wiki/index.cgi/CategoryExtension"
mesa-dri-drivers,应用库,核心,工具,Mesa-based DRI drivers,Mesa-based DRI drivers.
mesa-filesystem,应用库,应用,工具,Mesa driver filesystem,Mesa driver filesystem.
mesa-libglapi,应用库,核心,工具,Mesa shared glapi,Mesa shared glapi.
mesa-libxatracker,应用库,系统,库,Mesa XA state tracker,Mesa XA state tracker.
mesa-vdpau-drivers,应用库,应用,工具,Mesa-based VDPAU drivers,Mesa-based VDPAU drivers.
glx-utils,应用库,核心,工具,GLX utilities,The glx-utils package provides the glxinfo and glxgears utilities.
