name,label,layer_pred,class_pred,summary,description
polkit-pkla-compat,系统库,应用,工具,Rules for polkit to add compatibility with pklocalauthority,"A polkit JavaScript rule and associated helpers that mostly provide
compatibility with the .pkla file format supported in polkit <= 0.105 for users
of later polkit releases."
polkit-qt5-1,系统库,应用,库,PolicyKit Qt5 bindings,"Polkit-qt is a library that lets developers use the PolicyKit API
through a nice Qt-styled API."
poppler,应用库,核心,库,PDF rendering library,poppler is a PDF rendering library.
poppler-utils,应用库,应用,工具,Command line utilities for converting PDF files,"Command line tools for manipulating PDF files and converting them to
other formats."
poppler-data,应用库,应用,其它,Encoding files for use with poppler,"This package consists of encoding files for use with poppler. The encoding
files are optional and poppler will automatically read them if they are present.

When installed, the encoding files enables poppler to correctly render both CJK
and Cyrrilic characters properly."
portreserve,系统工具,系统,服务,TCP port reservation utility,"The portreserve program aims to help services with well-known ports that
lie in the portmap range.  It prevents portmap from a real service's port
by occupying it itself, until the real service tells it to release the
port (generally in the init script)."
postfix,应用工具,系统,工具,Postfix Mail Transport Agent,Postfix is a Mail Transport Agent (MTA).
postfix-mysql,应用工具,应用,服务,Postfix MySQL map support,"This provides support for MySQL maps in Postfix. If you plan to use MySQL
maps with Postfix, you need this."
postfix-pcre,应用工具,系统,工具,Postfix PCRE map support,"This provides support for PCRE maps in Postfix. If you plan to use PCRE
maps with Postfix, you need this."
postfix-perl-scripts,应用工具,系统,库,Postfix utilities written in perl,"This package contains perl scripts pflogsumm and qshape.

Pflogsumm is a log analyzer/summarizer for the Postfix MTA. It is
designed to provide an over-view of Postfix activity. Pflogsumm
generates summaries and, in some cases, detailed reports of mail
server traffic volumes, rejected and bounced email, and server
warnings, errors and panics.

qshape prints Postfix queue domain and age distribution."
postfix-sqlite,应用工具,系统,工具,Postfix SQLite map support,"This provides support for SQLite maps in Postfix. If you plan to use SQLite
maps with Postfix, you need this."
postgres-decoderbufs,应用库/数据库,应用,工具,PostgreSQL Protocol Buffers logical decoder plugin,"A PostgreSQL logical decoder output plugin to deliver data
as Protocol Buffers messages."
postgresql,应用服务/数据库,应用,工具,PostgreSQL client programs,"PostgreSQL is an advanced Object-Relational database management system (DBMS).
The base postgresql package contains the client programs that you'll need to
access a PostgreSQL DBMS server, as well as HTML documentation for the whole
system.  These client programs can be located on the same machine as the
PostgreSQL server, or on a remote machine that accesses a PostgreSQL server
over a network connection.  The PostgreSQL server can be found in the
postgresql-server sub-package."
postgresql-contrib,应用服务/数据库,应用,库,Extension modules distributed with PostgreSQL,"The postgresql-contrib package contains various extension modules that are
included in the PostgreSQL distribution."
postgresql-docs,应用服务/数据库,应用,工具,Extra documentation for PostgreSQL,"The postgresql-docs package contains some additional documentation for
PostgreSQL.  Currently, this includes the main documentation in PDF format
and source files for the PostgreSQL tutorial."
postgresql-plperl,应用库/数据库,系统,库,The Perl procedural language for PostgreSQL,"The postgresql-plperl package contains the PL/Perl procedural language,
which is an extension to the PostgreSQL database server.
Install this if you want to write database functions in Perl."
postgresql-plpython3,应用库/数据库,系统,服务,The Python3 procedural language for PostgreSQL,"The postgresql-plpython3 package contains the PL/Python3 procedural language,
which is an extension to the PostgreSQL database server.
Install this if you want to write database functions in Python 3."
postgresql-pltcl,应用服务/数据库,系统,工具,The Tcl procedural language for PostgreSQL,"The postgresql-pltcl package contains the PL/Tcl procedural language,
which is an extension to the PostgreSQL database server.
Install this if you want to write database functions in Tcl."
postgresql-server,应用服务/数据库,系统,服务,The programs needed to create and run a PostgreSQL server,"PostgreSQL is an advanced Object-Relational database management system (DBMS).
The postgresql-server package contains the programs needed to create
and run a PostgreSQL server, which will in turn allow you to create
and maintain PostgreSQL databases."
postgresql-static,应用库/数据库,核心,库,Statically linked PostgreSQL libraries,"Statically linked PostgreSQL libraries that do not have dynamically linked
counterparts."
postgresql-upgrade,应用服务/数据库,系统,服务,Support for upgrading from the previous major release of PostgreSQL,"The postgresql-upgrade package contains the pg_upgrade utility and supporting
files needed for upgrading a PostgreSQL database from the previous major
version of PostgreSQL."
postgresql-jdbc,应用库,应用,工具,JDBC driver for PostgreSQL,"PostgreSQL is an advanced Object-Relational database management
system. The postgresql-jdbc package includes the .jar files needed for
Java programs to access a PostgreSQL database."
potrace,应用工具,系统,工具,Transform bitmaps into vector graphics,"Potrace is a utility for tracing a bitmap, which means, transforming a bitmap
into a smooth, scalable image. The input is a bitmap (PBM, PGM, PPM, or BMP
format), and the default output is an encapsulated PostScript file (EPS).
A typical use is to create EPS files from scanned data, such as company or
university logos, handwritten notes, etc. The resulting image is not ""jaggy""
like a bitmap, but smooth. It can then be rendered at any resolution.

Potrace can currently produce the following output formats: EPS, PostScript,
PDF, SVG (scalable vector graphics), Xfig, Gimppath, and PGM (for easy
antialiasing). Additional backends might be added in the future.

Mkbitmap is a program distributed with Potrace which can be used to pre-process
the input for better tracing behavior on greyscale and color images."
powertop,应用工具,应用,库,Power consumption monitor,"PowerTOP is a tool that finds the software component(s) that make your
computer use more power than necessary while it is idle."
pptp,应用工具,核心,服务,Point-to-Point Tunneling Protocol (PPTP) Client,"Client for the proprietary Microsoft Point-to-Point Tunneling
Protocol, PPTP. Allows connection to a PPTP based VPN as used
by employers and some cable and ADSL service providers."
prefixdevname,系统工具,系统,服务,Udev helper utility that provides network interface naming using user defined prefix,"This package provides udev helper utility that tries to consistently name all ethernet NICs using
user defined prefix (e.g. net.ifnames.prefix=net produces NIC names net0, net1, ...). Utility is
called from udev rule and it determines NIC name and writes out configuration file for udev's
net_setup_link built-in (e.g. /etc/systemd/network/71-net-ifnames-prefix-net0.link)."
procmail,应用工具,系统,工具,Mail processing program,"Procmail can be used to create mail-servers, mailing lists, sort your
incoming mail into separate folders/files (real convenient when subscribing
to one or more mailing lists or for prioritising your mail), preprocess
your mail, start any programs upon mail arrival (e.g. to generate different
chimes on your workstation for different types of mail) or selectively
forward certain incoming mail automatically to someone."
procps-ng-i18n,系统工具,应用,工具,Internationalization pack for procps-ng,Internationalization pack for procps-ng
prometheus-jmx-exporter,应用服务/云原生,应用,库,Prometheus JMX Exporter,"JMX to Prometheus exporter: a collector that can be configured to scrape
and expose MBeans of a JMX target. This exporter is intended to be run as
a Java Agent, exposing a HTTP server and serving metrics of the local JVM."
prometheus-jmx-exporter-openjdk11,应用服务/云原生,应用,库,OpenJDK 11 binding for prometheus-jmx-exporter,OpenJDK 11 binding package for prometheus-jmx-exporter
python3-protobuf,应用库,系统,库,Python 3 bindings for Google Protocol Buffers,This package contains Python 3 libraries for Google Protocol Buffers
ps_mem,应用工具,应用,服务,Memory profiling tool,"The ps_mem tool reports how much core memory is used per program
(not per process). In detail it reports:
sum(private RAM for program processes) + sum(Shared RAM for program processes)
The shared RAM is problematic to calculate, and the tool automatically
selects the most accurate method available for the running kernel."
psacct,应用工具,系统,工具,Utilities for monitoring process activities,"The psacct package contains several utilities for monitoring process
activities, including ac, lastcomm, accton and sa. The ac command
displays statistics about how long users have been logged on. The
lastcomm command displays information about previous executed
commands. The accton command turns process accounting on or off. The
sa command summarizes information about previously executed
commands."
publicsuffix-list,应用库,其它,其它,Cross-vendor public domain suffix database,"The Public Suffix List is a cross-vendor initiative to provide
an accurate list of domain name suffixes, maintained by the hard work
of Mozilla volunteers and by submissions from registries.
Software using the Public Suffix List will be able to determine where
cookies may and may not be set, protecting the user from being
tracked across sites."
publicsuffix-list-dafsa,应用库,其它,其它,Cross-vendor public domain suffix database in DAFSA form,"The Public Suffix List is a cross-vendor initiative to provide
an accurate list of domain name suffixes, maintained by the hard work
of Mozilla volunteers and by submissions from registries.
Software using the Public Suffix List will be able to determine where
cookies may and may not be set, protecting the user from being
tracked across sites.

This package includes a DAFSA representation of the Public Suffix List
for runtime loading."
pulseaudio,应用服务,系统,服务,Improved Linux Sound Server,"PulseAudio is a sound server for Linux and other Unix like operating
systems. It is intended to be an improved drop-in replacement for the
Enlightened Sound Daemon (ESOUND)."
pulseaudio-libs,应用库,核心,库,Libraries for PulseAudio clients,"This package contains the runtime libraries for any application that wishes
to interface with a PulseAudio sound server."
pulseaudio-module-bluetooth,应用服务,应用,库,Bluetooth support for the PulseAudio sound server,Contains Bluetooth audio (A2DP/HSP/HFP) support for the PulseAudio sound server.
pulseaudio-module-x11,应用服务,核心,服务,X11 support for the PulseAudio sound server,X11 bell and security modules for the PulseAudio sound server.
pulseaudio-utils,应用工具,核心,库,PulseAudio sound server utilities,This package contains command line utilities for the PulseAudio sound server.
python3-pyatspi,系统库/编程语言,应用,库,Python3 bindings for at-spi,"at-spi allows assistive technologies to access GTK-based
applications. Essentially it exposes the internals of applications for
automation, so tools such as screen readers, magnifiers, or even
scripting interfaces can query and interact with GUI controls.

This package includes a python3 client library for at-spi."
pygobject2,系统库/编程语言,应用,库,Python 2 bindings for GObject,"The pygobject2 package provides a convenient wrapper for the GObject library
for use in Python programs."
pygobject2-codegen,系统库/编程语言,系统,工具,The code generation program for PyGObject,The package contains the C code generation program for PyGObject.
python3-gobject,系统库/编程语言,应用,库,Python 3 bindings for GObject Introspection,"The python3-gobject package provides a convenient wrapper for the GObject
library and and other libraries that are compatible with GObject Introspection,
for use in Python 3 programs."
pygtk2,系统库/编程语言,系统,工具,Python bindings for GTK+,"PyGTK is an extension module for Python that gives you access to the GTK+
widget set.  Just about anything you can write in C with GTK+ you can write
in Python with PyGTK (within reason), but with all the benefits of using a
high-level scripting language."
pygtk2-codegen,系统库/编程语言,核心,工具,The code generation program for PyGTK,This package contains the C code generation program for PyGTK.
pykickstart,系统工具/编程语言,系统,库,Python utilities for manipulating kickstart files.,"Python utilities for manipulating kickstart files.  The Python 2 and 3 libraries
can be found in the packages python-kickstart and python3-kickstart
respectively."
python3-pyparted,系统库/编程语言,系统,工具,Python 3 module for GNU parted,"Python module for the parted library.  It is used for manipulating
partition tables. This package provides Python 3 bindings for parted."
python3-pytest,系统库/编程语言,系统,工具,Simple powerful testing with Python,"py.test provides simple, yet powerful testing for Python."
python2-pytest,系统库/编程语言,系统,工具,Simple powerful testing with Python,"py.test provides simple, yet powerful testing for Python."
python39-pytest,系统库/编程语言,系统,工具,Simple powerful testing with Python,"py.test provides simple, yet powerful testing for Python."
python2-tkinter,系统库/编程语言,应用,工具,A graphical user interface for the Python 2 scripting language,"
The Tkinter (Tk interface) program is an graphical user interface for
the Python 2 scripting language.

You should install the python2tkinter package if you'd like to use a graphical
user interface for Python 2 programming."
python2-pip,系统工具/编程语言,系统,库,A tool for installing and managing Python 2 packages,"pip is a package management system used to install and manage software packages
written in Python. Many packages can be found in the Python Package Index
(PyPI). pip is a recursive acronym that can stand for either ""Pip Installs
Packages"" or ""Pip Installs Python""."
python3-idle,系统库/编程语言,系统,工具,A basic graphical development environment for Python,"IDLE is Python__ Integrated Development and Learning Environment.

IDLE has the following features: Python shell window (interactive
interpreter) with colorizing of code input, output, and error messages;
multi-window text editor with multiple undo, Python colorizing,
smart indent, call tips, auto completion, and other features;
search within any window, replace within editor windows, and
search through multiple files (grep); debugger with persistent
breakpoints, stepping, and viewing of global and local namespaces;
configuration, browsers, and other dialogs."
python3-tkinter,系统库/编程语言,应用,工具,A GUI toolkit for Python,"The Tkinter (Tk interface) library is a graphical user interface toolkit for
the Python programming language."
python38-idle,系统库/编程语言,系统,工具,A basic graphical development environment for Python,"IDLE is Python__ Integrated Development and Learning Environment.

IDLE has the following features: Python shell window (interactive
interpreter) with colorizing of code input, output, and error messages;
multi-window text editor with multiple undo, Python colorizing,
smart indent, call tips, auto completion, and other features;
search within any window, replace within editor windows, and
search through multiple files (grep); debugger with persistent
breakpoints, stepping, and viewing of global and local namespaces;
configuration, browsers, and other dialogs."
python38-tkinter,系统库/编程语言,系统,工具,A GUI toolkit for Python,"The Tkinter (Tk interface) library is a graphical user interface toolkit for
the Python programming language."
python39-idle,系统库/编程语言,系统,工具,A basic graphical development environment for Python,"IDLE is Python__ Integrated Development and Learning Environment.

IDLE has the following features: Python shell window (interactive
interpreter) with colorizing of code input, output, and error messages;
multi-window text editor with multiple undo, Python colorizing,
smart indent, call tips, auto completion, and other features;
search within any window, replace within editor windows, and
search through multiple files (grep); debugger with persistent
breakpoints, stepping, and viewing of global and local namespaces;
configuration, browsers, and other dialogs."
python39-tkinter,系统库/编程语言,应用,工具,A GUI toolkit for Python,"The Tkinter (Tk interface) library is a graphical user interface toolkit for
the Python programming language."
python3-azure-sdk,系统库/编程语言,系统,工具,Microsoft Azure SDK for Python,"This project provides a set of Python packages that make it easy to access
Management (Virtual Machines, ...) or Runtime (ServiceBus using HTTP, Batch,
Monitor) components of Microsoft Azure Complete feature list of this repo and
where to find Python packages not in this repo can be found on our Azure SDK for
Python documentation."
python38-pip,系统库/编程语言,系统,工具,A tool for installing and managing Python3 packages,"pip is a package management system used to install and manage software packages
written in Python. Many packages can be found in the Python Package Index
(PyPI). pip is a recursive acronym that can stand for either ""Pip Installs
Packages"" or ""Pip Installs Python""."
python38-pip-wheel,系统库/编程语言,系统,工具,The pip wheel,A Python wheel of pip to use with venv.
python39-pip,系统库/编程语言,系统,工具,A tool for installing and managing Python3 packages,"pip is a package management system used to install and manage software packages
written in Python. Many packages can be found in the Python Package Index
(PyPI). pip is a recursive acronym that can stand for either ""Pip Installs
Packages"" or ""Pip Installs Python""."
python39-pip-wheel,系统库/编程语言,系统,工具,The pip wheel,A Python wheel of pip to use with venv.
python3-argcomplete,系统库/编程语言,系统,工具,Bash tab completion for argparse,"Argcomplete provides easy, extensible command line tab completion of
arguments for your Python script.

It makes two assumptions:

 * You are using bash as your shell
 * You are using argparse to manage your command line arguments/options

Argcomplete is particularly useful if your program has lots of
options or subparsers, and if your program can dynamically suggest
completions for your argument/option values (for example, if the user
is browsing resources over the network).

Python 3 version."
blivet-data,系统库/编程语言,系统,服务,Data for the blivet python module.,"The blivet-data package provides data files required by the blivet
python module."
python3-blivet,系统库/编程语言,系统,工具,A python3 package for examining and modifying storage configuration.,"The python3-blivet is a python3 package for examining and modifying storage
configuration."
python2-chardet,系统库/编程语言,系统,工具,Character encoding auto-detection in Python,"Character encoding auto-detection in Python. As
smart as your browser. Open source."
python39-chardet,系统库/编程语言,系统,工具,Character encoding auto-detection in Python,"Character encoding auto-detection in Python. As
smart as your browser. Open source."
python38-chardet,系统库/编程语言,系统,工具,Character encoding auto-detection in Python,"Character encoding auto-detection in Python. As
smart as your browser. Open source."
python3-coverage,系统库/编程语言,系统,工具,Code coverage testing module for Python 3,"Coverage.py is a Python 3 module that measures code coverage during Python
execution. It uses the code analysis tools and tracing hooks provided in the
Python standard library to determine which lines are executable, and which
have been executed."
python3-dateutil,系统库/编程语言,系统,工具,Powerful extensions to the standard datetime module,"The dateutil module provides powerful extensions to the standard datetime
module available in Python.

This is the version for Python 3."
python3-dbus-python-client-gen,系统库/编程语言,系统,工具,Python Library for Generating dbus-python Client Code,"Python Library for Generating dbus-python Client Code.

Python 3 version."
python3-distro,系统库/编程语言,系统,工具,Linux Distribution - a Linux OS platform information API,"The distro (for: Linux Distribution) package provides information about the
Linux distribution it runs on, such as a reliable machine-readable ID, or
version information.

It is a renewed alternative implementation for Python's original
platform.linux_distribution function, but it also provides much more
functionality. An alternative implementation became necessary because
Python 3.5 deprecated this function, and Python 3.7 is expected to remove it
altogether. Its predecessor function platform.dist was already deprecated since
Python 2.6 and is also expected to be removed in Python 3.7. Still, there are
many cases in which access to that information is needed. See Python issue 1322
for more information.

Python 3 version."
python2-docs-info,系统库/编程语言,系统,工具,Documentation for the Python 2 programming language as info pages,"The python2-docs-info package contains documentation on the Python 2
programming language and interpreter as info pages.

Install the python2-docs-info package if you'd like to read the
documentation for the Python 2 language using the info command or Emacs."
python3-gssapi,系统库/编程语言,系统,服务,Python 3 Bindings for GSSAPI (RFC 2743/2744 and extensions),"A set of Python bindings to the GSSAPI C library providing both
a high-level pythonic interfaces and a low-level interfaces
which more closely matches RFC 2743.  Includes support for
RFC 2743, as well as multiple extensions."
python3-hwdata,系统库/编程语言,系统,服务,Python bindings to hwdata package,"Provide python interface to database stored in hwdata package.
It allows you to get human readable description of USB and PCI devices.

This is the Python 3 build of the module."
python3-hypothesis,系统库/编程语言,应用,库,Library for property based testing,"Hypothesis is a library for testing your Python code against a much
larger range of examples than you would ever want to write by
hand. It__ based on the Haskell library, Quickcheck, and is designed
to integrate seamlessly into your existing Python unit testing work
flow."
python3-into-dbus-python,系统库/编程语言,系统,工具,Transformer to dbus-python types,"Facilities for converting an object that inhabits core Python types, e.g.,
lists, ints, dicts, to an object that inhabits dbus-python types, e.g.,
dbus.Array, dbus.UInt32, dbus.Dictionary based on a specified dbus signature.

Python 3 version."
python3-ldap,系统库/编程语言,系统,工具,An object-oriented API to access LDAP directory servers,"python-ldap provides an object-oriented API for working with LDAP within
Python programs.  It allows access to LDAP directory servers by wrapping the
OpenLDAP 2.x libraries, and contains modules for other LDAP-related tasks
(including processing LDIF, LDAPURLs, LDAPv3 schema, etc.)."
python3-linux-procfs,系统库/编程语言,系统,工具,Linux /proc abstraction classes,Abstractions to extract information from the Linux kernel /proc files.
python3-meh-gui,系统库/编程语言,应用,库,Graphical user interface for the python3-meh library,The python3-meh-gui package provides a GUI for the python3-meh library.
python3-nose,系统库/编程语言,系统,工具,Nose Documentation,"nose extends the test loading and running features of unit test, making
it easier to write, find and run tests.

By default, nose will run tests in files or directories under the
current working directory whose names include ""test"" or ""Test"" at a
word boundary (like ""test_this"" or ""functional_test"" or ""TestClass""
but not ""libtest""). Test output is similar to that of unit test, but
also includes captured stdout output from failing tests, for easy
print-style debugging.

These features, and many more, are customizable through the use of
plugins. Plugins included with nose provide support for doctest, code
coverage and profiling, flexible attribute-based test selection,
output capture and more.

This package installs the nose module and nosetests3 program that can discover
python3 unit tests."
python2-nose,系统库/编程语言,系统,工具,Nose Documentation,"nose extends the test loading and running features of unit test, making
it easier to write, find and run tests.

By default, nose will run tests in files or directories under the
current working directory whose names include ""test"" or ""Test"" at a
word boundary (like ""test_this"" or ""functional_test"" or ""TestClass""
but not ""libtest""). Test output is similar to that of unit test, but
also includes captured stdout output from failing tests, for easy
print-style debugging.

These features, and many more, are customizable through the use of
plugins. Plugins included with nose provide support for doctest, code
coverage and profiling, flexible attribute-based test selection,
output capture and more."
