name,label,layer_pred,class_pred,summary,description
geoipupdate,应用工具,系统,库,Update GeoIP2 and GeoIP Legacy binary databases from MaxMind,"The GeoIP Update program performs automatic updates of GeoIP2 and GeoIP
Legacy binary databases."
geolite2-city,应用工具,应用,其它,Free IP geolocation city database,"GeoLite2 databases are free IP geolocation databases comparable to, but less
accurate than, MaxMind's GeoIP2 databases.  This product includes GeoLite2 data
created by MaxMind, available from http://www.maxmind.com."
geolite2-country,应用工具,应用,其它,Free IP geolocation country database,"GeoLite2 databases are free IP geolocation databases comparable to, but less
accurate than, MaxMind's GeoIP2 databases.  This product includes GeoLite2 data
created by MaxMind, available from http://www.maxmind.com."
geronimo-parent-poms,应用库,应用,工具,Parent POM files for geronimo-specs,The Project Object Model files for the geronimo-specs modules.
gflags,应用库,系统,库,Library for commandline flag processing,"The gflags package contains a library that implements commandline
flags processing. As such it's a replacement for getopt(). It has
increased flexibility, including built-in support for C++ types like
string, and the ability to define flags in the source file in which
they're used."
gfs2-utils,应用工具,系统,工具,Utilities for managing the global file system (GFS2),"The gfs2-utils package contains a number of utilities for creating, checking,
modifying, and correcting inconsistencies in GFS2 file systems."
ghc-srpm-macros,系统库,应用,服务,RPM macros for building Haskell source packages,Macros used when generating Haskell source RPM packages.
ghostscript,应用工具,应用,库,Interpreter for PostScript language & PDF,"This package provides useful conversion utilities based on Ghostscript software,
for converting PS, PDF and other document formats between each other.

Ghostscript is a suite of software providing an interpreter for Adobe Systems'
PostScript (PS) and Portable Document Format (PDF) page description languages.
Its primary purpose includes displaying (rasterization & rendering) and printing
of document pages, as well as conversions between different document formats."
ghostscript-tools-dvipdf,应用工具,其它,工具,Ghostscript's 'dvipdf' utility,"This package provides the utility 'dvipdf' for converting of TeX DVI files into
PDF files using Ghostscript and dvips."
ghostscript-tools-fonts,应用工具,其它,其它,Ghostscript's font utilities,"This package provides utilities which are useful when you are working with AFM,
PFB or PFA files, mostly for conversion purposes."
ghostscript-tools-printing,应用工具,系统,工具,Ghostscript's printing utilities,"This package provides utilities for formatting and printing text files using
either Ghostscript, or BubbleJet, DeskJet, DeskJet 500, and LaserJet printers.

It also provides the utility 'pphs', which is useful for printing of Primary
Hint Stream of a linearized PDF file."
ghostscript-x11,应用工具,应用,库,Ghostscript's X11-based driver for document rendering,"This package provides X11-based driver for Ghostscript, which enables displaying
of various document files (including PS and PDF)."
git,应用工具,系统,库,Fast Version Control System,"Git is a fast, scalable, distributed revision control system with an
unusually rich command set that provides both high-level operations
and full access to internals.

The git rpm installs common set of tools which are usually using with
small amount of dependencies. To install all git packages, including
tools for integrating with other SCMs, install the git-all meta-package."
git-all,应用工具,核心,服务,Meta-package to pull in all git tools,"Git is a fast, scalable, distributed revision control system with an
unusually rich command set that provides both high-level operations
and full access to internals.

This is a dummy package which brings in all subpackages."
git-core,应用工具,系统,工具,Core package of git with minimal functionality,"Git is a fast, scalable, distributed revision control system with an
unusually rich command set that provides both high-level operations
and full access to internals.

The git-core rpm installs really the core tools with minimal
dependencies. Install git package for common set of tools.
To install all git packages, including tools for integrating with
other SCMs, install the git-all meta-package."
git-daemon,应用工具,系统,服务,Git protocol daemon,The git daemon for supporting git:// access to git repositories
git-email,应用工具,应用,库,Git tools for sending patches via email,Git tools for sending patches via email.
git-gui,应用工具,核心,服务,Graphical interface to Git,Graphical interface to Git.
git-instaweb,应用工具,核心,服务,Repository browser in gitweb,"A simple script to set up gitweb and a web server for browsing the local
repository."
gitk,应用工具,核心,服务,Git repository browser,Git repository browser.
git-subtree,应用工具,核心,工具,Git tools to merge and split repositories,"Git subtrees allow subprojects to be included within a subdirectory
of the main project, optionally including the subproject's entire
history."
git-svn,应用工具,系统,工具,Git tools for interacting with Subversion repositories,Git tools for interacting with Subversion repositories.
gitweb,应用工具,系统,工具,Simple web interface to git repositories,Simple web interface to git repositories.
perl-Git,应用库,系统,库,Perl interface to Git,Perl interface to Git.
perl-Git-SVN,应用库,系统,库,Perl interface to Git::SVN,Perl interface to Git::SVN.
glassfish-legal,应用库,应用,工具,Legal License for glassfish code,An archive which contains license files for glassfish code.
glassfish-master-pom,应用库,应用,工具,Master POM for Glassfish Maven projects,This is a shared POM parent for Glassfish Maven projects.
glib2-fam,系统库,核心,库,FAM monitoring module for GIO,The glib2-fam package contains the FAM (File Alteration Monitor) module for GIO.
glib2-static,系统库,核心,库,glib static,The glib2-static subpackage contains static libraries for glib2.
glibc,核心库,系统,库,The GNU libc libraries,"The glibc package contains standard libraries which are used by
multiple programs on the system. In order to save disk space and
memory, as well as to make upgrading easier, common system code is
kept in one place and shared between programs. This particular package
contains the most important sets of shared libraries: the standard C
library and the standard math library. Without these two libraries, a
Linux system will not function."
glibc-common,核心库,核心,工具,Common binaries and locale data for glibc,"The glibc-common package includes common binaries for the GNU libc
libraries, as well as national language (locale) support."
glibc-gconv-extra,核心库,核心,工具,All iconv converter modules for glibc.,This package contains all iconv converter modules built in glibc.
glibc-headers,核心库,系统,其它,Header files for development using standard C libraries.,"The glibc-headers package contains the header files necessary
for developing programs which use the standard C libraries (which are
used by nearly all programs).  If you are developing programs which
will use the standard C libraries, your system needs to have these
standard header files available in order to create the
executables.

Install glibc-headers if you are going to develop programs which will
use the standard C libraries."
glibc-locale-source,核心库,系统,工具,The sources for the locales,"The sources for all locales provided in the language packs.
If you are building custom locales you will most likely use
these sources as the basis for your new locale."
glibc-utils,核心工具,系统,库,Development utilities from GNU C library,"The glibc-utils package contains memusage, a memory usage profiler,
mtrace, a memory leak tracer and xtrace, a function call tracer
which can be helpful during program debugging.

If unsure if you need this, don't install this package."
nscd,核心库,核心,服务,A Name Service Caching Daemon (nscd).,"The nscd daemon caches name service lookups and can improve
performance with LDAP, and may help with DNS as well."
glib-networking,应用库,应用,服务,Networking support for GLib,"This package contains modules that extend the networking support in
GIO. In particular, it contains libproxy- and GSettings-based
GProxyResolver implementations and a gnutls-based GTlsConnection
implementation."
gl-manpages,应用库,应用,服务,OpenGL manpages,OpenGL manpages
glusterfs-api,应用库,应用,服务,GlusterFS api library,"GlusterFS is a distributed file-system capable of scaling to several
petabytes. It aggregates various storage bricks over Infiniband RDMA
or TCP/IP interconnect into one large parallel network file
system. GlusterFS is one of the most sophisticated file systems in
terms of features and extensibility.  It borrows a powerful concept
called Translators from GNU Hurd kernel. Much of the code in GlusterFS
is in user space and easily manageable.

This package provides the glusterfs libgfapi library."
glusterfs-cli,应用工具,系统,库,GlusterFS CLI,"GlusterFS is a distributed file-system capable of scaling to several
petabytes. It aggregates various storage bricks over Infiniband RDMA
or TCP/IP interconnect into one large parallel network file
system. GlusterFS is one of the most sophisticated file systems in
terms of features and extensibility.  It borrows a powerful concept
called Translators from GNU Hurd kernel. Much of the code in GlusterFS
is in user space and easily manageable.

This package provides the GlusterFS CLI application and its man page"
glusterfs-client-xlators,应用工具,应用,服务,GlusterFS client-side translators,"GlusterFS is a distributed file-system capable of scaling to several
petabytes. It aggregates various storage bricks over Infiniband RDMA
or TCP/IP interconnect into one large parallel network file
system. GlusterFS is one of the most sophisticated file systems in
terms of features and extensibility.  It borrows a powerful concept
called Translators from GNU Hurd kernel. Much of the code in GlusterFS
is in user space and easily manageable.

This package provides the translators needed on any GlusterFS client."
glusterfs-fuse,应用工具,应用,服务,Fuse client,"GlusterFS is a distributed file-system capable of scaling to several
petabytes. It aggregates various storage bricks over Infiniband RDMA
or TCP/IP interconnect into one large parallel network file
system. GlusterFS is one of the most sophisticated file systems in
terms of features and extensibility.  It borrows a powerful concept
called Translators from GNU Hurd kernel. Much of the code in GlusterFS
is in user space and easily manageable.

This package provides support to FUSE based clients and inlcudes the
glusterfs(d) binary."
glusterfs-libs,应用库,系统,服务,GlusterFS common libraries,"GlusterFS is a distributed file-system capable of scaling to several
petabytes. It aggregates various storage bricks over Infiniband RDMA
or TCP/IP interconnect into one large parallel network file
system. GlusterFS is one of the most sophisticated file systems in
terms of features and extensibility.  It borrows a powerful concept
called Translators from GNU Hurd kernel. Much of the code in GlusterFS
is in user space and easily manageable.

This package provides the base GlusterFS libraries"
glusterfs-rdma,应用库,系统,服务,GlusterFS rdma support for ib-verbs,"GlusterFS is a distributed file-system capable of scaling to several
petabytes. It aggregates various storage bricks over Infiniband RDMA
or TCP/IP interconnect into one large parallel network file
system. GlusterFS is one of the most sophisticated file systems in
terms of features and extensibility.  It borrows a powerful concept
called Translators from GNU Hurd kernel. Much of the code in GlusterFS
is in user space and easily manageable.

This package provides support to ib-verbs library."
gmp,核心库,系统,库,A GNU arbitrary precision library,"The gmp package contains GNU MP, a library for arbitrary precision
arithmetic, signed integers operations, rational numbers and floating
point numbers. GNU MP is designed for speed, for both small and very
large operands. GNU MP is fast because it uses fullwords as the basic
arithmetic type, it uses fast algorithms, it carefully optimizes
assembly code for many CPUs' most common inner loops, and it generally
emphasizes speed over simplicity/elegance in its operations.

Install the gmp package if you need a fast arbitrary precision
library."
gmp-c++,核心库,应用,库,C++ bindings for the GNU MP arbitrary precision library,Bindings for using the GNU MP arbitrary precision library in C++ applications.
gnome-abrt,应用服务/桌面,应用,工具,A utility for viewing problems that have occurred with the system,"A GNOME application allows users to browse through detected problems and
provides them with convenient way for managing these problems."
gnome-autoar,应用服务/桌面,应用,库,Archive library,gnome-autoar is a GObject based library for handling archives.
gnome-bluetooth-libs,应用服务/桌面,应用,库,GTK+ Bluetooth device selection widgets,"This package contains libraries needed for applications that
want to display a Bluetooth device selection widget."
gnome-boxes,应用服务/桌面,应用,库,A simple GNOME 3 application to access remote or virtual systems,"gnome-boxes lets you easily create, setup, access, and use:
  * remote machines
  * remote virtual machines
  * local virtual machines
  * When technology permits, set up access for applications on
    local virtual machines"
gnome-calculator,应用服务/桌面,应用,工具,A desktop calculator,"gnome-calculator is a powerful graphical calculator with financial,
logical and scientific modes. It uses a multiple precision package
to do its arithmetic to give a high degree of accuracy."
gnome-characters,应用服务/桌面,应用,库,Character map application for GNOME,"Characters is a simple utility application to find and insert unusual
characters."
gnome-color-manager,应用服务/桌面,应用,库,Color management tools for GNOME,"gnome-color-manager is a session framework that makes it easy to manage, install
and generate color profiles in the GNOME desktop."
gnome-common,应用服务/桌面,应用,工具,Useful things common to building GNOME packages from scratch,"This package contains sample files that should be used to develop pretty much
every GNOME application.  The programs included here are not needed for running
GNOME apps or building ones from distributed tarballs.  They are only useful
for compiling from git sources or when developing the build infrastructure for
a GNOME application."
gnome-desktop3,应用服务/桌面,核心,服务,"Shared code among gnome-panel, gnome-session, nautilus, etc","
The gnome-desktop3 package contains an internal library
(libgnomedesktop) used to implement some portions of the GNOME
desktop, and also some data files and other shared components of the
GNOME user environment."
gnome-disk-utility,应用服务/桌面,核心,库,Disks,"This package contains the Disks and Disk Image Mounter applications.
Disks supports partitioning, file system creation, encryption,
fstab/crypttab editing, ATA SMART and other features"
gnome-keyring-pam,应用服务/桌面,核心,工具,Pam module for unlocking keyrings,"The gnome-keyring-pam package contains a pam module that can
automatically unlock the ""login"" keyring when the user logs in."
gnome-menus,应用服务/桌面,应用,工具,A menu system for the GNOME project,"gnome-menus is an implementation of the draft ""Desktop
Menu Specification"" from freedesktop.org. This package
also contains the GNOME menu layout configuration files,
.directory files and assorted menu related utility programs,
Python bindings, and a simple menu editor."
gnome-online-accounts,应用服务/桌面,应用,库,Single sign-on framework for GNOME,"GNOME Online Accounts provides interfaces so that applications and libraries
in GNOME can access the user's online accounts. It has providers for Google,
ownCloud, Facebook, Flickr, Foursquare, Microsoft Account, Pocket, Microsoft
Exchange, IMAP/SMTP and Kerberos."
gnome-remote-desktop,应用服务/桌面,系统,服务,GNOME Remote Desktop screen share service,"GNOME Remote Desktop is a remote desktop and screen sharing service for the
GNOME desktop environment."
gnome-screenshot,应用服务/桌面,应用,库,A screenshot utility for GNOME,gnome-screenshot lets you take pictures of your screen.
gnome-session,应用服务/桌面,核心,服务,GNOME session manager,"gnome-session manages a GNOME desktop or GDM login session. It starts up
the other core GNOME components and handles logout and saving the session."
gnome-session-kiosk-session,应用服务/桌面,核心,服务,Desktop file for mutter based kiosk session,Desktop file to add basic session used for setting up kiosk applications.
gnome-system-monitor,应用服务/桌面,应用,库,Process and resource monitor,"gnome-system-monitor allows to graphically view and manipulate the running
processes on your system. It also provides an overview of available resources
such as CPU and memory."
gnome-terminal-nautilus,应用服务/桌面,应用,工具,GNOME Terminal extension for Nautilus,"This package provides a Nautilus extension that adds the 'Open in Terminal'
option to the right-click context menu in Nautilus."
gnome-themes-standard,应用服务/桌面,核心,服务,Standard themes for GNOME applications,"The gnome-themes-standard package contains the standard theme for the GNOME
desktop, which provides default appearance for cursors, desktop background,
window borders and GTK+ applications."
gnome-video-effects,应用服务/桌面,应用,工具,Collection of GStreamer video effects,A collection of GStreamer effects to be used in different GNOME Modules.
gnu-efi,系统库,应用,库,Development Libraries and headers for EFI,"This package contains development headers and libraries for developing
applications that run under EFI (Extensible Firmware Interface)."
gnupg2,系统工具,应用,库,Utility for secure communication and data storage,"GnuPG is GNU's tool for secure communication and data storage.  It can
be used to encrypt data and to create digital signatures.  It includes
an advanced key management facility and is compliant with the proposed
OpenPGP Internet standard as described in RFC2440 and the S/MIME
standard as described by several RFCs.

GnuPG 2.0 is a newer version of GnuPG with additional support for
S/MIME.  It has a different design philosophy that splits
functionality up into several modules. The S/MIME and smartcard functionality
is provided by the gnupg2-smime package."
gnupg2-smime,系统工具,应用,库,CMS encryption and signing tool and smart card support for GnuPG,"GnuPG is GNU's tool for secure communication and data storage. This
package adds support for smart cards and S/MIME encryption and signing
to the base GnuPG package"
gnuplot,应用工具,应用,库,A program for plotting mathematical expressions and data,"Gnuplot is a command-line driven, interactive function plotting
program especially suited for scientific data representation.  Gnuplot
can be used to plot functions and data points in both two and three
dimensions and in many different formats.

Install gnuplot if you need a graphics package for scientific data
representation.

This package provides a Qt based terminal version of gnuplot."
gnuplot-common,应用工具,系统,工具,The common gnuplot parts,"Gnuplot is a command-line driven, interactive function plotting
program especially suited for scientific data representation.  Gnuplot
can be used to plot functions and data points in both two and three
dimensions and in many different formats.

This subpackage contains common parts needed for all versions of gnuplot."
gnutls-utils,核心工具,核心,库,Command line tools for TLS protocol,"GnuTLS is a secure communications library implementing the SSL, TLS and DTLS
protocols and technologies around them. It provides a simple C language
application programming interface (API) to access the secure communications
protocols as well as APIs to parse and write X.509, PKCS #12, OpenPGP and
other required structures.
This package contains command line TLS client and server and certificate
manipulation tools."
golang-bin,应用工具/编程语言,应用,库,Golang core compiler tools,Golang core compiler tools
golang-dbus,应用库/编程语言,应用,工具,Go client bindings for D-Bus,Go client bindings for D-Bus
python3-google-api-client,应用库,系统,库,Google APIs Client Library for Python,"Written by Google, this library provides a small, flexible, and powerful
Python 3 client library for accessing Google APIs."
google-guice,应用库,应用,工具,Lightweight dependency injection framework for Java 5 and above,"Put simply, Guice alleviates the need for factories and the use of new
in your Java code. Think of Guice's @Inject as the new new. You will
still need to write factories in some cases, but your code will not
depend directly on them. Your code will be easier to change, unit test
and reuse in other contexts.

Guice embraces Java's type safe nature, especially when it comes to
features introduced in Java 5 such as generics and annotations. You
might think of Guice as filling in missing features for core
Java. Ideally, the language itself would provide most of the same
features, but until such a language comes along, we have Guice.

Guice helps you design better APIs, and the Guice API itself sets a
good example. Guice is not a kitchen sink. We justify each feature
with at least three use cases. When in doubt, we leave it out. We
build general functionality which enables you to extend Guice rather
than adding every feature to the core framework."
guice-extensions,应用库,应用,工具,Extensions for Guice,"Guice is a lightweight dependency injection framework for Java 5
and above. This package provides extensions POM for Guice."
go-srpm-macros,系统库,应用,库,RPM macros for building Golang packages for various architectures,"The package provides macros for building projects in Go
on various architectures."
gpac-static,应用库,核心,库,Development libraries and files for gpac,Static library for gpac.
gpgme,系统库,应用,库,GnuPG Made Easy - high level crypto API,"GnuPG Made Easy (GPGME) is a library designed to make access to GnuPG
easier for applications.  It provides a high-level crypto API for
encryption, decryption, signing, signature verification and key
management."
gpgmepp,系统库,应用,库,C++ bindings/wrapper for GPGME,C++ bindings/wrapper for GPGME.
qgpgme,系统库,应用,库,Qt API bindings/wrapper for GPGME,Qt API bindings/wrapper for GPGME.
gpm,系统库,系统,工具,A mouse server for the Linux console,"Gpm provides mouse support to text-based Linux applications like the
Emacs editor and the Midnight Commander file management system.  Gpm
also provides console cut-and-paste operations using the mouse and
includes a program to allow pop-up menus to appear at the click of a
mouse button."
gpm-libs,系统库,核心,库,Dynamic library for gpm,"This package contains the libgpm.so dynamic library which contains
the gpm system calls and library functions."
grafana,应用服务,系统,服务,Metrics dashboard and graph editor,"Grafana is an open source, feature rich metrics dashboard and graph editor for
Graphite, InfluxDB & OpenTSDB."
grafana-pcp,应用服务,系统,工具,Performance Co-Pilot Grafana Plugin,"This Grafana plugin for Performance Co-Pilot includes datasources for
scalable time series from pmseries(1) and Redis, live PCP metrics and
bpftrace scripts from pmdabpftrace(1), as well as several dashboards."
graphviz,应用工具,应用,服务,Graph Visualization Tools,"A collection of tools for the manipulation and layout of graphs (as in nodes
and edges, not as in barcharts)."
graphviz-gd,应用工具,应用,库,Graphviz plugin for renderers based on gd,"Graphviz plugin for renderers based on gd.  (Unless you absolutely have to use
GIF, you are recommended to use the PNG format instead because of the better
quality anti-aliased lines provided by the cairo+pango based renderer.)"
graphviz-python3,应用库,应用,工具,Python 3 extension for graphviz,Python 3 extension for graphviz.
greenboot,系统工具,系统,服务,Generic Health Check Framework for systemd,Generic Health Check Framework for systemd.
greenboot-default-health-checks,系统工具,核心,服务,Series of optional and curated health checks,Series of optional and curated health checks.
grilo-plugins,应用库,应用,工具,Plugins for the Grilo framework,"Grilo is a framework that provides access to different sources of
multimedia content, using a pluggable system.
This package contains plugins to get information from theses sources:
- Apple Trailers
- Bookmarks
- Euronews
- Filesystem
- Flickr
- Freebox
- Gravatar
- iTunes Music Sharing
- Jamendo
- Last.fm (for album arts)
- Local metadata (album arts and thumbnails)
- Metadata Store
- Pocket
- Podcasts
- Radio France
- Shoutcast
- The Guardian Videos
- Tracker
- Vimeo
- Youtube"
groff,应用工具,核心,工具,A document formatting system,"Groff is a document formatting system. Groff takes standard text and
formatting commands as input and produces formatted output. The
created documents can be shown on a display or printed on a printer.
Groff's formatting commands allow you to specify font type and size,
bold type, italic type, the number and size of columns on a page, and
more.

Groff can also be used to format man pages. If you are going to use
groff with the X Window System, you will also need to install the
groff-x11 package."
