idx,name,y_true,y_predict,feature
1501,pcaudiolib,库,服务,audio device different library portable provide
1502,pciutils,工具,服务,connect contain device inspect library linux package related utility various
1504,pcre,库,服务,16 32 base binding change compatible detailed doc encoding expression follow function interface libpcreposix library native note package pcre perl posix provide regular semantics string supply support syntax utf variant work wrapper
1505,pcre2,库,服务,16 32 access base byte compatible contain distribution encoding entirely expression facility follow function install interface library note original package page pcre perl posix process provide regular restrict semantics string support syntax utf value variant work working wrapper write
1507,pcsc-lite,库,服务,application card command communicate communication connect coordinate daemon factor form framework include interface library line lite manager package pc provide purpose reader resource sc small smart smartcards tool windows
1508,pcsc-lite-ccid,库,其它,card chip daemon devices driver generic interface lite pc reader sc smart
1510,pentaho-reporting-flow-engine,库,工具,engine flow free java jfreereport know library pentaho report reporting
1511,perftest,工具,服务,collection communication connection design ip network normal number performance program provide rdma simple tcp test tests utilize work
1513,perl-Algorithm-Diff,工具,其它,algorithm compute diff difference file files guarantee identical intelligent list lists module possible program similar small string thing unix
1514,perl-Archive-Tar,库,其它,allow archive class compress creation custom easy file gzipped handle instal manipulation mechanism method module object orient perl provide quick support
1518,perl-B-Hooks-EndOfScope,库,其它,allow code compilation compile execute finish module perl scope surround
1519,perl-B-Lint,库,其它,carry equivalent extended lint module option perl process program similar version
1521,perl-CGI,库,其它,built cgi come common complete cooky environment fastcgi feature file form gateway generation handle header html http include interface major manipulation mature mod_perl performs pm prepare process processing query read request response solution stable string submission support uploads utility write
1544,perl-Crypt-OpenSSL-RSA,库,其它,crypt decoding encoding interface library openssl perl
1550,perl-Data-Dump,其它,库,argument code contain copy data deep dump easy evaled format function list module original perl pretty printing produce provide reading result single string structure value
1563,perl-DateTime-Locale,库,其它,available classes datetime factory function information locale localization pm primarily provide sub support various
1564,perl-DateTime-TimeZone,库,其它,base class factory internally object offset period represent time zone
1565,perl-DateTime-TimeZone-SystemV,库,其它,accord certain class cycle datetime daylight express extend form implement instance interface mean object offset plain posix recipe represent rule saving specify standard string switch syntax time timezone type universal
1566,perl-DateTime-TimeZone-Tzfile,库,其它,arbitrary change class datetime encode express file format implement instance interface limit object offset pattern represent resolution second time timezone universal
1568,perl-Devel-Caller,库,其它,caller devel version
1569,perl-Devel-GlobalDestruction,库,其它,actually avoid constructor deal destruction destructors effect execute expose flag free global happen hard little local mark mess need object order perl process resource respect simply tricky usually writing
1570,perl-Devel-LexAlias,库,其它,ability alias devel lexical provide scope subroutine variable
1571,perl-Devel-PPPort,库,服务,attempt benefit bring change environment feature file flexibility function gain generator header impact increase module older perl portability reduce release space time track typically user version worry write
1574,perl-Devel-Symdump,库,其它,class convenient devel hierarchy inspect module perl program provide running symbol table
1579,perl-Dist-CheckConflicts,库,工具,allow attempt automatically backwards break cause change circular client compatible conflict conflicting cpan currently deal declare depend dependency dist exist express fixed happen ideal installing instance intent issue manually module non properly separately solution specify update user version work
1581,perl-Encode,库,其它,character encode encoding interface module perl provide rest sequence string
1582,perl-Encode-Detect,库,其它,charset data decode detect detected determine encode encoder encoding input module perl subclass
1584,perl-Env,库,其它,access allow array environment hash import maintain method module perl scalar special treat variable
1586,perl-Eval-Closure,库,工具,accessors attempt cache caching clean cleanly closure code constructor control create description determine different difficult dynamic environment especially eval evaled faster fixed function generate generation heavily inlined inside instance issue large list module moose non note number problem properly provide quite result runtime safely scope significant slow solve source specified speed string variable version work
1587,perl-Exception-Class,库,其它,allow class declare exception hierarchy java manner module perl real
1588,perl-Exporter,库,服务,allow case common default export exporter flexible function highly implement implementation implements import interface method module optimize provide space user variable
1589,perl-Exporter-Tiny,库,其它,alternative behavior code configuration core dependency destination explicit export export_ok exporter external feature function import include installation installer installers interesting interface internal line mean method non option override package performs pm provide rename resolution support target variable write zero
1592,perl-ExtUtils-MakeMaker,库,工具,argument argv base case collection command common create deal dependency design easy extension extutils featured file function header issue make makefile makefiles method model module need perl perl5 pl provide pull replace routine sh small subroutine unix utility work write
1593,perl-ExtUtils-Manifest,库,其它,check file manifest utilities write
1596,perl-File-BaseDir,库,服务,application base cache configuration data desktop directory file follow freedesktop gnome gui layout locate mechanism module non org platform specification specifications specify suggest xfce
1602,perl-File-HomeDir,库,服务,consistently directory file home issue locate module platform solve typically user variety various wide
1603,perl-File-Listing,其它,库,directory export function listing module parse single
1604,perl-File-MimeInfo,库,其它,application database determine file freedesktop implement mime module open share specification type
1605,perl-File-Path,库,其它,arbitrary convenient create delete depth directory entire file module provide remove tree
1606,perl-File-ReadBackwards,库,其它,backwards efficient fast file handle interface line memory module object read simple support
1607,perl-File-Remove,库,其它,convenience directory file module remove
1608,perl-File-ShareDir,库,其它,advanced available class community companion developer dist file intent known large little locate make module modules perl process provide share tricky
1611,perl-File-Which,库,工具,absolute check executable existence file filename implementation instal path perl portable program utility
1612,perl-Filter,库,其它,alter compiler filter module perl preprocessor program source text
1613,perl-Filter-Simple,库,其它,case common filter filtering interface module perl provide simplified source sufficient
1616,perl-HTML-Parser,其它,库,document extract html include information module parse parser perl
1617,perl-HTML-Tagset,其它,库,contain data entity html kind module operation parse table useful various
1618,perl-HTML-Tree,库,其它,contain create development distribution documentation extract facilitate handle html information libwww module order perl relevant represent separate suite syntax track tree
1620,perl-HTTP-Date,其它,库,conversion date deal default export format function http module protocol provide routine
1621,perl-HTTP-Message,其它,库,class communication contain distribution header http message pass represent request response style useful
1622,perl-HTTP-Negotiate,其它,库,accept algorithm allow attribute base chapter choose complete content draft field header http ietf implementation module negotiation preferred provide ps representation request selection serve spec specify value variant various
1624,perl-IO-All,库,其它,class dozen file function helpful include inherit manipulation method module object perl proxy
1629,perl-IO-Socket-IP,库,工具,argument backward compatible constructor drop independent ipv4 ipv6 method module protocol provide replacement socket support
1632,perl-IO-Tty,库,其它,interface perl provide pseudo
1634,perl-IPC-Cmd,库,工具,allow command desire easy independently interactively make platform work
1635,perl-IPC-Run,库,工具,allow child command common file functional interact line mixed module operator perl pipe process provide pseudo redirection script style support supported unix usage various
1636,perl-IPC-SysV,库,其它,inter interface message object process
1638,perl-Importer,库,其它,alternative compatible consume export exporter extra feature follow import inherit interface layer module modules need perl plus specification symbol variable
1640,perl-JSON-PP,库,其它,compatible compile cpan environment fast instal json marc module perl proper pure used write
1646,perl-Locale-Codes,库,其它,code codes contain country currency deal different distribution handle identify include language locale module type
1647,perl-Locale-Maketext,库,工具,access application code common directly english feature framework german interface languages locale localization localize need organize present processing produce program provide software speaker text tool
1648,perl-MIME-Base64,库,其它,base64 contain decoder decoding encode encoder encoding extensions internet mail method mime package printable quoted specify string
1649,perl-MIME-Charset,库,其它,character charset information internet message mime provide
1653,perl-Mail-Sender,库,其它,attachment mail module send server smtp
1654,perl-MailTools,库,其它,ancient application mail module perl relate related various
1656,perl-Math-BigInt-FastCalc,库,其它,calculation fast integer math module perl provide speed support
1657,perl-Math-BigRat,库,其它,arbitrary complement math number provide rational support
1667,perl-Module-Pluggable,库,其它,ability automatically class essentially export extensible file hopefully instantiate look method module optionally package path plugins provide search simple space turn
1668,perl-Module-ScanDeps,库,其它,appear code dependency hash module names perl pm potential program recursively reference return scan test value
1669,perl-Mozilla-LDAP,库,其它,ldap module openldap perl wrap
1673,perl-Net-SMTP-SSL,库,其它,implements network operation support
1674,perl-Net-SSLeay,其它,库,access application client complicated convenience extension finally function high http level module offer openssl package page perl server write
1675,perl-Net-Server,库,其它,class engine extensible general intend internet layer module orient perl protocol server write
1677,perl-Number-Compare,库,其它,anonymous comparison compile module number numeric perl simple subroutine test value
1678,perl-Package-DeprecationManager,库,其它,allow deprecate deprecation distribution feature hash import manage module package provide value version warning
1680,perl-Package-Stash,库,其它,easy hide incredibly manipulate manipulating module necessary occasionally perl simple symbol table wrong
1681,perl-Package-Stash-XS,库,服务,compiler correct default end environment faster functionality implementation instal package prefer provide
1682,perl-PadWalker,库,其它,allow change inspect lexical module people play point scope subroutine variable
1683,perl-Params-Check,库,工具,allow argument checking generic input mechanism parsing requirement template validate
1686,perl-Params-Validate,库,其它,additional allow apply arbitrary argument callback capable certain class determine function hierarchy level method module object parameter params pass perl required simple specific type validate validation
1689,perl-Path-Tiny,库,工具,access appropriate attempt break clean core easy fast featured file force forward friendly function handle input like method mode module object operate output particularly path platform provide reading small style translation unix utility win32 work writing
1690,perl-PathTools,工具,库,combined distribution file module perl
1691,perl-Perl-OSType,库,服务,base behavior current example extutils freebsd generic initial know linux mapping match microsoft module modules need operate operating os perl provide specific type unix version win32 windows
1693,perl-Pod-Checker,库,工具,check compliance content document documentation error format module plain specification syntax tool verify
1694,perl-Pod-Coverage,库,其它,checks comprehensive computer determine developers documentation long maybe mechanism module provide tell write
1695,perl-Pod-Escapes,库,其它,decode escape module provide resolve sequence thing useful
1696,perl-Pod-LaTeX,库,工具,command convert data documentation format latex module provide replacement
1697,perl-Pod-Markdown,库,其它,convert markdown module
1699,perl-Pod-Perldoc,库,工具,display documentation embed format groff installation library look module pager perl perldoc piece primarily script tree
1702,perl-Pod-Usage,库,工具,argument command description desired documentation embedded entire exit level line manual message option page present print script status usage verbose
1705,perl-Role-Tiny,库,其它,composition minimalist moose portion role size slice tool
1712,perl-Socket6,库,其它,af_inet6 defines enable environment getaddrinfo include independent intend ipv6 manipulator module programming protocol relate related socket structure support
1713,perl-Software-License,库,其它,common contains license open package provide software source template
1714,perl-Specio,库,工具,apply assignment built check class constraint declare distribution explicitly fact instead interpreter make note optionally perl proper provide represent start sugar syntax type value variable
1716,perl-String-CRC32,库,其它,calculate calculation check checksum differ file generate generated generation interface mention module package perl pkzip program provide redundancy string support value various width zmodem
1718,perl-Sub-Exporter-Progressive,库,其它,additionally advanced come directly export export_ok exporter feature great incredibly like module need note package penalty pick power powerful rename runtime user variable work wrapper
1720,perl-Sub-Info,库,其它,allow inspect perl subroutine tool
1721,perl-Sub-Install,库,其它,easily easy install make mess module package strict subroutine subroutines
1722,perl-Sub-Name,库,工具,allow anonymous debug deep include magic mainly module note rename subroutine
1725,perl-Sys-MemInfo,库,其它,byte free information memory module perl physical return used variable
1727,perl-Term-ANSIColor,库,其它,ansi color constant escape explicitly function import interface module offer output screen sequence utility
1739,perl-Text-Balanced,库,其它,extract perl possibly prefix sequence skip specified string subroutine text
1740,perl-Text-CharWidth,库,其它,column equivalent feature module number provide string subroutine terminal
1741,perl-Text-Diff,库,工具,available basic complete diff diffs executable faster feature file generally integrate large near perform perl platform provide record service shell slow small text utility
1745,perl-Text-Tabs+Wrap,库,工具,break command document expand join line long paragraph perform reformat remove short simple text unix
1746,perl-Text-Template,库,工具,build embed embedded evaluate expand form generally generate html letter library little page perl piece program replace template text value
1747,perl-Text-Unidecode,库,其它,ascii attempt character data express function letter pronunciation provide represent representation roman text transliteration unicode universally writing
1748,perl-Text-WrapI18N,库,工具,11 8859 appear asian byte character chinese combine east encoding euc include intend internationalized iso japanese jp language like line locale mark module multi setup space substitute support text utf white width word wrap
1752,perl-TimeDate,其它,库,date display format include interface manipulation module number particular perl point provide read reliable representation small string suit textual time various
1758,perl-Unicode-EastAsianWidth,库,其它,asian character deal defined east http module org property provide specify status unicode user width www
1759,perl-Unicode-LineBreak,库,工具,algorithm annex break breaking concern define determine east_asian_width informative line performs position property standards unicode
1761,perl-Unicode-UTF8,库,其它,decode decoding encode encoding form function iec iso module provide specify unicode utf
1764,perl-WWW-RobotRules,其它,服务,access conform database derived exclusion file html http module org parse permission site specify standard txt webmasters www
1771,perl-XML-RegExp,库,服务,contain digit expression following letter module package reference regular token utility
1783,perl-constant,库,工具,accuracy allow away block code compile constant correctly declare digit easy equation expression false likely machine maintain method notice optimize particular perl pragma probe program read replace script send space time value write wrong
1784,perl-experimental,库,其它,convenient disable easy enable experimental feature make pragma provide
1786,perl-gettext,工具,库,access construct database family function gettext interface internationalize message module perl permit retrieve software string
1789,perl-libnet,库,其它,client collection community consistent interface internet module network perl programming protocol provide simple various
1790,perl-libwww-perl,其它,库,allow application class client collection consistent contain focus function general help http implement interface library libwww main module perl program provide server simple wide world write
1792,perl-local-lib,库,工具,allow app application apply appropriate bootstrapping case collection configuration construct contain convenient copy create current directly directory easy environment file generally home lib library like list local locate maintainer make module need outside patch perl print provide quick shell ship specific specify suitable syntax upstream usage useful user variable
1793,perl-namespace-autoclean,库,工具,available bind class clean compile current cycle function functions import instance like look method module namespace naturally package perl pragma remove similar symbol touch use
1795,perl-parent,库,其它,allows base class compile effect establish inheritance load module package push relationship require similar time
1797,perl-podlators,库,工具,capability classes contain convert format include input module output package page plain roff source sub suitable terminal text various
1799,perl-threads,库,工具,available based data default deprecate information interpreter model perl pm prior programming provide remove result share state thread
1804,phonon,库,其它,framework multimedia
1805,pidgin,库,工具,account allow base bonjour client common contain core design easy editor feature gtk implement include instant jabber libpurple library like lotus message messaging microsoft modular online perl pidgin plugins protocol sametime scripting simple support talk unique variety
1806,pidgin-sipe,库,工具,able client communications connect extended icon implement instant libpurple live microsoft multi office online package party pidgin plugin product productivity protocol provide replace server simple sip skype suite various version
1807,pigz,工具,库,compress core data exploit fully functional gzip implementation multiple parallel processor replacement stand
1812,pixman,库,工具,cairo library manipulation pixel pixman
1813,pkgconf,库,服务,application automatically autotools backend bin compiler config configure development ensure file flag framework freedesktop functionality handle help include library link linker macro manner metadata org package pkgconfig place program provide provider shim similar support toolkit usr
1817,pmdk,库,服务,access administration administrator allocation allow analysis apis append application array atomically backup barrier base block blocks capable change check checker collection command consistent convert copy create data database design device diagnostics dump dynamic environment erase execute facilitate facility failure fence file flush frequently general heap implement instruction ld_preload level libpmemobj library like line load low malloc management mapped memory modify nics node object operation option parse particular perform performs persistent pmdk pool power process program programming protocol provide python rdma read region remote repair replay replicate resident respect restore routine script separate sequence similar size standalone standard state store style support target tool transaction transactional transfer translation transparently troubleshoot turn typical update usage useful user utilities utility utilize variable volatile write zero
1818,pmix,库,服务,apis attempt branch challenge cluster communication current definition demonstrate design desired effort eliminate exchange execute exist expect extend extended fact fully impact implementation include information interface interprocess launch level management mean mpich need node objective operation overall predecessor process project property provide pseudo question quite rapid reference release remain represent resolve restriction scalability scale server size specifically standard support time version
1819,po4a,工具,库,area documentation ease expect gettext goal like maintain maintenance project tool translation
1820,policycoreutils,库,服务,access application architectural base based basic change component concept contain control core dbus design develop enforcement enhanced environment feature filesystems flask functionality general improve include interface kernel kind label level linux load load_policy machine manage management mandatory multi number operating operation originally package policy policycoreutils provide python python3 require role security selinux service support switch tool type user utility utils
1822,polkit-pkla-compat,库,工具,associate compatibility file format helper javascript late polkit provide release rule rules support user
1823,polkit-qt-1,库,其它,binding developer library nice policykit polkit qt
1825,poppler-data,库,工具,automatically character consist correctly enable encode encoding file instal optional package poppler present properly read render
1826,popt,库,服务,allow arbitrary argument argv array automatically base command configuration expansion file function getopt getopt_long heavily improve include influence library like line parameter parse powerful rule shell string style utility variable
1827,portreserve,工具,服务,generally help init known occupy port prevent program range real release reservation script service tell utility
1828,postfix,工具,服务,agent mail postfix transport
1830,postgresql-odbc,其它,服务,access application connectivity database driver include need odbc open package postgresql
1834,prefixdevname,工具,服务,built configuration consistently define determine ethernet file helper interface link net network nics package prefix produce provide rule systemd udev user utility write
1837,prometheus-jmx-exporter,库,服务,agent bind binding collector configure exporter expose http intend java local metric openjdk package prometheus scrape serve server target
1839,protobuf-c,库,其它,binding buffers code compiler contain data efficient encode extensible format generator google language library modified package programming protocol provide pure run structure time version
1841,psacct,工具,服务,activity command contain display execute executed include information long monitor package previous previously process statistic summarize turn user utilities utility
1842,psmisc,工具,服务,command contain display file filesystems identify manage package path process running send signal specified specify structure tree utilities utility
1844,publicsuffix-list,库,服务,able accurate cooky cross database determine domain form hard include initiative list loading maintain mozilla package protect provide public registry representation runtime site software submission suffix track user vendor work
1847,pyOpenSSL,库,工具,code connection error extensive handling high include level library mechanism method mirror module object openssl portable python socket ssl subset wrap wrapper write
1848,pyatspi,库,工具,access allows application assistive automation based binding client control essentially expose gtk include interact interface internals library magnifier package python3 query reader screen script spi technology tools
1849,pycairo,库,工具,binding cairo library python
1850,pygobject3,库,工具,base binding cairo gobject introspection library non package provide python specific
