idx,name,y_true,y_predict,feature
1232,linux-firmware,工具,服务,adapter adapters adaptor carefully condition contain device driver file firmware hardware include inside intel kernel license link linux mesh network olpc operate package provided read require series subject support term usage wifi wireless
1233,linuxconsoletools,工具,库,configure connect contain device event input joystick kernel layer legacy mouse package provide serial subsystem support test tools utility
1235,lksctp-tools,工具,服务,access available base command contain control documentation file follow implementation information intend kernel library line linux package protocol readme reference run section source space stream supplement time title tool tools transmission tree user version
1239,lm_sensors,库,服务,access application collection core general hardware include library module monitoring package smbus tool
1240,lmdb,工具,服务,application contains library libs necessary package share shared
1241,lockdev,库,服务,device exclusive library lock method provide reliable
1242,log4j,库,其它,nannan
1246,lorax-templates-anolis,服务,工具,80 anolis boot build create creator iso isos live livemedia lorax place share specific template templates usr
1250,lsof,工具,服务,file files information linux list lsof open process stand unix utility
1251,lsscsi,库,服务,associate author classic device file host includes information kernel linux list mimic option output prior proc provide pseudo scsi series sysfs uses widely
1252,lttng-ust,库,其它,application generate library space trace tracer user userspace
1258,lua-posix,库,其它,access feature library posix program provide
1259,lua-rpm-macros,库,其它,build macro package source
1262,lucene++,库,工具,date engine featured high java library lucene performance popular port search text write
1264,lvm2,工具,服务,access application bus command contain coordinate create daemon device disk event functionality group handle hard include interface kernel kind library lock logical loop lvm2 management mapper mdadm monitor multiple operation optical package partition physical raid read share shared state storage support systems tool userland userspace utility virtual volume write
1265,lz4,工具,服务,algorithm compression contain core decoder extremely fast feature limit loss multi multiple package provide reach scalable speed typically
1267,lzop,工具,库,advantage base companion compatibility compression compressor cost data decompression design drop file goal gzip high library main portability ratio real reasonable reliability speed time utility
1268,m17n-db,库,工具,contain data encode font input language layout lib m17n opentype package render text
1269,m17n-lib,库,工具,allow backend core db input language lib library m17n method multilingual package primarily provide table text
1276,mallard-rng,工具,库,extension final mark relax schema version
1278,mariadb,其它,工具,nannan
1279,mariadb-connector-c,其它,服务,application client configuration connect database deliver develop directory driver file include library mariadb mysql native package present require ship
1280,mariadb-connector-odbc,其它,服务,ansi client connectivity connector database driver drop industry lgpl library license mariadb mode mysql native odbc open replacement standard standardized support unicode
1283,matchbox-window-manager,工具,其它,base contain desktop embedded environment handhelds input kiosk limit manager matchbox mechanism non package platform resource screen set space window
1286,mcelog,工具,服务,32 64 check collect data decode exception machine tool translate utility x86
1287,mcpp,库,工具,alternative build check complicate conformance debug defines directive especially expand high include independent install library link macro multiple package portability preprocessor process program provide replacement resident share source stand standard support useful
1289,mdadm,工具,服务,array common configuration control create device file function functionality help linux manage mdadm monitor package perform program provide raid similar single software task
1291,mecab,其它,服务,analyzer conditional dictionary estimation fields install make mecab morphological note open parameter random source speech
1292,media-player-info,库,工具,capability contain data device directory file format identify info information install layout mass media medium music package player repository rule storage supported udev
1296,mesa,库,工具,based driver filesystem libegl libgl library mesa render runtime share state support tracker vdpau vulkan
1299,mesa-libGLw,库,工具,library mesa motif opengl runtime widget
1300,meson,工具,库,box build coverage design development high like modern optimize practice productivity programmer provide report simple software support test tool unit valgrind
1301,metacity,其它,工具,attention desktop gnome integrate manager metacity small stable stay strive unobtrusive window
1302,microcode_ctl,工具,服务,binary boot cpus file historical intel longer need package processor provide reboot result revert store update upload volatile x86_64
1303,microdnf,库,工具,action build design environment exactly implementation interpreter lightweight micro minimal need packaging possible simple stack tiny useful want
1306,mingw-binutils,工具,服务,binutils compile compiled cross dlls environment executables like need objdump strip understand utilities utility version win32 win64 windows
1307,mingw-bzip2,工具,库,added approximately available balance benefit best bzip2 capability compiling compress compression compressor contain cross data decompression development fast faster file free freely high library mingw32 mingw64 package patent percent quality software speed static strike technique time tool utility version windows
1308,mingw-cairo,工具,库,cairo library mingw windows
1309,mingw-crt,工具,库,base compiler cross library mingw runtime target win32 win64 windows
1310,mingw-expat,工具,库,associated clark discover document example expat handler james kind library mean mingw orient parse parser port prior register start stream structure windows write
1311,mingw-filesystem,工具,其它,base compiler contain cross environment file filesystem generic layout macro mingw mingw32 mingw64 need package target win32 win64
1312,mingw-fontconfig,工具,库,fontconfig library mingw windows
1313,mingw-freetype,工具,库,engine font free freetype library mingw portable render static version windows
1314,mingw-gcc,工具,库,compiler cross mingw preprocessor target win32 win64 windows
1315,mingw-gettext,工具,库,gettext library lingual message mingw multi produce static utility version windows
1317,mingw-gstreamer1,工具,库,applications architecture base based capability data filter framework graph gstreamer instal library mean media medium mingw operate play plug process processing real related runtime sound streaming time type video windows
1318,mingw-harfbuzz,工具,库,engine harfbuzz implementation layout library mingw opentype static version windows
1319,mingw-headers,库,其它,compiler cross file header mingw win32 win64 windows
1325,mingw-openssl,库,工具,algorithm certificate communication contain cryptographic development include library machine management mingw openssl package port protocol provide secure share support tool toolkit various windows
1328,mingw-pkg-config,工具,其它,compilation compiler configuration determine determines file flag library linker necessary option output pkgconfig read required target tool win32 win64
1331,mingw-termcap,工具,库,arbitrary compiled contain control cross database development enable entry feature function independent library limit mingw package place program send size string termcap terminal tool type unlike version
1335,minicom,工具,服务,ansi based control directory emulation external feature include language modem program script similar simple somewhat terminal text
1336,minizip,工具,其它,advanced buffer contrib contribution disk encryption feature include internet late minizip pkware split zlib
1337,mksh,工具,服务,alternative bourne compatible domain enhance especially feature good improvement include interactive korn largely modern order original produce public replacement robust script shell similar successor version
1338,mlocate,工具,服务,allow avoid cache database exist faster file implementation locate lookup make merge reuse stand traditional utility
1339,mobile-broadband-provider-info,库,服务,associate broadband contain database info information listing mobile network package plan provider
1340,mod_auth_gssapi,库,服务,apache authentication base define gssapi http implement module protocol service
1341,mod_auth_mellon,库,服务,access apache assertion attribute authentication base build diagnostic diagnostics directory federation generate httpd implement instruction logging module protocol readme receive redhat saml server service
1342,mod_authnz_pam,库,服务,authentication authorization basic checker example login module password provider stack supplement
1351,motif,库,工具,application contain dynamically environment include library link manager motif need package program run share static time window
1352,mousetweaks,其它,工具,access accessibility button center click command control desktop enhancement gnome hardware line mouse option package perform preferences provide support various
1355,mozjs60,库,服务,application code embed environment firefox host implementation intend javascript library mozilla provide spidermonkey
1358,mpg123,库,服务,audio commonly decoder decoding layer library mpeg output player plug pulseaudio real time usable
1359,mpich,库,工具,allow architecture automatically base binary blue build channel cluster communication computation compute configure cray default derived desktop device different easy edge efficiently enable end environment ethernet extend framework goal high implementation include infiniband instal install interface ip load manager memory message modular module mpi mpich multiple need network package passing performance platform portable process proprietary provide research select shared socket speed standard support tcp want widely
1360,mpitests,工具,库,compile mpich mvapich2 omnipath openmpi package suite test
1363,mstflint,工具,库,adapter base burn chip contain dump firmware mellanox network package register tool update
1365,mtdev,库,服务,contact device event kernel library protocol slot specifically stand transform translation type variant
1369,multilib-rpm-config,工具,库,file help helper issue macro packaging script shell tool
1370,munge,库,服务,allow authenticate authentication clients cluster common create credential cryptographic define design enables environment form group highly host library libs local method munge platform port privilege process realm remote reserve root runtime scalable security service share specific user validate
1372,mutter,其它,工具,base behavior clutter combine compositing core desktop display effect engine environment extensible fancy gnome inherit intend large logic manage management manager meet metacity mutter need opengl plugins primarily reason shell solid sophisticated stand toolkit visual window
1373,mvapich2,库,工具,adapter base develop implementation interface message mpich mvapich2 omni package passing path state transport university version
1374,mysql,其它,服务,accompany base client common connect contain daemon database different directory error essential file generic implementation install interface library libs message multi mysql need package program provide related require server share shared standard threaded user
1375,mythes,库,工具,binary data file index information library look meaning phrase return search simple speech structured synonym text thesaurus word
1376,mythes-bg,库,其它,bulgarian thesaurus
1377,mythes-ca,库,其它,catalan thesaurus
1378,mythes-cs,库,其它,czech thesaurus
1379,mythes-da,库,其它,danish thesaurus
1380,mythes-de,库,其它,german thesaurus
1381,mythes-el,库,其它,greek thesaurus
1383,mythes-es,库,其它,spanish thesaurus
1384,mythes-fr,库,其它,french thesaurus
1385,mythes-ga,库,其它,irish thesaurus
1386,mythes-hu,库,其它,hungarian thesaurus
1387,mythes-it,库,其它,italian thesaurus
1388,mythes-mi,库,其它,maori thesaurus
1389,mythes-ne,库,其它,nepali thesaurus
1391,mythes-pl,库,其它,polish thesaurus
1392,mythes-pt,库,其它,portuguese thesaurus
1397,mythes-sv,库,其它,swedish thesaurus
1398,mythes-uk,库,其它,thesaurus ukrainian
1400,nasm,工具,服务,assembler free instruction intel like nasm portable primarily series syntax traditional
1402,ncompress,工具,其它,compatible compress compressed compression contain decompression extension fast file gzip gzipped handle install need original package uncompress unix utility
1403,ncurses,库,工具,additional base binding character classic clear common compatibility compiler contain conversion curse description descriptions distributable freely include independent library method ncurses optimization package reasonable replacement routine screen support term termcap terminal tool update utility version
1406,net-snmp,库,其它,application binary client contain library libs net package runtime share snmp
1407,net-tools,工具,服务,basic check contain ifconfig include iproute net netstat networking obsolete package replacement route tool tools
1408,netlabel_tools,工具,服务,attribute configure contain data explicit implement kernel label labeling linux manage mark necessary network package packet protocol provide query secure security space subsystem tool tools user
1409,netpbm,库,工具,bitmap contain contains conversion convert different example file format function graphic group handle include install library manipulate need netpbm package portable program script support tools various
1410,nettle,库,工具,application context crypto cryptographic design easily gnupg kernel language level library like low object oriented python space toolkits
1411,network-manager-applet,其它,服务,applet area bluetooth configuration connection contain control editor modem network networkmanager notification package status utility
1412,newt,库,服务,base bin build button color contain dialog entry field interface label library mode need package plain program programming radio replacement share text user usr widget window
1415,nftables,工具,服务,interface module netfilter nftables provide python tables userspace utility
1419,nispor,库,服务,binding contain interface linux network package python3 querying state status unified
1420,nmap,工具,服务,addition alternatives analysis application auditing characteristic classic command communication compare connectivity data debug design determine end executable feature flexible generation host identification include instantly ip ipv4 ipv6 line netcat network networking nmap number offer operating pack packet ping port post potential provide read redirection reliable remote replacement requires response result reverse sbin scan scanner scanning security sequence service specification suite support target tcp technique tool transfer update user usr utility virtually work write
1421,nmstate,库,服务,accompany binding command contain database declarative enterprise host library line manage manager manipulation manner multi need network networking package plugin provider python satisfy setting support tool
1422,nodejs,其它,服务,nannan
1425,npth,库,工具,allow ancient base compatible contrast design implementation know library non operate portable replacement similar standard thread threads
1426,nspr,库,工具,basic calendar facility file free gui include interval library linking malloc management memory netscape network non normal nspr operating platform portable provide runtime share synchronization thread time timing
1427,nss,库,服务,509 application applications build certificate chain client command configure cross cryptographic database default define design development enabled globally initialization install library line load manage manipulate mime module need network nss operating package pkcs platform security server services standard support tool tools user utilities
1428,nss_nis,库,服务,data group host information module network obtain service switch user
1429,nss_wrapper,库,工具,able address allow cause client correctly create daemon define delete devel development environment file following function group host interact ld_preload libuid_wrapper modify need network normally package passwd path possible privilege project provide resolution resolve server setup socket_wrapper software space switch test testing unix user variable versa vice wrapper
1430,ntfs-3g,库,服务,3g access application attribute compress consist create currently device directory driver extend file filesystem functionality handle handling hard include included installation libraries library license like link linux list normal ntfs open operate package posix provide read remove rename right runtime safe server source sparse special stable stream support symbolic transparently userspace utility windows write
1431,numactl,库,服务,access allocation application consist library libs machine memory numa policy program provide simple specific support tune uniform
1435,nvme-cli,工具,服务,cli command express interface line linux management nvme provide space tooling user
1436,nvmetcli,工具,服务,allow command configuration configure contain file interactively interface json kernel line linux nvme package restore save shell storage target
1437,ocaml,库,工具,application batch bytecode code compiler comprehensive comprise contain debugger development documentation environment expose family fast functional generator high interactive internal internally language level library module native need note object ocaml optimize oriented package parse portable programming replay runtime strongly tool typed useful version yacc
1440,ocaml-findlib,库,其它,build caml helper manager objective package
1442,ocaml-ocamlbuild,库,工具,build library ocaml program tool
1443,ocaml-srpm-macros,库,其它,architecture build contain dependency macro need ocaml order package pull
1444,onboard,工具,服务,away configuration data design example hardware keyboard layout mind need read right screen server simplicity useful user xorg
1445,ongres-scram,库,其它,authentication challenge client contain family implementation java layer mechanism package response sasl scram security simple
1447,opa-ff,库,服务,access address application basic build compute contain contains database distribute export fabric ibacm interface level library manage management manager memory necessary node omni package path platform provider resolution script share tool
1448,opa-fm,工具,其它,application baseboard contains fabric fm include intel management manager omni path performance software subnet tool
1449,open-vm-tools,工具,服务,administration component contain core discovery driver essential experience functionality host implementation improve improved library machine management open operations pack package perform program project script service source space suite tools user utility virtual virtualization vm vmware
1454,openchange,库,服务,access exchange library microsoft native protocol provide provides server
1458,openhpi,库,服务,abstract access alert associate base center chassis computer control create data device easily event exist export forum hardware implementation include intent interface inventory ipmi libraries library limit machine manage mechanism modeling modular open platform plug project provide resource sensor server source support swap sysfs tool tree type typically various watchdog
1459,openjade,库,工具,application base clark command component document dsssl engine format iec implementation input iso jade james language line output semantics sgml specification standard style variety
1460,openjpeg2,库,工具,application class codec command compliance compliant component contain devel develop developer docs documentation extended file handling jpeg library line manipulation multiple open order package profile promote source standard tool transforms
1461,openldap,工具,服务,access application book client clients configuration contain development directory documentation domain file information internet ldap library lightweight modify need open openldap package phone possible program propagate protocol service similar source style suite support tool usually utility
1462,openmpi,库,服务,advantage application available best build combine completely compliant computer developer freely http implementation information interface library message mpi offer open order org passing project researcher resource science software source standard technology vendor www
1464,openoffice.org-dict-cs_CZ,工具,库,contain czech dictionary hunspell hyphenation package rule spellchecker
1466,opensc,库,工具,application applications authentication card compatible cryptographic digital encryption facilitate firefox focus implement library mail main mozilla operation pkcs provide security signature smart software standard support thunderbird utility work
1467,openscap,库,工具,allow assessment author avoid bash binding build capable check command compliance computer configuration contain content easy enable engine expression extension goal historically include information integration language library line manage network nist non open openscap oscap package path perform perl plug protocol provide python python3 related ruby scanner scap script scripting separate source standard sub tool utilities utils vulnerability write
1468,openslp,库,工具,allow application configuration define discover enterprise existence framework ietf implementation location network networking open protocol provide service source standard track
1469,opensm,库,服务,access contain daemon diagnose fabric include infiniband libraries library machine manage management manager need network opensm package project rout shared space state subnet test tool user utility various
1470,opensp,库,工具,application base clark command component generalized generic iec implementation include iso james language line markup parser sgml standard
1471,openssh,工具,服务,agent allow application arbitrary authenticate authentication backend binary bring channel client clients command communication connect connection contain core daemon date distribute driver easier encrypt encrypted execute feature file fips forward forwarding free host implementation include insecure install instance intend ip ldap machine make mode module necessary network open openbsd package port program protocol provide remote replace rlogin script secure securely security server service shell source ssh sshd stack store sudo support tcp term test token untrusted useful user validation version
1474,openssl-pkcs11,库,服务,application available card command configuration enables engine file hardware line load make module openssl optional pkcs pkcs11 precisely register security smart support
1477,orc,工具,服务,addition architecture arithmetic array assembly available code compile compiler data execute feature generic include language library operate operation optimized produce program represent run simd simple time tool
1478,orca,库,工具,access application assistive braille combination customizable desktop gnome graphical interface orca people provide provider reader screen service speech spi support technology toolkits user visual work
1480,osbuild,库,服务,allow artifact assembler base build container contains device encrypted host image inside label lvm2 necessary osbuild ostree policy selinux service source stage support unknown
1483,osinfo-db,工具,服务,automated configuration database facilitate file hypervisor information machine operating osinfo platform provide provisioning virtual
1484,osinfo-db-tools,工具,服务,database information manage operating osinfo package provide tool tools virtualization
1485,ostree,工具,服务,atomic bootable container design development filesystem flatpak grub2 header high host integration level library libs like manage ostree primarily provide rpm shared tool tree
1486,p11-kit,工具,服务,black certificate client command configuration contain contains domain enable enumerate experimental export feature instal kit library line list load module note package pkcs provide server setup share socket standard tool trust unix
1487,p7zip,工具,库,ability additional archiver commander compression contain extend file high http midnight org original package plugins port ratio unix version virtual www zip
1488,pacemaker,工具,服务,advanced availability aware cluster contain contains core form high libraries library libs manager need node pacemaker package resource scalable schemas share stylesheets tool upgrade
1491,pango,库,工具,backends cairo complete context core design different emphasis engine font form graphic gtk handling high integration internationalization internationalized layout library modular need pango provide quality render rendering solution text toolkit widget work
1493,papi,库,工具,application client contain interface libraries library monitor package performance program programmer programming provide run time wish
1495,paps,库,工具,contain converter file libraries library package pango plain postscript text
1497,passwd,工具,服务,authentication change contain library modules package passwd password pluggable utility
1500,pavucontrol,工具,库,allow base classic contrast control device hardware mixer playback pulseaudio separately server simple sound stream tool volume
