idx,name,y_true,y_predict,feature
0,GConf2,库,服务,administration backends configuration database feature pluggable preference process store support transparent user
1,GeoIP,库,工具,address base basis city country cron database enable file geoip hostname instal ipv4 ipv6 library mapping optionally organization package update user weekly
3,HdrHistogram_c,工具,库,dynamic hdrhistogram high histogram port range
4,Judy,其它,库,advantage allocated array available benefit bound consume core declare design desire dynamic dynamically efficiency element extensible general grow high implement large library machine memory null number performance pointer populate pre provide purpose scalability scale simply size sparse state technology unbounded
6,ModemManager,工具,服务,application broadband client consistent contain device easy functionality glib interact libraries library make management manages mobile modem package provide service support wwan
8,NetworkManager-libreswan,库,其它,capability contain desktop file gnome integrate ipsec libreswan networkmanager package plug plugin server software
10,OpenIPMI,库,工具,access allow application base binary binding code contain develop information intelligent interface ipmi language library libs listener management network open openipmi package perl platform project python runtime share tool
11,PackageKit,库,服务,abstraction access allow application architecture automatically bus codecs command configured cron crontab cross distro font glib gstreamer gtk3 helper install layer library line manage management module offer package packagekit pango plugin program related repository secure service session simple user utility
12,PyYAML,库,工具,allow applicable arbitrary broad capable complete complex configuration data design emitter error extension feature file format human interaction language message object parser provide python pyyaml range readability represent script sensible serialization specific standard support task unicode yaml
20,accel-config,工具,服务,accelerator config configuration configure device libraries library subsystem utility
21,accountsservice,库,服务,account application base bus client command contain daemon implementation information interact interface library libs manipulate package project provide query talk user useradd userdel usermod want
23,acpica-tools,工具,服务,acpi advanced architecture assist basic binary code codes command comparison compiles complete component configuration contain contains content current data debug definition develop development directly display environment execution extract extraction file firmware following format gplv2 help host implementation inclusion independent input instal integrate interface kernel keywords language license machine manipulate message method need op operation order os output package performs portion power project provide purpose reference release resident simulate small source space specific specification subsystem suitable table tool tree user version write
28,adwaita-icon-theme,服务,其它,adwaita contain cursor design desktop gnome icon modern originally package theme
29,adwaita-qt,库,其它,adwaita application library theme utilizing variant
31,alsa-lib,库,服务,advanced allow alsa application architecture audio binary case compatibility configuration functionality high include input level library linux manager operating output package program programming provide rout runtime simplify sound support universal
32,alsa-plugins,工具,库,access allow alsa application apps backend channel control convert converter daemon determine device driver easy expand explicitly expose external gateway http input jean kind like marc mixer mono native network node number option output play plugin plugins pre process processing program protocol provide public pulseaudio rate record resampler signal simple slave sound specific speex stereo stream suite surround task type uk usb use using virtual word www
34,alsa-tools,工具,服务,alsa available card certain contain firmware flash following loader package phase second sound tool upload
35,alsa-utils,工具,库,advanced alsa architecture audio basic command contain fast fourier framework library line linux package sound test tester tool transform utility
37,anaconda,工具,服务,anaconda boot contain core custom depend dependency disk dracut driver environment ftp graphical gtk handle http include initial install installation installer interface kickstarts list local main make metapackage module nfs option package possible program pull runtime server setup specific task textual time user widget
40,anolis-release,服务,其它,anolis file package release repository signature
41,ansible-core,工具,服务,ansible automatically based configuration daemon deployment driven execution extension instal language machine manage management model module multi node remote require simple software ssh task transfer work write
43,ant,其它,工具,allow apache application assemble build built command compile core dependent drive effectively extension file generally instance java known library line main mission number pilot point process supply target task term test tool type usage
44,aom,库,工具,alliance bandwidth capable commercial computational consistent contain content decoder deliver delivery designed device encoder file flexible focus footprint format free generated generation hardware include internet interoperable library media modern non open optimize optimized package quality real reference royalty scalable time user video
45,apache-commons-cli,其它,工具,argument command easy interface java library line option provide simple work
46,apache-commons-codec,其它,库,attempt base64 codec common commonly commons decoder encoders examples implementation include phonetic provide urls
47,apache-commons-collections,其它,工具,accelerate access adapter apis array certain class closure collection commons component container core create custom data development easy effective enumeration fast feature fulfill hole implementation interface intersection jakarta java leave lists maps method need object package powerful programming property provides purpose quick ready reduce set significantly special strive structure style sun test theory typical union utility
49,apache-commons-io,其它,库,assist class commons contains develop endian file filter functionality implementation io library stream utilities utility
50,apache-commons-jxpath,其它,库,applies context defines expression graph include interpreter javabeans kind language maps object servlet simple xpath
52,apache-commons-logging,其它,服务,abstraction addition allow apache basic choose commons component developer difference heavily implementation influence interface log log4j logging mean minimize number org orient package particular provide runtime simple small standalone user want wrapper
54,appstream-data,库,其它,appstream center distribution gnome metadata package provide require software specific
55,apr,库,服务,apache data form free include layer library mission operate os portability portable possible provide routine runtime structure win32
57,arpwatch,工具,服务,address automatically build certain change contain database device email ethernet fddi install ip monitor monitoring need network package pair report tool track traffic utility
60,aspell-en,工具,库,aspell british canadian dictionaries dictionary english following list provides word
61,at,工具,服务,allows batch command control crontab drop execute file input install instead level load need note oriented package particular read recur shell specify standard time tool user utility
64,atk,库,工具,accessibility alternative application device graphical input interface interfaces library magnifier provide reader screen support tool toolkit toolkits user
66,atlas,工具,库,algebra apply architecture automatically base binary blas bridge build compile compromise configuration contain cpus customized documentation efficient effort good hardware implementation improvement information interface ivy lapack largely libraries library linear make necessarily necessary obtain ongoing optimal optimization order package performance portable portably present project provide research routine software source specific technique tend time tuned variety x86_64
68,audit,工具,服务,application audit auditing binding configure contain database directory dispatcher dynamic event facility forward framework generate happen incoming interface kernel later library libs like linux machine management need os package plugin plugins provide python3 real record relay remote search server service space store subsystem thing time tool user utility
70,authselect,工具,服务,administrator approach authentication build case command common configuration configure configures design different ends feature file identity instead library line obsolete package potential potentially profile replacement ship solve source stack support test time tool use utility
72,autoconf-archive,库,其它,archive autoconf cause collection contribute free friendly internet macro software
74,autogen,工具,库,automated base command consist document eliminate hassle library line nearly option parser parsing powerful process template time
78,awscli,工具,服务,amazon command environment interface line package provide services unified universal
80,babeltrace,工具,服务,allow babel common conversion converter create format library plugin project provide read trace write
86,bash-completion,工具,其它,advantage bash collection completion feature function programmable shell
88,bcc,工具,其它,analysis berkeley binding collection command compiler control create easy ebpf efficient ends example extend feature filters include instrumentation kernel know line linux llvm make manipulation network packet performance program python python3 suit task tool toolkit trace traffic useful wrapper write
91,binutils,工具,其它,addr2line address archive assembler binary binutils collection content convert copying create data detailed discard display extract family file generate gprof graph include index information line linker list modify objcopy objdump object printable profile ranlib readelf section size string strip symbol translate utility
92,biosdevname,工具,服务,argument bios chassis device directly form given helper kernel label necessary return simple udev
93,bison,库,工具,able available binary bison calculator change compatible complex contain context convert correctly depend description desk develop development ensure file free general generate generated generator grammar information install internationalization know lalr language manual need package packages parse parser program programming purpose range runtime section simple support trouble wide work write yacc
94,bitmap-fonts,其它,服务,anaconda bitmap cjk compatibility contain convert design encode family file font fonts instal intend location meta native number package provide select selected terminal xorg
95,blktrace,工具,服务,block collect data detailed event format gather include information install kernel layer linux mechanism need operation package pattern perform provide queue request space trace tracing user utilities utility
96,bluez,工具,服务,adapter application automatically bluetooth button called configuration connect contact contain content daemon device example exchange file function include instal install keyboard libraries like make manual mobile mode mouse need note object package pair phone proxying regular require rule script share ship start support switch udev utilities utility want wire work
100,boom-boot,工具,服务,boot bootloader compatible configuration entry file function grub2 integration library linux loader manage manager module package patch project provide python3 require script specification support systemd tool
101,boost,库,工具,03 11 additional advanced allow answer application atomic base boost box buffer callback class code command compiler comply component concept configurable configuration conforming constraint container context conventional coordinate copy core coroutine data date define developer diagnostics directory draft easy emphasis entry establish execution exist expression extend extension facility feature file filesystem filter flexible framework free function functionality functions future generalize generic graph handling highly hope implement implementation include inclusion individual interface known language late library line little locale localization log logging long make manage mandate manipulate math memory method micro multiple obtain offer operate operation option order pair path peer persistence point portable portably portion practice preprocessor present program programming propose provide public query question random range reference regular require resume run runtime schedule sense separate serialization signal significantly single slot sort source specific standard standards stream style subroutine suitable support suspend switch synchronize template thread threads time timer tool type unicode useful user userland utility value variable wave wide work
102,booth,工具,服务,authorize cluster clusters core distribute executables facilitate file locate location manage manager multi pacemaker resource site support
103,bpftrace,工具,其它,available backend berkeley bpf bpftrace bytecode capability compile dynamic ebpf enhance exist filter high inspire interact kernel language level linux llvm make packet predecessor recent script systemtap trace tracer tracing user
104,brasero,工具,库,application burn cd contain desktop dvd easy extension gnome libraries library libs nautilus package runtime share simple
107,brotli,库,工具,algorithm available best brotli combination comparable compress compression context currently data dense general generic lossless method modeling modern offer order purpose ratio similar speed variant
108,bubblewrap,库,服务,bin binary container core engine execution kernel namespaces tool unprivileged user usr work
113,c2esp,库,服务,cups driver filter printer
114,ca-certificates,工具,其它,bundle certificate choose contain foundation internet mozilla package root
116,cairo,库,工具,acceleration advantage available binding buffer cairo consistent contain currently design display file functionality gnome gobject graphic hardware high image include integrate library make medium memory object output package postscript print produce provide quality support target window
119,cdrdao,工具,库,allow area audio base cd complete content control description disc disk lead length mode pause pre record recording rs single step textual track write writes
123,certmonger,工具,服务,authority certificate client concern enrol enrollment monitor primarily service status
124,chan,工具,库,available buffer channel implementation pure
127,cheese,工具,服务,application apply capture contain display effect fancy gnome graphical inspired interface library movie need package picture video want widget
128,chkconfig,工具,服务,administrator basic command configure current directly edit hierarchy information instead interface line link maintain manipulate manually numerous page provide query rc service simple specify start stop symbolic tool unless update utility various
129,chrome-gnome-shell,工具,服务,browser capable connector corresponding extension extensions firefox gnome google host http integration manage messaging native org provide repository shell support
131,chrpath,工具,服务,allow compile compiled currently dynamic library load modify path program remove support
132,cifs-utils,工具,服务,able allow authentication automatically cifs client conjunction contain credential deploy establish file filesystem kernel keyring krb5 linux login machine manage microsoft module mount need ntlm option package password protocol provide purpose session share smb standard support tool user username utilities widely windows work
134,cjose,库,服务,nannan
138,cloud-init,其它,库,cloud init initialization install instance need retrieve script special user various
140,clufter,工具,服务,additional agnostic arch built capable cluster command common compiled configuration contain conversion corosync data experimental extra file filter format framework generic include interface internal internally library line offer overall pacemaker package plugin plugins primarily process product python3 reusable rgmanager rhel serve specific stack step target tool trend underlying unused usable variety xslt
141,clutter,库,工具,application center clutter create example fast graphical hope interface library medium obvious open potential rich software source type usage user visually
142,clutter-gst2,库,其它,animated clutter create enable fast graphical gstreamer integration interface library open rich software source user visually
143,clutter-gst3,库,其它,animated clutter create enable fast graphical gstreamer integration interface library open rich software source user visually
144,clutter-gtk,库,工具,allow application basic clutter embed embedding gtk inside library stage widget
146,cockpit,库,服务,admin administer authenticate authentication base behalf bridge browser card certificate client cockpit command component configuration configure console contain dbus diagnostic enable freeipa gnu inspection instal interactive interface line linux listen network offer package report selinux server service session shell smart sssd troubleshoot user
147,cockpit-appstream,库,工具,add archive cockpit component create instal install integration interface load machine manage metric package packagekit read storage support udisks update user virt virtual
148,cockpit-composer,库,工具,cloud cockpit composer custom deploy frontend generate image integrate osbuild suitable upload
149,cockpit-session-recording,库,其它,allow cockpit component configuration generate journal module playback provide record recording session terminal tlog view
150,codemodel,库,其它,code codemodel compiler file generate generator java jaxb library nicer program project provide schema source spin
151,cogl,库,工具,able advantage apis backends centralized component design developer different draw easy extension future good graphic hardware having help implement implementation inconsistency interested library like machine make mean mention myriad need nice open opengl oppose option paper picture place position pretty provide render risk single small software source specification state step style think utility write
152,color-filesystem,库,其它,color directory filesystem layout package provide required store used
156,conntrack-tools,工具,服务,addition availability available cluster collect command connection conntrack contain currently daemon delete deploy dump establish event firewall gnu high highly inspect interact interface kernel line linux list maintain manipulate message monitor multiple netfilter newly package program search selection setup state statistic subsystem synchronize table tools track userspace using
157,container-exception-logger,工具,服务,able container design exception host input inside logger logging outside tool
162,corosync,库,服务,cluster contain corosync engine libraries library package
164,cpio,工具,服务,access archive ascii automatically binary byte collection compatible contain copy cpio create creates default different disk extract file following format information install kind machine magnetic manage need order owner permission pipe plus posix program read recognize support tape
165,cppcheck,工具,库,analysis code compiler detect error false goal normally positive primarily real static syntax tool type unlike zero
166,cppunit,工具,服务,automatic base famous framework junit output port test testing unit
167,cracklib,库,工具,actually appropriate certain characteristic check checking choose conjunction contain cracklib creation determine dict dictionary dicts easy entry exist function generate guess include instal install library match minimally necessary need normally oriented package particular passwd password pattern perform program purpose replacement secure security share standard stop test user username users usr utility want word
168,crash,工具,库,analysis core create critical dump investigate kdump kernel linux live mission offer package patch self suite tool utility
170,crash-ptdump-command,工具,库,buffer crash decode extension facility generate intel module processor retrieve trace utility
171,crash-trace-command,工具,库,command crash data dumpfile extension ftrace module read trace utility
177,cryptsetup,工具,服务,contain crypt disk encrypt encrypted encryption integrity kernel library luks module offline package protection share utility verification volume
183,cups-pk-helper,库,其它,application available config configuration control cups helper interface make policykit printer
185,cyrus-imapd,库,服务,access administration administrative advantage allow base board bulletin calendar compatible concurrent connection contact contain contains control convert cyrus database design differ efficiency email enterprise environment file filesystem hierarchy high icalendar imap imapd imaps implementation instal internal internet kpop large list mail mailbox message multiple news nntp node normally olson open package performance permit personal pop3 private program protocol provide quota read scalability scalable seamless server small software specification standards storage store support technology timezone tool user utilities utility utils version wide write
187,dav1d,库,工具,correctness cross decoder file focus library open platform source speed
188,dbus,其它,服务,access application bus common configuration contain dbus facility file implementation interact libraries library login lowlevel message messaging package provide reference send service session setup tools user utilities utility wide
193,dbxtool,工具,服务,boot contain package secure uefi update updater
194,dconf,工具,服务,backend configuration dconf glib gsettings level low main provide purpose
196,dcraw,工具,库,camera command contain data dcraw decode digital download image line package tool
199,dde-api,库,其它,daemon dde lang
214,dde-qt5platform-plugins,其它,库,platform plugins
226,deepin-devicemanager,其它,服务,device handy hardware information manage manager tool view
229,deepin-fcitxconfigtool-plugin,其它,库,core currently customize desktop easily extension fcitx feeling framework freebsd input light like linux method native provide requirement support unix weight
235,deepin-log-viewer,其它,工具,tool useful view viewer
236,deepin-manual,其它,库,application description design function help instruction learn manual operating provide specific summary user
245,deepin-terminal,其它,工具,application built console deepin default embeddable emulation emulator enabled library share terminal unicode widget
248,dejagnu,工具,服务,allow base development easy expect format framework host integrate make output portable program purpose software standardize target tcl test write
250,desktop-file-utils,工具,其它,application check contain desktop directory file freedesktop gnome http inclusion install manipulate menu optionally org package process specification standard standards utilities validate www
252,device-mapper-multipath,工具,其它,assemble checker contain creation detects device execs fail instruct internal kernel library libs manage manager mapper module multipath package partition path provide removal scan share shared thing tool tools update
253,device-mapper-persistent-data,库,服务,cache check contains data device dump include manage mapper metadata persistent provision provisioning repair restore snapshot target tool tools
255,dialog,库,工具,allow contain create dialog following implement info input install interface like menu message mode question script shell text utility
256,diffstat,工具,服务,base change command commonly compare complex deletion diff display file histogram insertion install large line modification need output patch program provide read statistic summary utility
259,disomaster,工具,库,burning class disc libisoburn library manipulate package provide wrapper
265,dlm,库,服务,application contain lib library need package userland
266,dmidecode,工具,服务,accord analyse asset bios data depend dmi dmidecode expansion hardware include information level list manufacturer memory model module number parallel port reliability report serial slot smbios socket standard status tool typically usage vary version
267,dnf,工具,服务,allow apply automate common comp configuration data download environment file group interface manage manager module package periodically python rpms support systemd unit upgrade user utility
268,dnf-plugins-core,工具,其它,action additionally allow changelog cleanup command compatibility complete config core debug debuginfo define download enhance file implementation install interface layer lock manager package plugin plugins post protect provide python shell shim supply transaction update utils version versions
269,dnssec-trigger,工具,服务,able applet base case change configuration configures create current daemon dialog dnssec dynamic input interaction local need network networkmanager package panel perform performs probe provide resolver result script server state test tool trigger unbound user validate validation window
270,docbook-dtds,库,工具,article book compliant consortium contain definition develop docbook document documentation manual oasis package page sgml syntax technical text type version xml
