idx,name,y_true,y_predict,feature
572,gvfs,工具,服务,access accounts apple application archive archiving backend backends base camera cifs client device file filesystems framework fuse glib gnome gphoto2 image implementation include inside integration media medium mobile module music network online original package phone picture player protocol provide read reading seamless service sftp share support transfer window windows write
574,hardlink,工具,服务,create disk hard instal installation kernel link package reduce space tree
575,harfbuzz,库,工具,contain engine harfbuzz implementation layout library opentype package shape support text
576,hdparm,工具,服务,disk display drive example hard parameter performance power spin tweak useful utility
579,hicolor-icon-theme,工具,其它,basic contains directory file icon need requirement support theme
581,hostname,工具,服务,command display domain host hostname package provide set utility
582,hplip,工具,服务,device driver files function graphical imaging libraries library linux multi need printer printing project provide sane scanner tool
586,httpd,其它,服务,abstract access apache associated authentication backends basic complete contain contains content correct cryptography data directory docs documentation efficient extensible filesystem filter guide html http httpd include information interface layer layout ldap manual modify module org package permission powerful protocol provide reference secure security server session sockets ssl store strong support tls tool tools transform transport user
587,hunspell,库,工具,analyzer character checker complex curses design encoding hunspell interface ispell language library libreoffice like module morphological morphology pipe program rich spell terminal word
711,hwloc,库,服务,11 abstraction application architecture attribute bind cache compat compute contain convenient core display efficiently exploit format gather hardware help hierarchical include information interface library locality logical memory modern multiple node numa offer package portable powerful primarily process processor programming provide share socket software thread time topology unit various version
712,hyphen,库,工具,english high hyphen hyphenation library quality rule text
759,i2c-tools,工具,库,access application chip collection connect contain decode device dumper helper heterogeneous interact level library linux offer package perl probe register script smbus tool write
770,icedtea-web,库,工具,additional base browser component contain deployment documentation implementation java javadocs manage openjdk originally package plug plugin project provide setting settings start tool web
772,icu,库,服务,character components compute current customize develop environment extend featured flexibility great heterogeneous important international libraries library need offer performance platform portability produce provide repertoire result robust sacrifice service software standard supplementary supplied support tools unicode utility variety various version wide
773,iio-sensor-proxy,工具,服务,device input proxy sensor
776,imlib2,工具,库,apps arbitrary architecture capable complete condition contain easily fast file flexible gplv2 highly image intelligent late libid3tag library link load loader loading make manipulation modular naive operation option package parse plugin program render rendering rewrite sacrifice save separately series simple speed subject support version write
777,imsettings,工具,其它,application apply change cinnamon configuration contain core daemon dbus deliver delivery desktop effect framework general gnome gsettings immediately input libraries library method module need package require restart service setting shared support utility work xsettings
778,iniparser,工具,库,ansi application configuration file hold information ini library parse style
779,initial-setup,工具,其它,allow configuration contain easy graphical gui guide initial installation interface machine package series setup step user utility
781,intel-cmt-cat,工具,服务,access allocation association bandwidth basic cache class code command configure data execute file interface level line linux logical manage mask measure memory model monitoring obtain package privilege provide provides read register require root service software space specific standard support technology thread user virtual write
784,ipcalc,工具,服务,address calculate calculator check depending format generate host human information network option parse private provide random readable resolve script simple specify suitable validity
785,ipmitool,工具,服务,capture chassis command communicate communication configuration contain content control daemon data define device display driver enabled encrypted event exchange field functionality given health host hostname info information intelligent interface interfacing inventory ipmi kernel listen machine management message open openipmi package pass platform power print protocol provide read reading remote repository send sensor serial specification standard support syslog unit utility value
786,iproute,库,服务,action advanced capability class configuration configure contain control design device example filter iproute kernel linux manage network networking package queue routing standard tool traffic utility
788,ipset,工具,服务,active address administer base benefit collection complex contain currently default depending dynamically ensure entry express framework functionality inside iptables kernel library linux manage match multiple number package penalty performance port proper provide rule service shared single speed split store tcp tool type udp update utility version want
792,iputils,工具,服务,basic command contain daemon discover host icmp include information ipv6 machine monitor monitoring network node package packets ping protocol queries query receive send series specify target tool traffic utility
795,iscsi-initiator-utils,工具,服务,access binding command configuration contain daemon disk distributed hardware help initiator interact interface internet iscsi libiscsi manage network offload package program protocol provide python python3 require scsi send server userspace utility utils
798,iso-codes,工具,库,code currency format gettext language list package provide sub territory translation
800,istack-commons,库,其它,commons contain package runtime tool
802,iw,工具,服务,base configuration configure currently device driver sell tool utility wireless write
803,jabberpy,库,工具,application base binding code concentrate contain deal develop instant jabber leave libs messaging module parsing programmer protocol py python python3 quality socket
804,jack-audio-connection-kit,库,服务,allow application area audio bus client connect connection design device different effort example execution focus ground latency launcher linux low mean normal number operating operation plugin primarily process professional server share small start suitable synchronous work write
805,jansson,库,服务,data decode document encode json library manipulate parse small write
808,java-1.8.0-openjdk,其它,工具,accessibility allow archive atk audio base based beta bundle class code compatible complete compress connector contain debugger demo demos documentation enables environment feature headless indexer install issue java know library need note openjdk package program really runtime single source src sub support swing tune unless video work wrapper
812,java-atk-wrapper,其它,服务,access affect atk bonobo bridge change communication convert deprecation event implementation java mechanism project replace send swing talk underlie wrapper
813,javapackages-tools,其它,服务,basic content directory filesystem install java layout macro macros package packaging provide script support
819,jboss-logging-tools,其它,工具,annotation contain i18n jboss logging processor
825,jolokia-jvm-agent,服务,其它,agent
826,jose,库,服务,command contain crypto encryption generation implement include json library line object operation package perform provide sign signing stack task tools utility various
827,jq,工具,库,command data dependency ease effort expect filter flexible format friend grep json lightweight like line little mangle play portable processor program runtime short simple slice structure text transform want write zero
832,kabi-dw,工具,库,build change compare detect dump dwarf file information kabi kernel later linux section specific symbol text type
833,kata-containers,工具,服务,advantage build community container containers feel gopkg http implementation io isolation lightweight like machines open perform project provide repository security source standard version virtual work workload
834,kbd,工具,服务,behavior configure console contain data file font helpful include kbd keyboard keymaps legacy linux manage misc note original package screen terminal tool tools virtual
838,kdump-anaconda-addon,工具,其它,addon anaconda configuration kdump
839,keepalived,工具,服务,accord achieve addition availability balance base brick build checker dynamically facility finite framework fundamental health high hook implement independently infrastructure interaction kernel known level linux load low machine maintain manage module monitor pool protocol provide relies robust router server service simple speed state virtual widely
840,kernel,其它,服务,additional allocation allow anymore application apps backports base basic binding block build change come commonly compatibility compile component components constant contain core cross customer debug define device directory documentation driver ebpf enable enforcement enhancement enterprise event external extra feature file filesystems function gather glibc handle hardware header headers heavily impact include information input inspection instal interface kabi kernel language layer libraries library like linux list maintain major management manipulate manipulation match mean memory meta modify module monitoring need numerous operating option output package perf performance permit plugin process program programming provide pull python python3 rebuild release scheduler security simple source specify stable standard structure support symbol test tool tools update upstream userspace variant version write
843,keycloak-httpd-client-install,工具,服务,apache authentication automate client configure contain httpd identity invoke library module package perform program provider rest server simplify support tool tools utilize variety
844,keyutils,工具,服务,control facility instantiate kernel library linux management mechanism package provide space user utilities utility wrapper
897,kmod,工具,服务,application automatic device driver example filesystems handle kernel later libraries library libs linux load loaded loading management module need package program provide runtime unload utility various wish
898,kmod-kvdo,库,服务,block compression data deduplication deliver device kernel level mapper module modules optimizer package provide provisioning target virtual
899,kpatch,工具,服务,allow automatically binary collection correspond dnf dynamic dynamically enable kernel live manage manager module package patch plugin reboot subscribe subscription update user
900,krb5,服务,工具,admin administrative allow authentication basic center certificate client consider contain credential data directory distribution initial instal install interface kerberos kinit krb5 ldap library libs module need network non object obtain package people plugin private program realm related server share shared stable storage store wish word workstation
901,kronosnet,库,服务,abstraction application availability case core design fail fast fault high https implement implementation information layer library network org protocol redundancy refer requirement security switch tolerance
902,ksc,工具,服务,checker code kernel module source symbol usage
903,kscreenlocker,库,其它,architecture component library lock screen secure
905,kyotocabinet,库,工具,application cabinet client essential interface libraries library libs package program provide shared
909,lasso,库,服务,alliance allow base binding cycle handle implement include language library life multiple provide saml sign single specification standard
912,ldns,库,工具,allow create define dns dnssec high instance level library low operation packet program programmer sign simplify support
913,ledmon,库,服务,activity application associate control design drive enclosure fail locate privilege root slot space status type user utilities
917,libEMF,库,工具,device driver enhanced generate gnuplot grace graphic graphics implement intend interface library limited natively program subset support
918,libICE,库,工具,client exchange inter library org runtime
919,libSM,库,工具,library management org runtime session
920,libX11,库,工具,client common core data interoperability library libxcb protocol
921,libXNVCtrl,库,工具,application communicate contain control driver include library nvidia package proprietary provide settings tool xorg
922,libXScrnSaver,库,工具,library org runtime
923,libXau,库,服务,access authorization block client connection cookie core data display exist hook individual know library magic mechanism protocol provide restrict sample server setup simple specific specify window
924,libXaw,库,工具,athena base library toolkit widget
925,libXcomposite,库,工具,composite extension library
926,libXcursor,库,工具,automatically best common cursor design exist file help library load locate management memory names pick simple size standard
927,libXdamage,库,工具,damage extension library org runtime
928,libXdmcp,库,工具,control display library manager protocol
929,libXext,库,工具,library org runtime
930,libXfixes,库,工具,fixes library
931,libXfont2,库,工具,library org runtime
932,libXft,库,工具,library org runtime
933,libXi,库,工具,library org runtime
934,libXinerama,库,工具,library org runtime
935,libXmu,库,工具,library org runtime
936,libXp,库,工具,library org runtime
937,libXpm,库,工具,library org runtime
938,libXrandr,库,工具,library org runtime
939,libXrender,库,工具,library org runtime
940,libXres,库,工具,allow client extension library query resource server usage various
941,libXt,库,工具,library org runtime
942,libXtst,库,工具,library org runtime
943,libXv,库,工具,library org runtime
944,libXvMC,库,工具,library org runtime
945,libXxf86dga,库,工具,library org runtime
946,libXxf86misc,库,工具,library org runtime
947,libXxf86vm,库,工具,library org runtime
948,libabw,库,工具,file import library
949,libaio,库,服务,accelerated access application async asynchronous capability facility kernel library linux native order posix provide require rich simple
950,libao,库,服务,audio cross currently irix library output platform solaris support
951,libappindicator,库,工具,allow application available based contain export fallback generic indicator library menu package support version work
953,libarchive,库,工具,archive cdrom contain cpio create different format handle image include iso9660 library manipulate package popular program read regular shar split standalone stream tape utility variant write
955,libassuan,库,工具,gnupg gpgme library package
956,libasyncns,库,服务,asynchronous easy function getaddrinfo implement libc library lightweight relate service small wrapper
957,libatasmart,库,服务,disk hard health library lightweight monitoring parser small
958,libatomic_ops,库,服务,allow architecture atomic barrier code consider construction direct early explicitly implementation involve memory minimum number operation overhead package portable provides reasonably semantics similar unlike update variety
961,libblockdev,库,服务,binding block btrfs configuration contain core create crypto dbus dependency device encrypt enhancement file function functionality gobject information introspection kernel level library like loop low luks manipulation mapper meta multipath nvdimm operation package partition partitioning perspective plugin plugins principle provide providing pull python3 raid relate related serve standalone storage support swap time utility utilize utils wrapper
962,libbpf,库,服务,bpf directory file header lib library linux mirror package plus reflect support tools tree version
965,libcacard,库,服务,access card certificate common compatible container emulation guest implement library machine provide read reader separate smart standard virtual
966,libcanberra,库,服务,0pointer binding bindings event gtk html http implementation libcanberra library lightweight portable public small sound spec specification theme
967,libcap,库,工具,capability draft libcap library posix
968,libcap-ng,库,工具,alternate analyze application base binding capability contain easier file libcap library make ng package posix program python3 utilities utils
969,libcdio,库,工具,access application cd control device independent input interface library need provide rom
971,libcdr,库,工具,ability application coreldraw drawing import interpret library libreoffice provide various
972,libcgroup,库,服务,administrate administrator allow associated authentication classify command configured contain control controller daemon group help infrastructure library line linux login manipulate module monitor package pam pluggable pre process program service user utility
973,libchardet,库,其它,character charset data detect detector encode interface mozilla provide universal
974,libcmis,库,工具,allow application client connect content drive example google interface library management open primary server source support work
975,libcomps,库,工具,binding comp content file library like manipulation modification python python3 read structure supports write
976,libconfig,库,服务,application aware code compact configuration file format library manipulate necessary parse readable simple string structure type unlike
977,libcroco,库,服务,css2 gnome library manipulation parsing
978,libdaemon,库,服务,compatible consist correct daemon ease file following fork library lightweight output pipe poll procedure process redirect select serialize signal simpler stderr stdout syslog unix usage wrapper write writing
980,libdazzle,库,工具,applications builder collection development drive experimental fancy feature generic glib ground gtk inside library project prototype prove quite ready tend widget
981,libdb,库,工具,access apis application berkeley caching client command database databases embedded extended fixed hashing include instal java length library line linear lock manage memory method perl programmatic provide python record recovery server share support tool toolkit traditional transaction tree variable
982,libdbusmenu,库,其它,build dbus design development easy file gtk gtk3 library make menu pass shared sharing simple small structure version work
984,libdmapsharing,库,服务,client implement include library protocol server support
985,libdmx,库,工具,distributed library multihead org runtime
987,libdrm,库,工具,direct library manager rendering runtime
992,libeasyfc,库,服务,configuration contain demand easy fontconfig generate generator gobject interface package provide
993,libecpg,库,工具,basic build calculation case code command compiler consist convert database embedded equivalent function help language library mixed offer ordinary pass postgresql preprocessor process program programming section server source specially type write
994,libedit,库,工具,editing editline function generic history library line port provide readline similar
995,libepoxy,库,工具,function handle library management opengl pointer runtime
996,libepubgen,库,工具,base directly document epub filter generate generator import library librevenge pluggable
999,libestr,库,服务,compile daemon essential handle handling library package rsyslog string
1001,libev,库,服务,code contain correct event faster feature featureful good high libevent loop loosely model module package performance perl scale small source
1002,libevdev,库,服务,device evdev interact kernel library proper provide wrap wrapper
1003,libevent,库,工具,abstract application asynchronous callback change descriptor drive dynamically event execute file function libevent library loop mean mechanism need network notification occur provide reach remove replace server specific timeout
1004,libexif,库,工具,allow camera contain data digital exif extra extract file image information jpeg library parse produce read
1005,libexttextcat,库,工具,based gram guessing intend language library primarily text
1006,libfabric,库,服务,application best collection communication component conjunction core daemon deal define directly export fabric focus framework integrate interface interfaces kernel libfabric library open openfabrics provider service software space test typically user work
1007,libfastjson,库,服务,allow construct count easily format implement implementation json model object output parse reference representation string
1009,libffi,库,工具,allow argument assumption bridge certain code compilation compile compiler convention conversion dependent description entry exist feature follow foreign fully function generate handle high instance interface interpreter know language layer level library machine make necessary number pass popular portable program programmer provide really return run separate specify stand tell time type value various work write
1010,libfontenc,库,工具,library org runtime
1013,libfprint,库,服务,consumer device fingerprint offer reader scanner support toolkit
1014,libfreehand,库,工具,ability adobe application document freehand import interpret library provide various
1015,libgcrypt,库,服务,base code crypto cryptography development general libgcrypt library privacy purpose version
1016,libgdata,库,服务,access apis asynchronous based common glib google library notably online protocol provide service support
1017,libgdither,库,服务,apply audio carry conversion data dither float library perform preserve process quality reduce sample source width
1019,libgexiv2,库,服务,application available based basic exiv2 feature gnome gobject library make wrapper
1020,libgit2,库,工具,allow application binding core custom implementation language libgit2 library linkable method native portable provide pure solid speed write
1022,libglvnd,库,其它,basis common dispatch implementation interface layer libegl libgl library multiple neutral opengl screen support vendor workstation
1023,libgnomekbd,库,工具,configuration contain gnome keyboard library manage offer package relate various widget
1025,libgpg-error,库,服务,agent common component daemon define error future gnupg gpgme libgcrypt library pinentry possibly smartcard value
1026,libgphoto2,库,服务,access application camera digital example frontends gphoto2 library oppose various
1028,libgsf,库,服务,file gnome library reading structure structured write
1029,libgtop2,库,服务,information library memory obtain portably process usage version
1030,libgudev,库,服务,based easily gobject introspection javascript language library libudev make possible program simpler support wrapper
1031,libguestfs,其它,工具,able access additional administration administrator alignment allocate alternative appliance application archive avoid backup bash basic batch binding blank block build builder capable change clone code collection com command compatible completion configuration contain contains content convert copy core customize debug depend dependency deprecated determine devel develop developer device diff difference different directly directory disk display documentation download driver edit editor element enhanced enterprise erase examine exist ext2 extract feature file filesystem filesystems follow format free fully fuse gfs2 global gobject guest guestfish header host hostname http hypervisors icon icons image include info initrd inside inspect instal install intelligent interactive introspection ja japanese java javadoc kernel language libguestfs library like limited line linux list log look ls machine make man metapackage migrate miscellaneous modify mount need network non note ntfs ocaml openstack operate org p2v package page pages para partition perform perl physical popular preparation problem process program provide pull python python3 qemu rapidly really reason redhat reduce reg registry replace replacement require rescue reset resize rsync ruby safe scan scheme scratch script secure separate shell software space sparse split statistic subpackages subset support sys tab tail tool tools type uk ukrainian unlike upload used utility uuid v2v various version virt virtual virtualized want win windows work write xfs
1032,libgusb,库,服务,asynchronous bulk cancellation control easy glib gobject integration interrupt mainloop make proper transfer wrapper
1033,libgweather,库,服务,access information library location numerous online service weather
1035,libgxps,库,工具,base document gobject handle library render
1036,libhangul,库,工具,common feature hangul input libhangul library method program provide
1037,libhbaapi,库,服务,adapters channel fibre hbaapi host level library manage project snia
1038,libhbalinux,库,服务,build hbaapi implementation interface library snia vendor
