name,label,predict,summary,description
plexus-languages,库,服务, Plexus Languages," Plexus Languages is a set of Plexus components that maintain shared
language features."
perl-Digest,库,服务, Modules that calculate message digests," The Digest:: modules calculate digests, also called ""fingerprints"" or
""hashes"", of some data, called a message. The digest is (usually) some
small/fixed size string. The actual size of the digest depends of the
algorithm used. The message is simply a sequence of arbitrary bytes or bits."
libinput-utils,库,工具, Utilities and tools for debugging libinput," The libinput-utils package contains tools to debug hardware and analyze
libinput."
python3-sphinx-theme-alabaster,库,服务, Configurable sidebar-enabled Sphinx theme," This theme is a modified ""Kr"" Sphinx theme from @kennethreitz (especially as
used in his Requests project), which was itself originally based on @mitsuhiko's
theme used for Flask & related projects."
poppler-glib,库,服务, Glib wrapper for poppler, Glib wrapper for poppler.
libreport-rhel,库,服务, Default configuration for reporting bugs via Red Hat infrastructure," Default configuration for reporting bugs via Red Hat infrastructure
used to easily configure the reporting process for Red Hat systems. Just
install this package and you're done."
httpcomponents-client,库,服务, HTTP agent implementation based on httpcomponents HttpCore," HttpClient is a HTTP/1.1 compliant HTTP agent implementation based on
httpcomponents HttpCore. It also provides reusable components for
client-side authentication, HTTP state management, and HTTP connection
management. HttpComponents Client is a successor of and replacement
for Commons HttpClient 3.x. Users of Commons HttpClient are strongly
encouraged to upgrade."
php-pecl-xdebug3,库,工具, Provides functions for function traces and profiling," The Xdebug extension helps you debugging your script by providing a lot of
valuable debug information. The debug information that Xdebug can provide
includes the following:

* stack and function traces in error messages with:
  o full parameter display for user defined functions
  o function name, file name and line indications
  o support for member functions
* memory allocation
* protection for infinite recursions

Xdebug also provides:

* profiling information for PHP scripts
* code coverage analysis
* capabilities to debug your scripts interactively with a debug client

Documentation: https://xdebug.org/docs/"
libotf,库,其它, A Library for handling OpenType Font," The library ""libotf"" provides the following facilites.
Read Open Type Layout Tables from OTF file. Currently these tables are
supported; head, name, cmap, GDEF, GSUB, and GPOS.  Convert a Unicode
character sequence to a glyph code sequence by using the above tables.
The combination of libotf and the FreeType library (Ver.2) realizes
CTL (complex text layout) by OpenType fonts. This library is currently
used by the m17n library. It seems that the probject Free Type Layout
provides the similar (or better) facility as this library, but
currently they have not yet released their library. So, we have
developed this one."
nghttp2,库,服务," Experimental HTTP/2 client, server and proxy"," This package contains the HTTP/2 client, server and proxy programs."
libmbim-utils,库,工具,Utilities to use the MBIM protocol from the command line ,"This package contains the utilities that make it easier to use MBIM
functionality from the command line. "
prometheus-jmx-exporter,库,服务, Prometheus JMX Exporter," JMX to Prometheus exporter: a collector that can be configured to scrape
and expose MBeans of a JMX target. This exporter is intended to be run as
a Java Agent, exposing a HTTP server and serving metrics of the local JVM."
libreoffice-wiki-publisher,库,服务, Create Wiki articles on MediaWiki servers with LibreOffice," The Wiki Publisher enables you to create Wiki articles on MediaWiki servers
without having to know the syntax of the MediaWiki markup language. Publish
your new and existing documents transparently with writer to a wiki page."
libnetfilter_cttimeout,库,服务, Timeout policy tuning for Netfilter/conntrack," This infrastructure allows you to define fine-grain timeout
policies per flow. Basically, from user-space, you can create
timeout policy objects via nfct_timeout_alloc(), set the
policy attributes, via nfct_timeout_*_attr_set(), and then
build the ctnetlink message to communicate this new timeout
policy to the kernel."
jboss-logging-tools,库,服务, JBoss Logging I18n Annotation Processor, This pacakge contains JBoss Logging I18n Annotation Processor
jss,库,服务, Java Security Services (JSS)," Java Security Services (JSS) is a java native interface which provides a bridge
for java-based applications to use native Network Security Services (NSS).
This only works with gcj. Other JREs require that JCE providers be signed."
tcl,库,工具," Tool Command Language, pronounced tickle"," The Tcl (Tool Command Language) provides a powerful platform for
creating integration applications that tie together diverse
applications, protocols, devices, and frameworks. When paired with the
Tk toolkit, Tcl provides a fastest and powerful way to create
cross-platform GUI applications.  Tcl can also be used for a variety
of web-related tasks and for creating powerful command languages for
applications."
libknet1-plugins-all,库,服务, Libknet1 plugins meta package, meta package to install all of libknet1 plugins
easymock,库,服务, Easy mock objects," EasyMock provides Mock Objects for interfaces in JUnit tests by generating
them on the fly using Java's proxy mechanism. Due to EasyMock's unique style
of recording expectations, most refactorings will not affect the Mock Objects.
So EasyMock is a perfect fit for Test-Driven Development."
python3-mod_wsgi,库,工具, A WSGI interface for Python web applications in Apache," The mod_wsgi adapter is an Apache module that provides a WSGI compliant
interface for hosting Python based web applications within Apache. The
adapter is written completely in C code against the Apache C runtime and
for hosting WSGI applications within Apache has a lower overhead than using
existing WSGI adapters for mod_python or CGI."
CUnit,库,服务, Unit testing framework for C," CUnit is a lightweight system for writing, administering,
and running unit tests in C.  It provides C programmers a basic
testing functionality with a flexible variety of user interfaces."
java-17-openjdk-jmods,库,服务, JMods for OpenJDK 17, The JMods for OpenJDK 17.
python38-pip-wheel,库,工具, The pip wheel, A Python wheel of pip to use with venv.
libss,库,工具, Command line interface parsing library," This is libss, a command line interface parsing library, part of e2fsprogs.

This package includes a tool that parses a command table to generate
a simple command-line interface parser, the include files needed to
compile and use it.

It was originally inspired by the Multics SubSystem library."
perl-Net-SMTP-SSL,库,服务, SSL support for Net::SMTP," Implements the same API as Net::SMTP, but uses IO::Socket::SSL for its
network operations."
perl-Encode-Locale,库,工具, Determine the locale encoding," In many applications it's wise to let Perl use Unicode for the strings
it processes.  Most of the interfaces Perl has to the outside world is
still byte based.  Programs therefore needs to decode byte strings
that enter the program from the outside and encode them again on the
way out."
mod_fcgid,库,服务, FastCGI interface module for Apache 2," mod_fcgid is a binary-compatible alternative to the Apache module mod_fastcgi.
mod_fcgid has a new process management strategy, which concentrates on reducing
the number of fastcgi servers, and kicking out corrupt fastcgi servers as soon
as possible."
boost-jam,库,工具, A low-level build tool," Boost.Jam (BJam) is the low-level build engine tool for Boost.Build.
Historically, Boost.Jam is based on on FTJam and on Perforce Jam but has grown
a number of significant features and is now developed independently."
python3-azure-sdk,库,服务, Microsoft Azure SDK for Python," This project provides a set of Python packages that make it easy to access
Management (Virtual Machines, ...) or Runtime (ServiceBus using HTTP, Batch,
Monitor) components of Microsoft Azure Complete feature list of this repo and
where to find Python packages not in this repo can be found on our Azure SDK for
Python documentation."
perl-Math-BigRat,库,服务, Arbitrary big rational numbers," Math::BigRat complements Math::BigInt and Math::BigFloat by providing
support for arbitrary big rational numbers."
perl-PadWalker,库,服务, Play with other people's lexical variables," PadWalker is a module that allows you to inspect (and even change!)
lexical variables in any subroutine that called you. It will only show
those variables that are in scope at the point of the call."
opencryptoki-swtok,库,服务,The software token implementation for opencryptoki ,"Opencryptoki implements the PKCS#11 specification v2.20 for a set of
cryptographic hardware, such as IBM 4764 and 4765 crypto cards, and the
Trusted Platform Module (TPM) chip. Opencryptoki also brings a software
token implementation that can be used without any cryptographic
hardware.
This package brings the software token implementation to use opencryptoki
without any specific cryptographic hardware. "
color-filesystem,库,服务, Color filesystem layout, This package provides some directories that are required/used to store color.
mingw64-headers,库,服务, MinGW Windows cross-compiler Win64 header files, MinGW Windows cross-compiler Win64 header files.
Xaw3d,库,服务, A version of the MIT Athena widget set for X," Xaw3d is an enhanced version of the MIT Athena Widget set for
the X Window System.  Xaw3d adds a three-dimensional look to applications
with minimal or no source code changes.

You should install Xaw3d if you are using applications which incorporate
the MIT Athena widget set and you'd like to incorporate a 3D look into
those applications."
pandoc-common,库,工具, Pandoc data files, This package contains the common data files used by pandoc.
qt5-qttranslations,库,服务, Qt5 - QtTranslations module, Qt5 - QtTranslations module.
maven-monitor,库,服务, Compatibility Maven monitor artifact, Maven monitor artifact
perl-PerlIO-utf8_strict,库,服务, Fast and correct UTF-8 I/O," This module provides a fast and correct UTF-8 PerlIO layer. Unlike perl's
default :utf8 layer it checks the input for correctness."
jakarta-commons-httpclient,库,服务, Jakarta Commons HTTPClient implements the client side of HTTP standards," The Hyper-Text Transfer Protocol (HTTP) is perhaps the most significant
protocol used on the Internet today. Web services, network-enabled
appliances and the growth of network computing continue to expand the
role of the HTTP protocol beyond user-driven web browsers, and increase
the number of applications that may require HTTP support.
Although the java.net package provides basic support for accessing
resources via HTTP, it doesn't provide the full flexibility or
functionality needed by many applications. The Jakarta Commons HTTP
Client component seeks to fill this void by providing an efficient,
up-to-date, and feature-rich package implementing the client side of the
most recent HTTP standards and recommendations.
Designed for extension while providing robust support for the base HTTP
protocol, the HTTP Client component may be of interest to anyone
building HTTP-aware client applications such as web browsers, web
service clients, or systems that leverage or extend the HTTP protocol
for distributed communication."
flute,库,服务, Java CSS parser using SAC," A Cascading Style Sheets parser using the Simple API for CSS, for Java."
golang-src,库,服务, Golang compiler source tree, Golang compiler source tree
glassfish-jaxb-core,库,服务, JAXB Core," JAXB Core module. Contains sources required by XJC, JXC and Runtime
modules."
perl-Algorithm-Diff,库,服务,Compute `intelligent' differences between two files/lists ,"This is a module for computing the difference between two files, two strings,
or any other two lists of things. It uses an intelligent algorithm similar to
(or identical to) the one used by the Unix ""diff"" program. It is guaranteed to
find the *smallest possible* set of differences. "
libbasicobjects,库,服务, Basic object types for C, Basic object types
python3-linux-procfs,库,服务, Linux /proc abstraction classes, Abstractions to extract information from the Linux kernel /proc files.
plexus-compiler-extras,库,服务, Extra compiler support for plexus-compiler," Additional support for csharp, eclipse and jikes compilers"
google-guice,库,服务, Lightweight dependency injection framework for Java 5 and above," Put simply, Guice alleviates the need for factories and the use of new
in your Java code. Think of Guice's @Inject as the new new. You will
still need to write factories in some cases, but your code will not
depend directly on them. Your code will be easier to change, unit test
and reuse in other contexts.

Guice embraces Java's type safe nature, especially when it comes to
features introduced in Java 5 such as generics and annotations. You
might think of Guice as filling in missing features for core
Java. Ideally, the language itself would provide most of the same
features, but until such a language comes along, we have Guice.

Guice helps you design better APIs, and the Guice API itself sets a
good example. Guice is not a kitchen sink. We justify each feature
with at least three use cases. When in doubt, we leave it out. We
build general functionality which enables you to extend Guice rather
than adding every feature to the core framework."
postgresql-jdbc,库,服务, JDBC driver for PostgreSQL," PostgreSQL is an advanced Object-Relational database management
system. The postgresql-jdbc package includes the .jar files needed for
Java programs to access a PostgreSQL database."
mythes-da,库,服务, Danish thesaurus, Danish thesaurus.
cups-filters,库,服务, OpenPrinting CUPS filters and backends," Contains backends, filters, and other software that was
once part of the core CUPS distribution but is no longer maintained by
Apple Inc. In addition it contains additional filters developed
independently of Apple, especially filters for the PDF-centric printing
workflow introduced by OpenPrinting."
php-dba,库,服务, A database abstraction layer module for PHP applications," The php-dba package contains a dynamic shared object that will add
support for using the DBA database abstraction layer to PHP."
dialog,库,工具, A utility for creating TTY dialog boxes," Dialog is a utility that allows you to show dialog boxes (containing
questions or messages) in TTY (text mode) interfaces.  Dialog is called
from within a shell script.  The following dialog boxes are implemented:
yes/no, menu, input, message, text, info, checklist, radiolist, and
gauge.

Install dialog if you would like to create TTY dialog boxes."
jctools,库,工具, Java Concurrency Tools for the JVM," This project aims to offer some concurrent data structures
currently missing from the JDK:

掳 SPSC/MPSC/SPMC/MPMC Bounded lock free queues
掳 SPSC/MPSC Unbounded lock free queues
掳 Alternative interfaces for queues
掳 Offheap concurrent ring buffer for ITC/IPC purposes
掳 Single Writer Map/Set implementations
掳 Low contention stats counters
掳 Executor"
icedtea-web,库,服务, Additional Java components for OpenJDK - Java browser plug-in and Web Start implementation," The IcedTea-Web project provides a an implementation of Java Web Start
(originally based on the Netx project) and a settings tool to
manage deployment settings for the aforementioned plugin and Web Start
implementations."
mythes-nl,库,服务, Dutch thesaurus, Dutch thesaurus.
python3-ptyprocess,库,服务, Run a subprocess in a pseudo terminal," Launch a subprocess in a pseudo terminal (pty), and interact with both the
process and its pty."
slf4j,库,服务, Simple Logging Facade for Java," The Simple Logging Facade for Java or (SLF4J) is intended to serve
as a simple facade for various logging APIs allowing to the end-user
to plug in the desired implementation at deployment time. SLF4J also
allows for a gradual migration path away from
Jakarta Commons Logging (JCL).

Logging API implementations can either choose to implement the
SLF4J interfaces directly, e.g. NLOG4J or SimpleLogger. Alternatively,
it is possible (and rather easy) to write SLF4J adapters for the given
API implementation, e.g. Log4jLoggerAdapter or JDK14LoggerAdapter.."
plexus-classworlds,库,服务, Plexus Classworlds Classloader Framework," Classworlds is a framework for container developers
who require complex manipulation of Java's ClassLoaders.
Java's native ClassLoader mechanisms and classes can cause
much headache and confusion for certain types of
application developers. Projects which involve dynamic
loading of components or otherwise represent a 'container'
can benefit from the classloading control provided by
classworlds."
perl-blib,库,工具, Use uninstalled version of a package," This module looks for MakeMaker-like ""blib"" directory structure starting in
given or current directory and working back up to five levels of directories.
It is intended for use on command line with -M option as a way of testing
arbitrary scripts against an uninstalled version of a package."
xalan-j2-xsltc,库,工具, XSLT compiler," The XSLT Compiler is a Java-based tool for compiling XSLT stylesheets into
lightweight and portable Java byte codes called translets."
liboggz,库,工具, Simple programming interface for Ogg files and streams," Oggz provides a simple programming interface for reading and writing
Ogg files and streams. Ogg is an interleaving data container developed
by Monty at Xiph.Org, originally to support the Ogg Vorbis audio
format."
dotnet-templates-3.0,库,工具, .NET Core 3.0 templates," This package contains templates used by the .NET Core SDK.

ASP.NET Core is a fast, lightweight and modular platform for creating
cross platform web applications that work on Linux, Mac and Windows.

It particularly focuses on creating console applications, web
applications and micro-services."
jetty-util,库,服务, util module for Jetty," 
Jetty is a 100% Java HTTP Server and Servlet Container. This means that you
do not need to configure and run a separate web server (like Apache) in order
to use Java, servlets and JSPs to generate dynamic content. Jetty is a fully
featured web server for static and dynamic content. Unlike separate
server/container solutions, this means that your web server and web
application run in the same process, without interconnection overheads
and complications. Furthermore, as a pure java component, Jetty can be simply
included in your application for demonstration, distribution or deployment.
Jetty is available on all Java supported platforms.

This package contains util module for Jetty."
dotnet-hostfxr-5.0,库,工具, .NET command line host resolver," The .NET host resolver contains the logic to resolve and select
the right version of the .NET SDK or runtime to use.

.NET is a fast, lightweight and modular platform for creating
cross platform applications that work on Linux, Mac and Windows.

It particularly focuses on creating console applications, web
applications and micro-services."
tagsoup,库,工具, A SAX-compliant HTML parser written in Java," TagSoup is a SAX-compliant parser written in Java that, instead of
parsing well-formed or valid XML, parses HTML as it is found in the wild: nasty
and brutish, though quite often far from short. TagSoup is designed for people
who have to process this stuff using some semblance of a rational application
design. By providing a SAX interface, it allows standard XML tools to be
applied to even the worst HTML."
marisa,库,工具, Static and spece-efficient trie data structure library," Matching Algorithm with Recursively Implemented StorAge (MARISA) is a
static and space-efficient trie data structure. And libmarisa is a C++
library to provide an implementation of MARISA. Also, the package of
libmarisa contains a set of command line tools for building and
operating a MARISA-based dictionary.

A MARISA-based dictionary supports not only lookup but also reverse
lookup, common prefix search and predictive search."
php-pecl-rrd,库,工具, PHP Bindings for rrdtool," Procedural and simple OO wrapper for rrdtool - data logging and graphing
system for time series data."
python3-setuptools-wheel,库,工具, The setuptools wheel, A Python wheel of setuptools to use with venv.
perl-Unicode-Normalize,库,服务, Unicode Normalization Forms," This package provides Perl functions that can convert strings into various
Unicode normalization forms as defined in Unicode Standard Annex #15."
ocaml-libguestfs,库,工具, OCaml bindings for libguestfs," ocaml-libguestfs contains OCaml bindings for libguestfs.

This is for toplevel and scripting access only.  To compile OCaml
programs which use libguestfs you will also need ocaml-libguestfs-devel."
turbojpeg,库,工具, TurboJPEG library, The turbojpeg package contains the TurboJPEG shared library.
mythes-ca,库,服务, Catalan thesaurus, Catalan thesaurus.
perl-Text-WrapI18N,库,工具, Line wrapping with support for several locale setups," This is a module which intends to substitute Text::Wrap,
which supports internationalized texts including:
 - multi-byte encodings such as UTF-8, EUC-JP, EUC-KR, GB2312, and Big5,
 - full width characters like east Asian characters which appear in
   UTF-8, EUC-JP, EUC-KR, GB2312, Big5, and so on,
 - combining characters like diacritical marks which appear in UTF-8,
   ISO-8859-11 (aka TIS-620), and so on, and
 - languages which don't use white spaces between words, like Chinese
   and Japanese."
rubygem-minitest,库,服务, Minitest provides a complete suite of testing facilities," minitest/unit is a small and incredibly fast unit testing framework.

minitest/spec is a functionally complete spec engine.

minitest/benchmark is an awesome way to assert the performance of your
algorithms in a repeatable manner.

minitest/mock by Steven Baker, is a beautifully tiny mock object
framework.

minitest/pride shows pride in testing and adds coloring to your test
output."
maven-shared-incremental-javadoc,库,工具, API documentation for maven-shared-incremental, This package provides API documentation for maven-shared-incremental.
perl-Net,库,服务, By-name interface to Perl built-in network resolver," This package provide object-oriented interface to Perl built-in gethost*(),
getnet*(), getproto*(), and getserv*() functions."
fence-virtd-cpg,库,服务, CPG/libvirt backend for fence-virtd," Provides fence_virtd with a connection to libvirt to fence
virtual machines. Uses corosync CPG to keep track of VM
locations to allow for non-local VMs to be fenced when VMs
are located on corosync cluster nodes."
perl-Errno,库,服务, System errno constants," ""Errno"" defines and conditionally exports all the error constants defined in
your system ""errno.h"" include file. It has a single export tag, "":POSIX"",
which will export all POSIX defined error numbers."
gtk3-immodule-xim,库,工具, XIM support for GTK+, The gtk3-immodule-xim package contains XIM support for GTK+ 3.
maven-plugin-build-helper-javadoc,库,工具, API documentation for maven-plugin-build-helper, This package provides API documentation for maven-plugin-build-helper.
perl-File-Path,库,服务, Create or remove directory trees," This module provides a convenient way to create directories of arbitrary
depth and to delete an entire directory subtree from the file system."
gutenprint,库,服务, Printer Drivers Package," Gutenprint is a package of high quality printer drivers for Linux, BSD,
Solaris, IRIX, and other UNIX-alike operating systems.
Gutenprint was formerly called Gimp-Print."
json-c,库,服务, JSON implementation in C," JSON-C implements a reference counting object model that allows you
to easily construct JSON objects in C, output them as JSON formatted
strings and parse JSON formatted strings back into the C representation
of JSON objects.  It aims to conform to RFC 7159."
perl-Tie-Memoize,库,服务, Add data to a hash when needed," This package allows a tied hash to load its values automatically on the first
access, and to use the cached value on the following accesses."
dotnet-host,库,工具, .NET command line launcher," The .NET host is a command line program that runs a standalone
.NET application or launches the SDK.

.NET is a fast, lightweight and modular platform for creating
cross platform applications that work on Linux, Mac and Windows.

It particularly focuses on creating console applications, web
applications and micro-services."
unixODBC,库,服务, A complete ODBC driver manager for Linux," Install unixODBC if you want to access databases through ODBC.
You will also need the mariadb-connector-odbc package if you want to access
a MySQL or MariaDB database, and/or the postgresql-odbc package for PostgreSQL."
platform-python-setuptools,库,工具, Easily build and distribute Python 3 packages," Setuptools is a collection of enhancements to the Python distutils that allow
you to more easily build and distribute Python packages, especially ones that
have dependencies on other packages.

This package also contains the runtime components of setuptools, necessary to
execute the software that requires pkg_resources.py."
