name,label,predict,summary,description
mpich,库,工具, A high-performance implementation of MPI," MPICH is a high-performance and widely portable implementation of the Message
Passing Interface (MPI) standard (MPI-1, MPI-2 and MPI-3). The goals of MPICH
are: (1) to provide an MPI implementation that efficiently supports different
computation and communication platforms including commodity clusters (desktop
systems, shared-memory systems, multicore architectures), high-speed networks
(10 Gigabit Ethernet, InfiniBand, Myrinet, Quadrics) and proprietary high-end
computing systems (Blue Gene, Cray) and (2) to enable cutting-edge research in
MPI through an easy-to-extend modular framework for other derived
implementations.

The mpich binaries in this RPM packages were configured to use the default
process manager (Hydra) using the default device (ch3). The ch3 device
was configured with support for the nemesis channel that allows for
shared-memory and TCP/IP sockets based communication.

This build also include support for using the 'module environment' to select
which MPI implementation to use when multiple implementations are installed.
If you want MPICH support to be automatically loaded, you need to install the
mpich-autoload package."
perl-Try-Tiny,库,服务, Minimal try/catch with proper localization of $@," This module provides bare bones try/catch statements that are designed to
minimize common mistakes with eval blocks, and NOTHING else.

This is unlike TryCatch, which provides a nice syntax and avoids adding
another call stack layer, and supports calling return from the try block to
return from the parent subroutine. These extra features come at a cost of a
few dependencies, namely Devel::Declare and Scope::Upper that are occasionally
problematic, and the additional catch filtering uses Moose type constraints,
which may not be desirable either."
perl-IO-Tty,库,服务, Perl interface to pseudo tty's, IO::Tty and IO::Pty provide an interface to pseudo tty's.
ant-jsch,库,服务, Optional jsch tasks for ant, Optional jsch tasks for ant.
libreport-gtk,库,服务, GTK front-end for libreport, Applications for reporting bugs using libreport backend
redhat-menus,库,服务, Configuration and data files for the desktop menus," This package contains the XML files that describe the menu layout for
GNOME and KDE, and the .desktop files that define the names and icons
of ""subdirectories"" in the menus."
perl-IO-Multiplex,库,服务, Manage IO on many file handles," IO::Multiplex is designed to take the effort out of managing multiple file
handles. It is essentially a really fancy front end to the select system call.
In addition to maintaining the select loop, it buffers all input and output
to/from the file handles. It can also accept incoming connections on one or
more listen sockets."
perl-Date-ISO8601,库,服务, Three ISO 8601 numerical calendars," The international standard ISO 8601 ""Data elements and interchange formats
- Information interchange - Representation of dates and times"" defines
three distinct calendars by which days can be labeled. It also defines
textual formats for the representation of dates in these calendars. This
module provides functions to convert dates between these three calendars
and Chronological Julian Day Numbers, which is a suitable format to do
arithmetic with. It also supplies functions that describe the shape of
these calendars, to assist in calendrical calculations. It also supplies
functions to represent dates textually in the ISO 8601 formats. ISO 8601
also covers time of day and time periods, but this module does nothing
relating to those parts of the standard; this is only about labeling days."
geronimo-jms-javadoc,库,工具, API documentation for geronimo-jms, This package provides API documentation for geronimo-jms.
pmdk-convert,库,工具, Conversion tool for PMDK pools," pmdk-convert is a tool for conversion of PMDK pools from any version
to any consecutive version. Currently only libpmemobj pools require
conversion and this tool supports only those kind of pools."
plexus-i18n,库,服务, Plexus I18N Component," The Plexus project seeks to create end-to-end developer tools for
writing applications. At the core is the container, which can be
embedded or for a full scale application server. There are many
reusable components for hibernate, form processing, jndi, i18n,
velocity, etc. Plexus also includes an application server which
is like a J2EE application server, without all the baggage."
bsdcat,库,工具, Expand files to standard output," The bsdcat program typically takes a filename as an argument or reads standard
input when used in a pipe.  In both cases decompressed data it written to
standard output."
mesa-libGLU,库,服务, Mesa libGLU library, Mesa implementation of the standard GLU OpenGL utility API.
perl-Mail-SPF,库,服务, Object-oriented implementation of Sender Policy Framework," Mail::SPF is an object-oriented implementation of Sender Policy Framework
(SPF). See http://www.openspf.org for more information about SPF."
perl-HTTP-Date,库,服务, Date conversion routines," This module provides functions that deal the date formats used by the HTTP
protocol (and then some more). Only the first two functions, time2str() and
str2time(), are exported by default."
gutenprint-plugin,库,工具, GIMP plug-in for gutenprint, This package contains the gutenprint GIMP plug-in.
python-rpm-macros,库,工具, The unversioned Python RPM macros," This package contains the unversioned Python RPM macros, that most
implementations should rely on.

You should not need to install this package manually as the various
python?-devel packages require it. So install a python-devel package instead."
perl-Carp,库,服务, Alternative warn and die for modules," The Carp routines are useful in your own modules because they act like
die() or warn(), but with a message which is more likely to be useful to a
user of your module. In the case of cluck, confess, and longmess that
context is a summary of every call in the call-stack. For a shorter message
you can use carp or croak which report the error as being from where your
module was called. There is no guarantee that that is where the error was,
but it is a good educated guess."
perl-Mail-Sender,库,服务, Module for sending mails with attachments through an SMTP server, Module for sending mails with attachments through an SMTP server.
libvirt-gconfig,库,服务, libvirt object APIs for processing object configuration," This package provides APIs for processing the object configuration
data"
python3-dbus-signature-pyparsing,库,服务, Parser for a D-Bus Signature," Parser for a D-Bus Signature.

Python 3 version."
edk2-ovmf,库,服务, UEFI firmware for x86_64 virtual machines," OVMF (Open Virtual Machine Firmware) is a project to enable UEFI support for
Virtual Machines. This package contains a sample 64-bit UEFI firmware for QEMU
and KVM."
perl-prefork,库,服务, Optimized module loading for forking or non-forking processes," Optimized module loading for forking or non-forking processes

prefork.pm is intended to serve as a central and optional marshalling
point for state detection (are we running in compile-time or run-time
mode) and to act as a relatively light-weight module loader."
perl-SUPER,库,服务, Sane superclass method dispatcher," When subclassing a class, you occasionally want to dispatch control to the
superclass - at least conditionally and temporarily. This module provides
an easier, cleaner way for class methods to access their ancestor's
implementation."
fstrm,库,服务, Frame Streams implementation in C," Frame Streams is a light weight, binary clean protocol that allows for the
transport of arbitrarily encoded data payload sequences with minimal framing
overhead -- just four bytes per data frame. Frame Streams does not specify
an encoding format for data frames and can be used with any data serialization
format that produces byte sequences, such as Protocol Buffers, XML, JSON,
MessagePack, YAML, etc."
sisu,库,服务, Eclipse dependency injection framework," Java dependency injection framework with backward support for plexus and bean
style dependency injection."
perl-DateTime-TimeZone,库,服务, Time zone object base class and factory," This class is the base class for all time zone objects. A time zone is
represented internally as a set of observances, each of which describes the
offset from GMT for a given time period."
dovecot-pigeonhole,库,服务, Sieve and managesieve plug-in for dovecot, This package provides sieve and managesieve plug-in for dovecot LDA.
bluez-libs,库,服务, Libraries for use in Bluetooth applications, Libraries for use in Bluetooth applications.
icu,库,工具,International Components for Unicode ,Tools and utilities for developing with icu. 
purple-sipe,库,服务, Libpurple protocol plugin to connect to MS Office Communicator," A third-party plugin for the Pidgin multi-protocol instant messenger.
It implements the extended version of SIP/SIMPLE used by various products:

    * Skype for Business
    * Microsoft Office 365
    * Microsoft Business Productivity Online Suite (BPOS)
    * Microsoft Lync Server
    * Microsoft Office Communications Server (OCS 2007/2007 R2)
    * Microsoft Live Communications Server (LCS 2003/2005)

This package provides the protocol plugin for libpurple clients."
fpc-srpm-macros,库,工具, RPM macros needed by packages built with Free Pascal Compiler," This package contains RPM macros needed by packages built with the
Free Pascal Compiler. For example, it makes available a macro that
lists all architectures where fpc is available."
dotnet-sdk-2.1.5xx,库,工具, .NET Core 2.1.5xx Software Development Kit," The .NET Core SDK is a collection of command line applications to
create, build, publish and run .NET Core applications.

.NET Core is a fast, lightweight and modular platform for creating
cross platform applications that work on Linux, Mac and Windows.

It particularly focuses on creating console applications, web
applications and micro-services."
mythes-ru,库,服务, Russian thesaurus, Russian thesaurus.
ant-jdepend,库,服务, Optional jdepend tasks for ant, Optional jdepend tasks for ant.
golang-docs,库,服务, Golang compiler docs, Golang compiler docs.
perl-Test-Pod-Coverage,库,服务, Check for pod coverage in your distribution," Test::Pod::Coverage is used to create a test for your distribution, to
ensure that all relevant files in your distribution are appropriately
documented in pod."
qgpgme,库,服务, Qt API bindings/wrapper for GPGME, Qt API bindings/wrapper for GPGME.
lz4-libs,库,工具, Libaries for lz4, This package contains the libaries for lz4.
gstreamer1-plugins-good-gtk,库,服务," GStreamer ""good"" plugins gtk plugin"," GStreamer is a streaming media framework, based on graphs of elements which
operate on media data.

GStreamer Good Plugins is a collection of well-supported plugins of
good quality and under the LGPL license.

This package (gstreamer1-plugins-good-gtk) contains the gtksink output plugin."
rust-toolset,库,工具, Package that installs rust-toolset, This is the main package for rust-toolset.
libchardet,库,服务, Mozilla's universal character set detector," libchardet provides an interface to Mozilla's universal charset detector,
which detects the charset used to encode data."
qt5-qtsvg,库,工具, Qt5 - Support for rendering and displaying SVG," Scalable Vector Graphics (SVG) is an XML-based language for describing
two-dimensional vector graphics. Qt provides classes for rendering and
displaying SVG drawings in widgets and on other paint devices."
perl-Test-Differences,库,工具, Test strings and data structures and show differences if not OK," When the code you're testing returns multiple lines, records or data
structures and they're just plain wrong, an equivalent to the Unix
diff utility may be just what's needed."
sssd-ad,库,服务, The AD back end of the SSSD," Provides the Active Directory back end that the SSSD can utilize to fetch
identity data from and authenticate against an Active Directory server."
libssh-config,库,服务, Configuration files for libssh, The libssh-config package provides the default configuration files for libssh.
dovecot-pgsql,库,服务, Postgres SQL back end for dovecot, This package provides the Postgres SQL back end for dovecot-auth etc.
atlas,库,服务,Automatically Tuned Linear Algebra Software ,"The ATLAS (Automatically Tuned Linear Algebra Software) project is an
ongoing research effort f(ocusing on applying empirical techniques in
order to provide portable performance. At present, it provides C and
Fortran77 interfaces to a portably efficient BLAS implementation, as
well as a few routines from LAPACK.

The performance improvements in ATLAS are obtained largely via
compile-time optimizations and tend to be specific to a given hardware
configuration. In order to package ATLAS some compromises
are necessary so that good performance can be obtained on a variety
of hardware. This set of ATLAS binary packages is therefore not
necessarily optimal for any specific hardware configuration.  However,
the source package can be used to compile customized ATLAS packages;
see the documentation for information. "
jigawatts,库,服务, Java CRIU helper," CRIU is a Linux utility that allows the checkpointing and restoring
of processes.You can read more about CRIU at criu.org. CRIU for
Java is a package which makes it more convenient to use CRIU from
Java."
libknet1-crypto-plugins-all,库,服务, Libknet1 crypto plugins meta package, meta package to install all of libknet1 crypto plugins
libnbd-bash-completion,库,服务, Bash tab-completion for libnbd," Install this package if you want intelligent bash tab-completion
for libnbd."
xml-commons-apis,库,服务," APIs for DOM, SAX, and JAXP"," xml-commons-apis is designed to organize and have common packaging for
the various externally-defined standard interfaces for XML. This
includes the DOM, SAX, and JAXP."
perl-vars,库,服务, Perl pragma to predeclare global variable names," This pragma will predeclare all the variables whose names are in the
list, allowing you to use them under ""use strict"", and disabling any
typo warnings for them.

For use with variables in the current package for a single scope, the
functionality provided by this pragma has been superseded by ""our""
declarations, available in Perl v5.6.0 or later, and use of this pragma is
discouraged."
libsvm-java,库,工具, Java tools and interfaces for libsvm," Java tools and interfaces for libsvm.
Install this package if you want to develop
programs with libsvm in Java."
mythes-es,库,服务, Spanish thesaurus, Spanish thesaurus.
python3-greenlet,库,工具, Lightweight in-process concurrent programming," The greenlet package is a spin-off of Stackless, a version of CPython
that supports micro-threads called ""tasklets"". Tasklets run
pseudo-concurrently (typically in a single or a few OS-level threads)
and are synchronized with data exchanges on ""channels"".

Python 3 version."
javacc-manual,库,服务, Manual for javacc, Manual for javacc.
php-opcache,库,服务, The Zend OPcache," The Zend OPcache provides faster PHP execution through opcode caching and
optimization. It improves PHP performance by storing precompiled script
bytecode in the shared memory. This eliminates the stages of reading code from
the disk and compiling it on future access. In addition, it applies a few
bytecode optimization patterns that make code execution faster."
blivet-data,库,工具, Data for the blivet python module.," The blivet-data package provides data files required by the blivet
python module."
xmvn-tools-pom,库,服务, XMvn Tools POM, This package provides XMvn Tools parent POM.
bsh-javadoc,库,工具, API documentation for bsh, This package provides API documentation for bsh.
redhat-lsb-languages,库,服务, LSB Languages module support," The Linux Standard Base (LSB) Languages module supports components for runtime
languages which are found on an LSB conforming system."
yasm,库,服务, Modular Assembler," Yasm is a complete rewrite of the NASM assembler under the ""new"" BSD License
(some portions are under other licenses, see COPYING for details). It is
designed from the ground up to allow for multiple assembler syntaxes to be
supported (eg, NASM, TASM, GAS, etc.) in addition to multiple output object
formats and even multiple instruction sets. Another primary module of the
overall design is an optimizer module."
python38-wcwidth,库,服务, Measures number of Terminal column cells of wide-character codes," This API is mainly for Terminal Emulator implementors, or those writing programs
that expect to interpreted by a terminal emulator and wish to determine the
printable width of a string on a Terminal."
libknet1-compress-zlib-plugin,库,服务, Libknet1 zlib support, zlib compression support for libknet1.
python3-wheel-wheel,库,工具, The Python wheel module packaged as a wheel, A Python wheel of wheel to use with virtualenv.
rarian-compat,库,工具, Extra files for compatibility with scrollkeeper," This package contains files needed to maintain backward-compatibility with
scrollkeeper."
guice-grapher,库,服务, Grapher extension module for Guice," Guice is a lightweight dependency injection framework for Java 5
and above. This package provides Grapher module for Guice."
phonon-qt5,库,服务, Multimedia framework api for Qt5, Multimedia framework api for Qt5.
python3-libsvm,库,工具, Python3 tools and interfaces for libsvm," Python3 tools and interfaces for libsvm.
Install this package if you want to develop
programs with libsvm in Python3."
postgresql-odbc,库,服务, PostgreSQL ODBC driver," This package includes the driver needed for applications to access a
PostgreSQL system via ODBC (Open Database Connectivity)."
openscap-scanner,库,工具, OpenSCAP Scanner Tool (oscap)," The openscap-scanner package contains oscap command-line tool. The oscap
is configuration and vulnerability scanner, capable of performing
compliance checking using SCAP content."
jtidy,库,工具, HTML syntax checker and pretty printer," JTidy is a Java port of HTML Tidy, a HTML syntax checker and pretty
printer.  Like its non-Java cousin, JTidy can be used as a tool for
cleaning up malformed and faulty HTML.  In addition, JTidy provides a
DOM interface to the document that is being processed, which
effectively makes you able to use JTidy as a DOM parser for real-world
HTML."
javapackages-filesystem,库,服务, Java packages filesystem layout," This package provides some basic directories into which Java packages
install their content."
qt5-qttools-common,库,服务, Common files for qt5-qttools, Common files for qt5-qttools.
vulkan-headers,库,服务, Vulkan Header files and API registry, Vulkan Header files and API registry
perl-Sub-Exporter,库,服务, Sophisticated exporter for custom-built routines," Sub::Exporter provides a sophisticated alternative to Exporter.pm. It allows
for renaming, currying/sub-generation, and other cool stuff.

ACHTUNG! If you're not familiar with Exporter or exporting, read
Sub::Exporter::Tutorial first!"
jetty-servlet,库,服务, servlet module for Jetty," 
Jetty is a 100% Java HTTP Server and Servlet Container. This means that you
do not need to configure and run a separate web server (like Apache) in order
to use Java, servlets and JSPs to generate dynamic content. Jetty is a fully
featured web server for static and dynamic content. Unlike separate
server/container solutions, this means that your web server and web
application run in the same process, without interconnection overheads
and complications. Furthermore, as a pure java component, Jetty can be simply
included in your application for demonstration, distribution or deployment.
Jetty is available on all Java supported platforms.

This package contains servlet module for Jetty."
ant-apache-oro,库,服务, Optional apache oro tasks for ant, Optional apache oro tasks for ant.
libknet1-compress-bzip2-plugin,库,服务, Libknet1 bzip2 support, bzip2 compression support for libknet1.
rpm-plugin-syslog,库,服务,Rpm plugin for syslog functionality ,Rpm plugin for syslog functionality 
lucene-queries,库,服务, Lucene Queries Module, Lucene Queries Module.
usbguard-notifier,库,工具, A tool for detecting usbguard policy and device presence changes," The usbguard-notifier package detects usbguard policy modifications as well as
device presence changes and displays them as pop-up notifications."
php-pecl-xdebug,库,工具, PECL package for debugging PHP scripts," The Xdebug extension helps you debugging your script by providing a lot of
valuable debug information. The debug information that Xdebug can provide
includes the following:

* stack and function traces in error messages with:
  o full parameter display for user defined functions
  o function name, file name and line indications
  o support for member functions
* memory allocation
* protection for infinite recursions

Xdebug also provides:

* profiling information for PHP scripts
* code coverage analysis
* capabilities to debug your scripts interactively with a debug client

Documentation: https://xdebug.org/docs/"
libguestfs-tools,库,工具, System administration tools for virtual machines," This package contains miscellaneous system administrator command line
tools for virtual machines.

Guestfish is the Filesystem Interactive SHell, for accessing and
modifying virtual machine disk images from the command line and shell
scripts.

The guestmount command lets you mount guest filesystems on the host
using FUSE and libguestfs.

Virt-alignment-scan scans virtual machines looking for partition
alignment problems.

Virt-builder is a command line tool for rapidly making disk images
of popular free operating systems.

Virt-cat is a command line tool to display the contents of a file in a
virtual machine.

Virt-copy-in and virt-copy-out are command line tools for uploading
and downloading files and directories to and from virtual machines.

Virt-customize is a command line tool for customizing virtual machine
disk images.

Virt-df is a command line tool to display free space on virtual
machine filesystems.  Unlike other tools, it doesn__ just display the
amount of space allocated to a virtual machine, but can look inside
the virtual machine to see how much space is really being used.  It is
like the df(1) command, but for virtual machines, except that it also
works for Windows virtual machines.

Virt-diff shows the differences between virtual machines.

Virt-edit is a command line tool to edit the contents of a file in a
virtual machine.

Virt-filesystems is a command line tool to display the filesystems,
partitions, block devices, LVs, VGs and PVs found in a disk image
or virtual machine.  It replaces the deprecated programs
virt-list-filesystems and virt-list-partitions with a much more
capable tool.

Virt-format is a command line tool to erase and make blank disks.

Virt-get-kernel extracts a kernel/initrd from a disk image.

Virt-inspector examines a virtual machine and tries to determine the
version of the OS, the kernel version, what drivers are installed,
whether the virtual machine is fully virtualized (FV) or
para-virtualized (PV), what applications are installed and more.

Virt-log is a command line tool to display the log files from a
virtual machine.

Virt-ls is a command line tool to list out files in a virtual machine.

Virt-make-fs is a command line tool to build a filesystem out of
a collection of files or a tarball.

Virt-rescue provides a rescue shell for making interactive,
unstructured fixes to virtual machines.

Virt-resize can resize existing virtual machine disk images.

Virt-sparsify makes virtual machine disk images sparse (thin-provisioned).

Virt-sysprep lets you reset or unconfigure virtual machines in
preparation for cloning them.

Virt-tail follows (tails) a log file within a guest, like 'tail -f'.

Virt-tar-in and virt-tar-out are archive, backup and upload tools
for virtual machines.  These replace the deprecated program virt-tar.

Virt-win-reg lets you look at and modify the Windows Registry of
Windows virtual machines."
shared-mime-info,库,服务, Shared MIME information database," This is the freedesktop.org shared MIME info database.

Many programs and desktops use the MIME system to represent the types of
files. Frequently, it is necessary to work out the correct MIME type for
a file. This is generally done by examining the file's name or contents,
and looking up the correct MIME type in a database."
publicsuffix-list,库,服务,Cross-vendor public domain suffix database ,"The Public Suffix List is a cross-vendor initiative to provide
an accurate list of domain name suffixes, maintained by the hard work
of Mozilla volunteers and by submissions from registries.
Software using the Public Suffix List will be able to determine where
cookies may and may not be set, protecting the user from being
tracked across sites. "
libqhull,库,服务, #NAME?, #NAME?
pki-servlet-4.0-api,库,服务, Apache Tomcat Java Servlet v4.0 API Implementation Classes, Apache Tomcat Servlet API Implementation Classes.
plexus-containers,库,服务, Containers for Plexus," The Plexus project seeks to create end-to-end developer tools for
writing applications. At the core is the container, which can be
embedded or for a full scale application server. There are many
reusable components for hibernate, form processing, jndi, i18n,
velocity, etc. Plexus also includes an application server which
is like a J2EE application server, without all the baggage."
libusbmuxd,库,服务, Client library USB multiplex daemon for Apple's iOS devices," libusbmuxd is the client library used for communicating with Apple's iPod Touch,
iPhone, iPad and Apple TV devices. It allows multiple services on the device
to be accessed simultaneously."
