name,label,summary,description
java-17-openjdk-devel-slowdebug,库, OpenJDK 17 Development Environment unoptimised with full debugging on," The OpenJDK 17 development tools.
This package is unoptimised with full debugging. Install only as needed and remove ASAP."
libdwarf-static,库, Static libdwarf library, Static libdwarf library.
python2-backports-ssl_match_hostname,库, The ssl.match_hostname() function from Python 3," The Secure Sockets layer is only actually secure if you check the hostname in
the certificate returned by the server to which you are connecting, and verify
that it matches to hostname that you are trying to reach.

But the matching logic, defined in RFC2818, can be a bit tricky to implement on
your own. So the ssl package in the Standard Library of Python 3.2 now includes
a match_hostname() function for performing this check instead of requiring
every application to implement the check separately.

This backport brings match_hostname() to users of earlier versions of Python.
The actual code is only slightly modified from Python 3.5."
vte291,库, Terminal emulator library," VTE is a library implementing a terminal emulator widget for GTK+. VTE
is mainly used in gnome-terminal, but can also be used to embed a
console/terminal in games, editors, IDEs, etc."
nbdkit-curl-plugin,库, HTTP/FTP (cURL) plugin for nbdkit, This package contains cURL (HTTP/FTP) support for nbdkit.
perl-Text-Tabs+Wrap,库, Expand tabs and do simple line wrapping," Text::Tabs performs the same job that the UNIX expand(1) and unexpand(1)
commands do: adding or removing tabs from a document.

Text::Wrap::wrap() will reformat lines into paragraphs. All it does is break
up long lines, it will not join short lines together."
libgnomekbd,库, A keyboard configuration library," The libgnomekbd package contains a GNOME library which manages
keyboard configuration and offers various widgets related to
keyboard configuration."
libbpf,库, Libbpf library," A mirror of bpf-next linux tree bpf-next/tools/lib/bpf directory plus its
supporting header files. The version of the package reflects the version of
ABI."
python3-cryptography,库,PyCA's cryptography library ,"cryptography is a package designed to expose cryptographic primitives and
recipes to Python developers. "
libblockdev-utils,库, A library with utility functions for the libblockdev library," The libblockdev-utils is a library providing utility functions used by the
libblockdev library and its plugins."
libreoffice-help-ja,库, Japanese help for LibreOffice, Provides Japanese help for LibreOffice.
python3-libselinux,库, SELinux python 3 bindings for libselinux," The libselinux-python3 package contains python 3 bindings for developing
SELinux applications."
java-1.8.0-openjdk-accessibility-fastdebug,库, OpenJDK 8 accessibility connector for packages with debugging on and optimisation, See normal java-1.8.0.342.b07-openjdk-accessibility description.
python3-speechd,库, Python 3 Client API for speech-dispatcher, Python 3 module for speech-dispatcher
qt5-qtscript-examples,库, Programming examples for qt5-qtscript, Programming examples for qt5-qtscript.
sonatype-oss-parent,库, Sonatype OSS Parent, Sonatype OSS parent pom used by other sonatype packages.
ghc-srpm-macros,库, RPM macros for building Haskell source packages, Macros used when generating Haskell source RPM packages.
mod_security,库, Security module for the Apache HTTP Server," ModSecurity is an open source intrusion detection and prevention engine
for web applications. It operates embedded into the web server, acting
as a powerful umbrella - shielding web applications from attacks."
Judy,库, General purpose dynamic array," Judy is a C library that provides a state-of-the-art core technology
that implements a sparse dynamic array. Judy arrays are declared
simply with a null pointer. A Judy array consumes memory only when it
is populated, yet can grow to take advantage of all available memory
if desired. Judy's key benefits are scalability, high performance, and
memory efficiency. A Judy array is extensible and can scale up to a
very large number of elements, bounded only by machine memory. Since
Judy is designed as an unbounded array, the size of a Judy array is
not pre-allocated but grows and shrinks dynamically with the array
population."
libreoffice-filters,库, All import / export filters," Metapackage to pull in all subpackages that contain import or export
filters."
perl-Sys-Hostname,库, Try every conceivable way to get a hostname," It attempts several methods of getting the system hostname and then caches the
result."
plexus-containers-component-metadata,库, Component metadata from plexus-containers, Component metadata from plexus-containers.
lua-posix,库, A POSIX library for Lua," This is a POSIX library for Lua which provides access to many POSIX features
to Lua programs."
dyninst-static,库, Static libraries for the compiling programs with Dyninst," dyninst-static includes the static versions of the library files for
the dyninst user-space libraries and interfaces."
perl-MRO-Compat,库, Mro::* interface compatibility for Perls < 5.9.5," The ""mro"" namespace provides several utilities for dealing with method
resolution order and method caching in general in Perl 5.9.5 and higher.
This module provides those interfaces for earlier versions of Perl (back
to 5.6.0 anyways).

It is a harmless no-op to use this module on 5.9.5+. That is to say,
code which properly uses MRO::Compat will work unmodified on both older
Perls and 5.9.5+.

If you're writing a piece of software that would like to use the parts
of 5.9.5+'s mro:: interfaces that are supported here, and you want
compatibility with older Perls, this is the module for you."
dbus-libs,库, Libraries for accessing D-BUS, This package contains lowlevel libraries for accessing D-BUS.
mingw32-gettext,库, GNU libraries and utilities for producing multi-lingual messages, MinGW Windows Gettext library
perl-Tie-File,库, Access the lines of a disk file via a Perl array," Tie::File represents a regular text file as a Perl array. Each element in the
array corresponds to a record in the file. The first line of the file is
element 0 of the array; the second line is element 1, and so on.  The file is
not loaded into memory, so this will work even for gigantic files.  Changes to
the array are reflected in the file immediately."
libreoffice-help-uk,库, Ukrainian help for LibreOffice, Provides Ukrainian help for LibreOffice.
slf4j-log4j12,库, SLF4J LOG4J-12 Binding, SLF4J LOG4J-12 Binding.
libstoragemgmt-udev,库,Udev files for libstoragemgmt ,"The libstoragemgmt-udev package contains udev rules and helper utilities for
uevents generated by the kernel. "
python38-requests,库," HTTP library, written in Python, for human beings"," Most existing Python modules for sending HTTP requests are extremely verbose and
cumbersome. Python__ built-in urllib2 module provides most of the HTTP
capabilities you should need, but the API is thoroughly broken. This library is
designed to make HTTP requests easy for developers."
rubygem-rspec-expectations,库, RSpec expectations (should and matchers)," rspec-expectations adds `should` and `should_not` to every object and includes
RSpec::Matchers, a library of standard matchers."
python39-psycopg2,库, A PostgreSQL database adapter for Python 3," Psycopg is the most popular PostgreSQL adapter for the Python
programming language. At its core it fully implements the Python DB
API 2.0 specifications. Several extensions allow access to many of the
features offered by PostgreSQL."
netcf-libs,库, Libraries for netcf, The libraries for netcf.
libblockdev-part,库, The partitioning plugin for the libblockdev library," The libblockdev library plugin (and in the same time a standalone library)
providing the functionality related to partitioning."
pcp-testsuite,库, Performance Co-Pilot (PCP) test suite, Quality assurance test suite for Performance Co-Pilot (PCP).
libmad,库, MPEG audio decoder library," MAD is a high-quality MPEG audio decoder. It currently supports MPEG-1
and the MPEG-2 extension to Lower Sampling Frequencies, as well as the
so-called MPEG 2.5 format. All three audio layers (Layer I, Layer II,
and Layer III a.k.a. MP3) are fully implemented."
kwin-libs,库, KWin runtime libraries, KWin runtime libraries.
slf4j-jcl,库, SLF4J JCL Binding, SLF4J JCL Binding.
mingw32-zlib-static,库, Static libraries for mingw32-zlib development., The mingw32-zlib-static package contains static library for mingw32-zlib development.
python3-rpmfluff,库," Lightweight way of building RPMs, and sabotaging them"," rpmfluff provides a python library for building RPM packages, and
sabotaging them so they are broken in controlled ways.

It is intended for use when validating package analysis tools such as RPM lint.
It can also be used to construct test cases for package management software
such as rpm and yum.

Python 3 version."
libuninameslist,库, A library providing Unicode character names and annotations," libuninameslist provides applications with access to Unicode name and
annotation data from the official Unicode Character Database."
libpng15,库," Old version of libpng, needed to run old binaries"," The libpng15 package provides libpng 1.5, an older version of the libpng.
library for manipulating PNG (Portable Network Graphics) image format files.
This version should be used only if you are unable to use the current
version of libpng."
cyrus-sasl-ntlm,库,NTLM authentication support for Cyrus SASL ,"The cyrus-sasl-ntlm package contains the Cyrus SASL plugin which supports
the NTLM authentication scheme. "
maven-reporting-api-javadoc,库, Javadoc for maven-reporting-api, API documentation for maven-reporting-api.
java-11-openjdk-slowdebug,库, OpenJDK 11 Runtime Environment unoptimised with full debugging on," The OpenJDK 11 runtime environment.
This package is unoptimised with full debugging. Install only as needed and remove ASAP."
python3-httplib2,库, A comprehensive HTTP client library," A comprehensive HTTP client library that supports many features left out of
other HTTP libraries."
hyphen-nl,库, Dutch hyphenation rules, Dutch hyphenation rules.
mingw64-openssl,库, MinGW port of the OpenSSL toolkit," The OpenSSL toolkit provides support for secure communications between
machines. OpenSSL includes a certificate management tool and shared
libraries which provide various cryptographic algorithms and
protocols.

This package contains Windows (MinGW) libraries and development tools."
libtdb,库, The tdb library, A library that implements a trivial database.
dotnet-runtime-6.0,库, NET 6.0 runtime," The .NET runtime contains everything needed to run .NET applications.
It includes a high performance Virtual Machine as well as the framework
libraries used by .NET applications.

.NET is a fast, lightweight and modular platform for creating
cross platform applications that work on Linux, Mac and Windows.

It particularly focuses on creating console applications, web
applications and micro-services."
apache-commons-jxpath-javadoc,库, API documentation for apache-commons-jxpath, This package contains the API documentation for apache-commons-jxpath.
pygtk2,库, Python bindings for GTK+," PyGTK is an extension module for Python that gives you access to the GTK+
widget set.  Just about anything you can write in C with GTK+ you can write
in Python with PyGTK (within reason), but with all the benefits of using a
high-level scripting language."
autocorr-es,库, Spanish auto-correction rules, Rules for auto-correcting common Spanish typing errors.
hplip-libs,库, HPLIP libraries, Libraries needed by HPLIP.
lpsolve,库, A Mixed Integer Linear Programming (MILP) solver," Mixed Integer Linear Programming (MILP) solver lpsolve solves pure linear,
(mixed) integer/binary, semi-continuous and special ordered sets (SOS) models."
java-17-openjdk,库, OpenJDK 17 Runtime Environment, The OpenJDK 17 runtime environment.
boost-math,库, Math functions for boost TR1 library," 
Run-time support for C99 and C++ TR1 C-style Functions from the math
portion of Boost.TR1."
perl-I18N-Collate,库, Compare 8-bit scalar data according to the current locale," This module provides you with objects that will collate according to your
national character set. This module is deprecated. See the perllocale manual
page for further information."
mingw32-libffi,库, A portable foreign function interface library for MinGW, Foreign function interface library for MinGW.
compat-libpthread-nonshared,库, Compatibility support for linking against libpthread_nonshared.a.," This package provides compatibility support for applications that expect
libpthread_nonshared.a to exist. The support provided is in the form of
an empty libpthread_nonshared.a that allows dynamic links to succeed.
Such applications should be adjusted to avoid linking against
libpthread_nonshared.a which is no longer used. The static library
libpthread_nonshared.a is an internal implementation detail of the C
runtime and should not be expected to exist."
mingw32-sqlite,库, MinGW Windows port of sqlite embeddable SQL database engine," SQLite is a C library that implements an SQL database engine. A large
subset of SQL92 is supported. A complete database is stored in a
single disk file. The API is designed for convenience and ease of use.
Applications that link against SQLite can enjoy the power and
flexibility of an SQL database without the administrative hassles of
supporting a separate database server.  Version 2 and version 3 binaries
are named to permit each to be installed on a single host

This package contains cross-compiled libraries and development tools
for Windows."
python39-lxml,库, XML processing library combining libxml2/libxslt with the ElementTree API," lxml is a Pythonic, mature binding for the libxml2 and libxslt libraries. It
provides safe and convenient access to these libraries using the ElementTree It
extends the ElementTree API significantly to offer support for XPath, RelaxNG,
XML Schema, XSLT, C14N and much more.To contact the project, go to the project
home page < or see our bug tracker at case you want to use the current ...

Python 3 version."
libpmemblk,库, Persistent Memory Resident Array of Blocks library," The libpmemblk implements a pmem-resident array of blocks, all the same
size, where a block is updated atomically with respect to power
failure or program interruption (no torn blocks)."
regexp,库, Simple regular expressions API," Regexp is a 100% Pure Java Regular Expression package that was
graciously donated to the Apache Software Foundation by Jonathan Locke.
He originally wrote this software back in 1996 and it has stood up quite
well to the test of time.
It includes complete Javadoc documentation as well as a simple Applet
for visual debugging and testing suite for compatibility."
gssntlmssp,库, GSSAPI NTLMSSP Mechanism, A GSSAPI Mechanism that implements NTLMSSP
libpmempool,库, Persistent Memory pool management library," The libpmempool library provides a set of utilities for off-line
administration, analysis, diagnostics and repair of persistent memory
pools created by libpmemlog, libpemblk and libpmemobj libraries."
perl-Locale-Codes,库, Distribution of modules to handle locale codes," Locale-Codes is a distribution containing a set of modules. The modules
each deal with different types of codes which identify parts of the locale
including languages, countries, currency, etc."
perl-FCGI,库, FastCGI Perl bindings, FastCGI Perl bindings.
python3-blockdev,库, Python3 gobject-introspection bindings for libblockdev," This package contains enhancements to the gobject-introspection bindings for
libblockdev in Python3."
luajit,库, Just-In-Time Compiler for Lua," LuaJIT implements the full set of language features defined by Lua 5.1.
The virtual machine (VM) is API- and ABI-compatible to the standard
Lua interpreter and can be deployed as a drop-in replacement."
python2-Cython,库, Language for writing Python extension modules," This is a development version of Pyrex, a language
for writing Python extension modules.

Python 2 version."
python3-pyghmi,库, Python General Hardware Management Initiative (IPMI and others)," This is a pure Python implementation of IPMI protocol.

The included pyghmicons and pyghmiutil scripts demonstrate how one may
incorporate the pyghmi library into a Python application."
perl-File-Compare,库, Compare files or file handles," A File::Compare Perl module provides functions for comparing a content of two
files specified by a file name or a file handle."
python2-pytest,库, Simple powerful testing with Python," py.test provides simple, yet powerful testing for Python."
python3-osbuild,库, A build system for OS images, A build system for OS images
jaxen,库, An XPath engine written in Java," Jaxen is an open source XPath library written in Java. It is adaptable
to many different object models, including DOM, XOM, dom4j, and JDOM.
Is it also possible to write adapters that treat non-XML trees such as compiled
Java byte code or Java beans as XML, thus enabling you to query these trees
with XPath too."
xml-commons-apis-javadoc,库, Javadoc for xml-commons-apis, Javadoc for xml-commons-apis.
jakarta-oro-javadoc,库, Javadoc for jakarta-oro, Javadoc for jakarta-oro.
postgresql-contrib,库, Extension modules distributed with PostgreSQL," The postgresql-contrib package contains various extension modules that are
included in the PostgreSQL distribution."
gegl04,库, Graph based image processing framework," GEGL (Generic Graphics Library) is a graph based image processing framework.
GEGLs original design was made to scratch GIMP's itches for a new
compositing and processing core. This core is being designed to have
minimal dependencies and a simple well defined API."
libreoffice-langpack-af,库, Afrikaans language pack for LibreOffice, Provides additional Afrikaans translations and resources for LibreOffice.
libreoffice-langpack-fa,库, Farsi language pack for LibreOffice, Provides additional Farsi translations and resources for LibreOffice.
perl-Term-Size-Perl,库, Perl extension for retrieving terminal size (Perl version)," Yet another implementation of Term::Size. Now in pure Perl, with the
exception of a C probe run on build time."
libreoffice-langpack-da,库, Danish language pack for LibreOffice, Provides additional Danish translations and resources for LibreOffice.
mojo-parent,库, Codehaus MOJO parent project pom file, Codehaus MOJO parent project pom file
rrdtool-ruby,库, Ruby RRDtool bindings, The rrdtool-ruby package includes RRDtool bindings for Ruby.
mariadb-connector-odbc,库, The MariaDB Native Client library (ODBC driver)," MariaDB Connector/ODBC is a standardized, LGPL licensed database driver using
the industry standard Open Database Connectivity (ODBC) API. It supports ODBC
Standard 3.5, can be used as a drop-in replacement for MySQL Connector/ODBC,
and it supports both Unicode and ANSI modes."
python3-qt5,库, Python 3 bindings for Qt5, Python 3 bindings for Qt5.
perl-Path-Tiny,库, File path utility," This module attempts to provide a small, fast utility for working with file
paths. It is friendlier to use than File::Spec and provides easy access to
functions from several other core file handling modules.

It doesn't attempt to be as full-featured as IO::All or Path::Class, nor does
it try to work for anything except Unix-like and Win32 platforms. Even then, it
might break if you try something particularly obscure or tortuous.

All paths are forced to have Unix-style forward slashes. Stringifying the
object gives you back the path (after some clean up).

File input/output methods flock handles before reading or writing, as
appropriate.

The *_utf8 methods (slurp_utf8, lines_utf8, etc.) operate in raw mode without
CRLF translation."
upower-devel-docs,库, Developer documentation for for libupower-glib, Developer documentation for for libupower-glib.
libreoffice-langpack-ru,库, Russian language pack for LibreOffice, Provides additional Russian translations and resources for LibreOffice.
iwl4965-firmware,其它,Firmware for Intel庐 PRO/Wireless 4965 A/G/N network adaptors ,"This package contains the firmware required by the iwl4965 driver
for Linux.  Usage of the firmware is subject to the terms and conditions
contained inside the provided LICENSE file. Please read it carefully. "
google-noto-sans-thai-ui-fonts,其它, Sans Thai UI font," Noto fonts aims to remove tofu from web by providing fonts for all
Unicode supported scripts. Its design goal is to achieve visual harmonization
between multiple scripts. Noto family supports almost all scripts available
in Unicode.

Noto Sans font for Thai UI."
iwl6050-firmware,其它,Firmware for Intel(R) Wireless WiFi Link 6050 Series Adapters ,"This package contains the firmware required by the Intel wireless drivers
for Linux.  Usage of the firmware is subject to the terms and conditions
contained inside the provided LICENSE file. Please read it carefully. "
kacst-office-fonts,其它, Fonts for arabic from arabeyes project, This package contains office type fonts for the display of Arabic
gnu-free-serif-fonts,其它, GNU FreeFont Serif Font," 
Gnu FreeFont is a free family of scalable outline fonts, suitable for general
use on computers and for desktop publishing. It is Unicode-encoded for
compatibility with all modern operating systems.

Besides a full set of characters for writing systems based on the Latin
alphabet, FreeFont contains large selection of characters from other writing
systems some of which are hard to find elsewhere.

FreeFont also contains a large set of symbol characters, both technical and
decorative. We are especially pleased with the Mathematical Operators range,
with which most of the glyphs used in LaTeX can be displayed.

This package contains the GNU FreeFont serif font."
f32-backgrounds,其它, Fedora 32 default desktop background," This package contains desktop backgrounds for the Fedora 32 default
theme.  Pulls in themes for GNOME, KDE, Mate and Xfce desktops."
google-noto-sans-tibetan-fonts,其它, Sans Tibetan font," Noto fonts aims to remove tofu from web by providing fonts for all
Unicode supported scripts. Its design goal is to achieve visual harmonization
between multiple scripts. Noto family supports almost all scripts available
in Unicode.

Noto Sans font for Tibetan."
kurdit-unikurd-web-fonts,其它, A widely used Kurdish font for Arabic-like scripts and Latin," A widely used Kurdish font which supports various Arabic-like scripts
(Arabic, Kurdish, Persian) and also Latin."
xorg-x11-fonts-ethiopic,其它, Ethiopic fonts, Ethiopic fonts which are part of the core X Window System distribution.
urw-base35-d050000l-fonts,其它, D050000L font family [part of Level 2 Core Font Set]," This package contains D050000L font family,
which is part of Level 2 Core Font Set.


The Level 2 Core Font Set is a PostScript specification of 35 base fonts that
can be used with any PostScript file. In Fedora, these fonts are provided freely
by (URW)++ company, and are mainly utilized by applications using Ghostscript."
iwl5150-firmware,其它,Firmware for Intel庐 PRO/Wireless 5150 A/G/N network adaptors ,"This package contains the firmware required by the iwl5150 driver
for Linux.  Usage of the firmware is subject to the terms and conditions
contained inside the provided LICENSE file. Please read it carefully. "
google-noto-sans-kannada-ui-fonts,其它, Sans Kannada UI font," Noto fonts aims to remove tofu from web by providing fonts for all
Unicode supported scripts. Its design goal is to achieve visual harmonization
between multiple scripts. Noto family supports almost all scripts available
in Unicode.

Noto Sans font for Kannada UI."
google-noto-sans-tamil-fonts,其它, Sans Tamil font," Noto fonts aims to remove tofu from web by providing fonts for all
Unicode supported scripts. Its design goal is to achieve visual harmonization
between multiple scripts. Noto family supports almost all scripts available
in Unicode.

Noto Sans font for Tamil."
urw-base35-fonts-common,其它, Common files of the (URW)++ Level 2 Core Font Set," 
The Level 2 Core Font Set is a PostScript specification of 35 base fonts that
can be used with any PostScript file. In Fedora, these fonts are provided freely
by (URW)++ company, and are mainly utilized by applications using Ghostscript.

This package contains the necessary license files for this font set."
adwaita-qt5,其它, Adwaita Qt5 theme, Adwaita theme variant for applications utilizing Qt5.
google-droid-kufi-fonts,其它, A kufi Arabic titling typeface designed to complement Droid Sans," 
The Droid typeface family was designed in the fall of 2006 by Ascender's
Steve Matteson, as a commission from Google to create a set of system fonts
for its Android platform. The goal was to provide optimal quality and comfort
on a mobile handset when rendered in application menus, web browsers and for
other screen text.
The family was later extended in collaboration with other designers such as
Pascal Zoghbi of 29ArabicLetters.

Droid Kufi is a stylized display font suitable for titles and short runs of
text, and designed to complement Droid Sans. It was initialy designed by
Steve Matteson of Ascender with consulting by Pascal Zoghbi of 29ArabicLetters
to finalize the font family."
systemd-udev,其它,Rule-based device node and kernel event manager ,"This package contains systemd-udev and the rules and hardware database
needed to manage device nodes. This package is necessary on physical
machines and in virtual machines, but not in containers. "
bpg-sans-regular-fonts,其它, Sans Regular family of BPG Georgian fonts," BPG Fonts are a set of GPL licensed Georgian Unicode fonts.

This package contains the Sans Regular font family."
