name,label,summary,description
biosdevname,工具,Udev helper for naming devices per BIOS names ,"biosdevname in its simplest form takes a kernel device name as an
argument, and returns the BIOS-given name it ""should"" be.  This is necessary
on systems where the BIOS name for a given device (e.g. the label on
the chassis is ""Gb1"") doesn't map directly and obviously to the kernel
name (e.g. eth0). "
autogen,工具, Automated text file generator," AutoGen is a tool designed to simplify the creation and maintenance of
programs that contain large amounts of repetitious text. It is especially
valuable in programs that have several blocks of text that must be kept
synchronised."
evolution-mapi-langpacks,工具, Translations for evolution-mapi, This package contains translations for evolution-mapi.
hunspell-yi,工具, Yiddish hunspell dictionaries, Yiddish hunspell dictionaries.
ncompress,工具, Fast compression and decompression utilities," The ncompress package contains the compress and uncompress file
compression and decompression utilities, which are compatible with the
original UNIX compress utility (.Z file extensions).  These utilities
can't handle gzipped (.gz file extensions) files, but gzip can handle
compressed files.

Install ncompress if you need compression/decompression utilities
which are compatible with the original UNIX compress utility."
mailman,工具, Mailing list manager with built in Web access," Mailman is software to help manage email discussion lists, much like
Majordomo and Smartmail. Unlike most similar products, Mailman gives
each mailing list a webpage, and allows users to subscribe,
unsubscribe, etc. over the Web. Even the list manager can administer
his or her list entirely from the Web. Mailman also integrates most
things people want to do with mailing lists, including archiving, mail
<-> news gateways, and so on.

Documentation can be found in: /usr/share/doc/mailman

When the package has finished installing, you will need to perform some
additional installation steps, these are described in:
/usr/share/doc/mailman/INSTALL.REDHAT"
pkgconf-m4,工具, m4 macros for pkgconf," This package includes m4 macros used to support PKG_CHECK_MODULES
when using pkgconf with autotools."
composer-cli,工具, A command line tool for use with the lorax-composer API server," A command line tool for use with the lorax-composer API server. Examine recipes,
build images, etc. from the command line."
seavgabios-bin,工具, Seavgabios for x86, SeaVGABIOS is an open-source VGABIOS implementation.
avahi,服务, Local network service discovery," Avahi is a system which facilitates service discovery on
a local network -- this means that you can plug your laptop or
computer into a network and instantly be able to view other people who
you can chat with, find printers to print to or find files being
shared. This kind of technology is already found in MacOS X (branded
'Rendezvous', 'Bonjour' and sometimes 'ZeroConf') and is very
convenient."
pcp-pmda-lio,服务, Performance Co-Pilot (PCP) metrics for the LIO subsystem," This package provides a PMDA to gather performance metrics from the kernels
iSCSI target interface (LIO). The metrics are stored by LIO within the Linux
kernels configfs filesystem. The PMDA provides per LUN level stats, and a
summary instance per iSCSI target, which aggregates all LUN metrics within the
target."
fdo-owner-onboarding-server,服务, FDO Owner Onboarding Server implementation, FDO Owner Onboarding Server implementation
pacemaker-schemas,服务, Schemas and upgrade stylesheets for Pacemaker," Schemas and upgrade stylesheets for Pacemaker

Pacemaker is an advanced, scalable High-Availability cluster resource
manager."
krb5-server-ldap,服务,The LDAP storage plugin for the Kerberos 5 KDC ,"Kerberos is a network authentication system. The krb5-server package
contains the programs that must be installed on a Kerberos 5 key
distribution center (KDC).  If you are installing a Kerberos 5 KDC,
and you wish to use a directory server to store the data for your
realm, you need to install this package. "
freeradius-unixODBC,服务, Unix ODBC support for freeradius, This plugin provides the unixODBC support for the FreeRADIUS server project.
pcp-export-pcp2zabbix,服务, Performance Co-Pilot tools for exporting PCP metrics to Zabbix," Performance Co-Pilot (PCP) front-end tools for exporting metric values
to the Zabbix (https://www.zabbix.org/) monitoring software."
cronie,服务, Cron daemon for executing programs at set times," Cronie contains the standard UNIX daemon crond that runs specified programs at
scheduled times and related tools. It is a fork of the original vixie-cron and
has security and configuration enhancements like the ability to use pam and
SELinux."
epel-aliyuncs-next-release,服务, Extra Packages for Enterprise Linux Next repository configuration," This package contains the Extra Packages for Enterprise Linux (EPEL) Next
configuration for yum."
sssd,服务,System Security Services Daemon ,"Provides a set of daemons to manage access to remote directories and
authentication mechanisms. It provides an NSS and PAM interface toward
the system and a plug-gable back-end system to connect to multiple different
account sources. It is also the basis to provide client auditing and policy
services for projects like FreeIPA.

The sssd sub-package is a meta-package that contains the daemon as well as all
the existing back ends. "
xsettingsd,服务, Provides settings to X11 clients via the XSETTINGS specification," xsettingsd is a daemon that implements the XSETTINGS specification.

It is intended to be small, fast, and minimally dependent on other libraries.
It can serve as an alternative to gnome-settings-daemon for users who are not
using the GNOME desktop environment but who still run GTK+ applications and
want to configure things such as themes, font anti-aliasing/hinting, and UI
sound effects."
usbguard-selinux,服务, USBGuard selinux," The usbguard-selinux package contains selinux policy for the USBGuard
daemon."
rsyslog-mysql,服务, MySQL support for rsyslog," The rsyslog-mysql package contains a dynamic shared object that will add
MySQL database support to rsyslog."
bind9.16-utils,服务, Utilities for querying DNS name servers," Bind-utils contains a collection of utilities for querying DNS (Domain
Name System) name servers to find out information about Internet
hosts. These tools will provide you with the IP addresses for given
host names, as well as other information about registered domains and
network addresses.

You should install bind9.16-utils if you need to get information from DNS name
servers."
cyrus-imapd,服务," A high-performance email, contacts and calendar server"," The Cyrus IMAP (Internet Message Access Protocol) server provides access to
personal mail, system-wide bulletin boards, news-feeds, calendar and contacts
through the IMAP, JMAP, NNTP, CalDAV and CardDAV protocols. The Cyrus IMAP
server is a scalable enterprise groupware system designed for use from small to
large enterprise environments using technologies based on well-established Open
Standards.

A full Cyrus IMAP implementation allows a seamless mail and bulletin board
environment to be set up across one or more nodes. It differs from other IMAP
server implementations in that it is run on sealed nodes, where users are not
normally permitted to log in. The mailbox database is stored in parts of the
filesystem that are private to the Cyrus IMAP system. All user access to mail
is through software using the IMAP, IMAPS, JMAP, POP3, POP3S, KPOP, CalDAV
and/or CardDAV protocols.

The private mailbox database design gives the Cyrus IMAP server large
advantages in efficiency, scalability, and administratability. Multiple
concurrent read/write connections to the same mailbox are permitted. The server
supports access control lists on mailboxes and storage quotas on mailbox
hierarchies."
pcp-pmda-infiniband,服务, Performance Co-Pilot (PCP) metrics for Infiniband HCAs and switches," This package contains the PCP Performance Metrics Domain Agent (PMDA) for
collecting Infiniband statistics.  By default, it monitors the local HCAs
but can also be configured to monitor remote GUIDs such as IB switches."
langpacks-fi,服务, Finnish langpacks meta-package, This package provides Finnish langpacks meta-package.
lorax-templates-anolis,服务, Anolis OS build templates for lorax and livemedia-creator," Anolis OS specific Lorax templates for creating the boot.iso and live isos are
placed in /usr/share/lorax/templates.d/80-anolis"
lldpad,服务,Intel LLDP Agent ,"This package contains the Linux user space daemon and configuration tool for
Intel LLDP Agent with Enhanced Ethernet support for the Data Center. "
uuidd,服务,Helper daemon to guarantee uniqueness of time-based UUIDs ,"The uuidd package contains a userspace daemon (uuidd) which guarantees
uniqueness of time-based UUID generation even at very high rates on
SMP systems. "
langpacks-ar,服务, Arabic langpacks meta-package, This package provides Arabic langpacks meta-package.
dde-api,服务, Go-lang bingding for dde-daemon, Go-lang bingding for dde-daemon.
langpacks-nl,服务, Dutch langpacks meta-package, This package provides Dutch langpacks meta-package.
kubernetes-kubeadm,服务, Kubernetes tool for standing up clusters, Kubernetes tool for standing up clusters
NetworkManager-bluetooth,服务,Bluetooth device plugin for NetworkManager ,This package contains NetworkManager support for Bluetooth devices. 
NetworkManager-initscripts-updown,服务,Legacy ifup/ifdown scripts for NetworkManager that replace initscripts (network-scripts) ,"Installs alternative ifup/ifdown scripts that talk to NetworkManager.
This is only for backward compatibility with initscripts (network-scripts).
Preferably use nmcli instead. "
langpacks-gl,服务, Galician langpacks meta-package, This package provides Galician langpacks meta-package.
pcp-pmda-mysql,服务, Performance Co-Pilot (PCP) metrics for MySQL," This package contains the PCP Performance Metrics Domain Agent (PMDA) for
collecting metrics about the MySQL database."
pcp-pmda-openvswitch,服务, Performance Co-Pilot (PCP) metrics for Open vSwitch," This package contains the PCP Performance Metrics Domain Agent (PMDA) for
collecting metrics from Open vSwitch."
kwin-common,服务, Common files for KWin X11 and KWin Wayland, Common files for KWin X11 and KWin Wayland.
xdg-desktop-portal-gtk,服务, Backend implementation for xdg-desktop-portal using GTK+," A backend implementation for xdg-desktop-portal that is using GTK+ and various
pieces of GNOME infrastructure, such as the org.gnome.Shell.Screenshot or
org.gnome.SessionManager D-Bus interfaces."
Dragonfly-supernode,服务, Dragonfly Cluster Manager(Supernode)," Dragonfly Cluster Manager(Supernode) is the P2P server, which is mainly
responsible for scheduling P2P task and making CDN cache."
bind-dyndb-ldap,服务, LDAP back-end plug-in for BIND," This package provides an LDAP back-end plug-in for BIND. It features
support for dynamic updates and internal caching, to lift the load
off of your LDAP server."
foomatic-db-ppds,服务, PPDs from printer manufacturers, PPDs from printer manufacturers.
samba-common,服务, Files used by both Samba servers and clients," samba-common provides files necessary for both the server and client
packages of Samba."
dleyna-renderer,服务, Service for interacting with Digital Media Renderers," D-Bus service for clients to discover and manipulate DLNA Digital Media
Renderers (DMRs)."
initscripts,服务, Basic support for legacy System V init scripts," This package provides basic support for legacy System V init scripts, and some
other legacy tools & utilities."
anolis-gpg-keys,服务, Anolis OS RPM keys, Anolis OS RPM signature keys
gnome-settings-daemon,服务, The daemon sharing settings from GNOME to GTK+/KDE applications," A daemon to share settings from GNOME to other applications. It also
handles global keybindings, as well as a number of desktop-wide settings."
usbmuxd,服务, Daemon for communicating with Apple's iOS devices," usbmuxd is a daemon used for communicating with Apple's iPod Touch, iPhone,
iPad and Apple TV devices. It allows multiple services on the device to be
accessed simultaneously."
pki-server,服务, PKI Server Package," The PKI Server Package contains libraries and utilities needed by other
PKI subsystems."
tigervnc-server-minimal,服务, A minimal installation of TigerVNC server," The VNC system allows you to access the same desktop from a wide
variety of platforms. This package contains minimal installation
of TigerVNC server, allowing others to access the desktop on your
machine."
bind-sdb-chroot,服务," A chroot runtime environment for the ISC BIND DNS server, named-sdb(8)"," This package contains a tree of files which can be used as a
chroot(2) jail for the named-sdb(8) program from the BIND package.
Based on the code from Jan ""Yenya"" Kasprzak <kas@fi.muni.cz>"
ipa-server-dns,服务, IPA integrated DNS server with support for automatic DNSSEC signing," IPA integrated DNS server with support for automatic DNSSEC signing.
Integrated DNS server is BIND 9. OpenDNSSEC provides key management."
pcp-pmda-zimbra,服务, Performance Co-Pilot (PCP) metrics for Zimbra," This package contains the PCP Performance Metrics Domain Agent (PMDA) for
collecting metrics about Zimbra."
gnome-shell-extension-updates-dialog,服务, Show a modal dialog when there are software updates, This GNOME Shell extension shows a modal dialog when there are software updates
pcp-pmda-shping,服务, Performance Co-Pilot (PCP) metrics for shell command responses," This package contains the PCP Performance Metrics Domain Agent (PMDA) for
collecting metrics about quality of service and response time measurements of
arbitrary shell commands."
xorg-x11-server-source,服务, Xserver source code required to build VNC server (Xvnc), Xserver source code needed to build VNC server (Xvnc)
cups-lpd,服务, CUPS printing system - lpd emulation," CUPS printing system provides a portable printing layer for
UNIX庐 operating systems. This is the package that provides standard
lpd emulation."
gvfs,服务, Backends for the gio framework in GLib," The gvfs package provides backend implementations for the gio
framework in GLib. It includes ftp, sftp, cifs."
rpcbind,服务, Universal Addresses to RPC Program Number Mapper," The rpcbind utility is a server that converts RPC program numbers into
universal addresses.  It must be running on the host to be able to make
RPC calls on a server on that machine."
greenboot,服务, Generic Health Check Framework for systemd, Generic Health Check Framework for systemd.
fence-agents-lpar,服务, Fence agent for IBM LPAR, Fence agent for IBM LPAR devices that are accessed via telnet or SSH.
libsss_idmap,服务, FreeIPA Idmap library, Utility library to convert SIDs to Unix uids and gids
pcp-pmda-denki,服务, Performance Co-Pilot (PCP) metrics dealing with electrical power," This package contains the PCP Performance Metrics Domain Agent (PMDA) for
collecting metrics related to the electrical power consumed by and inside
the system."
systemd,服务, System and Service Manager," systemd is a system and service manager that runs as PID 1 and starts
the rest of the system. It provides aggressive parallelization
capabilities, uses socket and D-Bus activation for starting services,
offers on-demand starting of daemons, keeps track of processes using
Linux control groups, maintains mount and automount points, and
implements an elaborate transactional dependency-based service control
logic. systemd supports SysV and LSB init scripts and works as a
replacement for sysvinit. Other parts of this package are a logging daemon,
utilities to control basic system configuration like the hostname,
date, locale, maintain a list of logged-in users, system accounts,
runtime directories and settings, and daemons to manage simple network
configuration, network time synchronization, log forwarding, and name
resolution."
pacemaker-remote,服务, Pacemaker remote executor daemon for non-cluster nodes," Pacemaker is an advanced, scalable High-Availability cluster resource
manager.

The pacemaker-remote package contains the Pacemaker Remote daemon
which is capable of extending pacemaker functionality to remote
nodes not running the full corosync/cluster stack."
thermald,服务, Thermal Management daemon," thermald monitors and controls platform temperature.

Thermal issues are important to handle proactively to reduce performance
impact.  thermald uses the existing Linux kernel infrastructure and can
be easily enhanced."
langpacks-lt,服务, Lithuanian langpacks meta-package, This package provides Lithuanian langpacks meta-package.
tang,服务, Network Presence Binding Daemon, Tang is a small daemon for binding data to the presence of a third party.
irqbalance,服务,IRQ balancing daemon ,"irqbalance is a daemon that evenly distributes IRQ load across
multiple CPUs for enhanced performance. "
langpacks-ga,服务, Irish langpacks meta-package, This package provides Irish langpacks meta-package.
tuned-gtk,服务, GTK GUI for tuned, GTK GUI that can control tuned and provides simple profile editor.
certmonger,服务, Certificate status monitor and PKI enrollment client," Certmonger is a service which is primarily concerned with getting your
system enrolled with a certificate authority (CA) and keeping it enrolled."
plymouth-plugin-label,服务, Plymouth label plugin," This package contains the label control plugin for
Plymouth. It provides the ability to render text on
graphical boot splashes using pango and cairo."
gnome-shell-extension-native-window-placement,服务, Native window placement for GNOME Shell," This GNOME Shell extension provides additional configurability for the window
layout in the overview, including a mechanism similar to KDE4."
freeradius-ldap,服务, LDAP support for freeradius, This plugin provides the LDAP support for the FreeRADIUS server project.
langpacks-tr,服务, Turkish langpacks meta-package, This package provides Turkish langpacks meta-package.
xorg-x11-drivers,服务, X.Org X11 driver installation package," The purpose of this package is to require all of the individual X.Org
driver rpms, to allow the OS installation software to install all drivers
all at once, without having to track which individual drivers are present
on each architecture.  By installing this package, it forces all of the
individual driver packages to be installed."
pcp-pmda-memcache,服务, Performance Co-Pilot (PCP) metrics for Memcached," This package contains the PCP Performance Metrics Domain Agent (PMDA) for
collecting metrics about Memcached."
libipa_hbac,服务, FreeIPA HBAC Evaluator library, Utility library to validate FreeIPA HBAC rules for authorization requests
tigervnc-server-module,服务, TigerVNC module to Xorg," This package contains libvnc.so module to X server, allowing others
to access the desktop on your machine."
containerd-stress,服务, containerd stress test for containerd daemon, stress test a containerd daemon
dde-daemon,服务, Daemon handling the DDE session settings, Daemon handling the DDE session settings
pki-acme,服务, PKI ACME Package," The PKI ACME responder is a service that provides an automatic certificate
management via ACME v2 protocol defined in RFC 8555."
subversion,服务, A Modern Concurrent Version Control System," Subversion is a concurrent version control system which enables one
or more users to collaborate in developing and maintaining a
hierarchy of files and directories while keeping a history of all
changes.  Subversion only stores the differences between versions,
instead of every complete file.  Subversion is intended to be a
compelling replacement for CVS."
gnome-logs,服务, Log viewer for the systemd journal, A log viewer for the systemd journal.
systemtap-server,服务, Instrumentation System Server," This is the remote script compilation server component of systemtap.
It announces itself to nearby clients with avahi (if available), and
compiles systemtap scripts to kernel objects on their demand."
fuse-overlayfs,服务, FUSE overlay+shiftfs implementation for rootless containers, FUSE overlay+shiftfs implementation for rootless containers.
langpacks-he,服务, Hebrew langpacks meta-package, This package provides Hebrew langpacks meta-package.
WALinuxAgent-udev,服务, Udev rules for Microsoft Azure, Udev rules specific to Microsoft Azure Virtual Machines.
pcp-pmda-netcheck,服务, Performance Co-Pilot (PCP) metrics for simple network checks," This package contains the PCP Performance Metrics Domain Agent (PMDA) for
collecting metrics from simple network checks."
containernetworking-plugins,服务, CNI network plugins," The CNI (Container Network Interface) project consists of a specification
and libraries for writing plugins to configure network interfaces in Linux
containers, along with a number of supported plugins. CNI concerns itself
only with network connectivity of containers and removing allocated resources
when the container is deleted."
gnome-shell-extension-no-hot-corner,服务, Disable the hot corner in GNOME Shell, This GNOME Shell extension disables the hot corner in the top bar.
qemu-kvm-block-gluster,服务, QEMU Gluster block driver," This package provides the additional Gluster block driver for QEMU.

Install this package if you want to access remote Gluster storage."
langpacks-th,服务, Thai langpacks meta-package, This package provides Thai langpacks meta-package.
fprintd-pam,服务, PAM module for fingerprint authentication," PAM module that uses the fprintd D-Bus service for fingerprint
authentication."
alsa-sof-firmware,服务,Firmware and topology files for Sound Open Firmware project ,This package contains the firmware binaries for the Sound Open Firmware project. 
startdde,服务, Starter of deepin desktop environment, Starter of deepin desktop environment.
gnome-control-center-filesystem,服务, GNOME Control Center directories," The GNOME control-center provides a number of extension points
for applications. This package contains directories where applications
can install configuration files that are picked up by the control-center
utilities."
python3-sss-murmur,服务,Python3 bindings for murmur hash function ,Provides python3 module for calculating the murmur hash version 3 
pcp-pmda-netfilter,服务, Performance Co-Pilot (PCP) metrics for Netfilter framework," This package contains the PCP Performance Metrics Domain Agent (PMDA) for
collecting metrics about the Netfilter packet filtering framework."
dde-qt5wayland-plugin,服务, Qt platform plugins for DDE, Qt platform plugins for DDE.
conmon,服务, OCI container runtime monitor, OCI container runtime monitor.
pcp-pmda-mssql,服务, Performance Co-Pilot (PCP) metrics for Microsoft SQL Server," This package contains the PCP Performance Metrics Domain Agent (PMDA) for
collecting metrics from Microsoft SQL Server."
pcp-pmda-perfevent,服务, Performance Co-Pilot (PCP) metrics for hardware counters," This package contains the PCP Performance Metrics Domain Agent (PMDA) for
collecting hardware counters statistics through libpfm."
system-lsb-languages,服务, LSB Languages module support," The Linux Standard Base (LSB) Languages module supports components for runtime
languages which are found on an LSB conforming system."
dde-clipboard,服务, Qt platform theme integration plugins for DDE," Qt platform theme integration plugins for DDE
 Multiple Qt plugins to provide better Qt5 integration for DDE is included."
pcp-export-pcp2influxdb,服务, Performance Co-Pilot tools for exporting PCP metrics to InfluxDB," Performance Co-Pilot (PCP) front-end tools for exporting metric values
to InfluxDB (https://influxdata.com/time-series-platform/influxdb)."
gnome-shell-extension-apps-menu,服务, Application menu for GNOME Shell, This GNOME Shell extension adds a GNOME 2.x style menu for applications.
php-gmp,库, A module for PHP applications for using the GNU MP library," These functions allow you to work with arbitrary-length integers
using the GNU MP library."
libisoburn,库, Library to enable creation and expansion of ISO-9660 filesystems," Libisoburn is a front-end for libraries libburn and libisofs which
enables creation and expansion of ISO-9660 filesystems on all CD/
DVD/BD media supported by libburn. This includes media like DVD+RW,
which do not support multi-session management on media level and
even plain disk files or block devices. Price for that is thorough
specialization on data files in ISO-9660 filesystem images. And so
libisoburn is not suitable for audio (CD-DA) or any other CD layout
which does not entirely consist of ISO-9660 sessions."
postgresql-plpython3,库, The Python3 procedural language for PostgreSQL," The postgresql-plpython3 package contains the PL/Python3 procedural language,
which is an extension to the PostgreSQL database server.
Install this if you want to write database functions in Python 3."
libreoffice-langpack-tr,库, Turkish language pack for LibreOffice, Provides additional Turkish translations and resources for LibreOffice.
lasso,库, Liberty Alliance Single Sign On," Lasso is a library that implements the Liberty Alliance Single Sign On
standards, including the SAML and SAML2 specifications. It allows to handle
the whole life-cycle of SAML based Federations, and provides bindings
for multiple languages."
glassfish-el-api,库, Expression Language 3.0 API, Expression Language 3.0 API.
perl-Data-Dump,库, Pretty printing of data structures," This module provides a single function called dump() that takes a list of
values as its argument and produces a string as its result. The string
contains Perl code that, when evaled, produces a deep copy of the original
arguments. The string is formatted for easy reading."
