name,label,summary,description
bitmap-lucida-typewriter-fonts,其它, Selected CJK bitmap fonts for Anaconda," 
The bitmap-fonts package provides a number of bitmap fonts selected
from the xorg package designed for use locations such as
terminals."
gnu-free-sans-fonts,其它, GNU FreeFont Sans-Serif Font," 
Gnu FreeFont is a free family of scalable outline fonts, suitable for general
use on computers and for desktop publishing. It is Unicode-encoded for
compatibility with all modern operating systems.

Besides a full set of characters for writing systems based on the Latin
alphabet, FreeFont contains large selection of characters from other writing
systems some of which are hard to find elsewhere.

FreeFont also contains a large set of symbol characters, both technical and
decorative. We are especially pleased with the Mathematical Operators range,
with which most of the glyphs used in LaTeX can be displayed.

This package contains the GNU FreeFont sans-serif font."
google-noto-sans-batak-fonts,其它, Sans Batak font," Noto fonts aims to remove tofu from web by providing fonts for all
Unicode supported scripts. Its design goal is to achieve visual harmonization
between multiple scripts. Noto family supports almost all scripts available
in Unicode.

Noto Sans font for Batak."
google-noto-sans-kannada-ui-fonts,其它, Sans Kannada UI font," Noto fonts aims to remove tofu from web by providing fonts for all
Unicode supported scripts. Its design goal is to achieve visual harmonization
between multiple scripts. Noto family supports almost all scripts available
in Unicode.

Noto Sans font for Kannada UI."
urw-base35-z003-fonts,其它, Z003 font family [part of Level 2 Core Font Set]," This package contains Z003 font family,
which is part of Level 2 Core Font Set.


The Level 2 Core Font Set is a PostScript specification of 35 base fonts that
can be used with any PostScript file. In Fedora, these fonts are provided freely
by (URW)++ company, and are mainly utilized by applications using Ghostscript."
liberation-serif-fonts,其它, Serif fonts to replace commonly used Microsoft Times New Roman," The Liberation Fonts are intended to be replacements for the 3 most commonly
used fonts on Microsoft systems: Times New Roman, Arial, and Courier New.

This package provides Serif TrueType fonts that replace commonly used
Microsoft Times New Roman."
kacst-book-fonts,其它, Fonts for arabic from arabeyes project, This package contains book type fonts for the display of Arabic
google-noto-sans-myanmar-fonts,其它, Sans Myanmar font," Noto fonts aims to remove tofu from web by providing fonts for all
Unicode supported scripts. Its design goal is to achieve visual harmonization
between multiple scripts. Noto family supports almost all scripts available
in Unicode.

Noto Sans font for Myanmar."
bpg-ucnobi-fonts,其它, Ucnobi family of BPG Georgian fonts," BPG Fonts are a set of GPL licensed Georgian Unicode fonts.

This package contains the Ucnobi font family."
paratype-pt-sans-fonts,其它, A pan-Cyrillic typeface," 
The PT Sans family was developed as part of the __ublic Types of Russian
Federation_ project. This project aims at enabling the peoples of Russia to
read and write their native languages, using free/libre fonts. It is
dedicated to the 300-year anniversary of the Russian civil type invented by
Peter the Great from 1708 to 1710, and was realized with financial support
from the Russian Federal Agency for Press and Mass Communications.

The fonts include support for all 54 title鹿 languages of the Russian
Federation as well as more common Western, Central European and Cyrillic
blocks making them unique and a very important tool for modern digital
communications.

PT Sans is a grotesque font based on Russian type designs of the second part
of the 20th century. However, it also includes very distinctive features of
modern humanistic design, fulfilling present day aesthetic and functional
requirements.

It was designed by Alexandra Korolkova, Olga Umpeleva and Vladimir Yefimov
and released by ParaType.

鹿 A __itle_ language is named after an ethnic group.

This package includes the four basic styles and two narrows styles for
economic setting."
samyak-gujarati-fonts,其它, Open Type Fonts for Gujarati script," This package contains truetype/opentype font for the display of \
Scripts Gujarati."
lohit-telugu-fonts,其它, Free Telugu font, This package provides a free Telugu truetype/opentype font.
urw-base35-c059-fonts,其它, C059 font family [part of Level 2 Core Font Set]," This package contains C059 font family,
which is part of Level 2 Core Font Set.


The Level 2 Core Font Set is a PostScript specification of 35 base fonts that
can be used with any PostScript file. In Fedora, these fonts are provided freely
by (URW)++ company, and are mainly utilized by applications using Ghostscript."
bpg-elite-fonts,其它, Elite family of BPG Georgian fonts," BPG Fonts are a set of GPL licensed Georgian Unicode fonts.

This package contains the Elite font family."
google-noto-serif-malayalam-fonts,其它, Serif Malayalam font," Noto fonts aims to remove tofu from web by providing fonts for all
Unicode supported scripts. Its design goal is to achieve visual harmonization
between multiple scripts. Noto family supports almost all scripts available
in Unicode.

Noto Serif font for Malayalam."
google-noto-sans-hanunoo-fonts,其它, Sans Hanunoo font," Noto fonts aims to remove tofu from web by providing fonts for all
Unicode supported scripts. Its design goal is to achieve visual harmonization
between multiple scripts. Noto family supports almost all scripts available
in Unicode.

Noto Sans font for Hanunoo."
libertas-sd8686-firmware,其它,Firmware for Marvell Libertas SD 8686 Network Adapter ,Firmware for Marvell Libertas SD 8686 Network Adapter 
google-noto-sans-tagalog-fonts,其它, Sans Tagalog font," Noto fonts aims to remove tofu from web by providing fonts for all
Unicode supported scripts. Its design goal is to achieve visual harmonization
between multiple scripts. Noto family supports almost all scripts available
in Unicode.

Noto Sans font for Tagalog."
kacst-naskh-fonts,其它, Fonts for arabic from arabeyes project, This package contains naskh type fonts for the display of Arabic
google-noto-sans-telugu-ui-fonts,其它, Sans Telugu UI font," Noto fonts aims to remove tofu from web by providing fonts for all
Unicode supported scripts. Its design goal is to achieve visual harmonization
between multiple scripts. Noto family supports almost all scripts available
in Unicode.

Noto Sans font for Telugu UI."
google-noto-serif-kannada-fonts,其它, Serif Kannada font," Noto fonts aims to remove tofu from web by providing fonts for all
Unicode supported scripts. Its design goal is to achieve visual harmonization
between multiple scripts. Noto family supports almost all scripts available
in Unicode.

Noto Serif font for Kannada."
google-noto-sans-gurmukhi-ui-fonts,其它, Sans Gurmukhi UI font," Noto fonts aims to remove tofu from web by providing fonts for all
Unicode supported scripts. Its design goal is to achieve visual harmonization
between multiple scripts. Noto family supports almost all scripts available
in Unicode.

Noto Sans font for Gurmukhi UI."
f32-backgrounds-extras-mate,其它, Extra F32 Wallpapers for Mate, This package contains F32 supplemental wallpapers for Mate
f32-backgrounds-kde,其它, Fedora 32 default wallpaper for KDE," This package contains KDE desktop wallpaper for the Fedora 32
default theme"
google-noto-sans-devanagari-ui-fonts,其它, Sans Devanagari UI font," Noto fonts aims to remove tofu from web by providing fonts for all
Unicode supported scripts. Its design goal is to achieve visual harmonization
between multiple scripts. Noto family supports almost all scripts available
in Unicode.

Noto Sans font for Devanagari UI."
bpg-classic-fonts,其它, Classic family of BPG Georgian fonts," BPG Fonts are a set of GPL licensed Georgian Unicode fonts.

This package contains the Classic font family."
bpg-excelsior-fonts,其它, Excelsior family of BPG Georgian fonts," BPG Fonts are a set of GPL licensed Georgian Unicode fonts.

This package contains the Excelsior font family."
samyak-fonts-common,其它, Common files for samyak-fonts," 
The Samyak package contains fonts for the display of
Scripts Devanagari, Gujarati, Malayalam, Odia and Tamil"
iwl135-firmware,其它,Firmware for Intel(R) Centrino Wireless-N 135 Series Adapters ,"This package contains the firmware required by the Intel wireless drivers
for Linux to support the iwl135 hardware.  Usage of the firmware
is subject to the terms and conditions contained inside the provided
LICENSE file. Please read it carefully. "
bitmap-fangsongti-fonts,其它, Selected CJK bitmap fonts for Anaconda," bitmap-fonts-cjk package contains bitmap fonts used by Anaconda. They are
selected from the xorg packages, and the font encoding are converted from
native encoding to ISO10646. They are only intended to be used in Anaconda."
bitmap-console-fonts,其它, Selected set of bitmap fonts," 
The bitmap-fonts package provides a number of bitmap fonts selected
from the xorg package designed for use locations such as
terminals."
google-noto-sans-rejang-fonts,其它, Sans Rejang font," Noto fonts aims to remove tofu from web by providing fonts for all
Unicode supported scripts. Its design goal is to achieve visual harmonization
between multiple scripts. Noto family supports almost all scripts available
in Unicode.

Noto Sans font for Rejang."
google-noto-naskh-arabic-ui-fonts,其它, Naskh Arabic UI font," Noto fonts aims to remove tofu from web by providing fonts for all
Unicode supported scripts. Its design goal is to achieve visual harmonization
between multiple scripts. Noto family supports almost all scripts available
in Unicode.

Noto Naskh font for Arabic UI."
bpg-fonts-common,其它, Common files for BPG Georgian fonts (documentation...)," BPG Fonts are a set of GPL licensed Georgian Unicode fonts.

This package consists of files used by other BPG font packages."
google-noto-sans-tagbanwa-fonts,其它, Sans Tagbanwa font," Noto fonts aims to remove tofu from web by providing fonts for all
Unicode supported scripts. Its design goal is to achieve visual harmonization
between multiple scripts. Noto family supports almost all scripts available
in Unicode.

Noto Sans font for Tagbanwa."
google-noto-sans-javanese-fonts,其它, Sans Javanese font," Noto fonts aims to remove tofu from web by providing fonts for all
Unicode supported scripts. Its design goal is to achieve visual harmonization
between multiple scripts. Noto family supports almost all scripts available
in Unicode.

Noto Sans font for Javanese."
lohit-gujarati-fonts,其它, Free Gujarati font, This package provides a free Gujarati truetype/opentype font.
google-noto-serif-gujarati-fonts,其它, Serif Gujarati font," Noto fonts aims to remove tofu from web by providing fonts for all
Unicode supported scripts. Its design goal is to achieve visual harmonization
between multiple scripts. Noto family supports almost all scripts available
in Unicode.

Noto Serif font for Gujarati."
google-noto-sans-old-italic-fonts,其它, Sans Old Italic font," Noto fonts aims to remove tofu from web by providing fonts for all
Unicode supported scripts. Its design goal is to achieve visual harmonization
between multiple scripts. Noto family supports almost all scripts available
in Unicode.

Noto Sans font for Old Italic."
wqy-microhei-fonts,其它, Compact Chinese fonts derived from Droid," A new Sans Serif CJK font derived from Google's ""Droid Sans Fallback""
and covers the entire GBK code points (20932 Han glyphs)."
dejavu-fonts-common,其它, Common files for the Dejavu font set," 
The DejaVu font set is based on the __itstream Vera_ fonts, release 1.10. Its
purpose is to provide a wider range of characters, while maintaining the
original style, using an open collaborative development process.

This package consists of files used by other DejaVu packages."
google-noto-sans-fonts,其它, Sans font," Noto fonts aims to remove tofu from web by providing fonts for all
Unicode supported scripts. Its design goal is to achieve visual harmonization
between multiple scripts. Noto family supports almost all scripts available
in Unicode.

Noto Sans font."
lohit-devanagari-fonts,其它, Free Devanagari Script Font, This package provides a free Devanagari Script TrueType/OpenType font.
sil-nuosu-fonts,其它, The Nuosu SIL Font," The Nuosu SIL Font is a single Unicode font for the standardized Yi script
used by a large ethnic group in southwestern China.
Until this version, the font was called SIL Yi."
urw-base35-d050000l-fonts,其它, D050000L font family [part of Level 2 Core Font Set]," This package contains D050000L font family,
which is part of Level 2 Core Font Set.


The Level 2 Core Font Set is a PostScript specification of 35 base fonts that
can be used with any PostScript file. In Fedora, these fonts are provided freely
by (URW)++ company, and are mainly utilized by applications using Ghostscript."
bpg-nateli-fonts,其它, Nateli family of BPG Georgian fonts," BPG Fonts are a set of GPL licensed Georgian Unicode fonts.

This package contains the Nateli font family."
saab-fonts,其它, Free Punjabi Unicode OpenType Serif Font," This package provides a free OpenType Punjabi (Gurmukhi) Serif font.
Developed by Bhupinder Singh."
thai-scalable-tlwgtypo-fonts,其它, Thai TlwgTypo fonts," 
fonts-tlwg provides a collection of free scalable Thai fonts.

This package provides the TlwgTypo family of Thai fonts."
bpg-chveulebrivi-fonts,其它, Chveulebrivi family of BPG Georgian fonts," BPG Fonts are a set of GPL licensed Georgian Unicode fonts.

This package contains the Chveulebrivi font family."
kernel,其它," The Linux kernel, based on version 5.10.112, heavily modified with backports"," This is the package which provides the Linux kernel for Alibaba Cloud Linux.
It is based on upstream Linux at version 5.10.112 and maintains kABI
compatibility of a set of approved symbols, however it is heavily modified with
backports and fixes pulled from newer upstream Linux kernel releases. This means
this is not a 5.10.112 kernel anymore: it includes several components which come
from newer upstream linux versions, while maintaining a well tested and stable
core. Some of the components/backports that may be pulled in are: changes like
updates to the core kernel (eg.: scheduler, cgroups, memory management, security
fixes and features), updates to block layer, supported filesystems, major driver
updates for supported hardware in Alibaba Cloud Linux, enhancements for
enterprise customers, etc."
urw-base35-fonts-common,其它, Common files of the (URW)++ Level 2 Core Font Set," 
The Level 2 Core Font Set is a PostScript specification of 35 base fonts that
can be used with any PostScript file. In Fedora, these fonts are provided freely
by (URW)++ company, and are mainly utilized by applications using Ghostscript.

This package contains the necessary license files for this font set."
bpg-irubaqidze-fonts,其它, Irubaqidze family of BPG Georgian fonts," BPG Fonts are a set of GPL licensed Georgian Unicode fonts.

This package contains the Irubaqidze font family. In 1628 Georgian printing
types were produced for the first time, in Rome. The ""Georgian-Italian
Dictionary""  and ""Georgian Prayers"" were printed in Rome, 1629, by Stephano
Paolini and Nikiphore Irbach (Irubakhidze-Cholokashvili). In 1643, in Rome,
""Georgian Grammar"" by Francisco-Maria Majio was printed, using Nuskhuri,
Asomtavruli and Mkhedruli. Majio spent 7 years in Georgia studying Georgian
language, scripture and grammar. Font ""BPG Irubaqidze"" is a modernized
replica of this casted type."
google-noto-sans-bengali-fonts,其它, Sans Bengali font," Noto fonts aims to remove tofu from web by providing fonts for all
Unicode supported scripts. Its design goal is to achieve visual harmonization
between multiple scripts. Noto family supports almost all scripts available
in Unicode.

Noto Sans font for Bengali."
google-noto-naskh-arabic-fonts,其它, Naskh Arabic font," Noto fonts aims to remove tofu from web by providing fonts for all
Unicode supported scripts. Its design goal is to achieve visual harmonization
between multiple scripts. Noto family supports almost all scripts available
in Unicode.

Noto Naskh font for Arabic."
f32-backgrounds-gnome,其它, Fedora 32 default wallpaper for GNOME and Cinnamon," This package contains GNOME/Cinnamon desktop wallpaper for the
Fedora 32 default theme."
google-noto-serif-cjk-ttc-fonts,其它, Serif OTC font files for google-noto-cjk-fonts," 
Noto CJK fonts, supporting Simplified Chinese, Traditional Chinese,
Japanese, and Korean. The supported scripts are Han, Hiragana, Katakana,
Hangul, and Bopomofo. Latin, Greek, Cyrllic, and various symbols are also
supported for compatibility with CJK standards.


The google-noto-serif-cjk-ttc-fonts package contains Serif OTC fonts."
iwl100-firmware,其它,Firmware for Intel(R) Wireless WiFi Link 100 Series Adapters ,"This package contains the firmware required by the Intel wireless drivers
for Linux to support the iwl100 hardware.  Usage of the firmware
is subject to the terms and conditions contained inside the provided
LICENSE file. Please read it carefully. "
google-noto-sans-balinese-fonts,其它, Sans Balinese font," Noto fonts aims to remove tofu from web by providing fonts for all
Unicode supported scripts. Its design goal is to achieve visual harmonization
between multiple scripts. Noto family supports almost all scripts available
in Unicode.

Noto Sans font for Balinese."
tibetan-machine-uni-fonts,其它," Tibetan Machine Uni font for Tibetan, Dzongkha and Ladakhi"," Tibetan Machine Uni is an TrueType OpenType, Unicode font released by THDL
project. The font supports Tibetan, Dzongkha and Ladakhi in dbu-can script
with full support for the Sanskrit combinations found in chos skad text."
urw-base35-nimbus-sans-fonts,其它, Nimbus Sans font family [part of Level 2 Core Font Set]," This package contains Nimbus Sans font family,
which is part of Level 2 Core Font Set.


The Level 2 Core Font Set is a PostScript specification of 35 base fonts that
can be used with any PostScript file. In Fedora, these fonts are provided freely
by (URW)++ company, and are mainly utilized by applications using Ghostscript."
kurdit-unikurd-web-fonts,其它, A widely used Kurdish font for Arabic-like scripts and Latin," A widely used Kurdish font which supports various Arabic-like scripts
(Arabic, Kurdish, Persian) and also Latin."
google-noto-sans-lycian-fonts,其它, Sans Lycian font," Noto fonts aims to remove tofu from web by providing fonts for all
Unicode supported scripts. Its design goal is to achieve visual harmonization
between multiple scripts. Noto family supports almost all scripts available
in Unicode.

Noto Sans font for Lycian."
khmeros-bokor-fonts,其它, Bokor font," 
The Khmer OS fonts include Khmer and Latin alphabets, and they have equivalent
sizes for Khmer and English alphabets, so that when texts mix both it is not
necessary to have different point sizes for the text in each language.

They were created by Danh Hong of the Cambodian Open Institute.

Bokor font."
sil-abyssinica-fonts,其它, SIL Abyssinica fonts," SIL Abyssinica is a Unicode typeface family containing glyphs for the
Ethiopic script.

The Ethiopic script is used for writing many of the languages of Ethiopia and
Eritrea. Abyssinica SIL supports all Ethiopic characters which are in Unicode
including the Unicode 4.1 extensions. Some languages of Ethiopia are not yet
able to be fully represented in Unicode and, where necessary, we have included
non-Unicode characters in the Private Use Area (see Private-use (PUA)
characters supported by Abyssinica SIL).

Abyssinica SIL is based on Ethiopic calligraphic traditions. This release is
a regular typeface, with no bold or italic version available or planned."
google-noto-sans-old-south-arabian-fonts,其它, Sans Old South Arabian font," Noto fonts aims to remove tofu from web by providing fonts for all
Unicode supported scripts. Its design goal is to achieve visual harmonization
between multiple scripts. Noto family supports almost all scripts available
in Unicode.

Noto Sans font for Old South Arabian."
thai-scalable-norasi-fonts,其它, Thai Norasi fonts," 
fonts-tlwg provides a collection of free scalable Thai fonts.

This package provides the Norasi family of Thai fonts."
culmus-yehuda-clm-fonts,其它, Fonts for Hebrew from Culmus project," 
The culmus-fonts package contains fonts for the display of
Hebrew from the Culmus project."
kacst-poster-fonts,其它, Fonts for arabic from arabeyes project, This package contains poster type fonts for the display of Arabic
khmeros-battambang-fonts,其它, Battambang font," 
The Khmer OS fonts include Khmer and Latin alphabets, and they have equivalent
sizes for Khmer and English alphabets, so that when texts mix both it is not
necessary to have different point sizes for the text in each language.

They were created by Danh Hong of the Cambodian Open Institute.

Battambang font."
google-noto-sans-mongolian-fonts,其它, Sans Mongolian font," Noto fonts aims to remove tofu from web by providing fonts for all
Unicode supported scripts. Its design goal is to achieve visual harmonization
between multiple scripts. Noto family supports almost all scripts available
in Unicode.

Noto Sans font for Mongolian."
khmeros-siemreap-fonts,其它, Siemreap font," 
The Khmer OS fonts include Khmer and Latin alphabets, and they have equivalent
sizes for Khmer and English alphabets, so that when texts mix both it is not
necessary to have different point sizes for the text in each language.

They were created by Danh Hong of the Cambodian Open Institute.

Siemreap font."
google-roboto-slab-fonts,其它, Google Roboto Slab fonts," Roboto has a dual nature. It has a mechanical skeleton and the forms are
largely geometric. At the same time, the font features friendly and open
curves. While some grotesks distort their letterforms to force a rigid
rhythm, Roboto doesn't compromise, allowing letters to be settled into
their natural width. This makes for a more natural reading rhythm more
commonly found in humanist and serif types.

This is the Roboto Slab family, which can be used alongside the normal
Roboto family and the Roboto Condensed family."
urw-base35-standard-symbols-ps-fonts,其它, Standard Symbols PS font family [part of Level 2 Core Font Set]," This package contains Standard Symbols PS font family,
which is part of Level 2 Core Font Set.


The Level 2 Core Font Set is a PostScript specification of 35 base fonts that
can be used with any PostScript file. In Fedora, these fonts are provided freely
by (URW)++ company, and are mainly utilized by applications using Ghostscript."
bitmap-fixed-fonts,其它, Selected set of bitmap fonts," 
The bitmap-fonts package provides a number of bitmap fonts selected
from the xorg package designed for use locations such as
terminals."
google-noto-sans-tifinagh-fonts,其它, Sans Tifinagh font," Noto fonts aims to remove tofu from web by providing fonts for all
Unicode supported scripts. Its design goal is to achieve visual harmonization
between multiple scripts. Noto family supports almost all scripts available
in Unicode.

Noto Sans font for Tifinagh."
lohit-odia-fonts,其它, Free truetype font for Odia language, This package provides a free truetype font for Odia language.
f32-backgrounds,其它, Fedora 32 default desktop background," This package contains desktop backgrounds for the Fedora 32 default
theme.  Pulls in themes for GNOME, KDE, Mate and Xfce desktops."
bpg-nateli-caps-fonts,其它, Nateli Caps family of BPG Georgian fonts," BPG Fonts are a set of GPL licensed Georgian Unicode fonts.

This package contains the Nateli Caps font family."
julietaula-montserrat-fonts,其它, Sans-serif typeface inspired from Montserrat area," 
A typeface inspired by signs around the Montserrat area of Buenos Aires, Argentina"
urw-base35-gothic-fonts,其它, URW Gothic font family [part of Level 2 Core Font Set]," This package contains URW Gothic font family,
which is part of Level 2 Core Font Set.


The Level 2 Core Font Set is a PostScript specification of 35 base fonts that
can be used with any PostScript file. In Fedora, these fonts are provided freely
by (URW)++ company, and are mainly utilized by applications using Ghostscript."
xorg-x11-fonts-ISO8859-15-75dpi,其它, ISO8859-15-75dpi fonts," Contains a set of 75dpi fonts in the ISO8859-15 encoding which provide Euro
support."
kacst-one-fonts,其它, Fonts for arabic from arabeyes project, This package contains one type fonts for the display of Arabic
google-noto-sans-phoenician-fonts,其它, Sans Phoenician font," Noto fonts aims to remove tofu from web by providing fonts for all
Unicode supported scripts. Its design goal is to achieve visual harmonization
between multiple scripts. Noto family supports almost all scripts available
in Unicode.

Noto Sans font for Phoenician."
google-noto-sans-armenian-fonts,其它, Sans Armenian font," Noto fonts aims to remove tofu from web by providing fonts for all
Unicode supported scripts. Its design goal is to achieve visual harmonization
between multiple scripts. Noto family supports almost all scripts available
in Unicode.

Noto Sans font for Armenian."
google-noto-sans-lepcha-fonts,其它, Sans Lepcha font," Noto fonts aims to remove tofu from web by providing fonts for all
Unicode supported scripts. Its design goal is to achieve visual harmonization
between multiple scripts. Noto family supports almost all scripts available
in Unicode.

Noto Sans font for Lepcha."
